 thanks visiting glad enjoyed ecologic plenty follow info ,HER
 final festival strictly ballroom bolero jacket getting ready new ,HER
 meccano orrery hour ,LER
 fix thanks heads ,LER
 welcome probably guessed party ticket sales iframed page need add ssl ,HER
 hi thanks heads fix mean book securely ,HER
 cockatoo island industry art ,HER
 moment admn bolden cut ribbon launching new rovers ,LER
 today administrator bolden nasa visiting mars yard commissioning new rovers ,HER
 class teaching labs adjacent ,LER
 view mars lab crowded workshop cc ,LER
 preparing celebrate sequinned splendour strictly ballroom stage screen new ,HER
 elise vere strikes pose amy lindy hall postcard series ,LER
 max dupain chris vandyke ,HER
 hear artists hadley maxwell discuss casting bust queen victoria work ,LER
 video hadley maxwell making cinefoil casts object queen victoria bust work ,HER
 sydney ferries built pleasure grounds 1910 attract customers ferry service ,HER
 hey work long running love lace exhibition ,HER
 epic hours casting completed hadley maxwell artwork ,LER
 artists subject cc ,LER
 casting queen victoria bust cc ,LER
 artists hadley maxwell begin casting queen victoria bust work shown ,LER
 queen victoria bust artists hadley maxwell cast work shown ,LER
 cinefoil casts hadley maxwell ,LER
   ,LER
 hadley maxwell begin casting queen victoria bust phmcollection powerhouse museum ,LER
 today turbine hall artists hadley maxwell making cast queen victoria bust ,LER
 thanks rap glad enjoyed exhibition hope checked gm mobile app ,LER
 ctd mame vice64 reliving classic retro games ,HER
 glad enjoyed forget gm app tablet phone emulators like ctd ,LER
 forget beatles australia exhibition opens arts centre melbourne tomorrow ,HER
 world women cinema wow film festival 2014 free museum entry starts today 30pm 30pm ,LER
 magnavox odyssey installed game masters exhibition powerhouse mus ,LER
 sunday steam loco 3265 ran buxton shuttle trips thirlmere festival steam ,LER
 philosophical bubbles link alcohol content powerhouse museum collection object h5 ,LER
 glad like mainly relating clothing including videos ,HER
 meeting nasa driver curiosity rover vandi verna video link jpl calif casula high ,LER
 streaming vandi tompkins driver nasa curiosity mars rover teleoperate mars lab rover ,LER
 mining bush regeneration ,HER
 dramas confusing whale floating air hopefully visit day ,LER
 hi puzzled realised powerhouse visited hovering beast ,HER
 carrington street wynyard station sydney cbd looked like 1900 ,LER
 hanging dick smith helicopter ,LER
 noticed pumice beach lately ,LER
 antarctic volcanoes sydney beaches link ,HER
 1970 television phmcollection daft punk powerhouse museum ,HER
 dig zagora archaeologist adela sobotkova irma havlicek powerhouse museum web producer ,LER
 1951 grant featherston chair phmuseum collection designed chair 1947 ,HER
 shooting photo stories collection objects today including prosthetic eyes ,LER
 neons museums sydney neon signs ,LER
 love jewelleryare associated valentine day ist new idea ,LER
 remembers mario game donkey kong play 100 games game masters ,LER
 photographers love opportunity capture ape bench 1900 tyrrell collection ,LER
 yes bags strollers cloaked free turn right admissions counter enter museum enjoy ,HER
 remembers classic arcade game asteroids play day exhibition game masters ,HER
 says love like water rat fur coat ,HER
 sydney suits king street 1900 ,HER
 rough road lady carrington drive 1883 royal national park ,HER
 excitement clearly ,HER
 think mean ,HER
 know hacking river named convict twice sentenced death ,HER
 dig zagora ancient technique using cuttlebone moulds make jewellery ,HER
 love shoes like phmcollection ,HER
 yes sheep bursting wall oopsatoreum inventions begin daring act ,LER
 school queen ,LER
 2014 chinese new year ,HER
 love shoes joseph box shoe collection powerhouse museum ,HER
 perfect day beach sydney bondi beach looked like 1855 1923 ,HER
 museumselfie lovin new directors dolla michael lost frocks ,HER
   ,LER
 amazing outfit les dame des fleurs created student alexis mccaughtrie photographed ,LER
 hi carole oopsatoreum late september ,LER
 dive shot enfield pool designed architects rudder grout 1933 ,HER
 great moment captured gamemasters recently edward kenway playing super mario bros ,HER
 glad like info ,LER
 art skating david griggs 2003 221 ,HER
 dig zagora petra janouchova zagora 2013 volunteer trowel tales true petra janouchova petra janouc ,LER
 meet astronomer author dr nick lomb signs copies 2014 australasian sky guide powerhouse museum shop tomorrow 14 14 ,HER
 check stereo plate george street sydney taken 1880 1923 ,HER
 let know advance planning trip sydney ,HER
 steam powered car 1922 stanley steam car ,HER
 soon website goes live soon able make bookings eye cc ,HER
 dig zagora relationship spatial patterns people behaviour zagora ,LER
 steam ploughs ,HER
 interesting hothouse event tonight museum ,HER
 augmenting horse carousel syddes14 awe behindthescenes technology circus powerhouse museum ,LER
 3d scanned object day red ericsson phone 3d scanning syddes14 ,HER
 scenes studio today 3d scanning collection objects upcoming syddes14 ,HER
 powerhouse goes venice ,HER
 monterey moderne design ,HER
 dig zagora great team adela sobotkova petra janouchova ,HER
 hi evan check curators send pm ,LER
 3d printing powerhouse museum collection ,HER
 think great discuss theory practice curating thanks anne marie ,HER
 art curating ,HER
 fyi exhibition showing arts centre melbourne cc ,LER
 red engine broken hill ,LER
 hi open day christmas ,LER
 dig zagora satellite remote sensing zagora archaeological project ,LER
 story australia airmail ,LER
 inspired museum collection creating gold rush dress ,HER
 queen victoria building taken 1900 tyrrell collection phmcollection sydney ,HER
 treasure collection wonderfull world massagers ,LER
 ok fixed typo website mobile version spotted arigatou gozaimashita ,LER
 hey robin thanks pointing typo let know make amends ,HER
 contacted house advise today able buy tickets game masters arrive ,LER
 hi recommend pre book ticketing timed slots sell faq info enjoy ,HER
 welcome hope fun ,LER
 dig zagora new processes zagora 2013 flotation marine debris seeds ,LER
 90 computers kids playing minecraft school holiday program minecraft100 powerhouse museum ,HER
 proud announce new strategic plan 2014 2019 museum applied arts sciences 2020 vision ,HER
 channel morning shown strictly ballroom exhibition costume designer catherine martin ,HER
 strictly dancing media preview strictlyballroom exhibition powerhouse museum ,HER
 spectacular array catherine martin awards strictly ballroom exhibition powerhouse museum ,HER
 ready exhibition strictly ballroom story opens saturday ,HER
 pics nights afinepossession opening paul keating stated best jewellery exhibition seen ,HER
 friday einstein lecture available youtube channel usfsyd14 ,LER
 reply pm reason glad enjoyed interface ipads meant ,HER
 excellent way interface exhibition ,LER
 welcome ,LER
 thanks letting know 3d scans online cc ,HER
 shhh won tell director won ,LER
 quite wheelie ,HER
 head wonder knows ,HER
 scanned events ,HER
 welcome soon detailed 3d scans select objects available page stl data sets ,HER
 fight fly used catch flies ,HER
 info promised exhibition website follow soon ,HER
 yes info info week weareexcitedtoo ,HER
 info week ,HER
 believe exhibition opening month features programma 101 similar objects ,HER
 story australia airmail mail arrives sydney ,HER
 thanks noticing missing link ,HER
 tickets sale augmented web workshop ,HER
 story australia airmail wizard stone make historic flight ,HER
 thanks visiting glad enjoying ,HER
 thanks visiting glad enjoyed gamemasters finish ,LER
 thanks visiting glad managed gamemasters days ,LER
 thanks kind words cc ,HER
 thanks visiting feedback pleased enjoyed gamemasters ,LER
 thanks visiting ,LER
 thanks visiting thinkspace ,HER
 great plate spinner thank coming circusfactory hope soon ,LER
 thank writing circusfactory ,LER
 powerhousemuseum rehearsing catch jan 26 jan apr 19 apr 2015 circusfactory ,HER
 thanks swinging great wrap exhibition ,LER
 looking powerhouse museum easier harris street new signage ,HER
 job better buying shoes collection place ,HER
 sure details week ,LER
 recollect shoes opening 29 november ,HER
 glad enjoyed visit ,LER
 event managed team need talk duke edinburgh organisers ,HER
 moving parramatta affect ,HER
 thanks shout ,LER
 welcome ,HER
 ditching bottled water favour tap daily 2l saves 854 1kwh year used produce plastic bottles nationalwaterweek ,LER
 particular coming ,HER
 cheeky cheeky ,LER
 fastbreak 3things sunday diverse ways create social change explored ,LER
 museums inspired past right feedback noted ,HER
 wiggles exhibition described classic version think murray greg jeff phil ,HER
 miss circusfactory coming school holidays live shows posemw museumweek ,LER
 great article great photo thanks ,LER
 brand new exhibition london officially open come undressed 350 years underwear fashion maasundressed ,LER
 couple familymw museumweek ,HER
 wrapping familymw tour family connections museum collection browse online museumweek ,LER
 ben palumbo saucy tease performance people bit warm collar maasivelates ,HER
 madame lash arrived lingerie pieces designed featured recollectunderwear exhibition ,HER
 live lingerie showcase happening feat curvessence designs maasundressed maasivelates ,HER
 food trucks serving hot diggity goods bellies maasivelates ,HER
 live streaming live tattooing tonight maasivelates elkie getting work ,HER
 velvet set swing band good form tonight maasivelates undressed maasundressed ,HER
 pun intended nice ,HER
 treasure house filled wonderful surprises jean paul gaultier inspirationmw museumweek ,HER
 selection inspired images visitors museumweek inspiredmw ,HER
 kids crafty school holidays hat making workshops schoolholidays easter ,LER
 box object like love know inspirationmw museumweek ,HER
 agree design amazing info including orange peel inspiration ,HER
 museumweek architecture underwear cage crinoline architecturemw ,HER
 thanks tuned live tour engineering excellence tweet questions museumweek architecturemw ,LER
 impressive angles doorstep new wing designed frank gehry museumweek architecturemw ,HER
 announces program fashion maasundressed recollectunderwear studentfashion15 ,HER
 excited opening undressed media opening public saturday maasundressed ,HER
 setting media preview undressed exhibition curators special guests ,HER
 installing recollect underwear exhibition opens maasivelates ,HER
 story boy souvenir left queen souvenirsmw museumweek ,HER
 collect souvenirs check collection museumweek souvenirsmw ,HER
 postpone today eye behindmaas tag future tours collection store ,HER
 thanks running tour museumweek hour hope follow ,HER
 huzzah museumweek better share news shenanigans watch space ,LER
 fact worldwaterday water usable fresh water info ,LER
 happy worldwaterday know water 97 saltwater fresh water ice waterfacts ,LER
 stories jewels curator tour jewellery exhibition festival ,LER
 win double pass meet johanna walk talk shoes ,LER
 win double pass meet johanna walk talk world shoes ,LER
 stories jewels curator tour jewellery exhibition festival ,LER
 live shoes meet johanna melb special meet maker event 19 march shoes ,LER
 shoe fanatics unite johanna melb town special meet maker event 19 march ,LER
 great day excitement welcome ,HER
 happy birthday jaedon like come visit leave family pass reception bdaywishes ,HER
 great piece work seriously impressed talent designers ,HER
 outstanding design technology projects nsw hsc students powerhousemuseum ,HER
 sizzling pair david aeon burning stage maasivelates sydney circusfactory ,HER
 david aeon mr pole dance 2014 stunned audience amazing silks routine maasivelates circusfactory ,HER
 gay cocktails going treat maasivelates sydney circusfactory ,HER
 plane max speed 130 hr today plane 400km hr 747 800 hr ,HER
 rests team shfa updates ,HER
 dress ups general clowning photo booth ahappenin maasivelates circusfactory sydney ,HER
 got party started maasivelates style powerhousemuseum sydney circusfactory ,HER
 photo bomb maasivelates sydney powerhousemuseum circusfactory ,HER
 miss house maasivelates queer bigtop ,HER
 roll roll maasivelates queer bigtop open powerhousemuseum circusfactory ,HER
 great question team people know lots transport planes ask ,HER
 serving pulled pork sliders tofu satay burgers rainbow salad ,HER
 tonight serving gay pride cake plus green gaytime cocktails maasivelates ,HER
 need speed saving speedo swimwear ,LER
 delivered win maasivelates queer bigtop tank playing game drag queen bingo tonight sydney ,HER
 new success metric number exploding toddlers ,HER
 mr pole dance 2014 hanging maasive lates queer bigtop event tickets ,LER
 want learn shimmy like 1965 good gidget sessions queer big ,LER
 called geniuses ,HER
 sure send link book live online ,HER
 constellation like capricorn pisces libra taste like canape come stargayzing ,LER
 science uncovers game changing fibre optic catheter featured engineeeringexcellence exhibition ,LER
 welcome great day ,LER
 wondered information technologies started changed gave ,LER
 brought maas brand late year process rolling think ,HER
 ultimo site powerhouse museum maas reflects brand sites discovery centre ,HER
 wraps annie quick tour questions tweet let know behindmaas ,LER
 ms mayo woman accepted royal academy arts london 1919 graduating academy gold medal sculpture behindmaas ,LER
 couple pieces art daphne mayo real trailblazer women arts behindmaas ,HER
 sir charles abrahams significant figure colonial sculptors behindmaas ,LER
 annie holding miniature painting sir john harris 1830 named suburb ultimo behindmaas ,HER
 annie loves ellis rowan 79 paintings behindmaas ,HER
 begins annie favourite things tour behindmaas ,HER
 looking good wait eventuates ,HER
 spent hours powerhouse museum heard lot having seen impressed ,LER
 dr lisa harvey smith astrophysicist coming fri night taking questions ,LER
 great photo thanks coming visit peta ,HER
 dad engimamachine weekendadventures dadadventures powerhouse museum ,LER
 energizereco launch powerhouse museum night ,HER
 come stargayzing hear leading astrophysicist dr lisa harvey smith fri 20 feb ,LER
 engineers hold catheter engineeringexcellence ,HER
 checking green materials project engineeringexcellence ,HER
 rose hiscock director loves exhibition application science fix problems ,HER
 chef claire lune cooking fri 20 february ,LER
 koalas gastroenterology recycling houses apartment buildings common ,LER
 great shot hope guys ball visiting ,LER
 great photo abstract hope good powerhousemuseum ,HER
 come stargayzing solar inspired cocktails canap designed chef claire lune ,LER
 lovely pics btw powerhouse museum discovery centre called ,HER
 enjoy stars sip cocktails canap specially designed chef claire lune ,LER
 display powerhouse museum indaily ,LER
 rebecca holding hat silk leather 1863 1868 mensfashion fashion behindthescenes ,HER
 cc ,LER
 talked pieces easily worn today chiffon beaded dress france 1920s ,HER
 gorgeous men pieces detailed patchwork piece gentleman dressing gown 1830s ,HER
 immediately gravitated mid century evening gown fashion dior behindthescenes ,HER
 rebecca told 30 000 fashion objects collection fashion behindthescenes ,LER
 closer look david jone tag inside jacket dress silk brocade faille glass beads sequins ,HER
 dress matching skirt entire outfit look like behindthescenes ,HER
 day dress 1895 interchangeable sleeves day night behindthescenes ,HER
 performance costume used annette kellerman hollywood star fabric plastic bone metal ,HER
 cotton muslin gown owned ann marsden daughter chaplains nsw behindthescenes ,HER
 rebecca opened costume tray wi beautiful silk english court dress 1760 1770 behindthescenes ,HER
 sorry feel way enjoy working range communities city offering diverse programming ,LER
 giving away double passes queer bigtop night 26 feb waiting ,HER
 donate future generations oooh aaaah ,HER
 sure maybe use pop acoustic studio space gigs thingsyoudowithamonorail ,HER
 queer bigtop extravaganza 2015 feat drag queen bingo dancing ,LER
 queer bigtop extravaganza 2015 adults powerhouse museum feat ,HER
 queer bigtop extravaganza 2015 feat drag queen bingo dancing ,LER
 queer bigtop extravaganza 2015 feat drag queen bingo dancing ,LER
 join sydney glam research symposium focusing collaborations partnerships feb 19 ,LER
 queer bigtop extravaganza 2015 adults powerhouse museum feat ,HER
 feat dj kitty glitter eat drink play drag queen bingo learn dance ,LER
 love feel lucky innovative landmark door ,HER
 circusfactory volunteer lauren took break spinning plates today helped spin story ,LER
 collective shudder damian brought pretty sharp bone cutting saw behindthescenes ,HER
 old hearing aid designed able sit men beards behindthescenes ,HER
 amazing history medical technology bronzed hearing aid 1880s ,HER
 know disposable syringes australian development damian holding 1949 ,HER
 electro massage machine 1900s used belong dr bodkin adams rumour dark ,HER
 damian talking introduction toilets increased life expectancy significantly behindthescenes ,HER
 hanging curators damian special tour medical collection basement ,HER
 like officially welcome lovely new neighbour dr chau chak wing building congratulations ,HER
 instagram follow exclusive scenes photos exhibitions collections sydney museum ,LER
 hula acrobatics chance live holidays circusfactory ,LER
 tic toc tic toc long weekend hoorah know open day including monday come visit ,LER
 shoes exhibit powerhousemuseum mumcannolongertellmemyheelstoohigh recollectshoes ,LER
 thanks coming visit hope fantastic circusfactory ,HER
 love museum kewpie dolls circusfactory ,LER
 brooch queen display australia powerhousemuseum sydney ,LER
 hanging piece moon museumselfie day ,HER
 museumselfie basement friends mr mrs devil ,HER
 museumselfie day usa technically day ahead want play snap selfie visit today ,LER
 designed 1993 promo poster amazing guess circusfactory ,HER
 make date night cosmically cool book champagne stars viewing venus ,LER
 miss date night cosmic twist champagne stars viewing venus 23 25 ,LER
 miss date night cosmic twist champagne stars viewing venus 23 25 ,LER
 looking fun schoolholidays serve pizza planets family sydney ,LER
 beloved date night remember think champagne stars viewing venus ,LER
 quick chat alban le henry gerard cholot designers latest exhibition circusfactory ,LER
 welcome hope enjoying tonight ,LER
 welcome great night maasivelates year ,HER
 cool remember pretty iconic looking machines remember year ,HER
 hands used school played world carmen sandiego ,LER
 maasive lates chance powerhousemuseum hours enjoy food drinks music latest exhibition ,LER
 sneaky try healthy bento box kids powerhousemuseum yummmmm ,HER
 absolutely feel free photos share social media circusfactory ,HER
 caroline guitaut senior curator decorative art royal collection trust speaking powerhousemuseum 17 jan ,LER
 maasive lates powerhousemuseum hours come enjoy food drinks music latest exhibition ,LER
 miss tix 1st maasive lates 15 jan 25 bundle feb edition 40 sydney summernights ,LER
 problems beautiful photo ,HER
 enigma cipher machine like used display imitationgame ,HER
 pizza planets common think serve schoolholidays ,LER
 experience powerhouse museum hours food drinks live music circus performances plus exhibition entry ,LER
 circus performances drinks food music maasive lates circus follies ,LER
 come come series bi monthly lates museum 2015 ,LER
 rare look queen pieces jewellery personal collection powerhousemuseum ,HER
 welcome kids hope fantastic day exploring ,HER
 thanks think curators pretty good job comes telling good story ,HER
 thanks coming kirsten hope great visiting ,HER
 experience powerhouse museum hours food drinks live music circus performances plus exhibition entry ,HER
 experience powerhouse museum hours food drinks live music circus performances plus exhibition entry ,LER
 fantastic photos looks like fun thanks coming visit ,HER
 thanks coming visit weekend took awesome photos ,HER
 hosting talk feat senior curator decorative arts royal collection trust brooch ,HER
 thanks stopping circusfactory ,HER
 happy new year look forward welcoming know queen wattle brooch arriving soon ,HER
 dazzling royal jewel coming town loan majesty personal collection sydney jewellery ,HER
 meet amanda cat regular feature early aussie tv mewseummonday museumcats ,HER
 lovely model got loveourvsos ,HER
 pretty great shoes asking price ,HER
 towers taller kids freemuseumweekend ,HER
 using light rail freemuseumweekend alight paddy market stop use new entrance ,HER
 akira isogawa ambassador centre fashion cff fashionfriday ,HER
 great exhibition powerhouse museum undressed 350 years underwear fashion miss ,LER
 school holidays corner happy kids bondi beach 1900 tbt ,HER
 bold indie fashion label romance born inspiration maas read ,LER
 excellent hope educational fun ,LER
 excited visiting love hear visit ,LER
  both  ,HER
 model foetus c1900 leather horse hair tomorrow basement tour ,HER
 puppet cats monday mewseummonday museumcats happymonday ,HER
 kids coders spoke thinkspace team coding new literacy ,HER
 dr gene sherman donated limited edition bag designed museum today ,HER
 iced vo vo dress 2009 instant classic designed romance born fashionfriday ,HER
 true emergency crying wolf ,HER
 excitement great visit ,HER
 hi goods line open stairs open paddy market direction ,LER
 learn female condom basement tour 24 june 11am register ,HER
 close garden beds beginning shape ,HER
 popular send email learn enquire wait list subscribe early notice round ,HER
 fabulous check interviews afinepossession exhibit ,HER
 thanks compliments favourite exhibition ,HER
 thank write japanese folds display fashion sydney ,LER
 interface beautiful smooth consistent software create hypertext program happybirthday ,LER
 unearth treasures mental ac dc sunday rock basement tour ,HER
 happened design legend hartmut esselinger came visit ,HER
 thanks coming past weekend sharing gorgeous photo ,HER
 thanks coming weekend sharing great pics favourites day ,HER
 maasivelates tonight music drinks food plus curators tours ,LER
 thanks coming recollectshoes sharing great photos special pair shoes caught eye ,LER
 make pictures using light tomorrow night aperture club maasivelates ,LER
 collect experiences maasivelates thurs night chance win vivid alleyway dining experience ,LER
 applied 2015 nsw young regional artist scholarships check eligible ,LER
 work museums education miss museumedoz chat hosted tonight 30pm ,HER
 hurry vote liquid nitrogen icecream flavour want devour maasivelates thurs ,LER
 collect experiences maasivelates thurs night chance win vivid alleyway dining experience ,LER
 blog post national archaeology week coincides news isis troops taking palmyra syria ,HER
 experience powerhousemuseum hours feat curator tours drinks food live music ,LER
 collect experiences maasivelates thurs night chance win vivid alleyway dining experience ,LER
 welcome museum professional friends visiting powerhousemuseum tonight ma2015syd ,HER
 hurry vote liquid nitrogen icecream flavour want maasivelates thurs voting closes sun ,LER
 hear sydney singer producer love storytelling maasivelates thur 28 ,LER
 maasivelates 28 check sweet sweet sounds ,LER
 design luminary provocateur hartmut esslinger coming australia hear speak monday 25 ,LER
 hurry vote liquid nitrogen icecream flavour want devour maasivelates thurs ,LER
 hi meet curators talk textile piece ,HER
 automatic totaliser model hear ask ,LER
 thanks pass ,HER
 ask information ,HER
 vegemite good example sustainable design practice yes read imd2015 museumday ,HER
 vote liquid nitrogen icecream flavour serve pick tweet maasivelates ,LER
 happy friday excited wkend japanese folds display opens tomorrow ,HER
 spiced ginger caramel macchiato strawberry black pepper tell liquid nitrogen icecream flavour want ,LER
 meet little fuzzy mammal djing ,HER
 vivid ideas powerhouse museum night ,LER
 experience powerhouse museum hours food drinks exhibition tours live music performances ,LER
 explore outfits australian fashion label romance born ,HER
 spectacular works sections ozarts mag takes depth look jewellery exhibition ,LER
 curtains close circusfactory miss morning chance ,LER
 wkend circusfactory bring troupe today sunday morning sunday afternoon sold ,LER
 trying howoldrobot faces collection william sixsmith ,HER
 high quality competition pleased entry brought smiles thanks ,HER
 congrats progressing round museumdanceoff2 fun thanks voted ,HER
 thanks hours enthusiastic groovers shakers left museumdanceoff2 ,HER
 help fellow aussie cultural institution progress museumdanceoff2 ,HER
 agree great museums world really shake ,HER
 proving excellent object handling skills dance museumdanceoff2 museumlife ,HER
 gaining ground appreciate museumdanceoff2 votes coming ,HER
 help fellow australian cultural institution progress museumdanceoff2 ,HER
 dancing song sticks head thanks support ,LER
 celebrating museumdanceoff2 entry bacon eggs spot malcolm video ,HER
 support aussie museum museumdanceoff2 vote share ,HER
 thanks waking sydney lots votes ahead ,HER
 thanks support loving breakfast club gif today round big vote ,HER
 thanks support museumdanceoff2 ,HER
 voting open museumdanceoff2 entry vote help spread word ,HER
 excited voting entry museumdanceoff2 opens 10pm est fingers buzzers ,HER
 deal locals tafe uts jmc local residents ,HER
 museumdanceoff2 day museum boogies best voting new zealand neighbours ,LER
 thanks recommendation link check ,LER
 powerhouse museum ultimo nsw ,LER
 thanks recommendation love check got ,LER
 museumdanceoff2 underway join fun vote favourite day ,HER
