 follow story charles laseron early collector anzac anzaclive ,HER
 children lucky ones pupil free day bring way fun ,LER
 need help win museumdanceoff2 trophy vote answers ,HER
 circusfactory powerhouse museum ,LER
 busted moves museumdanceoff2 check ,HER
 hi thanks sharing circusfactory experience blog pleased great ,LER
 hey glad great circusfactory hope soon ,LER
 holly darge major project features designtech 2014 exhibition advice studying design ,LER
 stay tuned new robots soon installed ,HER
 join bespoke shoe maker jodie morrison demonstrates shoe making process saturday 18 april shoes ,LER
 member member school holidays save save 20 ,LER
 open day easter long weekend 930am 5pm come check ,HER
 link rabbits eggs easter curator anni turnbull answer ,HER
 staff easter bonnet competition hit guess won behindmaas cheersbigears ,HER
 story award excellence exhibit label writing creativemuseum ,HER
 easter hat tip worldcup2015 champions howzat bunnikins ,HER
 adventurous childhood big influence designer career read ,LER
 noted thanks ,LER
 hi mike inspected activities floor working order specific issues ,HER
 hi try instead ,HER
 welcome twitter curator tweeting thanks askacurator ,LER
 absolutely stunning ,LER
 5pm stop asking questions happy answer askacurator ,LER
 curatorial work brings main loves research creative askacurator ,LER
 born museum loved material culture history visiting museums askacurator ,LER
 estimate organisation askacurator ,LER
 volunteering internships postgrad studies essential curatorial experience askacurator ,LER
 love mix match cards faith fashion fusion askacurator ,LER
 yes curator melanie pitkin intermediate period specialist askacurator ,HER
 realising going know curator melanie pitkin askacurator ,HER
 help nitpick historical details pop culture makes cringe askacurator ,LER
 benini archive photographic cllxns photo librarians help manage askacurator ,HER
 enjoyed talking world plain old meeting room hour askacurator ,HER
 speaking tea tea cup china jingdezhen kiln askacurator ,LER
 collect objects ppl migrated australia bringing objects askacurator ,LER
 lots research matter project working askacurator ,LER
 ha microwave cllxn askacurator ,HER
 armchair owned governor lachlan macquarie reminds throne askacurator ,LER
 hard choose btw michael hirst chair clement meadmore askacurator ,LER
 hi happy answer questions coins pots toys chairs old stuff ,LER
 lots amateur astronomical discoveries australia comets crashing jupiter askacurator ,LER
 looking list cllxn let know askacurator ,HER
 sure pass ,HER
 thanks tuning periscope tour collette dinnigan unlaced glynis jones 24 hrs askacurator ,LER
 11mm read askacurator ,LER
 diversity interesting things curators perks job askacurator ,HER
 rise shine australia askacurator day curator day answer ,HER
 like forebears jenny kee linda jackson romance born designs global ,LER
 vote yes ,HER
 thanks lisa team pleasure working ,HER
 look forward hearing seeing thoughts ,HER
 8pm tonight goes scenes ahead collettedinniganunlaced opening sep fashion ,LER
 exploded lot things sunday relive action great chief exploder ,LER
 let know want intro particular team ,HER
 best views museum ,HER
 come flag carried douglas mawson epic 1911 antarctic expedition ,LER
 played toys like basement tour sat 22 aug ,LER
 sydney mini maker faire open today sydsciencefest robots makers ilovesydney ,HER
 dinosaur escaped caught sauntering powerhousemuseum lunchtime ,HER
 happens museum closes break ping pong balls escalator museumlife ,HER
 replica permanent collection retired display number years ago ,HER
 cyberworlds exhibition mean ibm object ,HER
 thanks maasfashion correspondent ,HER
 vale peter rushforth australia great ceramic artists ,HER
 trouble choosing details share ,LER
 international tigerday join share collection collectionfishing ,LER
 meet shirley martin designer 1956 melbourne olympic towel abhm blakhistorymonth ,HER
 happybirthday florence broadhurst life colourful wallpaper designs otd ,HER
 design practitioner want help shape sydney design festival apply tuesday 28 july ,LER
 concludes maassymp provenance research diligence thanks tweeters regular programming ,LER
 sector involvement gov process best practice guidelines essential says audience member knowledge exists maassymp ,LER
 varying views panel caution advised systematic response required sector prof prott maassymp ,LER
 panel asked thoughts ebay purchases acquisitions maassymp provenance ,LER
 tricky delicate personal issue repsonse panel case case likely shape response maassymp ,LER
 floor proecess accreditation valuers conflict key loans process maassymp ,LER
 maassymp incredible speakers seek information clarification tweeters questions panel provenance ,LER
 hogan talking changed result experience loan agreements different value issue central maassymp ,LER
 works damaged loan restoration suggested lender agreement agreement value paintings key maassymp ,LER
 hogan sharing story loan early 90 interesting note nature loan agreements maassymp ,LER
 katrina hogan speaking collection management issues diligence happen maassymp ,LER
 discussion paper national keeping place canberra proactive repatriation processes poll maassymp ,LER
 geotagging information remains key ensuring questions problems provenance resurface poll maassymp ,LER
 visual analysis key understanding provenance studying human remains says poll misattribution problem maassymp ,LER
 ethics key says poll challenges regarding original location objects return maassymp ,LER
 poll repatriation remains starting point thinking handling ancestral remains communities maassymp ,LER
 poll speaking repatriation project ongoing responsibilities people working ancestral remains maassymp ,LER
 matt poll speak maassymp ,LER
 kelly pres shows loans insitutions easier provenance documentation processes thorough maassymp ,LER
 kelly thorough provenance object straight forward loans process maassymp ,LER
 kelly lender borrower perspectives loans objects complexity space provenance embedded systems maassymp ,LER
 sara kelly speak behalf sara registrar maassymp provenance ,LER
 kelly sharing application process scheme audience documentation appears critical process maassymp ,LER
 kelly institution approved new scheme info ministry arts website protected maassymp ,LER
 kelly aus gov dev key policies including aus best practice guide collecting cultural material support sector maassymp ,LER
 simon kelly speak attorney gens dep ministry arts canberra maassymp provenance ,LER
 shared klimt painting popular film woman gold maassymp ,LER
 curator mad square agnsw sharing story loan request caught provenance issues maassymp ,LER
 works german modernism looted histories shared audience maassymp ,LER
 fine art continues particularly problematic area provenance says maassymp ,LER
 offering curatorial perspective provenance cultural insitutions maassymp ,LER
 aim draw line problem agree way forward concludes vaughan provenance maassymp ,LER
 vaughan hurried wrong rigor absolutely critical new place maassymp provenance ,LER
 collecting antiquities nga suspended says vaughan dedicated resources allocated transperancy key maassymp ,LER
 systems processes past fall far short today standards ethics requirements says vaughan maassymp provenance research ,LER
 vaughan cultural institutions proactive motivated ethics maassymp provenance ,LER
 photographic evidence work origin key prompt request return object vaughan maassymp ,LER
 vaughan addressing nat gallery dancing shiva issue maassymp provenance ,LER
 american institutions attempting address provenance dedicated resources says vaughan maassymp ,LER
 researching asian anitquities extremely problematic museums galleries says vaughan maassymp ,LER
 vaughan internat issues provenance news pop culture means cultural institutions viewed hostility maassymp ,LER
 vaughan aus late party regarding provenance diligence mixed response sector requirements maassymp ,LER
 vaughan speaking long difficult issues brit mus greece parthenon sculptures maassymp provenance ,LER
 vaughan increasingly amiss crisis facing museums galleries prompted gathering culture maassymp ,LER
 vaughan view museums galleries come sustained pressure regarding provenance cultural heritage maassymp ,LER
 dr gerard vaughan director stage maassymp provenance ,LER
 productive cultivate bilateral relations source countries best way ensure import quality items says prott maassymp ,LER
 prott willful ignorance issue provenance need insist origin objects self defeating maassymp ,LER
 dealers collectors auction houses need held responsible provenance diligence says prott maassymp ,LER
 provenance come normal track says prott maassymp ,LER
 prott price paid acquisition indicator low price suggests trouble maassymp provenance ,LER
 mosaics northern cyprus prott sharing example looting cyprus known red flag maassymp ,LER
 object acquisition standards tests purchaser reasonably known information says prott maassymp ,LER
 checks tests vary world says prott strict maassymp object based research provenance ,LER
 question good faith challenging issue says prott maassymp provenance ,LER
 tricky detailed work gain consistency uniformity says prott maassymp provenance ,LER
 prott explaining experience provenance research constraints difficulties understood need uniformity work maassymp ,LER
 prof lyndel prott speak 1st syd traffic casuing speaker delays maassymp ,LER
 facilitator session morning talking schedule maassymp program ,LER
 provenance research diligence hot topic says 2nd topic series professional series maassymp ,LER
 getting started director introducing uncle chikka welcome country maassymp sydney provenance ,LER
 link morning program provenance research great speakers cultural sector maassymp ,HER
 hi live tweeting morning event provenance research cultural sector maassymp ,LER
 hi lunar module replica permanent cllxn retired display number years ago ,HER
 live tweet provenance symposium thurs 9am check speakers maassymp ,HER
 explore antiques coin collection intimate basement tour tomorrow wed 22 july 11am tickets ,LER
 jumping discovery centre castle hill redevelopment great future 2016 excursions ,HER
 classical cats monday museumcats mewseummonday happymonday ,HER
 classic 1920s frock custom david jones honeymoon outfit fashionfriday ,HER
 looked like 1980 visit location ultimo throwbackthursday ,HER
 rounding naidoc2015 marie mcmahon classic poster read story ,HER
 australia earliest currency holey dollar close basement tour ,HER
 excited partnering deliver festival ,HER
 ha great shot ,LER
 sneak peek come art brick dc comics exhibition coming november lego ,LER
 long way spanks 1930s model berlei girdle brassiere fashionfriday ,HER
 yes right intended astronomy fix right ,HER
 maybe interested ,HER
 branding powerhousemuseum maas ,LER
 fabric cats frances burke fabrics mewseummonday museumcats happymonday ,HER
 new fave ,LER
 happybirthday james tyrrell father tyrrell photo collection born onthisday 1875 ,HER
 thank leadership vision wish adventure ,HER
 hi follow curatorial inquiries ,HER
 ochres opened strictly limited season ,LER
 hi angela dm email address refer right team ,HER
 glad enjoyed look ,HER
 look new bat mobile artofthebrickdc powerhousemuseum ,HER
 night george gittoes received 2015 sydney peace prize gittoes early works ,LER
 maas director takes prestigious international science leadership role year ,HER
 create environments discuss ideas matter opening disobedientobjects evidenceba powerhousemuseum ,LER
 areas australians owning territory says maasfashion ,LER
 austrian australian managed confuse buyers early career maasfashion ,LER
 got question let know maasfashion ,LER
 frightening fashion discussion conversation maasfashion ,LER
 accessories sell conversation maasfashion ,LER
 granny smith festival today enjoy david waller parade float honour 2000 welovegsf ,LER
 hi know hosting 22 oct student tickets available ,LER
 hi know hosting 22 oct student tickets available ,LER
 hi know hosting 22 oct student tickets available ,LER
 hi know hosting 22 oct student tickets available ,LER
 new batmobile designed coming sydney powerhouse museum artofthebrick dc comics tickets ,LER
 treat tastebuds sydney artofthebrickdc check offer ilovesydney ,LER
 meet min jung kim curator caring asian collections peoplemw ,HER
 close peek german enigma machine used relay secrets wwii secretsmw ,HER
 bag flashback sydney bags paper ,HER
 thanks super host ,LER
 immerse williammorris textile celebration birthday ,HER
 want tix batmanvsuperman win dbl passes tagging pic fav lego sculpture artofthebrickdc 28 mar ,LER
 education team love positive feedback glad great visit ,HER
 water carriers 1896 palm leaf carrier today water bottles worldwaterday ,HER
 johnny keefe suites definitely maascollection gems outthere16 ,HER
 glad looked created new beautiful ,HER
 inspirational art theatre exhibitions sydney thriving arts scene ilovesydney ,LER
 let iwd2016 pass applause director inspiring leader arts ,HER
 live periscope seb chan showing things ,LER
 better ,LER
 asked periscoper look thanks heads ,LER
 cheap school uniforms learn resist fast fashion disobedientobjects ,HER
 looking extend til july 2016 planning visit ,LER
 extent online happy send info email dm ,LER
 disobedient object collection maralinga souvenir clock disobedientobjects ,HER
 hitting selfie hotspots taken museumselfie recently share ,HER
 spend friday night super heroes artofthebrickdc open tonight friday jan 8pm ,LER
 man ode little plastic bricks ,LER
 artofthebrickdc fans won want miss ,LER
 help meantime send email info ,LER
 join powerhousemuseum friday morning fastbreak minute breakfast talks ,LER
 want taken guided tour isabellablow afashionablelife saturday curator book ,LER
 team happy chat help glad great visit ,HER
 celebrating reality vision come explore collette dinnigan unlaced ,LER
 delighted welcome isabella blow fashionable life today openingweekend ,HER
 enjoy intimate curator led tour isabellablow afashionablelife tomorrow 10 30am ,LER
 design fans miss kendone chats colourful life ,LER
 enjoy collette dinnigan unlaced curated instrumental powerhousemuseum mbfwa ,LER
 pleasure launch isabella blow fashionable life isabellablow afashionablelife ,HER
 experience guided tour isabellablow afashionablelife curator 14 tickets ,LER
 kidman rocked tech inspired mcqueen metgala discover muse isabellablow afashionablelife 14 ,HER
 big thank everybody voted mdo3 whilst make sure lot fun hope ,LER
 hours vote museum dance dance way vote mdo3 ,LER
 watch video vote museum dance ,LER
 voting entry year museum dance opens 10pm tonight voting fingers ready mdo3 ,LER
 say hi aibo robot dog cheap feed haikupoetryday museumhaiku ,LER
 art brick best lego exhibition powerhouse haikupoetryday museumhaiku ,LER
 trio 1940s smiles fridayfeeling tgif ,LER
 great let developers know ,HER
 thanks visiting sharing ,HER
 happy friday remember sydney sweatbox dance parties tgif ,LER
 australian designed betachek g5 glucose meter memory card worldhealthday ,LER
 beauty ,LER
 enjoy bootcamp ,LER
 direct contact curator today receive email end week alli ,HER
 excellent flash approve ,HER
 good hear thanks visiting ,HER
 certainly appears confusing thanks feedback pass ,HER
 detachable wings sneakers yes pair jeremy scott adidas zoommw ,HER
