sydneyobs,Wed Dec 16 09:15:36 +0000 2015,677054459277500416,3622,654,1,0,has_no_media, check fabulous school holidays program hidden histories story telling lots 
sydneyobs,Tue Dec 15 18:50:01 +0000 2015,676836628229308416,3622,654,1,4,has_no_media, mark diary january february nice way start year 
sydneyobs,Tue Dec 15 18:37:15 +0000 2015,676833413689511937,3622,654,0,0,has_no_media, interesting space climate science development 
sydneyobs,Tue Dec 15 18:03:36 +0000 2015,676824946316738560,3622,654,0,1,has_no_media, australians space british astronaut tim peake blasted iss today 
sydneyobs,Mon Dec 14 18:32:46 +0000 2015,676469897350668288,3622,654,0,4,has_photo, catch glimpse falling star night magical geminids meteor 
sydneyobs,Mon Dec 14 18:31:06 +0000 2015,676469480214544385,3622,654,1,0,has_no_media, essential guide star wars speed release 17 dec 
sydneyobs,Mon Dec 14 10:27:06 +0000 2015,676347673717301248,3622,654,4,1,has_no_media, fancy free tour sydney observatory friday 18 dec 12 30 2pm message 9221 3472 book 
sydneyobs,Sun Dec 13 11:20:28 +0000 2015,675998716742930433,3622,654,5,4,has_photo, spectacular finale international year light 150 meteors ph light moonless night 
sydneyobs,Sat Dec 12 21:10:25 +0000 2015,675784795062796288,3622,654,0,0,has_no_media,  where s who  
sydneyobs,Sat Dec 12 21:07:12 +0000 2015,675783986275221504,3622,654,0,1,has_no_media, santa headlights 
sydneyobs,Sat Dec 12 21:01:54 +0000 2015,675782651010113536,3622,654,0,2,has_no_media, day life guides 
sydneyobs,Fri Dec 11 09:01:08 +0000 2015,675238876441665538,3622,654,2,1,has_no_media, looking online gift person star 
sydneyobs,Fri Dec 11 07:44:18 +0000 2015,675219543615217665,3622,654,0,1,has_no_media, make 1858 sorry 
sydneyobs,Thu Dec 10 23:20:53 +0000 2015,675092853039734784,3622,654,0,0,has_no_media, happening free friday week 12 30 14 00 
sydneyobs,Thu Dec 10 23:03:12 +0000 2015,675088402698608640,3622,654,1,0,has_no_media, forget new free history tour today starts 12 30 built 1958 sydney oldest landmarks best view 
sydneyobs,Thu Dec 10 20:51:10 +0000 2015,675055176198324226,3622,654,0,1,has_no_media, especially lovely 
sydneyobs,Thu Dec 10 20:50:36 +0000 2015,675055031821955073,3622,654,0,0,has_no_media, thanks visiting lovely photos 
sydneyobs,Wed Dec 09 19:51:56 +0000 2015,674677881943941120,3622,654,1,0,has_no_media, eso vlt revisits curious cosmic collision photo release eso1547 
sydneyobs,Wed Dec 09 19:46:36 +0000 2015,674676540316119044,3622,654,0,0,has_no_media, darkness disappearing bad news astronomy writes fred watson 
sydneyobs,Wed Dec 09 19:20:54 +0000 2015,674670071663333376,3622,654,0,0,has_no_media, answer big solar mystery 2015 writes 
sydneyobs,Wed Dec 09 11:43:04 +0000 2015,674554853486559233,3622,654,0,3,has_no_media, video essential monitor impact space body attempting longer journeys 
sydneyobs,Wed Dec 09 03:11:58 +0000 2015,674426233573085184,3622,654,2,2,has_no_media, interested free tour step 12 30 14 00 friday 11 18 december bookings essential 9921 3471 
sydneyobs,Mon Dec 07 19:50:40 +0000 2015,673952784945778688,3622,654,0,1,has_no_media, great photo sydney 
sydneyobs,Mon Dec 07 19:49:22 +0000 2015,673952460554170368,3622,654,0,0,has_no_media, turned breakfast 
sydneyobs,Mon Dec 07 19:42:51 +0000 2015,673950818052136960,3622,654,3,1,has_no_media, meteor shower likely southern hemisphere taking place evenings 
sydneyobs,Sun Dec 06 20:07:42 +0000 2015,673594687152754690,3622,654,2,1,has_no_media, insight wise mind 
sydneyobs,Sat Dec 05 21:07:21 +0000 2015,673247308037787649,3622,654,1,1,has_photo, cost send letter mars wonder day 
sydneyobs,Sat Dec 05 06:54:44 +0000 2015,673032739948367872,3622,654,0,0,has_photo, 17 000 kilometres away pluto 
sydneyobs,Fri Dec 04 07:30:56 +0000 2015,672679464552128512,3622,654,0,0,has_no_media, virgin presses 747 jumbos space action 
sydneyobs,Thu Dec 03 12:35:48 +0000 2015,672393796496179200,3622,654,2,0,has_photo, astronomers near canberra research space mystery 
sydneyobs,Wed Dec 02 19:39:19 +0000 2015,672137992899719168,3622,654,0,0,has_no_media, lisa detect gravitational waves 
sydneyobs,Mon Nov 30 23:21:43 +0000 2015,671469182479826944,3622,654,0,1,has_no_media, beginning 
sydneyobs,Mon Nov 30 21:41:59 +0000 2015,671444083760496640,3622,654,2,3,has_photo, good morning good morning moon ball 
sydneyobs,Mon Nov 30 13:01:34 +0000 2015,671313119465967616,3622,654,3,0,has_photo, december 2015 night sky guide podcast transcript sky chart 
sydneyobs,Mon Nov 30 11:05:57 +0000 2015,671284021972701184,3622,654,1,2,has_no_media, starwatch december night sky northern hemisphere 
sydneyobs,Mon Nov 30 00:57:15 +0000 2015,671130840286425089,3622,654,4,3,has_no_media, 2016 australasian sky guide available 
sydneyobs,Sun Nov 29 19:46:26 +0000 2015,671052618404249600,3622,654,2,1,has_no_media, mirror mirror high tech nasa webb space telescope receives mirror installation 
sydneyobs,Sun Nov 29 09:39:27 +0000 2015,670899867372396544,3622,654,1,0,has_no_media, thaks visiting 
sydneyobs,Fri Nov 27 10:57:42 +0000 2015,670194784456196096,3622,654,0,0,has_no_media, great tips sydney sky watchers 
sydneyobs,Thu Nov 26 19:54:04 +0000 2015,669967377761611777,3622,654,0,0,has_no_media, google vs amazon space race wins innovations stem 
sydneyobs,Thu Nov 26 19:48:24 +0000 2015,669965951148814336,3622,654,0,0,has_photo, twinkle twinkle little star fish 
sydneyobs,Thu Nov 26 11:32:31 +0000 2015,669841157824774144,3622,654,3,1,has_no_media, esa red planet 2019 joint project roscosmos diary date 
sydneyobs,Thu Nov 26 03:39:38 +0000 2015,669722150526279681,3622,654,0,1,has_no_media, moon landing hoax 
sydneyobs,Wed Nov 25 19:12:34 +0000 2015,669594545437306880,3622,654,0,1,has_no_media, rumour einstein combed hair photos look eccentric 
sydneyobs,Wed Nov 25 19:06:15 +0000 2015,669592954147762176,3622,654,0,0,has_no_media, nasa solved alien superstructure mystery 
sydneyobs,Wed Nov 25 03:14:26 +0000 2015,669353423121223680,3622,654,1,1,has_no_media, 100 years general relativity matters 
sydneyobs,Tue Nov 24 22:29:26 +0000 2015,669281698996031488,3622,654,5,2,has_no_media, touchdown origin blue landed rocket stunning image visible damage rocket base 
sydneyobs,Tue Nov 24 21:54:19 +0000 2015,669272862079909888,3622,654,1,2,has_photo, sydney observatory surrounded stunning ships harbour come 
sydneyobs,Mon Nov 23 19:33:12 +0000 2015,668874961071697920,3622,654,0,3,has_no_media, uk astronaut ready flight international space station 
sydneyobs,Sun Nov 22 05:41:37 +0000 2015,668303298831618048,3622,654,0,0,has_no_media, space technologies dubai air common mars investigation course 
sydneyobs,Sat Nov 21 10:40:15 +0000 2015,668016062844112896,3622,654,0,3,has_no_media, imagine seeing sunset planet far far away real 
sydneyobs,Sat Nov 21 10:37:21 +0000 2015,668015334633291776,3622,654,0,0,has_no_media, dr fans 
sydneyobs,Fri Nov 20 10:18:20 +0000 2015,667648159661686788,3622,654,0,2,has_no_media, wahoo dc comic lego head starts tomorrow maasmuseum 
sydneyobs,Fri Nov 20 00:45:21 +0000 2015,667503966318559232,3622,654,1,2,has_photo, sydney observatory keeping cool peeping trees cut cahill 
sydneyobs,Thu Nov 19 19:34:25 +0000 2015,667425715852324864,3622,654,0,0,has_no_media, amazing think landed comet 4km long know comets 
sydneyobs,Wed Nov 18 21:51:28 +0000 2015,667097818415263746,3622,654,3,1,has_photo, outside look international space station tonight 
sydneyobs,Wed Nov 18 19:14:45 +0000 2015,667058377508319232,3622,654,2,2,has_no_media, ooh lovely hubble sees galaxy glowing heart 
sydneyobs,Wed Nov 18 10:13:35 +0000 2015,666922190663651328,3622,654,1,0,has_no_media, space ride worth watching 
sydneyobs,Tue Nov 17 07:31:02 +0000 2015,666518893142216704,3622,654,4,7,has_photo, beautiful evening sydney observatory clear skies observing telescopes 
sydneyobs,Mon Nov 16 06:25:12 +0000 2015,666139939554246656,3622,654,0,1,has_photo, harry reports delta group flare strongly expected 
sydneyobs,Sat Nov 14 20:40:51 +0000 2015,665630496043327488,3622,654,4,1,has_no_media, nice article chris lidman use hubble telescope photos pluto 
sydneyobs,Fri Nov 13 22:15:12 +0000 2015,665291849251221504,3622,654,2,2,has_no_media, new research northern lights impact 
sydneyobs,Thu Nov 12 21:20:20 +0000 2015,664915656517681152,3622,654,0,0,has_no_media, thank 
sydneyobs,Thu Nov 12 21:15:38 +0000 2015,664914474835402752,3622,654,0,0,has_no_media, talking moon conspiracy theory 
sydneyobs,Thu Nov 12 20:22:50 +0000 2015,664901185917186048,3622,654,0,0,has_no_media, tune 8am 2day fm astronomy debate moon landing featuring curator andrew jacobs 
sydneyobs,Thu Nov 12 19:39:47 +0000 2015,664890350222184448,3622,654,1,1,has_no_media, learn everyday pluto 
sydneyobs,Thu Nov 12 19:24:25 +0000 2015,664886485875752961,3622,654,2,1,has_photo, scientists sized exoplanet close study atmosphere 
sydneyobs,Thu Nov 12 02:48:07 +0000 2015,664635757487767552,3622,654,1,3,has_photo, fabulous day schools learn weather join 
sydneyobs,Wed Nov 11 10:56:15 +0000 2015,664396213521743872,3622,654,2,2,has_no_media, distant solar object spied 
sydneyobs,Tue Nov 10 19:42:42 +0000 2015,664166307860869120,3622,654,1,1,has_no_media, thanks 
sydneyobs,Mon Nov 09 19:42:18 +0000 2015,663803822226063360,3622,654,3,2,has_no_media, astronomers capture powerful explosion big bang 
sydneyobs,Mon Nov 09 06:33:00 +0000 2015,663605186695290881,3622,654,1,1,has_no_media, december provides opportunity view clouds magellan closest visible galaxies easily seen south dark locations 
sydneyobs,Thu Nov 05 00:43:18 +0000 2015,662067631881519104,3622,654,2,5,has_photo, unlocking ancient astronomical knowledge 
sydneyobs,Wed Nov 04 04:58:13 +0000 2015,661769393534144512,3622,654,1,0,has_photo, flying space right 
sydneyobs,Mon Nov 02 06:50:35 +0000 2015,661072897235005440,3622,654,3,6,has_photo, harry reports coronal loops sunspot group ar12422 
sydneyobs,Sat Oct 31 13:01:49 +0000 2015,660441547385667584,3622,654,3,1,has_no_media, november 2015 night sky guide sky chart 
sydneyobs,Fri Oct 30 01:10:46 +0000 2015,659900215856513024,3622,654,4,3,has_photo, calling early birds dawn planetary gathering 
sydneyobs,Mon Oct 26 06:07:25 +0000 2015,658525320039952384,3622,654,3,2,has_no_media, dawn planetary gathering 
sydneyobs,Mon Oct 19 04:15:51 +0000 2015,655960528720891904,3622,654,2,5,has_photo, 6in transit factory 
sydneyobs,Mon Oct 19 04:13:09 +0000 2015,655959847519715329,3622,654,0,1,has_no_media, similar transit melbourne 
sydneyobs,Mon Oct 12 07:57:57 +0000 2015,653479705727795200,3622,654,1,0,has_photo, harry reports ar12422 complex delta group 
sydneyobs,Sun Oct 11 19:00:40 +0000 2015,653284095766560768,3622,654,3,3,has_photo, centenary discovery proxima centauri proximity 
sydneyobs,Wed Oct 07 19:01:11 +0000 2015,651834673899790336,3622,654,0,0,has_photo, venus hides moon dawn friday oct 2015 
sydneyobs,Thu Mar 31 20:53:28 +0000 2016,715643195711815680,3622,654,0,0,has_no_media, video race save japan lost satellite hitomi 
sydneyobs,Thu Mar 31 20:42:05 +0000 2016,715640331144826880,3622,654,0,0,has_no_media, alma detailed image protoplanetary disc eso 
sydneyobs,Thu Mar 31 19:44:23 +0000 2016,715625809172541441,3622,654,0,0,has_no_media, jewel box prettiest constellation sky 
sydneyobs,Wed Mar 30 02:09:59 +0000 2016,714998073076936705,3622,654,0,0,has_no_media, total solar eclipses end 
sydneyobs,Mon Mar 28 20:44:36 +0000 2016,714553802624344064,3622,654,2,3,has_no_media, multicultural march success korean german portuguese nepali spanish astronomy tours received 
sydneyobs,Mon Mar 28 20:08:28 +0000 2016,714544705539674112,3622,654,1,0,has_no_media, japan new satellite studying blackholes suffers communication failure 
sydneyobs,Sat Mar 26 21:08:11 +0000 2016,713834961283854336,3622,654,0,2,has_no_media, fabulous seeing planetary science eyes 
sydneyobs,Fri Mar 25 21:26:06 +0000 2016,713477081418477568,3622,654,2,2,has_no_media, moon used spin different axis 
sydneyobs,Fri Mar 25 21:25:29 +0000 2016,713476924413124608,3622,654,1,1,has_no_media, kepler space telescope catches star explosion 
sydneyobs,Fri Mar 25 20:52:09 +0000 2016,713468536828469248,3622,654,0,0,has_no_media, batmanvsuperman batman win scientists planet krypton 
sydneyobs,Fri Mar 25 20:47:05 +0000 2016,713467263903399936,3622,654,0,0,has_no_media, zvezdochka dog living cosmonaut puppy power 
sydneyobs,Fri Mar 25 20:41:23 +0000 2016,713465828121808897,3622,654,1,1,has_no_media, easter excursion capturingthecosmos produced 15pm today everyday 
sydneyobs,Fri Mar 25 20:38:20 +0000 2016,713465060606119936,3622,654,1,0,has_no_media, technologies making world gadgets smarter thinner 
sydneyobs,Fri Mar 25 09:38:17 +0000 2016,713298953689673728,3622,654,2,4,has_no_media, ballarat observatory looking stunning tonight annular eclipse old telescopes mysterious death 
sydneyobs,Fri Mar 25 03:04:32 +0000 2016,713199860896260097,3622,654,3,4,has_no_media, check fabulous images moon garside thanks 
sydneyobs,Thu Mar 24 10:29:24 +0000 2016,712949430371024896,3622,654,7,10,has_photo, wonderful guide terrace talking moon stars universe 
sydneyobs,Thu Mar 24 08:07:36 +0000 2016,712913743030538240,3622,654,2,4,has_no_media, come tonight trailblazer series unsung astronomers tonight 
sydneyobs,Thu Mar 24 04:57:32 +0000 2016,712865910122483715,3622,654,2,4,has_no_media, glad agree school holiday fun list bring kids april 
sydneyobs,Wed Mar 23 17:48:55 +0000 2016,712697649808457728,3622,654,1,1,has_no_media, thank needed beautiful moon photo 
sydneyobs,Wed Mar 23 11:25:19 +0000 2016,712601113661423616,3622,654,2,5,has_no_media, marvelous night moondance stars eyes look sydney moon tnt astronomy 
sydneyobs,Wed Mar 23 02:18:49 +0000 2016,712463581686702082,3622,654,0,1,has_no_media, autocorrect strikes 
sydneyobs,Wed Mar 23 02:17:03 +0000 2016,712463138059325441,3622,654,1,2,has_no_media, capturing cosmos featuring seen saturday 15pm thanks 
sydneyobs,Tue Mar 22 19:26:44 +0000 2016,712359877243437056,3622,654,0,1,has_no_media, heavenly singing thanks visiting brisbane adventist college 
sydneyobs,Tue Mar 22 09:46:24 +0000 2016,712213830043103232,3622,654,0,1,has_no_media,  perhaps this is of interest  
sydneyobs,Tue Mar 22 09:37:13 +0000 2016,712211518981595136,3622,654,1,1,has_no_media, peachy 
sydneyobs,Tue Mar 22 09:34:45 +0000 2016,712210898602074112,3622,654,0,2,has_no_media, excited host writers festival week 
sydneyobs,Tue Mar 22 09:32:15 +0000 2016,712210269171261440,3622,654,1,3,has_no_media, monitoring progresses posting 
sydneyobs,Mon Mar 21 09:36:10 +0000 2016,711848869923987457,3622,654,0,2,has_no_media, know event forget 
sydneyobs,Sun Mar 20 11:01:42 +0000 2016,711508005540356096,3622,654,0,1,has_no_media, veteran astronaut docks iss 
sydneyobs,Sun Mar 20 09:32:17 +0000 2016,711485505536282624,3622,654,12,9,has_no_media, happy equinox day officially autumn 
sydneyobs,Sat Mar 19 12:32:09 +0000 2016,711168379671805952,3622,654,0,2,has_no_media, thanks playing beautifully michael wyana hour music ears 
sydneyobs,Fri Mar 18 22:46:45 +0000 2016,710960664093663232,3622,654,0,0,has_no_media, byo water wine 
sydneyobs,Fri Mar 18 22:13:05 +0000 2016,710952190513315840,3622,654,2,3,has_no_media, watched come life right outside doorstep icons sydney 
sydneyobs,Fri Mar 18 22:10:17 +0000 2016,710951484892971008,3622,654,0,1,has_no_media, clear skies 30 30pm sky watching 
sydneyobs,Fri Mar 18 22:07:58 +0000 2016,710950900513132545,3622,654,0,0,has_no_media, got food stall site grab food water tonight 
sydneyobs,Thu Mar 17 04:15:16 +0000 2016,710318561856610304,3622,654,4,7,has_no_media, got new planetarium film narrated geoffrey rush free screening stem teachers 21 march book marnie ogg 
sydneyobs,Wed Mar 16 09:16:48 +0000 2016,710032053949960192,3622,654,1,4,has_no_media, thanks visiting enjoy 
sydneyobs,Wed Mar 16 09:01:12 +0000 2016,710028127896883200,3622,654,0,0,has_no_media, thanks fingers crossed clear skies 
sydneyobs,Wed Mar 16 09:00:08 +0000 2016,710027862590365696,3622,654,1,1,has_no_media, love set telescopes movies let people moon 
sydneyobs,Tue Mar 15 20:53:35 +0000 2016,709845018626826242,3622,654,0,1,has_no_media, sky clear stargazing 19 march 
sydneyobs,Tue Mar 15 19:53:23 +0000 2016,709829869710934016,3622,654,7,4,has_no_media, turning turn lights 19 march 30 30pm mind looking stars 
sydneyobs,Tue Mar 15 06:02:40 +0000 2016,709620812630732801,3622,654,1,1,has_no_media, regular solar observer correspondent harry roberts reports tau canis majoris star cluster 
sydneyobs,Mon Mar 14 23:24:19 +0000 2016,709520565623623680,3622,654,0,1,has_no_media, join tomorrow lunchtime cycle harbour bridge bike tune 200 riders free lunch 
sydneyobs,Sun Mar 13 23:03:52 +0000 2016,709153031867076609,3622,654,0,0,has_no_media, email marnie ogg 
sydneyobs,Sun Mar 13 20:24:47 +0000 2016,709112996396568576,3622,654,1,2,has_no_media, otd einstein born 137 years ago 
sydneyobs,Sun Mar 13 19:25:01 +0000 2016,709097955479801856,3622,654,0,0,has_no_media, ken fabulous 
sydneyobs,Sun Mar 13 19:24:26 +0000 2016,709097807802535936,3622,654,0,0,has_no_media, email marnie ogg 
sydneyobs,Sun Mar 13 11:30:50 +0000 2016,708978621839314944,3622,654,0,0,has_no_media, great email marnie ogg organise ticket 
sydneyobs,Sun Mar 13 11:12:17 +0000 2016,708973954447183872,3622,654,0,1,has_no_media, speak korean fancy seeing stars learning universe language 28 march 
sydneyobs,Sun Mar 13 10:58:38 +0000 2016,708970519039598592,3622,654,2,1,has_no_media, happy uranus day 
sydneyobs,Sun Mar 13 10:44:56 +0000 2016,708967072026374144,3622,654,5,7,has_no_media, stem teachers free 21 march 5pm planetarium launch 16 tickets glass bubbly 
sydneyobs,Sat Mar 12 23:15:45 +0000 2016,708793631914590208,3622,654,3,3,has_photo, cannon telescope explores observatories world 
sydneyobs,Fri Mar 11 05:30:25 +0000 2016,708163145802514433,3622,654,5,2,has_no_media, join alfred johnson explore golden age observatories history 
sydneyobs,Fri Mar 11 01:59:42 +0000 2016,708110117678362624,3622,654,1,4,has_no_media, thanks love definitely things sydney list 
sydneyobs,Wed Mar 09 09:04:59 +0000 2016,707492367155077121,3622,654,0,6,has_no_media, thanks help folks broke 500 
sydneyobs,Wed Mar 09 08:35:52 +0000 2016,707485037663375361,3622,654,1,5,has_no_media, twitter follower away 500 great crowd thanks following 
sydneyobs,Tue Mar 08 23:32:59 +0000 2016,707348417354137600,3622,654,1,3,has_no_media, friends live casting today total solar eclipse indonesia tune midday 
sydneyobs,Tue Mar 08 19:17:02 +0000 2016,707284006006423552,3622,654,0,2,has_no_media, watcher astronomer andrew jacob morning explaining eclipses 
sydneyobs,Tue Mar 08 18:58:40 +0000 2016,707279383241707520,3622,654,4,3,has_no_media, happy total solar eclipse day viewable indonesia moon 400 times closer 400 times smaller sun 
sydneyobs,Tue Mar 08 18:52:46 +0000 2016,707277900978921472,3622,654,0,1,has_no_media, thanks visiting look sun new light 
sydneyobs,Tue Mar 08 04:59:10 +0000 2016,707068115981434881,3622,654,0,1,has_no_media, russian german portuguese nepali korean spanish speaker join night multicultural tours march 
sydneyobs,Tue Mar 08 02:23:54 +0000 2016,707029043925782529,3622,654,30,36,has_photo, today celebrate winsome bellamy catalogued 430 000 southern hemisphere stars twice iwd2016 
sydneyobs,Mon Mar 07 06:12:57 +0000 2016,706724296454836224,3622,654,3,4,has_photo, adult astronomy understanding relativity begins tomorrow night grab spots 
sydneyobs,Fri Mar 04 18:10:29 +0000 2016,705817706377945088,3622,654,2,2,has_photo, scott kelly grows centimetres space 
sydneyobs,Fri Mar 04 12:07:47 +0000 2016,705726430718472192,3622,654,0,1,has_no_media, stem teachers posted future events 
sydneyobs,Fri Mar 04 06:48:34 +0000 2016,705646096580673536,3622,654,1,3,has_no_media, true need characters maths 
sydneyobs,Fri Mar 04 06:44:45 +0000 2016,705645138643521536,3622,654,10,14,has_photo, teachmeet 16 75 keen science teachers sharing stem ideas evening thanks coming tmsydobs 
sydneyobs,Wed Mar 02 20:52:56 +0000 2016,705133813223927808,3622,654,1,0,has_photo, awesome origins gravitational waves 
sydneyobs,Mon Feb 29 19:00:22 +0000 2016,704380708177850368,3622,654,1,0,has_no_media, renovating blog ready 10th birthday 
sydneyobs,Mon Feb 29 13:02:52 +0000 2016,704290740772298752,3622,654,6,6,has_photo, march 2016 night sky guide podcast transcript sky chart 
sydneyobs,Fri Feb 26 22:00:40 +0000 2016,703338918628831232,3622,654,6,10,has_photo, sydney observatory past present 
sydneyobs,Fri Feb 26 00:15:06 +0000 2016,703010361809571841,3622,654,0,3,has_no_media, learn black holes space affect physical universe adult astronomy course book 
sydneyobs,Thu Feb 25 19:06:46 +0000 2016,702932767714078720,3622,654,3,5,has_no_media, catch discussing string theory filmed catch iview 
sydneyobs,Thu Feb 25 18:57:45 +0000 2016,702930498268430336,3622,654,4,4,has_photo, wanted know string theory multiverse 
sydneyobs,Mon Feb 22 21:49:57 +0000 2016,701886672472903680,3622,654,0,1,has_no_media, 12 30 pm 2pm 
sydneyobs,Mon Feb 22 21:30:35 +0000 2016,701881799463415808,3622,654,7,5,has_photo, head circular quay today lunchtime sun close free telescopes 
sydneyobs,Sun Feb 21 10:40:19 +0000 2016,701355763151691776,3622,654,1,2,has_no_media, popular proposals loveinthecosmos 
sydneyobs,Fri Feb 19 19:29:10 +0000 2016,700764078277423105,3622,654,1,1,has_no_media, nice picture thanks sharing 
sydneyobs,Thu Feb 18 11:45:36 +0000 2016,700285028144513024,3622,654,0,2,has_no_media, kind come won 
sydneyobs,Thu Feb 18 11:44:30 +0000 2016,700284755200225282,3622,654,0,2,has_no_media, mayan mate gave fabulous talk sold audience 
sydneyobs,Thu Feb 18 11:43:01 +0000 2016,700284381240295424,3622,654,0,0,has_no_media, thanks visiting 
sydneyobs,Thu Feb 18 08:31:47 +0000 2016,700236253409599488,3622,654,1,4,has_photo, wowing crowd event thank sharing building 
sydneyobs,Thu Feb 18 08:25:08 +0000 2016,700234582742818816,3622,654,1,0,has_no_media, fred watson takes mic explain gravitational waves 
sydneyobs,Thu Feb 18 08:13:00 +0000 2016,700231526827491328,3622,654,1,1,has_no_media, existence black holes theorised 300 years ago pierre simon laplace jon michell 
sydneyobs,Thu Feb 18 08:09:16 +0000 2016,700230589404721152,3622,654,0,1,has_no_media, listening guide aina talk gravity black holes 
sydneyobs,Thu Feb 18 07:05:10 +0000 2016,700214455355846656,3622,654,2,5,has_photo, summer series talk fred watson 
sydneyobs,Thu Feb 18 03:10:39 +0000 2016,700155440466759680,3622,654,3,6,has_photo, art meets science sydney observatory beautiful day 
sydneyobs,Wed Feb 17 03:44:02 +0000 2016,699801451669794817,3622,654,3,1,has_no_media, david malin awards 2016 theme light pollution bad beautiful 
sydneyobs,Mon Feb 15 22:45:34 +0000 2016,699363953055412224,3622,654,0,2,has_no_media, sold thursday talk space march history talk 
sydneyobs,Mon Feb 15 19:36:56 +0000 2016,699316480865796097,3622,654,1,2,has_no_media, loving weirdweather planetary science action lenticular clouds crete 
sydneyobs,Mon Feb 15 19:28:45 +0000 2016,699314421424762880,3622,654,3,5,has_no_media, sydney observatory share story east dome exhibition watching heavens female pioneers science 
sydneyobs,Sun Feb 14 19:56:18 +0000 2016,698958966173208576,3622,654,3,1,has_no_media, loving weird weather perfect sort photo atoptics 
sydneyobs,Sat Feb 13 21:26:09 +0000 2016,698619191574724608,3622,654,1,2,has_no_media, thanks perfect evening dinner stars happy valentine day romantics 
sydneyobs,Thu Feb 11 22:20:32 +0000 2016,697908102046154752,3622,654,5,7,has_no_media, learn einstein gravitationalwaves understanding relativity astronomy course 
sydneyobs,Thu Feb 11 19:23:28 +0000 2016,697863543014592512,3622,654,4,5,has_no_media, squiggles heaven great discovery ligo 
sydneyobs,Thu Feb 11 19:15:59 +0000 2016,697861656940916736,3622,654,6,5,has_photo, einstein gravitational waves directly observed 
sydneyobs,Thu Feb 11 13:02:20 +0000 2016,697767626563387392,3622,654,3,3,has_photo, mars caught claw 
sydneyobs,Thu Feb 11 08:14:09 +0000 2016,697695100097265665,3622,654,2,2,has_no_media, hear chirp gravitational wave merging black holes 
sydneyobs,Thu Feb 11 08:02:36 +0000 2016,697692193595588608,3622,654,2,0,has_no_media, latest rumour gravitational waves probably true 
sydneyobs,Thu Feb 11 08:02:12 +0000 2016,697692095314669568,3622,654,1,0,has_no_media, einstein gravitational waves finally 
sydneyobs,Thu Feb 11 07:59:41 +0000 2016,697691460653613056,3622,654,6,5,has_no_media, big announcement ligo gravitational waves tonight 02 30am east detected 
sydneyobs,Thu Feb 11 06:40:10 +0000 2016,697671450992386049,3622,654,1,1,has_no_media, thanks josh good luck mission 
sydneyobs,Wed Feb 10 18:03:08 +0000 2016,697480937949437952,3622,654,3,2,has_photo, hubble space telescope balogh explains patterns universe 
sydneyobs,Wed Feb 10 06:14:35 +0000 2016,697302623486017537,3622,654,0,1,has_no_media, day solar viewing sydney observatory rocks 
sydneyobs,Tue Feb 09 23:46:49 +0000 2016,697205040503590912,3622,654,2,1,has_no_media, spots left week adult astronomy astronomical concepts course starting 25 feb book 
sydneyobs,Tue Feb 09 22:01:01 +0000 2016,697178412855635969,3622,654,0,0,has_no_media, black holes twinkle 
sydneyobs,Tue Feb 09 10:54:37 +0000 2016,697010710572761088,3622,654,1,0,has_no_media, think aussie make mars 
sydneyobs,Tue Feb 09 10:21:24 +0000 2016,697002349806530560,3622,654,0,0,has_no_media, robots bring 87 metre tall sydney harbour control tower smh 
sydneyobs,Tue Feb 09 06:31:55 +0000 2016,696944598921379840,3622,654,3,4,has_no_media, early planets iss wed feb 10 28am visible min max height 47 appears 47 sse disappears 24 se 
sydneyobs,Tue Feb 09 03:46:55 +0000 2016,696903074258952193,3622,654,0,1,has_no_media, missed seeing sun moon lunar new year object beauty observatory 
sydneyobs,Tue Feb 09 02:59:44 +0000 2016,696891200368877569,3622,654,8,10,has_photo, sydney harbour looking sun join free peep telescopes 
