earthskyscience,Mon Mar 30 20:52:45 +0000 2015,117513,1447,47,41,0.0399955749577,Moon between Jupiter and Regulus tonight http://t.co/QmfyJFLZjI http://t.co/UEs1A9xW1P
earthskyscience,Mon Mar 30 20:17:14 +0000 2015,117513,1447,12,28,0.0102116361594,Thank you  Jackson  for your kind donation to EarthSky! http://t.co/TOLAhPU9p9  It means the world to us. http://t.co/mRhItjZVJJ
earthskyscience,Mon Mar 30 17:04:03 +0000 2015,117513,1447,26,32,0.0221252116787,Passing comets painted Mercury black http://t.co/6vclO54s7k http://t.co/dwrw09r1sm
earthskyscience,Mon Mar 30 16:20:09 +0000 2015,117513,1447,22,45,0.0187213329589,Thank you  Rahlj  for your donation to EarthSky!  Donate here to help EarthSky keep going:  http://t.co/iodAYqUem9 http://t.co/U7HoTopBJb
earthskyscience,Mon Mar 30 14:03:01 +0000 2015,117513,1447,15,4,0.0127645451993,Greenland glacier melt increases mercury discharge   increasing risk of mercury poisoning in humans &amp; wildlife http://t.co/itBbEVsXWb
earthskyscience,Mon Mar 30 13:16:06 +0000 2015,117513,1447,30,41,0.0255290903985,See it! This weekend’s moon and Jupiter http://t.co/ZLcg83irxC  Photo by Colin Chatfield. Glow in right is an aurora. http://t.co/SVjBIYJKeq
earthskyscience,Mon Mar 30 12:37:04 +0000 2015,117513,1447,42,53,0.0357407265579,See it! This weekend’s moon and Jupiter http://t.co/aRhnKhC2kj Many saw them in a moon halo! Photo: Amy Van Artsdalen http://t.co/9T4WgvHOiE
earthskyscience,Mon Mar 30 02:36:03 +0000 2015,117513,1447,42,44,0.0357407265579,Last chance coming up to see Nova Sagittarius before it's gone! http://t.co/L6CipRMaTl  Tom Wildoner tells you how... http://t.co/gL0s1K0uvB
earthskyscience,Mon Mar 30 00:09:01 +0000 2015,117513,1447,29,41,0.0246781207186,One-year crew lift-off success http://t.co/T5in5Ryar6 http://t.co/EzoUsHy7Rb
earthskyscience,Sun Mar 29 23:48:00 +0000 2015,117513,1447,71,51,0.0604188472765,"Bright ""star"" near tonight's moon is the planet Jupiter. http://t.co/9NpmsyqU5c http://t.co/xg6ufhWfdB"
earthskyscience,Sun Mar 29 21:25:28 +0000 2015,117513,1447,67,50,0.0570149685567,Moon and Jupiter tonight and tomorrow night! http://t.co/OsfuZM6YXH http://t.co/zovGBfwXT9
earthskyscience,Sun Mar 29 21:21:03 +0000 2015,117513,1447,24,23,0.0204232723188,Public invited to NASA flying saucer broadcast on Tuesday at 16 UTC (11 a.m. CDT) http://t.co/5OdkIU991y http://t.co/430j08Jvlu
earthskyscience,Sun Mar 29 20:31:40 +0000 2015,117513,1447,2,3,0.0017019393599,Help EarthSky keep growing ... DONATE:  http://t.co/dmkUfGjzJb  Only $252 more to reach $21 000 today! http://t.co/GekmKLGFU9
earthskyscience,Sun Mar 29 16:30:15 +0000 2015,117513,1447,35,47,0.0297839387983,Black hole winds stop star formation http://t.co/1TZJ1baKxJ http://t.co/xPp8KKAuji
earthskyscience,Sun Mar 29 15:47:07 +0000 2015,117513,1447,97,76,0.0825440589552,The moon and Jupiter are close tonight! http://t.co/FUX5JCkSq6 http://t.co/xsfGLeX2pM
earthskyscience,Sun Mar 29 15:07:55 +0000 2015,117513,1447,15,24,0.0127645451993,Big EarthSky shoutout to rcolli53! Thank you for your kind donation to EarthSky this morning! http://t.co/jJQ0L5o863 http://t.co/qqFd4W2G5z
earthskyscience,Sun Mar 29 14:02:04 +0000 2015,117513,1447,35,60,0.0297839387983,Beautiful moon halo seen by Sheryl R Garrison in Idaho last week. http://t.co/gnT8mevt8M  Thanks  Sheryl. http://t.co/RhSbooq6K7
earthskyscience,Sun Mar 29 13:04:01 +0000 2015,117513,1447,27,33,0.0229761813587,How to see Nova Sagittarii.  Its brightness is back up!  http://t.co/kT7Petoekj  Tom Wildoner's image  from today. http://t.co/VGbCEqZvuB
earthskyscience,Sun Mar 29 00:37:46 +0000 2015,117513,1447,11,20,0.00936066647945,An awesome donation just now from Schaefertm! http://t.co/CQ50P08mbp  Thank you so much!! http://t.co/NtfRnjiq1L
earthskyscience,Sun Mar 29 00:33:24 +0000 2015,117513,1447,42,57,0.0357407265579,Why our cities need to be ecosystems  too. http://t.co/djyOMs2JQC http://t.co/d9Ol3VZ6Oz
earthskyscience,Sat Mar 28 23:40:01 +0000 2015,117513,1447,23,18,0.0195723026389,Compare with previous chart ... this one is the view from the S. Hemisphere. http://t.co/yh5Fl4K3MH  Upside-down! http://t.co/a58QJRLEll
earthskyscience,Sat Mar 28 23:39:03 +0000 2015,117513,1447,34,21,0.0289329691183,Identify these stars - and planet Jupiter - near tonight's moon! http://t.co/QvxwLaoxzy http://t.co/CBxNzGxfSe
earthskyscience,Sat Mar 28 21:21:00 +0000 2015,117513,1447,43,32,0.0365916962379,Possible New Continental Heat Record for Antarctica http://t.co/VkzLxPijmc http://t.co/v11ZVDYR3j
earthskyscience,Sat Mar 28 19:15:03 +0000 2015,117513,1447,19,20,0.0161684239191,Curiosity rover detects nitrogen on Mars http://t.co/uLYaQTJexe Discovery adds to the evidence that ancient Mars was habitable for life.
earthskyscience,Sat Mar 28 19:02:43 +0000 2015,117513,1447,5,13,0.00425484839975,Help EarthSky reach $20 000 donated! http://t.co/77QukK4g8K  Just $52 left to go! http://t.co/Aiob89EddL
earthskyscience,Sat Mar 28 17:09:00 +0000 2015,117513,1447,27,54,0.0229761813587,Crescent moon and Venus setting on the second day of spring in central California. Ross Barringer Photography http://t.co/1eBlcB4dCm
earthskyscience,Sat Mar 28 16:35:05 +0000 2015,117513,1447,100,125,0.085096967995,Jupiter and its four largest moons - submitted by Jeremy Lux in Elmira  NY. http://t.co/O3H2nHEoco http://t.co/SxGsYGnps1
earthskyscience,Sat Mar 28 16:30:10 +0000 2015,117513,1447,26,42,0.0221252116787,Sunset at Joshua Tree National Park - California. Photo: Daniel McVey http://t.co/a8xJNEGkjE  Thank you Daniel! http://t.co/MEar40dbuV
earthskyscience,Sat Mar 28 15:34:33 +0000 2015,117513,1447,71,68,0.0604188472765,Shortest total lunar eclipse of century on April 4  http://t.co/ieSkaU5XEh  Photo: Fred Espenak http://t.co/EzcyTkSzLP
earthskyscience,Sat Mar 28 15:02:02 +0000 2015,117513,1447,10,29,0.0085096967995,Digby Gut  Nova Scotia. Photo: Susan Saunders http://t.co/ls2la2KbMY
earthskyscience,Sat Mar 28 14:25:11 +0000 2015,117513,1447,53,32,0.0451013930374,Watch the moon move past Jupiter in the next few nights. http://t.co/VnyAVhskfe http://t.co/Fbm2APtkrJ
earthskyscience,Sat Mar 28 14:02:14 +0000 2015,117513,1447,14,39,0.0119135755193,We are having a major meltdown  fog  showers and thunder. Central MA Eileen Claffey http://t.co/AKQo7dPgwF
earthskyscience,Sat Mar 28 13:04:18 +0000 2015,117513,1447,100,106,0.085096967995,Stellar reflections on SEST telescope at La Silla  Chile. Photo: Yuri Beletsky http://t.co/qQo8F1wlsw
earthskyscience,Sat Mar 28 02:04:18 +0000 2015,117513,1447,61,84,0.051909150477,North window section  Arches National Park. © Manish Mamtani Photography More info abt photo: http://t.co/nhwRbvkQIV http://t.co/XAw9JEhlrA
earthskyscience,Fri Mar 27 23:12:12 +0000 2015,117513,1447,72,101,0.0612698169564,Moonrise under the Milky Way at Lake Cuyamaca  San Diego  CA by Jack Fusco Photography http://t.co/wuvWUhinXf http://t.co/GI9gX93lkG
earthskyscience,Fri Mar 27 20:01:03 +0000 2015,117513,1447,12,20,0.0102116361594,Mars rover finishes first-ever marathon on another world http://t.co/UZpPVvg18b finish time?  Eleven years and 2 months.
earthskyscience,Fri Mar 27 19:41:16 +0000 2015,117513,1447,22,34,0.0187213329589,Moon north of the Winter Triangle tonight. http://t.co/WuTnZetXvZ http://t.co/ANwQy6DaLb
earthskyscience,Fri Mar 27 18:30:09 +0000 2015,117513,1447,12,10,0.0102116361594,Friday FAQ:  What is a pulsar? http://t.co/OjeXbUSOf1 A teaspoon of matter from a neutron star weighs as much as Mount Everest. Intrigued?
earthskyscience,Fri Mar 27 17:07:22 +0000 2015,117513,1447,10,7,0.0085096967995,This date in science: Biggest earthquake in North America http://t.co/Q41eQ7EAaD
earthskyscience,Fri Mar 27 15:03:15 +0000 2015,117513,1447,18,23,0.0153174542391,Saturn  captured by our friend Annie Lewis in Madrid  Spain.  See Saturn before dawn now:  http://t.co/1yk2RGQ2rX http://t.co/pTgwJhRt8l
earthskyscience,Fri Mar 27 14:49:08 +0000 2015,117513,1447,33,59,0.0280819994384,Malibu stargazer http://t.co/bUtpIYIM5v  Photo by Shreenivasan Manievannan. http://t.co/JCXCOshG48
earthskyscience,Fri Mar 27 14:18:12 +0000 2015,117513,1447,18,21,0.0153174542391,Spotlight on the star Betelgeuse! Last night's sky from Robert Kelly. http://t.co/Z5trt8sZLU
earthskyscience,Fri Mar 27 13:06:04 +0000 2015,117513,1447,22,29,0.0187213329589,Today's sun with prominences! From Mohamad Fadzli in Melaka  Malaysia. http://t.co/OrE0wcTyWn
earthskyscience,Fri Mar 27 00:23:00 +0000 2015,117513,1447,61,91,0.051909150477,Solar halo seen in Sweden.  Thank you  Jörgen Norrland Andersson​!  http://t.co/HZiH8QtvKq http://t.co/SYRFirV2us
earthskyscience,Fri Mar 27 00:02:13 +0000 2015,117513,1447,40,45,0.034038787198,Find the Winter Circle tonight ... http://t.co/8igyeHClRI  Tonight's moon is in the midst of these stars. http://t.co/W9ir7g9rq2
earthskyscience,Thu Mar 26 23:30:09 +0000 2015,117513,1447,41,56,0.034889756878,Bluish Acrux - aka Alpha Crucis - is 13th brightest star in all the sky. http://t.co/JhTqAojLhQ #SouthernHemisphere http://t.co/5ipGnsni8G
earthskyscience,Thu Mar 26 21:46:46 +0000 2015,117513,1447,12,23,0.0102116361594,Thank you  M.J. Clark  donating to EarthSky!  Have you donated yet?  http://t.co/gWOD8CvswY  We need you. http://t.co/nAjTweZOFD
earthskyscience,Thu Mar 26 21:12:06 +0000 2015,117513,1447,66,83,0.0561639988767,Incredibly bright airglow and setting Milky Way over the Pacific ocean thanks to our friend Yuri Beletsky. http://t.co/7iPyzJMyRm
earthskyscience,Thu Mar 26 19:53:02 +0000 2015,117513,1447,48,43,0.0408465446376,Largest asteroid impact zone ever found on Earth! http://t.co/nBWCGQuTLK #Australia #400kmwide http://t.co/5ELJTyiZNm
earthskyscience,Thu Mar 26 17:27:05 +0000 2015,117513,1447,4,6,0.0034038787198,Thank you  Dan  for your $100 donation to EarthSky!  We love you.  DONATE:  http://t.co/TcOxoMTEcF http://t.co/R5XOI4NJg4
earthskyscience,Thu Mar 26 17:23:27 +0000 2015,117513,1447,51,39,0.0433994536775,April 4 eclipse is a Blood Moon eclipse http://t.co/SE3C7tAxM0  Photo: Greg Lepper http://t.co/gSGBit4Qe4
earthskyscience,Thu Mar 26 17:21:57 +0000 2015,117513,1447,33,34,0.0280819994384,April 4 eclipse @ N American time zones http://t.co/1rNZPExCzR  Translate to your time zone: http://t.co/lnlPcEmxkf http://t.co/DMlklVv7ur
earthskyscience,Thu Mar 26 17:20:11 +0000 2015,117513,1447,38,23,0.0323368478381,In N America  eclipse MORNING April 4 In Asia and Australia  eclipse EVENING April 4  Details: http://t.co/5yRNc9Gnvq http://t.co/I0tOb6GWD8
earthskyscience,Thu Mar 26 17:17:35 +0000 2015,117513,1447,49,49,0.0416975143176,Shortest total lunar eclipse of century on April 4 http://t.co/dyloCdRpGj http://t.co/Byl84jTwIN
earthskyscience,Thu Mar 26 17:01:06 +0000 2015,117513,1447,26,17,0.0221252116787,Cities  moonlight  and fossil-fuels industries frame the Gulf of Mexico with light. Photo by ISS astronauts. http://t.co/u2UWvxAa1T
earthskyscience,Thu Mar 26 16:19:05 +0000 2015,117513,1447,2,5,0.0017019393599,Thanks Crowd101 for helping EarthSky's crowd-funding campaign! http://t.co/OEWIanWZNs DONATE!  http://t.co/KF6f3lvh4d http://t.co/saQhybLvyM
earthskyscience,Thu Mar 26 16:09:07 +0000 2015,117513,1447,116,134,0.0987124828742,Ice halo display by Joshua Thomas in Red River  New Mexico on the morning of January 9  2015. http://t.co/SmscmXQ1pf http://t.co/H0OnNrr8xC
earthskyscience,Thu Mar 26 15:25:12 +0000 2015,117513,1447,13,20,0.0110626058394,A chance discovery by a team of researchers has provided experimental evidence that stars might generate sound...htt…/bit.ly/1906oQn
earthskyscience,Thu Mar 26 14:16:02 +0000 2015,117513,1447,41,39,0.034889756878,Tonight’s waxing crescent moon resides inside the Winter Circle as seen from North America. http://t.co/0GrjGnZyNT http://t.co/bbTAzYuIGF
earthskyscience,Thu Mar 26 13:20:04 +0000 2015,117513,1447,70,88,0.0595678775965,March 20  2015 total solar eclipse  seen from an airplane – 35 000 feet up – and captured by Eric Recurt of the UK. http://t.co/Dyyef4G3RD
earthskyscience,Thu Mar 26 02:35:00 +0000 2015,117513,1447,66,95,0.0561639988767,Beautiful shot of bright Jupiter and the Beehive star cluster (upper left).  Thank you   Scott MacNeil! http://t.co/TCxaR5VaSV
earthskyscience,Wed Mar 25 23:09:12 +0000 2015,117513,1447,34,50,0.0289329691183,India's Mars Orbiter Mission (MOM) expected to end yesterday  but may have another 6 months! http://t.co/asiAlGSHQ3 http://t.co/Y5nNkCW8ln
earthskyscience,Wed Mar 25 17:04:04 +0000 2015,117513,1447,112,98,0.0953086041544,Shortest total lunar eclipse of century on April 4  http://t.co/T5PsFQuPwr  Photo: Fred Espenak http://t.co/912MiDOFXb
earthskyscience,Wed Mar 25 16:20:09 +0000 2015,117513,1447,28,34,0.0238271510386,Tonight's moon heading to northern standstill. http://t.co/WXRBJMaHLW http://t.co/G6hCnMjsDG
earthskyscience,Wed Mar 25 15:05:14 +0000 2015,117513,1447,2,3,0.0017019393599,Yacht Sunrise is helping EarthSky build a new community website.  Donate: http://t.co/R7ZAJuJ7v0  Thank you! http://t.co/aMIj6Ke9C9
earthskyscience,Wed Mar 25 14:03:20 +0000 2015,117513,1447,29,46,0.0246781207186,"""Sometimes we can reach the moon ...""  Last night's waxing crescent from Daniela Claudia G in Bucharest. http://t.co/510obprpYl"
earthskyscience,Wed Mar 25 13:16:09 +0000 2015,117513,1447,52,53,0.0442504233574,New movie about the Svalbard Global Seed Vault – sometimes called the Doomsday Vault. http://t.co/XbbArdPPru http://t.co/g1kifMkfaL
earthskyscience,Wed Mar 25 02:03:08 +0000 2015,117513,1447,99,99,0.0842459983151,Sunsets moving north  as northern half of Earth moves toward summer. http://t.co/TMpZE7PlDS Photo: Abhijit Juvekar. http://t.co/fkX07f9OYq
earthskyscience,Wed Mar 25 01:17:08 +0000 2015,117513,1447,10,25,0.0085096967995,Danlorts1 is helping EarthSky build a new website.  Our thanks.  Donate:  http://t.co/up7qts96YF http://t.co/8bLEU3XXGs
earthskyscience,Wed Mar 25 00:23:06 +0000 2015,117513,1447,198,207,0.16849199663,Alpha and Beta Centauri (2 bright ones  rt) and Mount Semeru (red fire spot) in Indonesia from Martin Marthadinata http://t.co/Kzjw8hFgvb
earthskyscience,Wed Mar 25 00:02:02 +0000 2015,117513,1447,39,56,0.0331878175181,Back yard sunset with the moon &amp; Venus last night  from Columbia  SC. Jennifer Coulter http://t.co/D0HictxFK4
earthskyscience,Tue Mar 24 23:30:05 +0000 2015,117513,1447,121,179,0.102967331274,The Milky Way as seen the edge of Dantes Peak  in Death Valley National Park  CA by Jennifer Khordi http://t.co/lMi6VZA6em
earthskyscience,Tue Mar 24 21:12:07 +0000 2015,117513,1447,13,21,0.0110626058394,Jupiter may have swept through early solar system like a wrecking ball  destroying first generation of inner planets http://t.co/TEEcDkMy2f
earthskyscience,Tue Mar 24 20:24:34 +0000 2015,117513,1447,26,59,0.0221252116787,Last night's crescent moon and Pleiades star cluster  from Susan Waldron in Texas  Tonight:  http://t.co/KOR8LmoTxY http://t.co/CkO5fhBvGH
earthskyscience,Tue Mar 24 19:53:11 +0000 2015,117513,1447,3,6,0.00255290903985,Thanks to all who are helping EarthSky create a new community website in 2016!  Donate today:  http://t.co/tazW5LWtk1 http://t.co/CbtO8MYkHg
earthskyscience,Tue Mar 24 19:47:28 +0000 2015,117513,1447,22,24,0.0187213329589,This is an awesome infographic ... highest and lowest points on Earth. http://t.co/2fTBbZWHTQ  Click in to view the whole thing!
earthskyscience,Tue Mar 24 19:09:41 +0000 2015,117513,1447,7,8,0.00595678775965,Severe weather possible in parts of Oklahoma  Arkansas  Missouri &amp; Kansas today. http://t.co/kOnpIltPEy http://t.co/lbrHMLu0er
earthskyscience,Tue Mar 24 19:00:00 +0000 2015,117513,1447,29,42,0.0246781207186,Popular at EarthSky today ... when is our next Great Comet? http://t.co/e2rulusIim  Photo: Jerry Lodriguss http://t.co/xTrH0zlHgm
earthskyscience,Tue Mar 24 17:01:10 +0000 2015,117513,1447,15,18,0.0127645451993,Largest asteroid impact zone on Earth found in Australia http://t.co/vjCINJzlfl http://t.co/6h14JazoDZ
earthskyscience,Tue Mar 24 16:16:06 +0000 2015,117513,1447,7,11,0.00595678775965,Awesome Melissa McKeand donated to EarthSky!  Donate!  http://t.co/gSHwCRMFFw  All the cool people are! http://t.co/e7n6qBNNiY
earthskyscience,Tue Mar 24 16:09:07 +0000 2015,117513,1447,63,95,0.0536110898369,Meteor season ahead!  http://t.co/nm2K6nyhuC  Perseid meteor over Mount Rainier by Jeff Berkes Photography http://t.co/lvG6TNRMq7
earthskyscience,Tue Mar 24 15:59:41 +0000 2015,117513,1447,9,10,0.00765872711955,Dwarf planet Ceres has place names! http://t.co/kbYvri36nB  Thanks for the cool map Emily Lakdawalla (@elakdawalla)! http://t.co/heSC0Gl5CW
earthskyscience,Tue Mar 24 15:25:04 +0000 2015,117513,1447,58,78,0.0493562414371,If only we could hear them  would the stars make a sound?   http://t.co/Xts60OzLYT  Photo posted by Jason Brownlee http://t.co/r5HYPR7Sjj
earthskyscience,Tue Mar 24 14:16:02 +0000 2015,117513,1447,18,37,0.0153174542391,What if an advanced civilization could collect ALL of its star's energy? http://t.co/WYhVTQjs9f  #dysonsphere http://t.co/ggsnqmFAGj
earthskyscience,Tue Mar 24 13:30:14 +0000 2015,117513,1447,31,34,0.0263800600785,Bright Aldebaran near moon on March 24 http://t.co/mxRIop4yq1 http://t.co/MOfQmz8WC9
earthskyscience,Tue Mar 24 13:20:16 +0000 2015,117513,1447,22,40,0.0187213329589,When is our next Great Comet? http://t.co/XUay32feoo http://t.co/RoI034QEAi
earthskyscience,Tue Mar 24 12:32:04 +0000 2015,117513,1447,48,114,0.0408465446376,I like this photo of star trails from Daniel Chang in Hong Kong. http://t.co/nROA1Qeavk
earthskyscience,Tue Mar 24 10:47:10 +0000 2015,117513,1447,31,62,0.0263800600785,Last night's moon from Marcus Floyd. http://t.co/WT1xlDXr4n
earthskyscience,Tue Mar 24 02:35:08 +0000 2015,117513,1447,58,97,0.0493562414371,Tyler Collins in Ireland captured this shot along the Wild Atlantic Way - a trail on the west coast of Ireland. http://t.co/haSFErghia
earthskyscience,Tue Mar 24 02:16:48 +0000 2015,117513,1447,46,78,0.0391446052777,Tonight's moon  from France. Thank you  Jean Marie André Delaporte! http://t.co/FeyHXEat5R
earthskyscience,Tue Mar 24 00:51:24 +0000 2015,117513,1447,68,117,0.0578659382366,The legendary diamond ring effect in Friday's eclipse  by Núria Camps  Faroe Islands. More:  http://t.co/uyeqGrge7u http://t.co/1Ya1fq51mo
earthskyscience,Mon Mar 23 23:09:09 +0000 2015,117513,1447,13,20,0.0110626058394,The REAL Paleo Diet  http://t.co/lTl3xeB1QW  Early hominids ate just about everything http://t.co/0LwJUheA9g
earthskyscience,Mon Mar 23 21:32:26 +0000 2015,117513,1447,14,18,0.0119135755193,Live in Alaska? The moon will occult Aldebaran on the night of March 24-25. Find out more at http://t.co/vyEAeUBAwQ http://t.co/0UxePDO5cQ
earthskyscience,Mon Mar 23 21:23:10 +0000 2015,117513,1447,34,41,0.0289329691183,First 1-year ISS crew to launch Friday http://t.co/Q4uWNNYBgW    Watch launch  arrival  ...  #rightstuff http://t.co/lOdKFVQUIP
earthskyscience,Mon Mar 23 21:12:15 +0000 2015,117513,1447,39,74,0.0331878175181,On the road to the moon and Venus  from Steve Scanlon Photography​.  More photos here:  http://t.co/lbvT6Vd8fK http://t.co/Yg87Fra296
earthskyscience,Mon Mar 23 20:34:58 +0000 2015,117513,1447,56,56,0.0476543020772,Moon between Venus and Pleiades tonight ... Europe is already seeing this beautiful scene! http://t.co/QEP3AK09uM http://t.co/0YDSVudBS1
earthskyscience,Mon Mar 23 19:09:01 +0000 2015,117513,1447,27,41,0.0229761813587,Waxing crescent moon w/Venus above it Mars just to the right. Medano Creek  CO. Photo:  Forrest Boutin http://t.co/MxmYDZNQCy
earthskyscience,Mon Mar 23 17:04:06 +0000 2015,117513,1447,11,27,0.00936066647945,EarthSky shoutout to s.allen.pops!  Thanks for your donation! http://t.co/J68dx08LCh http://t.co/ZVXtSz3Fbn
earthskyscience,Mon Mar 23 16:20:12 +0000 2015,117513,1447,59,72,0.0502072111171,Beautiful moon halo in Mandan  North Dakota via Marshall Lipp  What causes moon halos: http://t.co/ZXjhZ7VTIU http://t.co/tZlUTZIbxf
earthskyscience,Mon Mar 23 15:52:09 +0000 2015,117513,1447,2,3,0.0017019393599,EarthSky weather blogger @mattdanielwx brilliantly sums up this winter's weather for his TV audience on 13WMAZ in GA https://t.co/mx0pNI42YQ
earthskyscience,Mon Mar 23 15:05:07 +0000 2015,117513,1447,94,124,0.0799911499153,12 moons by one of our favorite astrophotographers  Stefano De Rosa in Turin  Italy. http://t.co/xuNRxWG2Ts
earthskyscience,Mon Mar 23 14:03:04 +0000 2015,117513,1447,99,140,0.0842459983151,Check out this awesome photo of Friday's eclipse from Tine Mari Thornes in Norway! http://t.co/UNHFlMhLZb
earthskyscience,Mon Mar 23 13:16:06 +0000 2015,117513,1447,42,52,0.0357407265579,Beautiful telescopic shot of last night's moon  from Jenna in Poland  Ohio.  Venus nearby!  http://t.co/bXUfX7Bl7v http://t.co/puIJLTjsuH
earthskyscience,Mon Mar 23 12:37:04 +0000 2015,117513,1447,48,62,0.0408465446376,Venus and moon last night from Edmar Fermino in Brazil. http://t.co/k5QHqAo6tj http://t.co/dHDEsBoSo2
earthskyscience,Mon Mar 23 12:29:47 +0000 2015,117513,1447,9,23,0.00765872711955,One more!  Selfie w last night's moon and Venus  from Fotograf Göran Strand​! http://t.co/9HzAH8PSNY  #Airplanewindow http://t.co/0a9CmUCr3r
earthskyscience,Mon Mar 23 12:27:28 +0000 2015,117513,1447,15,23,0.0127645451993,Linda Sturgess saw them from Philadelphia  PA.  Lots more photos here!  http://t.co/oBBeoRg0xo http://t.co/7gF5mwZFfC
earthskyscience,Mon Mar 23 12:26:07 +0000 2015,117513,1447,27,44,0.0229761813587,Rodolfo Useche Melo in Bogota  Colombia caught a dramatic view of last night's moon and Venus http://t.co/BRfr7xo31t http://t.co/LJrMG1pkwu
earthskyscience,Mon Mar 23 12:21:28 +0000 2015,117513,1447,68,84,0.0578659382366,In the U.S.  we saw them about like this ...  Photo via John Gravell in Boston.  More:  http://t.co/gwrC0TUWxN http://t.co/zyo9HfaiqW
earthskyscience,Mon Mar 23 12:20:06 +0000 2015,117513,1447,4,17,0.0034038787198,So many awesome photos of last night's moon and Venus!  I hardly know where to begin!  Did you see them?
earthskyscience,Mon Mar 23 02:21:36 +0000 2015,117513,1447,8,16,0.0068077574396,Tonight's moon and Venus from our friend Eileen Claffey in central Mass.  Cold there. Lens frozen! http://t.co/XjENQYvJif
earthskyscience,Mon Mar 23 01:44:46 +0000 2015,117513,1447,16,36,0.0136155148792,EarthSky shoutout to our friend Valerie Myers!  Thank you for your kind donation  and yo! http://t.co/nBljq3H1vD http://t.co/uZZ1dHn3M9
earthskyscience,Mon Mar 23 01:33:31 +0000 2015,117513,1447,84,175,0.0714814531158,Whimsical shot of tonight's moon and Venus by Anthony Lynch in Dublin  Ireland.   http://t.co/sSpV2W8utX  Look west! http://t.co/cvrFyj6f6F
earthskyscience,Mon Mar 23 00:09:02 +0000 2015,117513,1447,31,60,0.0263800600785,Brian Tribelhorn near Cape Town  South Africa saw tonight's moon and Venus nearly side by side http://t.co/y8a9ENIY3g http://t.co/RGQ8vHFKvk
earthskyscience,Sun Mar 22 22:18:45 +0000 2015,117513,1447,65,78,0.0553130291968,Tonight's moon and Venus over the Saronic Gulf in Greece  by Nikolaos Pantazis.  More:  http://t.co/47KEaGyruQ http://t.co/aLnHkv8XZN
earthskyscience,Sun Mar 22 22:18:24 +0000 2015,117513,1447,11,33,0.00936066647945,Last night's planets and moon by Robert Kelly in Las Vegas  NV. http://t.co/VNlnRzPpRF http://t.co/ManKJNJX0U
earthskyscience,Sun Mar 22 22:02:22 +0000 2015,117513,1447,206,252,0.17529975407,Beautiful timelapse of moon and Venus in tonight's sky by Nitish Thakur in India.  http://t.co/Dd8vK9ztpw http://t.co/FNdGMEiZYH
earthskyscience,Sun Mar 22 21:21:05 +0000 2015,117513,1447,52,24,0.0442504233574,Arctic sea ice sets record winter low http://t.co/DAXKht8ZgM http://t.co/GrZQYsmhZJ
earthskyscience,Sun Mar 22 20:25:24 +0000 2015,117513,1447,6,7,0.0051058180797,Thanks to Barbara Byrd  EarthSky's dream is coming true! http://t.co/SvDV1Myrl2  Love ya  sis! http://t.co/aBZOtvVTC9
earthskyscience,Sun Mar 22 19:15:03 +0000 2015,117513,1447,4,10,0.0034038787198,THANK YOU  Glenn!  Your kind donation is appreciated. http://t.co/GvjYxBHvco http://t.co/A0XQstrPCt
earthskyscience,Sun Mar 22 18:02:36 +0000 2015,117513,1447,12,23,0.0102116361594,Thanks for helping EarthSky keep going  Mjmarggraff!  DONATE:  http://t.co/5GOn8pPoAM http://t.co/6TBL1FuKvL
earthskyscience,Sun Mar 22 17:09:05 +0000 2015,117513,1447,49,101,0.0416975143176,Red color of Mars easy to see in photo from last night by Hope Carter.  Thanks  Hope! http://t.co/5VvBkVMQ1G http://t.co/Gp2ZIzpanA
earthskyscience,Sun Mar 22 16:30:16 +0000 2015,117513,1447,10,29,0.0085096967995,EarthSky team shoutout to James Prosser for donating!  Thank you.  Donate today!  http://t.co/tbI52YaEZA http://t.co/WASnUoSCQG
earthskyscience,Sun Mar 22 15:02:02 +0000 2015,117513,1447,4,14,0.0034038787198,Larry  we love you!  Thanks for donating to help EarthSky build a new website in 2016!  http://t.co/pqLMgGLVYt http://t.co/QlXhAuE93f
earthskyscience,Sun Mar 22 14:44:49 +0000 2015,117513,1447,24,43,0.0204232723188,Catch Venus near moon tonight! http://t.co/stPNWRNw58  Photo from last night by Anthony Lynch Photography in Ireland http://t.co/RkrBYUzuBq
earthskyscience,Sun Mar 22 14:02:15 +0000 2015,117513,1447,106,67,0.0902027860747,Catch the moon and Venus tonight! http://t.co/EgYnjMgjox http://t.co/duGMQtnsXn
earthskyscience,Sun Mar 22 13:04:11 +0000 2015,117513,1447,74,88,0.0629717563163,"""Star"" next to the moon last night was Mars! Photo by Hector Barrios in Hermosillo  Mexico http://t.co/P3olnlVONb http://t.co/iu92HEOwxq"
earthskyscience,Sun Mar 22 11:54:42 +0000 2015,117513,1447,32,44,0.0272310297584,Last night's moon  Venus and Mars from Niko Powe in Illinois.  Thanks  Niko! More photos:  http://t.co/aZ0fzV0efB http://t.co/UjRRf4iCOl
earthskyscience,Sun Mar 22 03:28:00 +0000 2015,117513,1447,14,24,0.0119135755193,Thank you  I. Cintora  for donating to EarthSky!  Donate:  http://t.co/qmpwfuvFCu http://t.co/bbmPbxwOl5
