earthskyscience,Sat May 30 20:35:06 +0000 2015,117513,1447,51,38,0.0433994536775,Earth went between sun and Saturn a week ago  Saturn will be near moon Sunday night! http://t.co/K6MM5i4Tkc http://t.co/2Deb99Tg1W
earthskyscience,Sat May 30 20:23:04 +0000 2015,117513,1447,108,104,0.0919047254346,Manhattanhenge 2015 starts this weekend in NYC.  All Manhattanhenge 2015 dates here: http://t.co/yWO7quFWxa http://t.co/mA80FKbrFO
earthskyscience,Sat May 30 16:29:55 +0000 2015,117513,1447,12,15,0.0102116361594,This bear video went viral this week.  https://t.co/H1QCp6JFby
earthskyscience,Sat May 30 14:19:22 +0000 2015,117513,1447,33,40,0.0280819994384,Tonight's moon is heading toward the planet Saturn and star Antares http://t.co/iwpd1Bk0Ew http://t.co/TaoApDw6y8
earthskyscience,Sat May 30 14:18:05 +0000 2015,117513,1447,23,45,0.0195723026389,Which phase of the moon is best for stargazing? http://t.co/f2HiAb6hN2 http://t.co/QiWRC1Wuy7
earthskyscience,Sat May 30 02:04:20 +0000 2015,117513,1447,36,72,0.0306349084782,Electric showers over Lake Michigan earlier this year thanks to Images by Walter E. Elliott. http://t.co/3AXlMxgfcf
earthskyscience,Fri May 29 23:12:11 +0000 2015,117513,1447,49,54,0.0416975143176,The Cassini mission to Saturn is now preparing for it's “last close looks” at Saturn’s moons. http://t.co/cfy3fszEBU http://t.co/gxuDyujmxq
earthskyscience,Fri May 29 20:01:12 +0000 2015,117513,1447,46,21,0.0391446052777,6.7-magnitude earthquake in Alaska http://t.co/nF1tqOyj50 #AleutianArc #earthquake http://t.co/9d2KPfBmch
earthskyscience,Fri May 29 18:30:43 +0000 2015,117513,1447,37,45,0.0314858781582,'Bubble universe' via Colin Legg in Australia. http://t.co/y5K34uv0uM http://t.co/Cd0sWg8xn8
earthskyscience,Fri May 29 17:07:08 +0000 2015,117513,1447,28,24,0.0238271510386,Friday FAQ:  What is a coronal mass ejection or CME? http://t.co/JIqhCT0MnD http://t.co/QLvHnrdfAB
earthskyscience,Fri May 29 15:03:03 +0000 2015,117513,1447,24,27,0.0204232723188,Sunday is Cassini’s last close sweep of Saturn’s moons http://t.co/QS9DMUd59K #Hyperion http://t.co/eyc9gAxKtt
earthskyscience,Fri May 29 14:18:10 +0000 2015,117513,1447,42,75,0.0357407265579,Highland Light - aka Cape Cod Light - in Massachusetts  U.S. taken by our friend Venkat Pakala Photography! http://t.co/DRrxzhh9Hc
earthskyscience,Fri May 29 13:46:08 +0000 2015,117513,1447,16,29,0.0136155148792,Of course  you can always find Spica by following the curve in the handle of the Big Dipper http://t.co/ven3tZ86L0 http://t.co/SacK4iiJ2U
earthskyscience,Fri May 29 13:45:09 +0000 2015,117513,1447,24,27,0.0204232723188,Moon close to Spica again tonight http://t.co/msHQrSxzRr http://t.co/9algKvFDPB
earthskyscience,Fri May 29 13:06:08 +0000 2015,117513,1447,22,26,0.0187213329589,Pluto and all 5 known moons imaged by the approaching New Horizons spacecraft http://t.co/nUXPJkFd8L
earthskyscience,Fri May 29 02:07:03 +0000 2015,117513,1447,29,40,0.0246781207186,New pic from Dawn spacecraft  as it spirals closer to dwarf planet Ceres. http://t.co/6Ma2ni7vY0 http://t.co/JjQMJzEn8u
earthskyscience,Fri May 29 00:09:02 +0000 2015,117513,1447,13,21,0.0110626058394,Analysis of a particular type of call let human researchers single out individual whales. http://t.co/F89L97ce6t http://t.co/RyG40C2Som
earthskyscience,Thu May 28 23:21:10 +0000 2015,117513,1447,19,28,0.0161684239191,This wonderful video by Colin Legg lets you spend two days and nights at a reef in Australia! http://t.co/zT3600gy2B http://t.co/4ukZkENE0P
earthskyscience,Thu May 28 21:53:01 +0000 2015,117513,1447,23,37,0.0195723026389,Octopus opens a jar .... from the inside http://t.co/NxCCgB1jw8 #video #octopusesareamazing http://t.co/ePP9Bv5dkb
earthskyscience,Thu May 28 19:08:11 +0000 2015,117513,1447,97,117,0.0825440589552,Stunning photo from the Florida Keys taken earlier this year by our friend Jeff Berkes Photography! #MilkyWay #Wowza http://t.co/hs63u8TXXf
earthskyscience,Thu May 28 17:08:12 +0000 2015,117513,1447,83,105,0.0706304834359,Manhattanhenge 2015 starts this weekend in NYC.  All Manhattanhenge 2015 dates here: http://t.co/oDEJY3jNkQ http://t.co/CTQjI00A9J
earthskyscience,Thu May 28 15:44:08 +0000 2015,117513,1447,22,48,0.0187213329589,Another great firefly shot - this one thanks to Mike Lewinski in Virginia  USA! Keem em' coming  we LOVE your pics :) http://t.co/Ct1WWrgAAg
earthskyscience,Thu May 28 14:29:15 +0000 2015,117513,1447,15,20,0.0127645451993,Bright moon close to star Spica tonight http://t.co/yF3Nt92DNu http://t.co/iFUkQTHLIe
earthskyscience,Thu May 28 13:54:06 +0000 2015,117513,1447,11,23,0.00936066647945,Humans  meet your new ancestor... http://t.co/o985CmhJJA #Australopithecusdeyiremeda #Lucy http://t.co/nrypOz84oj
earthskyscience,Thu May 28 13:06:01 +0000 2015,117513,1447,18,32,0.0153174542391,The moon last night from Normandy  France thanks to FB friend Jean Marie Andre Delaporte! http://t.co/ukUqmzAiEV http://t.co/7QD24lS5qk
earthskyscience,Thu May 28 12:36:02 +0000 2015,117513,1447,40,64,0.034038787198,First firefly photo this year  from Matt Pollock in New York. http://t.co/Hc4oJTLgY8 Anyone else have firefly photos? http://t.co/RuxGWGEXyf
earthskyscience,Thu May 28 02:35:01 +0000 2015,117513,1447,18,9,0.0153174542391,NOAA forecasts slow 2015 Atlantic hurricane season http://t.co/i9jSHJgKyI http://t.co/JOHog3MeWz
earthskyscience,Thu May 28 00:51:04 +0000 2015,117513,1447,8,14,0.0068077574396,Video: Translating climate change into music http://t.co/TwcYFQzfr5 http://t.co/Wj7YGjQeO1
earthskyscience,Wed May 27 21:23:07 +0000 2015,117513,1447,35,36,0.0297839387983,From the New Horizons spacecraft on its way to Pluto ...  http://t.co/51jxJAPzNJ http://t.co/6HG5nJsSGe
earthskyscience,Wed May 27 20:29:58 +0000 2015,117513,1447,7,7,0.00595678775965,Great video about the amazing camouflage abilities of octopuses. https://t.co/1ou83OSSGv
earthskyscience,Wed May 27 20:22:31 +0000 2015,117513,1447,12,16,0.0102116361594,Wonderful night-shining clouds ... seen from ISS. https://t.co/s74GN866MP
earthskyscience,Wed May 27 19:09:09 +0000 2015,117513,1447,40,41,0.034038787198,"""If Alaska is a canary in the climate coal mine  we’re in trouble"" Good article  @EricHolthaus http://t.co/Dah2KgFAzt http://t.co/jcxaGjhFxk"
earthskyscience,Wed May 27 16:34:10 +0000 2015,117513,1447,5,12,0.00425484839975,Hawaii governor says Thirty Meter Telescope has 'right' to continue http://t.co/ceOuZpMEo0  What do you think? http://t.co/NkREWpYRMU
earthskyscience,Wed May 27 15:05:07 +0000 2015,117513,1447,53,14,0.0451013930374,Heat wave kills 1 100 in India http://t.co/dZe0lcLeGZ http://t.co/sXO4fU7mty
earthskyscience,Wed May 27 14:09:00 +0000 2015,117513,1447,31,35,0.0263800600785,Beautiful Summer Triangle asterism ... and a word on how we find star distances. http://t.co/E7Qbjvzgcw http://t.co/3tdNJOS9Df
earthskyscience,Wed May 27 14:03:17 +0000 2015,117513,1447,28,54,0.0238271510386,Rough weather here in central Texas this week. Anne Marie caught these mammatus clouds. http://t.co/LRYl3ujco6 http://t.co/A2x6MvwV81
earthskyscience,Wed May 27 13:16:01 +0000 2015,117513,1447,25,40,0.0212742419988,Last night's moon from Tom Wildoner in Weatherly PA  The phase is now waxing gibbous: http://t.co/eiNMCffT4f http://t.co/dwwmEB9phy
earthskyscience,Wed May 27 12:38:08 +0000 2015,117513,1447,18,18,0.0153174542391,Rajib Maji in India caught the moon  star Regulus and planets  too ... and kindly labeled them for us. Thanks  Rajib! http://t.co/hlhF8WBxv3
earthskyscience,Wed May 27 12:37:10 +0000 2015,117513,1447,25,39,0.0212742419988,Did you see the moon and two planets (and a star!) in a line last night?  This photo from Chintan Gadani in the UK. http://t.co/QsGpOOjJ0A
earthskyscience,Wed May 27 12:01:55 +0000 2015,117513,1447,1,9,0.00085096967995,Wow!  check this out NOW. http://t.co/dbdk5TyJRT
earthskyscience,Wed May 27 11:53:30 +0000 2015,117513,1447,4,8,0.0034038787198,And you know what Stevie Ray would say ... https://t.co/tkdaEtTvUM
earthskyscience,Wed May 27 11:52:37 +0000 2015,117513,1447,6,5,0.0051058180797,EarthSky is in Texas.  It's been raining here.  https://t.co/oYrJkQjJYD
earthskyscience,Wed May 27 11:35:34 +0000 2015,117513,1447,16,15,0.0136155148792,Watch NASA TV today at 8 am EDT (1200 UTC).  They're moving a BIG storage module aboard ISS. http://t.co/4DcVkDIEkI http://t.co/kerKuFO3Em
earthskyscience,Wed May 27 00:54:04 +0000 2015,117513,1447,43,37,0.0365916962379,Does the North Star ever move? http://t.co/OjsSoeEPKP http://t.co/em382RlbfU
earthskyscience,Wed May 27 00:08:18 +0000 2015,117513,1447,17,21,0.0144664845592,9 instruments chosen for a mission to Jupiter's moon  Europa http://t.co/b4obBy1Q4Q  Liquid ocean beneath icy crust! http://t.co/avOCkO8am1
earthskyscience,Tue May 26 21:15:08 +0000 2015,117513,1447,38,37,0.0323368478381,Super interesting article in Natl. Geographic ...Has the Last Human Trekked to the North Pole? http://t.co/h5z7R1KMfz http://t.co/bAFx9qiUGS
earthskyscience,Tue May 26 18:45:23 +0000 2015,117513,1447,2,16,0.0017019393599,Eek!  Sorry ... wrong Medusa.  Medusa Nebula foreshadows our sun's fate http://t.co/qrzkh4fUOo http://t.co/JKm9BbtRyC
earthskyscience,Tue May 26 18:44:00 +0000 2015,117513,1447,44,66,0.0374426659178,Medusa Nebula foreshadows our sun's fate http://t.co/XKFsADlFWk http://t.co/P650EN4Fyl
earthskyscience,Tue May 26 17:42:11 +0000 2015,117513,1447,25,35,0.0212742419988,A clap of thunder ... Bam!  Yikes!  Do you - and your dog - have astraphobia? http://t.co/znvjBRuWo0 http://t.co/GzUdZXNRIf
earthskyscience,Tue May 26 16:20:06 +0000 2015,117513,1447,29,56,0.0246781207186,Last night's moon with planets Jupiter and Venus. In the Saronic Gulf  near Athens  Greece.  Via Nikolaos Pantazis http://t.co/lagDIKXi6Y
earthskyscience,Tue May 26 16:19:00 +0000 2015,117513,1447,2,8,0.0017019393599,What the Cassini spacecraft - orbiting Saturn - is doing today ... https://t.co/83kAFTEMG3
earthskyscience,Tue May 26 15:54:03 +0000 2015,117513,1447,15,28,0.0127645451993,Star of the week: Polaris is the North Star http://t.co/umvbfGXFeI http://t.co/M90Ihx2vjS
earthskyscience,Tue May 26 14:31:02 +0000 2015,117513,1447,10,16,0.0085096967995,Deneb again ... and the entire Summer Triangle asterism http://t.co/cNpLfynhZb  Image via our friend Susan Jensen http://t.co/AMpUnoQzBs
earthskyscience,Tue May 26 14:09:09 +0000 2015,117513,1447,40,48,0.034038787198,Yesterday's sun - May 25  2015 - by Mohamed Fadzli.  No spots! http://t.co/ka0SHmJq8m
earthskyscience,Tue May 26 14:04:01 +0000 2015,117513,1447,9,13,0.00765872711955,Watch for Deneb  brightest star in Cygnus the Swan http://t.co/cyyCsOPc07 http://t.co/6w7XGt5qOs
earthskyscience,Tue May 26 13:22:07 +0000 2015,117513,1447,14,23,0.0119135755193,Last night's moon  stars  and planet Jupiter  from Robert Kelly in Las Vegas  Planet guide:  http://t.co/QeRFCXbBk5 http://t.co/EWsTpd2Mkw
earthskyscience,Tue May 26 12:38:00 +0000 2015,117513,1447,18,40,0.0153174542391,Last night's moon  Jupiter and Venus in the sky after sunset by Kurt Zeppetello. http://t.co/Bef4nK4SPU http://t.co/A51EvMuE5C
earthskyscience,Tue May 26 11:26:26 +0000 2015,117513,1447,13,13,0.0110626058394,If you like the subtle colors in the sky  check out this video by  juan manuel pérez rayego in Spain.   https://t.co/xwyyQOHyxv #Vimeo
earthskyscience,Mon May 25 23:09:19 +0000 2015,117513,1447,61,107,0.051909150477,Today's featured image at earthsky is called Starglobe. http://t.co/HkGNSmG9B7  It's by Paul Wilson. http://t.co/xShJkgqfMl
earthskyscience,Mon May 25 21:23:18 +0000 2015,117513,1447,116,148,0.0987124828742,Earth went between Saturn and the sun this weekend  and Scott MacNeill in RI captured this. http://t.co/3xkm6MggNZ http://t.co/1HwNw0e6al
earthskyscience,Mon May 25 20:32:33 +0000 2015,117513,1447,46,50,0.0391446052777,Tonight's moon!  Moon near star Regulus tonight:  http://t.co/OV7iCx7B9O  Photo: Teluk Kemang Observatory  Maylasia http://t.co/ulAQu2xcXw
earthskyscience,Mon May 25 19:09:07 +0000 2015,117513,1447,18,44,0.0153174542391,7 more and EarthSky Photos on G+ will have 1 000 members  Join:  http://t.co/7j4GcJ2qbl  Photo: Martin Marthadinata. http://t.co/ytlGJvqfhC
earthskyscience,Mon May 25 17:42:25 +0000 2015,117513,1447,16,8,0.0136155148792,Central U.S. inundated with heavy rain http://t.co/7d5PYsU57o http://t.co/4wfB3HRxI1
earthskyscience,Mon May 25 17:04:09 +0000 2015,117513,1447,109,131,0.0927556951146,"""For small creatures such as we the vastness is bearable only through love."" - Carl Sagan  Via Josh Blash in Rye  NH http://t.co/vVdAWJY6zy"
earthskyscience,Mon May 25 16:20:06 +0000 2015,117513,1447,46,73,0.0391446052777,The Portal.  9-image panorama at Arches National Park in Utah  by Mike Taylor. http://t.co/uBa8QdCEHC http://t.co/n1cDvOZcJ9
earthskyscience,Mon May 25 15:05:01 +0000 2015,117513,1447,23,38,0.0195723026389,Saturn’s rings still very open in 2015 See Saturn: http://t.co/uI8csM7riC  Yearly comparison by Abhijit Juvekar http://t.co/V20C6cuJwS
earthskyscience,Mon May 25 14:03:07 +0000 2015,117513,1447,42,44,0.0357407265579,Anniversary of John F. Kennedy's famous moon speech today http://t.co/OOtc7F8UQZ http://t.co/OMcuau7uve
earthskyscience,Mon May 25 13:16:03 +0000 2015,117513,1447,54,41,0.0459523627173,First quarter moon and star Regulus tonight http://t.co/I8Z1aIUPk4  Venus and Jupiter very bright! http://t.co/HQUBi9rfI3
earthskyscience,Mon May 25 12:37:05 +0000 2015,117513,1447,57,93,0.0485052717572,"""Can I jump in the water and be in a parallel world?"" wrote Amit Kamble in New Zealand. http://t.co/D7SH6o9mYk http://t.co/L0JXv5dhLv"
earthskyscience,Mon May 25 00:09:14 +0000 2015,117513,1447,54,93,0.0459523627173,Rare rainbow shot from Juan Manuel Perez Rayego in Spain. http://t.co/2FiyUayNfE http://t.co/hTNzZ98hJT
earthskyscience,Sun May 24 21:21:02 +0000 2015,117513,1447,75,84,0.0638227259963,Most luminous galaxy in the universe discovered with a luminosity of 300 trillion suns! http://t.co/PK4Cc2sjnn #WISE http://t.co/XUBU8w0jO2
earthskyscience,Sun May 24 19:20:48 +0000 2015,117513,1447,18,15,0.0153174542391,This is cool.  Proxima Centauri's motion on our sky's dome since its discovery - 100 years ago this year - in 1915. https://t.co/UD5T2h8GLm
earthskyscience,Sun May 24 19:15:00 +0000 2015,117513,1447,34,50,0.0289329691183,How is it possible to capture the Milky Way with such a bright moon?  Justin Ng tells you how! http://t.co/ZFGnxQswq0 http://t.co/eVX9XrSZbL
earthskyscience,Sun May 24 18:55:08 +0000 2015,117513,1447,33,37,0.0280819994384,Neptune  orbited by its large moon Triton.  A 70-day span of observations by Kepler ... https://t.co/1mpwZ1KlnQ Via @Astroguyz Thank you!
earthskyscience,Sun May 24 17:09:00 +0000 2015,117513,1447,38,31,0.0323368478381,Venus and Jupiter draw closer! http://t.co/DeaGok5IRK  Great article  many charts  by @JayRyanAstro http://t.co/vzlkIST1sF
earthskyscience,Sun May 24 16:30:19 +0000 2015,117513,1447,25,21,0.0212742419988,Watch the Arctic ice pack vanish in this one-minute animation. http://t.co/GxyD8e6Te4 http://t.co/vZyvssseU2
earthskyscience,Sun May 24 15:02:19 +0000 2015,117513,1447,25,41,0.0212742419988,Two amazing and beautiful videos of paddle boarders’ close encounters with orcas. #killerwhale http://t.co/KHHSv32eUQ http://t.co/6faLtsiyhY
earthskyscience,Sun May 24 14:02:08 +0000 2015,117513,1447,27,31,0.0229761813587,Origin of Antarctica's creepy Blood Falls  http://t.co/GbyGBv3tA8 http://t.co/UymSUUT76c
earthskyscience,Sun May 24 14:02:04 +0000 2015,117513,1447,18,21,0.0153174542391,Here's a closer look at the constellation Leo. http://t.co/OYAZ4rFURx http://t.co/bkhFvIGy1Y
earthskyscience,Sun May 24 14:00:28 +0000 2015,117513,1447,30,20,0.0255290903985,Moon near star Regulus  Lion's Heart  tonight http://t.co/PSMkggHmuu http://t.co/qJ6wbqN3go
earthskyscience,Sun May 24 13:04:04 +0000 2015,117513,1447,91,116,0.0774382408755,I saw a cloud that looked like ocean waves.  What is it? http://t.co/WV1rX5hCsl  Photo by Paul Chartier http://t.co/dzkJnvvubd
earthskyscience,Sun May 24 00:09:06 +0000 2015,117513,1447,36,76,0.0306349084782,Beautiful shot of moon and Venus from Max Corneau.  He's in Hawaii ... lucky!  Planet guide: http://t.co/iDUTICOLXj http://t.co/pWuOHNjPzl
earthskyscience,Sat May 23 21:21:01 +0000 2015,117513,1447,54,57,0.0459523627173,Earth went between the sun and Saturn last night ... http://t.co/cUJVUjtuDZ http://t.co/Q2UZapoUx2
earthskyscience,Sat May 23 20:42:48 +0000 2015,117513,1447,40,69,0.034038787198,Beautiful rainbow over Paris last week ...  Photo by Pascal Colin. http://t.co/uoe4uTmNyE http://t.co/A6nswm9Qna
earthskyscience,Sat May 23 15:02:32 +0000 2015,117513,1447,20,23,0.017019393599,Jupiter (above)  moon and Venus on Friday night from Mumbai by Himanshu H. Sheth  More photos:http://t.co/G0LNPcK0cr http://t.co/4fhwzazrP7
earthskyscience,Sat May 23 14:02:11 +0000 2015,117513,1447,84,81,0.0714814531158,This is Proxima Centauri.  It's our sun's closest neighbor at 4.22 light-years away. http://t.co/w19TTN234z http://t.co/vqFWHDDxMq
earthskyscience,Sat May 23 13:59:17 +0000 2015,117513,1447,13,23,0.0110626058394,Here's a closer look at the constellation Cancer http://t.co/aUyNzTpzKH http://t.co/2IDl1F55KA
earthskyscience,Sat May 23 13:57:04 +0000 2015,117513,1447,63,57,0.0536110898369,Tonight's moon and Jupiter are in front of the constellation Cancer the Crab. http://t.co/P8Zyf0QDjp http://t.co/9VIvKYBCxO
earthskyscience,Sat May 23 13:56:02 +0000 2015,117513,1447,61,46,0.051909150477,Moon and Jupiter tonight! http://t.co/YFRThhbxXB http://t.co/2VMPEzVKGl
earthskyscience,Sat May 23 13:04:34 +0000 2015,117513,1447,54,79,0.0459523627173,Last night's moon  with earthshine  from Eileen Claffey.  More moon and planet photos!  http://t.co/SJ8gmQjGZp http://t.co/AvBnGlLhny
earthskyscience,Sat May 23 01:25:10 +0000 2015,117513,1447,9,18,0.00765872711955,Moon and Venus from Bogota  Colombia thanks to our friend Rodolfo. http://t.co/vVdJleaZCd Share more pics with us! http://t.co/cvtkflhCD7
earthskyscience,Fri May 22 23:12:06 +0000 2015,117513,1447,35,34,0.0297839387983,Scared of thunder and lightning? You have astraphobia http://t.co/yXrK3AAIbW #astraphobia http://t.co/r3xgd8XYUb
earthskyscience,Fri May 22 20:01:05 +0000 2015,117513,1447,87,60,0.0740343621557,Earth goes between the sun and Saturn today http://t.co/eYS7pYm9cJ http://t.co/OO58D6iist
earthskyscience,Fri May 22 18:30:33 +0000 2015,117513,1447,19,31,0.0161684239191,10 intriguing facts about the stars of our universe that you probably didn’t know! http://t.co/WalOFniZUy #spacenerds http://t.co/b949LntvfO
earthskyscience,Fri May 22 17:07:08 +0000 2015,117513,1447,75,47,0.0638227259963,Tonight  watch for Venus  Jupiter and the moon in the west after sunset. http://t.co/5xmpLBSS5N http://t.co/xxCtLyTFyc
earthskyscience,Fri May 22 15:03:20 +0000 2015,117513,1447,68,62,0.0578659382366,Most luminous galaxy in the universe discovered with a luminosity of 300 trillion suns! http://t.co/qTM4NU3idz #WISE http://t.co/OUG4ut2ali
earthskyscience,Fri May 22 14:18:05 +0000 2015,117513,1447,49,51,0.0416975143176,Earth goes between Saturn and the sun today  See Saturn tonight! http://t.co/titR2cviRW  Opposite sun  east at sunset http://t.co/aCIQ5dPKRn
earthskyscience,Fri May 22 13:06:13 +0000 2015,117513,1447,14,26,0.0119135755193,Another amazing shot of the Moon and Venus last night  this one thanks to our friends at Lunar 101-Moon Book! http://t.co/nLSgQF1OWZ
earthskyscience,Fri May 22 12:17:55 +0000 2015,117513,1447,41,58,0.034889756878,Moon and Venus last night from Wisconsin  U.S. thanks to Suzanne Murphy! Anyone else see Venus last night?! http://t.co/0LZdDjyDRT
earthskyscience,Thu May 21 23:21:05 +0000 2015,117513,1447,27,37,0.0229761813587,Two amazing and beautiful videos of paddle boarders’ close encounters with orcas. #killerwhale http://t.co/RT8Rv8Kpyg http://t.co/25PApO1qqV
earthskyscience,Thu May 21 21:53:02 +0000 2015,117513,1447,63,96,0.0536110898369,Serene shot of Blue Ridge Parkway as seen from Tennessee  U.S. thanks to Ron Weaver Photography! #BlueRidgeParkway http://t.co/KYEjWKFMtb
earthskyscience,Thu May 21 20:15:16 +0000 2015,117513,1447,67,54,0.0570149685567,Moon passes near Venus tonight and Jupiter on Saturday.  Chart and more by @JayRyanAstro http://t.co/Mhla9DYVTf http://t.co/k5kXEqUi8O
earthskyscience,Thu May 21 19:08:17 +0000 2015,117513,1447,32,66,0.0272310297584,This morning's sunrise from Surfrider Beach Club in Sea Bright  New Jersey thanks to Steve Scanlon Photography! http://t.co/Wgxf3RZHJg
earthskyscience,Thu May 21 18:58:26 +0000 2015,117513,1447,16,27,0.0136155148792,SpaceX confirmed splashdown of Dragon in Pacific at 12:42 ET (1642 UTC)  SW of Long Beach  CA. http://t.co/YEFDBYJB7Y http://t.co/jR8Ct5z6DU
earthskyscience,Thu May 21 18:49:32 +0000 2015,117513,1447,44,67,0.0374426659178,Venus and moon last night!  They'll be even closer tonight:  http://t.co/WffMqNRddm  By Bob Safir in Sherman Oaks  CA http://t.co/wnfPhwep05
earthskyscience,Thu May 21 17:08:06 +0000 2015,117513,1447,6,12,0.0051058180797,When you discover a new dinosaur species  you get to name it! #SaurornitholestesSullivani http://t.co/b3huF4fwy7 http://t.co/eM7y51Xj1Y
earthskyscience,Thu May 21 16:04:45 +0000 2015,117513,1447,11,24,0.00936066647945,Waxing crescent moon over New Delhi  India thanks to CB Devgun! Venus close by tonight too ;) http://t.co/cd2ahMuto3 http://t.co/G0bjNmaQHJ
earthskyscience,Thu May 21 15:44:17 +0000 2015,117513,1447,3,11,0.00255290903985,Highly recommended!  Annuals of the Deep Sky by Jeff Kanipe and Dennis Webb. http://t.co/XqN0G2SzC4 http://t.co/N0ffASGcbR
earthskyscience,Thu May 21 14:29:03 +0000 2015,117513,1447,2,5,0.0017019393599,Do nano-sunscreens harm sea life? http://t.co/e7QSxjrwPH http://t.co/aQXgKHBuGs
earthskyscience,Thu May 21 13:54:14 +0000 2015,117513,1447,65,110,0.0553130291968,I saw a cloud that looked like ocean waves.  What is it? http://t.co/KWcX9pWbvD  Photo by Paul Chartier http://t.co/CUV61DwKMH
earthskyscience,Thu May 21 13:44:13 +0000 2015,117513,1447,24,25,0.0204232723188,Very bright object near tonight's moon after sunset is Venus! http://t.co/dFuXW9mjpp  Other bright one is Jupiter. http://t.co/KdTSDjl61q
earthskyscience,Thu May 21 13:40:49 +0000 2015,117513,1447,19,23,0.0161684239191,Only 13 more followers to go before we reach 100 000!  Tell your friends to be our 100 000th.  Thank you  and we love you!
earthskyscience,Thu May 21 13:06:05 +0000 2015,117513,1447,27,48,0.0229761813587,Last night's moon from Jim Hatcher in San Diego.  More moon  Venus  Jupiter pics:  http://t.co/PAsPlgGwHR http://t.co/u8QQHZRmhf
earthskyscience,Thu May 21 12:54:41 +0000 2015,117513,1447,13,21,0.0110626058394,Last night's moon  Venus and Jupiter from Patricia Evans in North Billerica  MA.  In a parking lot after work! http://t.co/bcZfATLMoi
earthskyscience,Thu May 21 12:36:02 +0000 2015,117513,1447,31,34,0.0263800600785,Last night's moon and Venus  from Helio C. Vital in Brazil.  Moon and Venus closest tonight:  http://t.co/HTLW0DejfE http://t.co/NwC17lvwBs
earthskyscience,Thu May 21 12:02:33 +0000 2015,117513,1447,1,7,0.00085096967995,Video Why curing death would be a big mistake http://t.co/LozReUe9Iq
earthskyscience,Thu May 21 11:58:51 +0000 2015,117513,1447,0,4,0.0,Yikes! https://t.co/TaYv2wpoLE
earthskyscience,Thu May 21 11:54:41 +0000 2015,117513,1447,13,12,0.0110626058394,SpaceX Dragon left ISS this morning http://t.co/DlXqKMCGcQ  Splash down in Pacific 12:42 p.m. EDT (1642 UTC) today http://t.co/OtywOlMcBq
earthskyscience,Thu May 21 11:24:26 +0000 2015,117513,1447,13,22,0.0110626058394,View from ISS as #Dragon departed this morning. http://t.co/3iLfb01vtV
earthskyscience,Thu May 21 11:23:48 +0000 2015,117513,1447,14,20,0.0119135755193,Moments after Dragon's release. http://t.co/SOrUC8ZUVl
earthskyscience,Thu May 21 11:23:30 +0000 2015,117513,1447,8,12,0.0068077574396,Dragon has been released from ISS.  Moments before release ... http://t.co/CHESEvLgkq
earthskyscience,Thu May 21 10:48:09 +0000 2015,117513,1447,11,9,0.00936066647945,Direct link to NASA TV coverage of SpaceX Dragon departure from ISS this morning. http://t.co/P4Vg9aSRAV  Coverage begins now.
earthskyscience,Thu May 21 10:47:29 +0000 2015,117513,1447,4,4,0.0034038787198,Systems go for #Dragon release from ISS at 7:04 a.m. EDT (1104 UTC) http://t.co/GFrTAcupPS
earthskyscience,Thu May 21 10:35:55 +0000 2015,117513,1447,11,17,0.00936066647945,Another shot of a #Dragon departure from ISS (October  2014). http://t.co/axsdR84aGp  Live coverage starts in 10 min. http://t.co/YCf6Ghd75f
earthskyscience,Thu May 21 10:28:47 +0000 2015,117513,1447,2,8,0.0017019393599,Here's an October  2014 departure.  Pretty cool stuff! https://t.co/MI3KjJ4cL9
earthskyscience,Thu May 21 10:26:36 +0000 2015,117513,1447,14,18,0.0119135755193,SpaceX Dragon cargo ship will leave International Space Station at 7:04 a.m. EDT (1104 UTC) http://t.co/VU20hiw5Gu http://t.co/HeViK8z1Sp
earthskyscience,Thu May 21 10:25:59 +0000 2015,117513,1447,2,10,0.0017019393599,Good morning  friends.  Anybody going to watch SpaceX Dragon leave ISS this morning?
earthskyscience,Thu May 21 02:04:33 +0000 2015,117513,1447,38,56,0.0323368478381,Tonight's moon and Venus  via Kurt Zeppetello ... http://t.co/ZGNxCse4ct
earthskyscience,Thu May 21 01:35:41 +0000 2015,117513,1447,21,21,0.017870363279,This just in from Oklahoma ... https://t.co/ufylINGDMt
earthskyscience,Thu May 21 01:33:08 +0000 2015,117513,1447,34,62,0.0289329691183,Tonight's moon and Venus from Cindy Gurmann in Whitestone  NY  More photos: http://t.co/iq09hXUFcW http://t.co/jaH8pX3AFB
earthskyscience,Thu May 21 00:20:05 +0000 2015,117513,1447,19,24,0.0161684239191,"Alpha Centauri A and B.  Arrow points to Proxima.  This system is our ""star of the week."" http://t.co/eDXeQeSZxM http://t.co/MtxtBU18Hu"
