NASAblueshift,Mon Jul 11 20:00:50 +0000 2011,54608,602,2,0,0.0036624670378,Two weeks of awesomeness in one post! Supernovae  neutron stars  galactic cannibalism  and more: http://1.usa.gov/q2iK7T
NASAblueshift,Fri Jul 08 15:55:12 +0000 2011,54608,602,4,4,0.00732493407559,A special Friday awesomeness round-up in honor of #Atlantis  with 100% more William Shatner than most round-ups: http://1.usa.gov/qLbn2T
NASAblueshift,Wed Jul 06 14:41:12 +0000 2011,54608,602,2,0,0.0036624670378,Let Polly the Proton take you on a tour of the close relationship between astronomy and chemistry: http://1.usa.gov/q2160D
NASAblueshift,Fri Jul 01 19:17:02 +0000 2011,54608,602,1,0,0.0018312335189,The ultimate gas-guzzler - Spitzer scientists discover that galaxies grow when they gobble up gas! http://1.usa.gov/lzYFfA
NASAblueshift,Fri Jul 01 17:37:24 +0000 2011,54608,602,1,0,0.0018312335189,Check out Goddard's MicroSpec - a tiny NASA instrument with a lot of promising applications: http://1.usa.gov/mMFkFR
NASAblueshift,Thu Jun 30 18:55:45 +0000 2011,54608,602,1,1,0.0018312335189,We're excited for @NASAWebbTelescp - final polishing is done on Webb's remaining 12 mirrors! http://1.usa.gov/l4wL9T
NASAblueshift,Wed Jun 29 20:28:01 +0000 2011,54608,602,3,0,0.00549370055669,"Check out this ""odd couple"" that Fermi found - a pulsar and its companion emit gamma-ray flares whenever they meet: http://1.usa.gov/jUC2IS"
NASAblueshift,Wed Jun 29 18:22:07 +0000 2011,54608,602,4,0,0.00732493407559,Headed to @BlogWorld this fall in LA? We're looking for a few social media folks to join us on a panel. Get in touch if you're interested!
NASAblueshift,Tue Jun 28 16:57:14 +0000 2011,54608,602,1,0,0.0018312335189,RT @NASAGoddard: Broadcasting Robotic Refueling Mission demo at Goddard live on #Ustream. Watch and chat! 12:48 PM http://ustre.am/75hp
NASAblueshift,Mon Jun 27 21:58:21 +0000 2011,54608,602,1,1,0.0018312335189,Ready for some awesomeness? Faith's latest round-up has colliding galaxies  protostars  and more: http://1.usa.gov/m6omd7
NASAblueshift,Thu Jun 23 18:43:35 +0000 2011,54608,602,2,2,0.0036624670378,Check out the first entry in Faith's blog series on the intersection of astronomy and art/music: http://1.usa.gov/jNaWbL
NASAblueshift,Tue Jun 21 21:24:39 +0000 2011,54608,602,1,0,0.0018312335189,Our intern Faith is back for the summer... and she put together an awesomeness round-up! http://1.usa.gov/ls7btM
NASAblueshift,Wed Jun 15 19:00:58 +0000 2011,54608,602,1,1,0.0018312335189,Even the early Universe had massive black holes! Check out the latest from Chandra: http://1.usa.gov/kW4PJr
NASAblueshift,Wed Jun 15 17:32:43 +0000 2011,54608,602,3,1,0.00549370055669,New blog post - some more hints about our mysterious video shoot! http://1.usa.gov/k9P5GS
NASAblueshift,Thu Jun 09 20:21:24 +0000 2011,54608,602,0,0,0.0,June's going to be a little quiet for Blueshift - a couple of big projects coming to fruition  lots of folks on vacation and business trips!
NASAblueshift,Tue Jun 07 19:53:41 +0000 2011,54608,602,3,0,0.00549370055669,Check out those Physics of the Cosmos NASA Bandz in action! RT @puck90: @thinkgeek Astro Timmy! @nasatweetup http://tinyurl.com/3nl7ns5
NASAblueshift,Wed Jun 01 02:53:41 +0000 2011,54608,602,2,1,0.0036624670378,Just wrapped a 15-hour day shooting for a collaborative project. A day of firsts: someone wore an astronaut suit  everyone ate space food!
NASAblueshift,Tue May 31 16:54:24 +0000 2011,54608,602,1,1,0.0018312335189,What's in these mysterious packets?  http://lockerz.com/s/106490200
NASAblueshift,Tue May 31 16:31:09 +0000 2011,54608,602,2,0,0.0036624670378,Astronaut... filmed! Now on to our kitchen set. Curious about what's going on? Stay tuned for some tweeted photos later today!
NASAblueshift,Tue May 31 13:53:02 +0000 2011,54608,602,2,1,0.0036624670378,"The day-long adventure begins! We're hosting some fun guests - and we've borrowed a (non-flight) spacesuit and a cleanroom ""bunny"" suit!"
NASAblueshift,Fri May 27 19:58:30 +0000 2011,54608,602,2,0,0.0036624670378,"Just picked up a cleanroom ""bunny"" suit for Tuesday's shoot! It's all coming together... it'll be a long weekend full of anticipation!"
NASAblueshift,Thu May 26 19:48:51 +0000 2011,54608,602,2,0,0.0036624670378,Fresh on the heels of this week's excitement... we've got a big shoot planned for Tuesday! The collaboration has been months in the making.
NASAblueshift,Thu May 26 18:38:29 +0000 2011,54608,602,4,0,0.00732493407559,Hear all about Maggie's awesome Tuesday - a visit from @SethGreen and the ISIM on the centrifuge! http://1.usa.gov/l2Dygr
NASAblueshift,Tue May 24 22:10:01 +0000 2011,54608,602,0,0,0.0,Follow @astraughnomer and watch #TEDastro for live discussion during tonight's talk  about Webb! Stream starts 7PM ET: http://bit.ly/iJm0Fx
NASAblueshift,Tue May 24 20:29:04 +0000 2011,54608,602,0,0,0.0,RT @astraughnomer: #TED talk auditions tonight!  7-9pm EST; stream on http://bit.ly/jMLKQa  Watch #TEDastro for discussion about telescopes!
NASAblueshift,Tue May 24 20:24:35 +0000 2011,54608,602,0,0,0.0,Lots of cool stuff going on here! Glad you enjoyed your visit - sorry we missed you! RT @SethGreen: Visit Goddard Space Center- so cool.
NASAblueshift,Mon May 23 19:52:47 +0000 2011,54608,602,1,0,0.0018312335189,Link round-up: pics of @NASAWebbTelescp's ISIM on the @NASAGoddard centrifuge; info on @astraugnomer's TED audition. http://1.usa.gov/m6kl9v
NASAblueshift,Thu May 19 12:13:23 +0000 2011,54608,602,1,2,0.0018312335189,Looking back at last weekend's Explore@NASAGoddard event... did you explore with us? Sara's blog: http://1.usa.gov/m6sQrL
NASAblueshift,Mon May 16 19:26:40 +0000 2011,54608,602,4,2,0.00732493407559,New link round-up w/ cool vid & pics of today's launch  @NASAGoddard in 3D  comets colliding with the sun and more! http://1.usa.gov/iwsumf
NASAblueshift,Sat May 14 21:24:24 +0000 2011,54608,602,2,0,0.0036624670378,We survived Explore @ NASA Goddard 2011! If you visited  hope you had a great time seeing what we do here! We're happy but exhausted.
NASAblueshift,Fri May 13 17:52:48 +0000 2011,54608,602,2,1,0.0036624670378,And yes  Explore @ NASA Goddard will be going on  rain or shine! We're hoping for shine  prepared for rain. Activities  tours  prizes  more!
NASAblueshift,Fri May 13 17:16:18 +0000 2011,54608,602,4,1,0.00732493407559,We're busy preparing for tomorrow's big event at Goddard - come explore with us! Will you be there? http://1.usa.gov/mGCzWi
NASAblueshift,Thu May 12 19:47:42 +0000 2011,54608,602,6,2,0.0109874011134,A Blueshift exclusive! Two Goddard astrophysicists are finalists for TED2012 - see their audition! http://1.usa.gov/iljzCw
NASAblueshift,Wed May 11 22:12:13 +0000 2011,54608,602,3,4,0.00549370055669,Superflares! Check out this video and release about intense pulses of radiation spotted by Fermi in the Crab Nebula: http://1.usa.gov/lZLZ1n
NASAblueshift,Tue May 10 15:56:51 +0000 2011,54608,602,6,1,0.0109874011134,In the DC area? Come visit NASA Goddard this Saturday  May 14th! Some of the fabulous folks from Blueshift will be running fun activities!
NASAblueshift,Mon May 09 19:08:53 +0000 2011,54608,602,2,0,0.0036624670378,New awesomeness round-up! A little bit of everything - black holes  spacesuits  and xkcd! http://1.usa.gov/iYAfxw
NASAblueshift,Wed May 04 22:27:02 +0000 2011,54608,602,4,2,0.00732493407559,Your eyes can deceive you. Don't trust them. Sometimes you need to look in a wavelength your eyes can't see: http://bit.ly/kigRMx
NASAblueshift,Wed May 04 20:33:01 +0000 2011,54608,602,6,0,0.0109874011134,Don't underestimate the Force.... of gravity  that is! Check out the amazingly warped shape of the Meathook Galaxy: http://bit.ly/lLoJt7
NASAblueshift,Wed May 04 19:02:00 +0000 2011,54608,602,2,0,0.0036624670378,It's an app! Your iPhone can't repel space imagery of this magnitude! (Your Android phone can't  either.) http://1.usa.gov/jUsE7m
NASAblueshift,Wed May 04 17:16:02 +0000 2011,54608,602,4,0,0.00732493407559,It might not be as cool as Tatooine's twin suns  but check out the solar eclipse (moon transit) seen by SDO! http://youtu.be/5zRGlGYSZyE
NASAblueshift,Wed May 04 15:23:01 +0000 2011,54608,602,8,1,0.0146498681512,"""That's no moon. It's a space station."" Check out the ISS   captured last week by amateur astronomer James West! http://flic.kr/p/9Corc5"
NASAblueshift,Wed May 04 13:26:02 +0000 2011,54608,602,4,2,0.00732493407559,A look back to 1977  when Voyager 1 was about to launch and Star Wars was the top-grossing film: http://1.usa.gov/lmpa27
NASAblueshift,Wed May 04 11:21:07 +0000 2011,54608,602,3,2,0.00549370055669,If you didn't see last week's asteroid collision video  seemed appropriate to RT today. May the fourth be with you! http://1.usa.gov/k43Dos
NASAblueshift,Tue May 03 22:24:56 +0000 2011,54608,602,2,0,0.0036624670378,This week's awesomeness roundup begins with @hankgreen's new video about  well  awesomeness! http://1.usa.gov/iFy59K
NASAblueshift,Mon May 02 22:48:46 +0000 2011,54608,602,10,5,0.018312335189,The ISS truly is international! RT @twisst People all over the world watching ISS  as seen through favorite tweets http://twisst.nl/gmapfavs
NASAblueshift,Mon May 02 14:32:03 +0000 2011,54608,602,4,1,0.00732493407559,Happy birthday  Goddard! RT @NewsFromSpace: 1May1959: @NASAGoddard opens - NASA's first space flight center. http://goo.gl/RdPq8
NASAblueshift,Fri Apr 29 16:59:52 +0000 2011,54608,602,3,0,0.00549370055669,RT @NASA: Endeavour’s launch has been scrubbed for at least 48 hours because of an issue with Auxiliary Power Unit 1 heaters.
NASAblueshift,Fri Apr 29 16:43:05 +0000 2011,54608,602,0,0,0.0,We've got a Blueshift correspondent down at Kennedy for today's launch... wish we were all there! We'll share her pics and video.
NASAblueshift,Fri Apr 29 14:43:47 +0000 2011,54608,602,1,1,0.0018312335189,Thanks for the #FF love  guys! A few of the places we get our NASA news: @NASAWebbTelescp @NASAUniverseEdu @NASA_Hubble @NASAGoddard
NASAblueshift,Thu Apr 28 15:13:57 +0000 2011,54608,602,5,0,0.00915616759449,"""Sir  the possibility of successfully navigating an asteroid field is approximately 3 720 to 1!"" http://1.usa.gov/lXKfcZ"
NASAblueshift,Thu Apr 28 14:57:23 +0000 2011,54608,602,4,1,0.00732493407559,Who doesn't love asteroid collisions? Swift and Hubble took a look at an asteroid named Schella: http://1.usa.gov/k43Dos
NASAblueshift,Thu Apr 28 14:47:48 +0000 2011,54608,602,4,0,0.00732493407559,Loving the new video from @hankgreen about the importance of increasing awesome! It's what we try to do! Watch: http://go.nasa.gov/jQ1HzE
NASAblueshift,Tue Apr 26 19:17:31 +0000 2011,54608,602,2,0,0.0036624670378,Ready for the week's awesomeness? Hubble turns 21  STEREO studies binary stars  plenty of vids: http://1.usa.gov/f3zkHF
NASAblueshift,Fri Apr 22 22:09:06 +0000 2011,54608,602,0,0,0.0,Try this out this weekend - crunch a can and mimic a dying star! Sara stars in this new vid: http://youtu.be/mkVSY39PYlE
NASAblueshift,Tue Apr 19 23:10:07 +0000 2011,54608,602,7,2,0.0128186346323,RT @NASAWebbTelescp: Our videographer couldn't resist taking a snapshot of his reflection in our flight mirrors! http://twitpic.com/4mxbgw
NASAblueshift,Tue Apr 19 20:21:49 +0000 2011,54608,602,3,2,0.00549370055669,Our latest awesomeness round-up has a variety of lovely multimedia for you to ooh and ahh over: http://1.usa.gov/fIRx7K
NASAblueshift,Mon Apr 18 16:50:27 +0000 2011,54608,602,3,1,0.00549370055669,RT @Discovery_Space: Did Supernova Herald the Birth of a King? http://ow.ly/4CjiB by @JenLucPiquant
NASAblueshift,Fri Apr 15 18:20:22 +0000 2011,54608,602,1,1,0.0018312335189,In Maggie's new post  Amber Straughn talks about what it takes to become a research astronomer:  http://1.usa.gov/h8GGLV
NASAblueshift,Tue Apr 12 21:00:13 +0000 2011,54608,602,2,1,0.0036624670378,In a new blog post  Maggie looks back at the first Shuttle launch 30 years ago... http://1.usa.gov/eIG4SN
NASAblueshift,Tue Apr 12 20:25:37 +0000 2011,54608,602,4,0,0.00732493407559,Hubble! Spitzer! Keck! Why different telescopes look at the same objects - a 'toddler' galaxy: http://1.usa.gov/gHaHVO
NASAblueshift,Tue Apr 12 19:51:44 +0000 2011,54608,602,2,0,0.0036624670378,Congrats to the museums that will be receiving the decommissioned Shuttle orbiters - I'll have to pay each one a visit!
NASAblueshift,Mon Apr 11 21:26:37 +0000 2011,54608,602,3,1,0.00549370055669,Latest awesomeness round-up - cosmic blasts  moonbuggies  and another round with @AstronomyMag: http://1.usa.gov/fLPNBq
NASAblueshift,Mon Apr 11 12:57:50 +0000 2011,54608,602,3,1,0.00549370055669,We're here! Check out this gorgeous set of photos (put together by @TheAtlantic) from Expedition 26. http://bit.ly/fOetBz
NASAblueshift,Sat Apr 09 05:50:45 +0000 2011,54608,602,5,3,0.00915616759449,RT @NASA_GoddardPix I think we all look good tonight! View the most recent #NASA NOAA satellite image of earth. http://flic.kr/p/9x1aoB
NASAblueshift,Fri Apr 08 18:32:27 +0000 2011,54608,602,3,0,0.00549370055669,FYI: Our Facebook page may also be unavailable in the event of a shutdown.
NASAblueshift,Fri Apr 08 15:50:58 +0000 2011,54608,602,0,0,0.0,In the event of a government shutdown  Blueshift will not be updated and our website may be down. Expect us when you see us.
NASAblueshift,Thu Apr 07 22:37:25 +0000 2011,54608,602,5,1,0.00915616759449,One more story for today (whew!). This instrument on SOFIA is GREAT! No  really  GREAT: http://1.usa.gov/dVqA3q
NASAblueshift,Thu Apr 07 20:16:33 +0000 2011,54608,602,4,1,0.00732493407559,Supercomputer models of merging neutron stars show the immense power of a collision between two: http://1.usa.gov/ecJDQI
NASAblueshift,Thu Apr 07 17:31:34 +0000 2011,54608,602,2,1,0.0036624670378,When 3 powerful satellites work together  astronomers get closer to solving a cosmic puzzle:  http://1.usa.gov/gEDLII
NASAblueshift,Mon Apr 04 21:22:37 +0000 2011,54608,602,1,0,0.0018312335189,A shout-out to @AstronomyMag's Bill Andrews in response to his shout-out to our shout-out (whew!): http://bit.ly/f3gA4V
NASAblueshift,Mon Apr 04 20:31:52 +0000 2011,54608,602,2,0,0.0036624670378,This week's round-up was a big one! Exoplanets  violent stars  first pics from MESSENGER  & more: http://1.usa.gov/eMJJQ2
NASAblueshift,Fri Apr 01 17:02:52 +0000 2011,54608,602,4,0,0.00732493407559,Seen any good space-themed April Fools' gags? The folks at @apod have a good one... or is it a joke at all? http://1.usa.gov/e5ghPK
NASAblueshift,Thu Mar 31 21:42:15 +0000 2011,54608,602,3,0,0.00549370055669,We got a tip from @priesett that we made the April 2011 issue of @AstronomyMag! More on our blog: http://1.usa.gov/gZ8hXe
NASAblueshift,Mon Mar 28 19:04:54 +0000 2011,54608,602,5,0,0.00915616759449,Unusual awesomeness round-up: dust  spacecraft SPF  space sounds  and origins of life. Intrigued? http://1.usa.gov/eAMyH7
NASAblueshift,Fri Mar 25 18:40:06 +0000 2011,54608,602,6,2,0.0109874011134,Astronomy isn't just pretty pictures! How a by-product of research can overshadow the science: http://1.usa.gov/eHE81g
NASAblueshift,Thu Mar 24 15:02:43 +0000 2011,54608,602,0,0,0.0,Check out the @RWIWChallenge - Amber Straughn  NASA Post-Doc Fellow/Astronomer is InWorld today 4-5 PM EST  event is open to the public!
NASAblueshift,Wed Mar 23 20:18:45 +0000 2011,54608,602,4,2,0.00732493407559,Some exciting hardware for @NASAWebbTelescp has arrived at Goddard! We'll give you a peek: http://1.usa.gov/egn8MS
NASAblueshift,Tue Mar 22 18:07:16 +0000 2011,54608,602,6,2,0.0109874011134,RT @thinkgeek: Looking for new desktop wallpaper? May we suggest this Milky Way stunner from @SpitzerScope: http://j.mp/efY8bV via @NASAJPL
NASAblueshift,Mon Mar 21 20:49:55 +0000 2011,54608,602,4,1,0.00732493407559,This is going straight into our next round-up! RT @JenLucPiquant: Space Music: Sounds of the Universe : Discovery News http://bit.ly/ie1wYV
NASAblueshift,Mon Mar 21 20:40:02 +0000 2011,54608,602,1,0,0.0018312335189,Ready for the awesomeness round-up? Gorgeous supermoon pics  dark energy  pruny fingers  and more! http://1.usa.gov/fYZTIf
NASAblueshift,Fri Mar 18 19:47:58 +0000 2011,54608,602,5,4,0.00915616759449,Here's a fun weekend project - build a (paper) NASA satellite! Lots of ones to choose from: http://1.usa.gov/g7U9dJ
NASAblueshift,Thu Mar 17 21:19:55 +0000 2011,54608,602,1,0,0.0018312335189,Though it may be enhanced color  even the universe is wearing green: http://bit.ly/hTBQRe + http://bit.ly/eMPr1N + http://bit.ly/gr2Kuh
NASAblueshift,Tue Mar 15 21:01:33 +0000 2011,54608,602,3,2,0.00549370055669,We've got a new round-up with links about citizen science you can try at home and a giant centrifuge that you can't! http://1.usa.gov/eu0cDr
NASAblueshift,Mon Mar 14 18:04:50 +0000 2011,54608,602,1,1,0.0018312335189,RT @RWIWChallenge: RWIW is hosting our 5th guest speaker event this Wednesday from 4-5 p.m. EST InWorld  come join us! http://bit.ly/enpeOc
NASAblueshift,Fri Mar 11 23:57:30 +0000 2011,54608,602,1,0,0.0018312335189,Have you shared your picks for astronaut wakeup songs? Some neat ideas in the comments we're getting! http://1.usa.gov/hy2BsJ
NASAblueshift,Thu Mar 10 12:34:33 +0000 2011,54608,602,1,0,0.0018312335189,Great blog post about what a DVD has to do with spectroscopy  and the history of diffraction: http://bit.ly/ehtcBA (via @JenLucPiquant)
NASAblueshift,Thu Mar 10 12:29:30 +0000 2011,54608,602,0,0,0.0,New Blueshift Ponders... what song would you pick to wake up the astronauts? See our choices and share yours: http://1.usa.gov/hy2BsJ
NASAblueshift,Tue Mar 08 16:22:57 +0000 2011,54608,602,0,0,0.0,RT @RWIWChallenge: Paul Geithner  Obsvtry Mngr @ JWST  will be InWorld from 3-4 pm 2day for a live talk: http://bit.ly/epFOuo
NASAblueshift,Mon Mar 07 20:05:51 +0000 2011,54608,602,4,2,0.00732493407559,Loving @WilliamShatner's wakeup call for the crew of Discovery! Wish every morning could start out like that! http://1.usa.gov/eiHQZi
NASAblueshift,Mon Mar 07 19:52:57 +0000 2011,54608,602,5,2,0.00915616759449,New awesomeness roundup with superfluids  our busy Sun  and videos that will knock your socks off! http://1.usa.gov/geXpmJ
NASAblueshift,Fri Mar 04 14:20:01 +0000 2011,54608,602,11,0,0.0201435687079,Our hearts go out to the scientists  engineers  and other personnel who worked so hard on the Glory satellite. http://bit.ly/dZrUrm
NASAblueshift,Wed Mar 02 20:20:12 +0000 2011,54608,602,4,2,0.00732493407559,Check out Maggie's photos and video from last week's launch of Discovery! The timing couldn't have been more perfect. http://bit.ly/fxgTuh
NASAblueshift,Wed Mar 02 01:17:35 +0000 2011,54608,602,0,0,0.0,Enjoy! Do great things with them! RT @Space_Sugar: Thanks for my NASA Bandz! My daughter loves them. http://twitpic.com/453hip
NASAblueshift,Fri Feb 25 17:35:49 +0000 2011,54608,602,4,1,0.00732493407559,Want to play with the James Webb Space Telescope? Here's your chance to reach out and give it a spin! http://bit.ly/ewVtVq
NASAblueshift,Thu Feb 24 22:20:27 +0000 2011,54608,602,1,1,0.0018312335189,There goes Discovery! Only two launches left: http://bit.ly/15iJkK
NASAblueshift,Wed Feb 23 19:56:23 +0000 2011,54608,602,2,0,0.0036624670378,So who won last week's NASA Bandz contests? A wrap-up  with all the winning entries: http://bit.ly/fL6KF9
NASAblueshift,Tue Feb 22 20:29:50 +0000 2011,54608,602,3,1,0.00549370055669,After a long weekend  a belated round-up! The Sun (lots of it!) plus an amazing galactic zoom-through: http://bit.ly/hv4oMV
NASAblueshift,Fri Feb 18 18:36:03 +0000 2011,54608,602,1,0,0.0018312335189,Brilliant idea. Love it! RT @MittensMorgul: Percy Lowell could wrap enough NASA Bandz around Pluto to return it to full-planet status.
NASAblueshift,Fri Feb 18 18:19:46 +0000 2011,54608,602,2,0,0.0036624670378,Yesterday's NASA Bandz winners: @1yearofgiving won our random drawing  & @MittensMorgul gets a set for an innovative use! We'll be in touch!
NASAblueshift,Fri Feb 18 18:12:08 +0000 2011,54608,602,1,0,0.0018312335189,Wonder how astronomy news goes from discovery to press conference? Blueshift gives you an inside look: http://bit.ly/emPXRf
NASAblueshift,Fri Feb 18 14:23:54 +0000 2011,54608,602,3,0,0.00549370055669,Last day to win NASA Bandz! Enter today on NASA Universe Education's FB: http://on.fb.me/etEJBF Rules on our blog: http://bit.ly/hy7eze
NASAblueshift,Thu Feb 17 20:42:55 +0000 2011,54608,602,1,1,0.0018312335189,We're LOVING the answers to today's contest for NASA Bandz! Still time to enter! http://bit.ly/eIpqHC Rules: http://bit.ly/hy7eze
NASAblueshift,Thu Feb 17 15:16:29 +0000 2011,54608,602,6,1,0.0109874011134,Enter to win NASA Bandz: Follow & tweet at us what famous/historical astronomer might use a set of NASA Bandz! Rules: http://bit.ly/hy7eze
NASAblueshift,Thu Feb 17 15:15:47 +0000 2011,54608,602,1,0,0.0018312335189,We're giving away NASA Bandz! Next tweet will be instructions  follow us & @-reply before 11:59PM EST to enter. Rules: http://bit.ly/hy7eze
NASAblueshift,Wed Feb 16 16:08:06 +0000 2011,54608,602,4,1,0.00732493407559,Wondering who won yesterday's NASA Bandz giveaway on our Facebook? See our winners (yes  winners!) here: http://on.fb.me/fx7DLf
NASAblueshift,Wed Feb 16 15:17:50 +0000 2011,54608,602,4,1,0.00732493407559,"""Always keep your sense of wonder "" said a sunshield engineer for @NASAWebbTelescp in a Q&A with students. Blog post: http://bit.ly/eWpNA8"
NASAblueshift,Wed Feb 16 13:43:44 +0000 2011,54608,602,3,1,0.00549370055669,The Sun's been busy cooking up a mega Class X2.2 flare - and a lucky bunch may get to see the aurora! We're jealous. http://bit.ly/hrVKtS
NASAblueshift,Wed Feb 16 13:37:36 +0000 2011,54608,602,1,1,0.0018312335189,Want another chance to grab some NASA Bandz? Today's giveaway is from @NASAUniverseEdu: http://bit.ly/huxHal Rules: http://bit.ly/hy7eze
NASAblueshift,Tue Feb 15 23:07:27 +0000 2011,54608,602,0,1,0.0,Just a handful of hours left to win NASA Bandz on the Blueshift FB: http://on.fb.me/f8P3Qg Rules: http://bit.ly/hy7eze New chance tomorrow!
NASAblueshift,Tue Feb 15 20:33:47 +0000 2011,54608,602,8,0,0.0146498681512,In the DC area? Goddard astrophysicist Neil Gehrels will be giving a free lecture tomorrow at the Library of Congress: http://bit.ly/gqfpV4
NASAblueshift,Tue Feb 15 15:11:55 +0000 2011,54608,602,3,1,0.00549370055669,It's the 2nd day to win NASA Bandz! Enter today: NASA Blueshift FB http://on.fb.me/f8P3Qg Rules on @NASAblushift's blog http://bit.ly/hy7eze
NASAblueshift,Mon Feb 14 22:43:43 +0000 2011,54608,602,0,0,0.0,In lieu of our weekly link round-up (we're too busy giving away NASA Bandz!)  how about some romantic... black holes? http://bit.ly/fvhuP0
NASAblueshift,Mon Feb 14 22:36:57 +0000 2011,54608,602,1,0,0.0018312335189,Still time to enter to win NASA Bandz on the Webb Telescope FB: http://on.fb.me/WebbFB  Rules: http://bit.ly/hy7eze  New contest tomorrow!
NASAblueshift,Mon Feb 14 15:28:55 +0000 2011,54608,602,18,13,0.0329622033402,First day to win NASA Bandz! Enter on the Webb Telescope FB: http://on.fb.me/WebbFB  Rules & info on our blog: http://bit.ly/hy7eze
NASAblueshift,Fri Feb 11 21:30:34 +0000 2011,54608,602,1,0,0.0018312335189,Giveaway starts Monday with @NASAUniverseEdu & @NASAWebbTelescp - your chance to win some of these! http://twitpic.com/3yqsfx
NASAblueshift,Fri Feb 11 20:20:18 +0000 2011,54608,602,3,0,0.00549370055669,"New post from Blueshift's guest blogger Koji - ""Even Spherical Cows Have Udders."" Intrigued? http://bit.ly/hypbo6"
NASAblueshift,Thu Feb 10 15:22:49 +0000 2011,54608,602,0,0,0.0,Cooking up something special with @NASAUniverseEdu - stay tuned in the next week or so!
NASAblueshift,Tue Feb 08 20:47:25 +0000 2011,54608,602,2,1,0.0036624670378,Want to catch a glimpse of Goddard? Part of tonight's “What Not to Wear” were shot in our integration and test facilities!
NASAblueshift,Tue Feb 08 19:41:40 +0000 2011,54608,602,1,2,0.0018312335189,Nice explanation of the Casimir effect (and why it could be useful) from @jenlucpiquant: http://bit.ly/hLdukr
NASAblueshift,Tue Feb 08 18:21:03 +0000 2011,54608,602,1,2,0.0018312335189,Did you see the awesome orrery in yesterday's Blueshift round-up? I can't stop playing with it! http://bit.ly/gxiCkt
NASAblueshift,Mon Feb 07 21:59:00 +0000 2011,54608,602,3,3,0.00549370055669,Newest round-up with lots of astro-links - astronomy  astrometry  astrology  and more! http://bit.ly/hKi35J
NASAblueshift,Fri Feb 04 23:09:08 +0000 2011,54608,602,0,0,0.0,These are all excellent #FF picks! RT @MythBusters: #FF @CraigyFerg @NASA @ScienceChannel @donttrythis @grantimahara @Discovery
NASAblueshift,Fri Feb 04 22:15:36 +0000 2011,54608,602,3,0,0.00549370055669,Here at Blueshift  we are currently full of schemes. You should be very scared... and/or very  excited.
NASAblueshift,Fri Feb 04 20:26:53 +0000 2011,54608,602,2,1,0.0036624670378,We've got a new post up about the fun vid @hankgreen made about why @NASAWebbTelescp is awesome! http://bit.ly/f4cxoa
NASAblueshift,Wed Feb 02 23:24:20 +0000 2011,54608,602,2,0,0.0036624670378,Have you seen our latest Blueshift Ponders? Read and respond with your thoughts on the future of space exploration: http://bit.ly/euD3nX
NASAblueshift,Tue Feb 01 19:11:56 +0000 2011,54608,602,1,0,0.0018312335189,Eight years after the loss of Columbia  we ponder the past and future of space exploration. Join us: http://bit.ly/euD3nX
NASAblueshift,Mon Jan 31 23:58:53 +0000 2011,54608,602,0,0,0.0,Is World of Warcraft's Azeroth a tiny Dyson sphere with a black hole at the center? http://bit.ly/fhPxJI (via @dvice)
NASAblueshift,Mon Jan 31 17:43:42 +0000 2011,54608,602,1,0,0.0018312335189,New round-up! More snow  more Optimus Prime  a runaway star  and the most distant galaxy ever seen: http://bit.ly/e0J83M
NASAblueshift,Mon Jan 24 21:47:54 +0000 2011,54608,602,4,0,0.00732493407559,In today's round-up - missing galaxies  Optimus Prime  and Betelgeuse  Betelgeuse  Betelgeuse! http://bit.ly/gKyz4e
