earthskyscience,Tue Aug 18 21:15:31 +0000 2015,117513,1447,16,15,0.0136155148792,Space weather threatens equatorial regions too  not just the poles  says study. http://t.co/u0HvXXKlvX http://t.co/CX4vLcjnbF
earthskyscience,Tue Aug 18 19:08:08 +0000 2015,117513,1447,38,27,0.0323368478381,Summer Triangle – 3 bright stars in 3 different constellations – by Susan Jensen. http://t.co/cAQKGXcukN http://t.co/ERaiS1CQBj
earthskyscience,Tue Aug 18 17:05:08 +0000 2015,117513,1447,30,43,0.0255290903985,Summer Triangle and top of the Louvre in Paris from VegaStar Carpentier. http://t.co/iIWs5Pu1Oz http://t.co/92OS1734WX
earthskyscience,Tue Aug 18 16:20:26 +0000 2015,117513,1447,7,11,0.00595678775965,This year's dead zone in the Gulf of Mexico is above average in size  likely because of heavy rains in June. http://t.co/VtdvZgjCJ1
earthskyscience,Tue Aug 18 15:18:04 +0000 2015,117513,1447,64,112,0.0544620595168,"""Last night's mild Aurora  taken from the Adirondacks region of New York State  around 2:30 am."" by Jennifer Khordi. http://t.co/uHE4gT2Daa"
earthskyscience,Tue Aug 18 14:09:07 +0000 2015,117513,1447,22,31,0.0187213329589,Young moon and Mercury from Zimbabwe 8/16 http://t.co/agSo5SXljz Photo: Peter Lowenstein http://t.co/jBAn49j3WF
earthskyscience,Tue Aug 18 13:22:08 +0000 2015,117513,1447,41,47,0.034889756878,Tonight … find the Summer Triangle  http://t.co/LSv6VV4Kro http://t.co/2qXErESZQ8
earthskyscience,Tue Aug 18 12:38:01 +0000 2015,117513,1447,33,43,0.0280819994384,How to spot the International Space Station in your sky http://t.co/2nUExhiqEz http://t.co/mZXVPCjvO8
earthskyscience,Tue Aug 18 02:35:06 +0000 2015,117513,1447,59,69,0.0502072111171,Astronomers discover 'young Jupiter' exoplanet http://t.co/ymlGi5AKsW http://t.co/u5BBerMGK3
earthskyscience,Mon Aug 17 23:09:17 +0000 2015,117513,1447,43,94,0.0365916962379,Crescent moon over Jones Beach  NY 8/16 by Maggie Angela. Thank you Maggie! http://t.co/eJnBvu9ttp
earthskyscience,Mon Aug 17 19:09:04 +0000 2015,117513,1447,25,36,0.0212742419988,Balanced rocks http://t.co/rMvKYC1OiB  Photo by Jeff Berkes Photography http://t.co/Qvpm46hfJI
earthskyscience,Mon Aug 17 17:04:24 +0000 2015,117513,1447,8,5,0.0068077574396,Teeny supermassive black hole http://t.co/tuv224GX0H Astronomers have found smallest black hole ever observed in the center of a galaxy.
earthskyscience,Mon Aug 17 15:05:26 +0000 2015,117513,1447,69,79,0.0587169079166,Tonight … find Cassiopeia.  It points to the Andromeda galaxy  too. http://t.co/Zlo1xNdQ03 http://t.co/T0d29CXsDL
earthskyscience,Mon Aug 17 13:37:05 +0000 2015,117513,1447,28,45,0.0238271510386,Cassini's last close flyby of Saturn moon Dione today http://t.co/aAs0MBQPDf http://t.co/6ImRTYazZn
earthskyscience,Sun Aug 16 14:21:13 +0000 2015,117513,1447,58,61,0.0493562414371,Tonight … find the Great Square of Pegasus.  It points to the Andromeda galaxy http://t.co/fqPyjHaVwI http://t.co/1A9GpWV24O
earthskyscience,Sat Aug 15 15:02:09 +0000 2015,117513,1447,35,59,0.0297839387983,Why haven’t earthquakes toppled these balancing rocks? http://t.co/eIOORPm6QV #gravity #science #awesome http://t.co/1jClksvCqV
earthskyscience,Sat Aug 15 14:02:18 +0000 2015,117513,1447,24,34,0.0204232723188,A series of photos of Mercury  Venus  Jupiter and the star Regulus by Peter Lowenstein! http://t.co/ESoGno4Qtd http://t.co/Kut9MasQhu
earthskyscience,Sat Aug 15 13:52:00 +0000 2015,117513,1447,34,29,0.0289329691183,Tonight … Look for the Teapot in the direction toward galaxy's center http://t.co/wHh4NmU0K9 http://t.co/oX6iyuMlfF
earthskyscience,Sat Aug 15 13:04:07 +0000 2015,117513,1447,16,35,0.0136155148792,Artichoke about to bloom http://t.co/hwBNgJ1YT1  Photo by Donna Severson http://t.co/ZXzbfnxJJR
earthskyscience,Sat Aug 15 02:04:15 +0000 2015,117513,1447,29,62,0.0246781207186,Sunset over Pikes Peak  from Fountain Creek Nature Center on July 28. Photo by Max Moorman. http://t.co/HqK7DxugS2
earthskyscience,Fri Aug 14 23:12:08 +0000 2015,117513,1447,49,71,0.0416975143176,More awesome pics from our friends of the Perseid meteor shower...http://t.co/h3z6sRe63k Credit: Darla Young … http://t.co/ZmMsS19pwh
earthskyscience,Fri Aug 14 20:01:11 +0000 2015,117513,1447,90,124,0.0765872711955,Milky Way rising over the Paint Mines Interpretive Park near Calhan  Colorado. Photo: John Skiba. http://t.co/6SipT9BmEu
earthskyscience,Fri Aug 14 18:30:21 +0000 2015,117513,1447,89,115,0.0757363015156,Composite photo of 13 images  Aug 13 at Tucson Mountain Park.  Copyright © Dylan Martin Photography http://t.co/7LAdSgoIuf
earthskyscience,Fri Aug 14 17:07:01 +0000 2015,117513,1447,30,45,0.0255290903985,Swirling mystery of Jupiter’s Great Red Spot. http://t.co/6jNfIA8Ln9 Why is it red? http://t.co/XwYMCJQMXP
earthskyscience,Fri Aug 14 15:03:01 +0000 2015,117513,1447,9,27,0.00765872711955,Time to see the starlit Milky Way ... http://t.co/aRZoddHYPt http://t.co/OZOjFVtPQ7
earthskyscience,Fri Aug 14 14:18:02 +0000 2015,117513,1447,70,112,0.0595678775965,Mojave Desert  California. Cory Smart's composite image of meteors from 1:00 to 4:00. http://t.co/i0yV3jfo8K
earthskyscience,Fri Aug 14 13:06:12 +0000 2015,117513,1447,24,28,0.0204232723188,Cool!  Digital map of ocean floor http://t.co/EmgjOxaoCq http://t.co/3XoF5SwWPU
earthskyscience,Fri Aug 14 00:09:04 +0000 2015,117513,1447,32,52,0.0272310297584,Amazing images from around the world of the Perseids! http://t.co/4rZdoLTHk0 Share your own pictures in the comments! http://t.co/9ma1Tr3ZKY
earthskyscience,Thu Aug 13 23:21:28 +0000 2015,117513,1447,51,72,0.0433994536775,"Sean Parker says  ""Even with 30% moonlight we were still able to see quite a few meteors!"" Thank you Sean #JoshuaTree http://t.co/wnMnJxRxgE"
earthskyscience,Thu Aug 13 21:53:05 +0000 2015,117513,1447,57,88,0.0485052717572,A peaceful early morning for viewing the Perseid meteor showers over Martin  Michigan by Hope Carter. Thanks Hope! http://t.co/x6epZhe2lg
earthskyscience,Thu Aug 13 19:08:06 +0000 2015,117513,1447,34,33,0.0289329691183,Video: Zoom to the center of the Milky Way... http://t.co/uM9gttxADL #blackhole #MilkyWay #galaxy #video http://t.co/gGyRJN8I3v
earthskyscience,Thu Aug 13 17:08:05 +0000 2015,117513,1447,21,19,0.017870363279,Charting the slow death of the universe http://t.co/3hoDSTffHR #galaxies #energy #ultraviolet http://t.co/MReogIM1H3
earthskyscience,Thu Aug 13 15:44:08 +0000 2015,117513,1447,33,33,0.0280819994384,Tonight … Can you still see Perseid meteors? http://t.co/xkEYaD7Dbn http://t.co/RbhCwnJcoS
earthskyscience,Thu Aug 13 14:29:06 +0000 2015,117513,1447,20,34,0.017019393599,A series of photos of Mercury  Venus  Jupiter and the star Regulus by Peter Lowenstein! http://t.co/uAROD8uGTP http://t.co/ITKH68RaoY
earthskyscience,Thu Aug 13 14:13:18 +0000 2015,117513,1447,56,48,0.0476543020772,Perseid meteor caught over Malaysia last night thanks to Farrouk! #Perseids #meteorshower http://t.co/TwhSVP74v4 http://t.co/8OdaCrpjOm
earthskyscience,Thu Aug 13 02:35:06 +0000 2015,117513,1447,83,150,0.0706304834359,We give the nod to Thursday morning as the best time to watch 2015's Perseid meteor shower.  http://t.co/mTuUEvuxkk #meteorshower
earthskyscience,Wed Aug 12 23:09:11 +0000 2015,117513,1447,71,104,0.0604188472765,More awesome pics from our friends of the Perseid meteor shower...http://t.co/EWB3o7Jv5W Credit: Darla Young … http://t.co/pSk6Srfah6
earthskyscience,Wed Aug 12 19:09:11 +0000 2015,117513,1447,39,37,0.0331878175181,Where does lightning flash most frequently on our planet? Checkout this cool map! http://t.co/AyC815WoRP #land #ocean http://t.co/K3IndFJbXe
earthskyscience,Wed Aug 12 17:04:03 +0000 2015,117513,1447,4,6,0.0034038787198,EarthSky tees are BACK! Be sure to use promo code EARTHSKY to save $5. http://t.co/f2BsSTMM8c #PerseidTees #LogoTees http://t.co/eu3j9yZEpJ
earthskyscience,Wed Aug 12 15:05:19 +0000 2015,117513,1447,75,62,0.0638227259963,Perseid meteor shower going on now ... Thursday morning best! http://t.co/VvjkSp9lnP  Photo: Barry Simmons http://t.co/4YUNq6l0nS
earthskyscience,Wed Aug 12 13:37:01 +0000 2015,117513,1447,50,68,0.0425484839975,Some awesome pics from our friends of the Perseid meteor shower! http://t.co/YCgufHOpZK Credit: Tracy Lynn Jones http://t.co/BGfl7yNv34
earthskyscience,Tue Aug 11 16:19:18 +0000 2015,117513,1447,77,57,0.0655246653562,Plan to watch meteors before dawn tomorrow.  Watch for Mars near the waning crescent moon. http://t.co/jXXcynOHII http://t.co/rzzUKSPmOc
earthskyscience,Tue Aug 11 15:18:13 +0000 2015,117513,1447,33,76,0.0280819994384,Sunflower time!  Photo taken August 8 by Kev's Kaptures http://t.co/cPuMbhi4GQ http://t.co/cfaatlMu1J
earthskyscience,Tue Aug 11 14:19:08 +0000 2015,117513,1447,100,63,0.085096967995,Top tips for tonight's Perseid meteor shower http://t.co/bHvZXpMDhi http://t.co/ok6aFZFQFK
earthskyscience,Tue Aug 11 14:09:17 +0000 2015,117513,1447,28,37,0.0238271510386,"Nene geese on lava flows of Kilauea  Hawaii.  ""The first gosling I've seen in the wild"" Photo: Imaginscape Photograpy http://t.co/lL4BaJF2C9"
earthskyscience,Tue Aug 11 13:22:03 +0000 2015,117513,1447,69,105,0.0587169079166,Milky Way setting behind a group of rocks in Arches National park  Utah. Photo: Jennifer Khordi http://t.co/0nNensaaqt
earthskyscience,Tue Aug 11 12:38:09 +0000 2015,117513,1447,55,74,0.0468033323973,Double rainbow. Calgary  Alberta  Canada  August 8. Photo: Jill Whamond #loverainbows http://t.co/kfof8RjFf3
earthskyscience,Tue Aug 11 02:35:17 +0000 2015,117513,1447,71,80,0.0604188472765,Sunset at Purgatory Creek San Marcos Texas. Photo: Raymund Lastierre http://t.co/omfccwoMSH
earthskyscience,Mon Aug 10 23:09:03 +0000 2015,117513,1447,24,20,0.0204232723188,Sun enters into Leo tomorrow (8/11) Dates of sun’s entry into each Zodiac constellation: http://t.co/pHt2JbtLcH http://t.co/dqf4OLzWCa
earthskyscience,Mon Aug 10 21:21:48 +0000 2015,117513,1447,11,30,0.00936066647945,Sneak peek into our new EarthSky tees! Purchase one here: http://t.co/KgURlghrq3 #Perseids #Meteors http://t.co/3yAI1qOeU9
earthskyscience,Mon Aug 10 19:09:27 +0000 2015,117513,1447,31,61,0.0263800600785,Like cotton balls floating in the sky over Sabah  North Borneo at sunrise. Photo: Jenney Disimon http://t.co/XGQDg6Dvwh
earthskyscience,Mon Aug 10 17:04:02 +0000 2015,117513,1447,86,128,0.0731833924757,Milky Way rising over the Paint Mines Interpretive Park near Calhan  Colorado. Photo: John Skiba. http://t.co/uGwCElCATx
earthskyscience,Mon Aug 10 15:05:26 +0000 2015,117513,1447,21,16,0.017870363279,From 7/17 to 8/24 each year  Earth crosses orbital path of Comet Swift-Tuttle  parent of the Perseid meteor shower. http://t.co/K7NSihKqw4
earthskyscience,Mon Aug 10 13:37:17 +0000 2015,117513,1447,76,78,0.0646736956762,Tonight … 2015 a great year for the Perseids! http://t.co/rkohEYcDHH  Photo: Daniel McVey http://t.co/C2DIDc6IKe
earthskyscience,Mon Aug 10 12:37:12 +0000 2015,117513,1447,8,7,0.0068077574396,What makes the difference btwn near-miss asteroid &amp; potential hit? Video: http://t.co/Kir8m6HvOk
earthskyscience,Sun Aug 09 19:15:21 +0000 2015,117513,1447,27,47,0.0229761813587,Artichoke about to bloom http://t.co/LIqbKkzDLm Photo by Donna Severson http://t.co/3jkb3Uxwnt
earthskyscience,Sun Aug 09 13:21:08 +0000 2015,117513,1447,56,65,0.0476543020772,Tonight … Explore the Big Dipper  http://t.co/2rXYEl3y6M http://t.co/5SPzAI9644
earthskyscience,Sun Aug 09 13:04:00 +0000 2015,117513,1447,42,63,0.0357407265579,Sunrise colors from the summit of Mount Democrat  Colorado.  August 2. Photo: Max Moorman http://t.co/GYQzWwFEzM
earthskyscience,Sun Aug 09 00:09:10 +0000 2015,117513,1447,60,88,0.051058180797,Every visible star lies within our Milky Way galaxy http://t.co/QuF3xRYWsC http://t.co/Eq5Pnbvojq
earthskyscience,Sat Aug 08 21:21:14 +0000 2015,117513,1447,135,158,0.114880906793,The Perseids are going to be awesome this year ... no moon!  How to shoot photos of meteors: http://t.co/9P1eXdxher http://t.co/qOSYX39cwm
earthskyscience,Sat Aug 08 19:15:02 +0000 2015,117513,1447,46,68,0.0391446052777,Sunflowers at dusk  with a white baby elephant (cloud) photobomb. Credit: Eileen Claffey Do you also see an elephant? http://t.co/FiFMLzguj7
earthskyscience,Sat Aug 08 17:09:13 +0000 2015,117513,1447,65,90,0.0553130291968,A lenticular cloud over the Mono craters in eastern California. Photo: Kurt Harvey http://t.co/NzXoyKKR8k
earthskyscience,Sat Aug 08 16:30:22 +0000 2015,117513,1447,40,68,0.034038787198,Independence Pass  Colorado. Photo: Joe Randall.  Thank you Joe! http://t.co/KpaMu1i16h
earthskyscience,Sat Aug 08 15:19:20 +0000 2015,117513,1447,59,90,0.0502072111171,Lenticular altocumulus cloud over Mono Craters in California http://t.co/DHY29odqPV  Photo by Kurt Harvey http://t.co/8qTHQN9gQ2
earthskyscience,Sat Aug 08 15:13:01 +0000 2015,117513,1447,40,53,0.034038787198,Tonight's moon passes in front of star Aldebaran  seen from eastern Europe and the Middle East http://t.co/pbyHfdN00O http://t.co/x5HezNHYhG
earthskyscience,Sat Aug 08 15:02:09 +0000 2015,117513,1447,56,90,0.0476543020772,Key West  Florida. Photo: Jeff Berkes http://t.co/QYZ32v58o8 http://t.co/SflzEFVGuW
earthskyscience,Sat Aug 08 14:49:11 +0000 2015,117513,1447,10,25,0.0085096967995,Tonight … Ophiuchus is part of the Zodiac  too http://t.co/6pIxv3Cr1C http://t.co/gnkRBWzVbf
earthskyscience,Sat Aug 08 14:02:06 +0000 2015,117513,1447,135,119,0.114880906793,Meteor season is here! Everything you need to know: Perseid meteor shower http://t.co/BibKh3VNjq http://t.co/mjVTrHlqVg
earthskyscience,Sat Aug 08 13:04:07 +0000 2015,117513,1447,33,39,0.0280819994384,Video: Cruise over Ceres http://t.co/lCgxnaC29u Visit mysterious bright spots &amp; 4-mile-tall mountain. http://t.co/VKbg925Ds3
earthskyscience,Sat Aug 08 02:04:10 +0000 2015,117513,1447,43,44,0.0365916962379,It's a great year for a favorite meteor shower! Everything you need to know: Perseid meteor shower http://t.co/aRatNhYNzX
earthskyscience,Fri Aug 07 23:12:00 +0000 2015,117513,1447,32,40,0.0272310297584,Sagittarius? You can see your constellation on August evenings. http://t.co/Zeqvs7wHmG http://t.co/tcemeQFT5F
earthskyscience,Fri Aug 07 20:01:14 +0000 2015,117513,1447,32,45,0.0272310297584,Sunset over Pikes Peak  from Fountain Creek Nature Center on July 28. Photo by Max Moorman. http://t.co/EZSCb5ojjs
earthskyscience,Fri Aug 07 18:30:24 +0000 2015,117513,1447,30,71,0.0255290903985,"""It was a bit stormy in Colorado Springs yesterday evening...""  Photo: Ray Cammack Jr. http://t.co/9pbSkxJ8IT"
earthskyscience,Fri Aug 07 17:07:01 +0000 2015,117513,1447,18,31,0.0153174542391,U.S. deserts wet until 8 200 years ago http://t.co/2tz85oJFGO http://t.co/jGU6ShlJvv
earthskyscience,Fri Aug 07 15:03:17 +0000 2015,117513,1447,5,11,0.00425484839975,Breakthrough Listen not all about aliens http://t.co/7MdP1CY8Vh http://t.co/zyQzZL2NQs
earthskyscience,Fri Aug 07 14:18:37 +0000 2015,117513,1447,12,19,0.0102116361594,No double moon in 2015  or ever http://t.co/p8Sv9BNjn9
earthskyscience,Fri Aug 07 14:07:19 +0000 2015,117513,1447,30,29,0.0255290903985,Moon near star Aldebaran before dawn Saturday and Sunday http://t.co/K93Yz2qoy4 http://t.co/dW7Qq8Eezu
earthskyscience,Fri Aug 07 13:06:01 +0000 2015,117513,1447,66,110,0.0561639988767,Key West  Florida. Photo: Jeff Berkes http://t.co/cjX80W1oqN http://t.co/7nEhzBvW0G
earthskyscience,Fri Aug 07 02:07:01 +0000 2015,117513,1447,49,72,0.0416975143176,Independence Pass  Colorado. Photo: Joe Randall.  Thank you Joe! http://t.co/Nd7adrbOEM
earthskyscience,Fri Aug 07 00:09:30 +0000 2015,117513,1447,7,8,0.00595678775965,What makes the difference between a near-miss asteroid and a potential hit? Yarkovsky effect. http://t.co/xEQznxD3Qt #Video
earthskyscience,Thu Aug 06 23:21:03 +0000 2015,117513,1447,49,65,0.0416975143176,Why haven’t earthquakes toppled these balancing rocks? http://t.co/1N2zVcaxIt #gravity #science #awesome http://t.co/GwW5w923oy
earthskyscience,Thu Aug 06 21:53:02 +0000 2015,117513,1447,17,28,0.0144664845592,If you’re outside  look for the zodiacal constellation Sagittarius the Archer. http://t.co/ZaNcnywSpQ #stargazing http://t.co/DQp5XkGHMu
earthskyscience,Thu Aug 06 19:08:11 +0000 2015,117513,1447,104,112,0.0885008467148,Meteor season is here! Everything you need to know: Perseid meteor shower http://t.co/xXQjSvoz3u http://t.co/sC508HvVkN
earthskyscience,Thu Aug 06 17:08:08 +0000 2015,117513,1447,31,31,0.0263800600785,Moon is waning now and in the sky after midnight. http://t.co/YVumVgQ4ew  Watch late night or before dawn! http://t.co/nEtOMKdSVb
earthskyscience,Thu Aug 06 15:44:31 +0000 2015,117513,1447,30,41,0.0255290903985,The waning crescent moon over Dublin  Ireland thanks to our friend Deirdre Horan!  http://t.co/wgtztcx6x6 #tonight http://t.co/dBfG0fjN1V
earthskyscience,Thu Aug 06 14:29:13 +0000 2015,117513,1447,33,27,0.0280819994384,Closest conjunction of Mercury and Jupiter since 2012 tonight.   But can you see it? http://t.co/k9un3szou9 http://t.co/D8wYDeXMMR
earthskyscience,Thu Aug 06 14:22:12 +0000 2015,117513,1447,38,69,0.0323368478381,Amazing sunset as seen from San Francisco  CA thanks to Julle Taylor Clough! #GoldenGateBridge http://t.co/e5AR6dLcvU
earthskyscience,Thu Aug 06 01:47:34 +0000 2015,117513,1447,37,34,0.0314858781582,The constellation Cepheus is faint  but easy to locate if you look north during the evening. http://t.co/QRderQwtX6 http://t.co/ueOUprimUm
earthskyscience,Wed Aug 05 21:23:04 +0000 2015,117513,1447,47,92,0.0399955749577,Sunflowers at dusk  with a white baby elephant (cloud) photobomb. Credit: Eileen Claffey Do you also see an elephant? http://t.co/D9qQwKAWFE
earthskyscience,Wed Aug 05 20:32:28 +0000 2015,117513,1447,24,32,0.0204232723188,Wow!  We really do live on a beautiful planet. https://t.co/z5xs7DDYR9
earthskyscience,Wed Aug 05 20:31:10 +0000 2015,117513,1447,33,35,0.0280819994384,Good article from @NatGeo on how to nuke an incoming asteroid  safely. http://t.co/fkFHY6QYkt http://t.co/uZCzw7RvqU
earthskyscience,Wed Aug 05 19:09:02 +0000 2015,117513,1447,32,29,0.0272310297584,El Niño has strengthened in the past several months. Will it rival the event of 1997–98? http://t.co/7Ahgnb8uyZ http://t.co/uR692QaTLy
earthskyscience,Wed Aug 05 17:04:04 +0000 2015,117513,1447,56,55,0.0476543020772,August 2015 guide to the five visible planets! http://t.co/x4LujviCGb #Mercury #Venus #Mars #Jupiter #Saturn http://t.co/ECJFpcAtRR
earthskyscience,Wed Aug 05 16:20:13 +0000 2015,117513,1447,18,25,0.0153174542391,Albireo as captured by EarthSky community member Tom Wildoner! #doublestar #staroftheweek http://t.co/o1nOlojGGO http://t.co/feAp5ITKXr
earthskyscience,Wed Aug 05 15:05:21 +0000 2015,117513,1447,16,20,0.0136155148792,Constellation Cepheus represents a King  but looks like the stick house that children draw. http://t.co/F3ViSaXOrQ http://t.co/vGCWmaOdGE
earthskyscience,Wed Aug 05 14:03:20 +0000 2015,117513,1447,20,35,0.017019393599,Venus  Jupiter  Regulus from Zimbabwe thanks to Peter Lowenstein http://t.co/SEg1BULFGT #todaysimage #earthsky http://t.co/kNrB3RmSoJ
earthskyscience,Tue Aug 04 21:15:06 +0000 2015,117513,1447,42,48,0.0357407265579,Venus  Jupiter  Mercury Aug 3. http://t.co/gpP1LsCDzQ  Your final glimpse of these planets?  Photo: Peter Lowenstein http://t.co/FFhP27tBj7
earthskyscience,Tue Aug 04 19:11:22 +0000 2015,117513,1447,9,15,0.00765872711955,Meteors  stars and more cool stuff from our friend Jeremy Evans. https://t.co/fHfIy68Uv7
earthskyscience,Tue Aug 04 15:42:14 +0000 2015,117513,1447,56,52,0.0476543020772,Looking toward the Milky Way's center http://t.co/lsipEoKvyw  Photo by Max Corneau http://t.co/eqr4cjMLIQ
earthskyscience,Tue Aug 04 14:17:10 +0000 2015,117513,1447,36,30,0.0306349084782,Tonight … find Cassiopeia the Queen  http://t.co/NOIduOXcUC  Look for the Queen's telltale shape W or M. http://t.co/QzPFUxcNKu
earthskyscience,Tue Aug 04 14:09:06 +0000 2015,117513,1447,16,44,0.0136155148792,Before midnight in Nordreisa (Kildalen)  Troms  Northern Norway.by T.Richardsen http://t.co/VCJDB0PXz0
earthskyscience,Tue Aug 04 13:22:07 +0000 2015,117513,1447,85,108,0.0723324227958,Milky Way seen from the base of Nauset Light  Eastham  Massachusetts Photo: Raj K Jonwal http://t.co/k7CY5J246T
earthskyscience,Tue Aug 04 12:38:12 +0000 2015,117513,1447,25,45,0.0212742419988,Really large rainbow at sunset 8/2 over 14 000 ft Mauna Kea on the Big Island of Hawaii by Imaginscape Photography http://t.co/TwkMay0399
earthskyscience,Tue Aug 04 02:35:07 +0000 2015,117513,1447,37,75,0.0314858781582,Sunrise colors from the summit of Mount Democrat  Colorado.  August 2. Photo: Max Moorman http://t.co/0rh7l4gqGO
earthskyscience,Tue Aug 04 00:51:06 +0000 2015,117513,1447,36,55,0.0306349084782,Storm chasing in southern Utah. by Jennifer Khordi http://t.co/WHkvG1UWad
earthskyscience,Mon Aug 03 23:09:05 +0000 2015,117513,1447,34,53,0.0289329691183,"""Floating symphony.""  T. Richardsen in northern Norway caught it under the dim light of a midnight sun .... http://t.co/m69HpqIMDg"
earthskyscience,Mon Aug 03 21:23:11 +0000 2015,117513,1447,65,87,0.0553130291968,Isn't this beautiful?  Lake Louise  Canada  Posted at EarthSky by Raj K. Jonwal http://t.co/zGwIilCvWC
earthskyscience,Mon Aug 03 19:09:21 +0000 2015,117513,1447,14,24,0.0119135755193,Cool compilation of images from various cameras on space probes  from B&amp;H http://t.co/KosPpYzoPp http://t.co/J95sxRg35L
earthskyscience,Mon Aug 03 17:04:06 +0000 2015,117513,1447,26,32,0.0221252116787,US deserts wet until 8 200 years ago http://t.co/8ht1KeXjGo http://t.co/qHCjLRLpFM
earthskyscience,Mon Aug 03 16:20:10 +0000 2015,117513,1447,48,59,0.0408465446376,Every visible star lies within our Milky Way galaxy http://t.co/xq8tdp7dYJ http://t.co/L4WVqfffSl
earthskyscience,Mon Aug 03 15:05:11 +0000 2015,117513,1447,16,15,0.0136155148792,"California's  accumulated ""rain debt"" is now equal to an average full year of precipitation http://t.co/nL7hjuTa2W http://t.co/HMs1sC4bDA"
earthskyscience,Mon Aug 03 14:03:14 +0000 2015,117513,1447,32,35,0.0272310297584,New Milky Way map shows 1/3 of the stars have traveled a long way from where they were born. http://t.co/JyNTR4wwPi http://t.co/sXplnFoBlm
earthskyscience,Mon Aug 03 13:16:12 +0000 2015,117513,1447,46,51,0.0391446052777,Cosmic convergence!  New Zealand's Mt. Ruapehu  Milky Way  Large &amp; Small Magellanic Clouds.  Photo: Manoj Kesavan http://t.co/qTotuvCkSe
earthskyscience,Mon Aug 03 12:37:07 +0000 2015,117513,1447,22,36,0.0187213329589,Seeing the star with nearest rocky planet http://t.co/6xlyt5DHu3  Also in this post ... see the star's proper motion http://t.co/VjszngEjKl
earthskyscience,Mon Aug 03 00:09:01 +0000 2015,117513,1447,46,59,0.0391446052777,Blue Moon in a cloudy sky.  Greg Hogan blended the image twice  1 with a blue tint and 1 normal. #bluemoon #justaname http://t.co/ZeUJqHOtSa
earthskyscience,Sun Aug 02 21:21:08 +0000 2015,117513,1447,60,89,0.051058180797,August planet guide is out! http://t.co/lmgEiKaeZa  Planet of the month: Saturn http://t.co/RAqrKerEqF
earthskyscience,Sun Aug 02 20:12:29 +0000 2015,117513,1447,9,12,0.00765872711955,Watch for it! https://t.co/9uOwNkEjMy
earthskyscience,Sun Aug 02 19:04:49 +0000 2015,117513,1447,5,10,0.00425484839975,Elizabeth Crehan in Connecticut got this shot early Saturday morning. She said she just added a nice … https://t.co/qsSnCCWGJc
earthskyscience,Sun Aug 02 13:04:10 +0000 2015,117513,1447,80,116,0.068077574396,Southern New Mexico  after a rainstorm  by Steve Lacy http://t.co/cixHNqNUmP
earthskyscience,Sun Aug 02 01:57:33 +0000 2015,117513,1447,4,3,0.0034038787198,lovethywalrus's photo https://t.co/JorZjrNzro
earthskyscience,Sun Aug 02 00:09:06 +0000 2015,117513,1447,37,64,0.0314858781582,Henri Bruyère caught this double red rainbow in Brussels  Belgium.  More on red rainbows: http://t.co/fDnkCqEh1c http://t.co/vWNBevzn2z
earthskyscience,Sat Aug 01 21:21:01 +0000 2015,117513,1447,67,99,0.0570149685567,Sunset in Golyazi  Turkey. Photo by Raj K. Jonwal http://t.co/IbNwYSTQtu
earthskyscience,Sat Aug 01 19:15:07 +0000 2015,117513,1447,42,58,0.0357407265579,Awesome corona around the moon  caught on July 29 by CB Devgun in New Delhi  India http://t.co/PuJSSCyb3c http://t.co/LIQt2ZaIcz
earthskyscience,Sat Aug 01 17:09:12 +0000 2015,117513,1447,69,107,0.0587169079166,A lenticular cloud over the Mono craters in eastern California. Photo: Kurt Harvey http://t.co/D73QFAreTS
earthskyscience,Sat Aug 01 16:30:19 +0000 2015,117513,1447,78,96,0.0663756350361,Rainbow and storm clouds. Near Gallop  New Mexico. Photo: Jennifer Khordi http://t.co/p2sRApIlQn
earthskyscience,Sat Aug 01 15:02:11 +0000 2015,117513,1447,118,193,0.100414422234,Full Blue Moon setting behind Pikes Peak  Colorado  7/31  Photo: Forrest Boutin http://t.co/KMxR4O8fFu http://t.co/C2Hsj7ckkM
earthskyscience,Sat Aug 01 14:02:04 +0000 2015,117513,1447,53,77,0.0451013930374,Blue heron moon  Cape Breton  Canada  by Tynski Photographic http://t.co/grKQMhuRVS
earthskyscience,Sat Aug 01 13:04:03 +0000 2015,117513,1447,37,34,0.0314858781582,First maps of Charon and Pluto http://t.co/qts0AMfWGe  This is a portion of Pluto's large moon Charon ... http://t.co/nwtb9ATFvC
earthskyscience,Sat Aug 01 02:04:07 +0000 2015,117513,1447,22,23,0.0187213329589,"First maps of Charon and Pluto http://t.co/JEN5xHJowq  Tombaugh Regio  Pluto's ""heart"" ... http://t.co/sk3yYExSc2"
earthskyscience,Fri Jul 31 23:12:00 +0000 2015,117513,1447,73,90,0.0621207866364,Bioluminescent organisms in Neah Bay  Washington - July 2015  by Jeff Berkes http://t.co/L4dG07zTAk   Thanks Jeff! http://t.co/jsGJPxFy6z
earthskyscience,Fri Jul 31 20:01:17 +0000 2015,117513,1447,47,52,0.0399955749577,How often do we have a Blue Moon in July? http://t.co/IXDMwu3gJ4  Photo:  Tim Geers http://t.co/NCfKODcVQo
earthskyscience,Fri Jul 31 18:30:36 +0000 2015,117513,1447,31,49,0.0263800600785,Captured in Senja  Troms  Northern Norway  by T.Richarden http://t.co/pbki329SF2
