Sweetrushy,Sun Oct 09 23:30:43 +0000 2011,123178607970492416,10,2,0,0,has_no_media,Lmaooo! You mad ma? rt @Merces_By_Far  @Sweetrushy foh
Abdurrahmanezz,Sun Oct 09 23:25:37 +0000 2011,123177325243285504,261433,2458,63,1,has_no_media,عاجل: عدد من رجال الأمن والمخابرات يقتحمون مقر قناة 25 للمرة الثانية ويفتشون المكان بدعوي البحث عن هاربين...عبدالرحمن عز
FreddyAmazin,Sun Oct 09 18:40:15 +0000 2011,123105511724941312,3812743,703143,515,179,has_no_media,I just realized that when you clap  you're really just High-fiving Yourself.
copoplastico,Sun Oct 09 23:21:25 +0000 2011,123176267326554112,40191,575,116,6,has_no_media,hobby: ser ignorado
sasakitoshinao,Sun Oct 09 23:21:03 +0000 2011,123176175848787968,527803,21527,79,171,has_no_media,興味深い朝日新聞38歳記者のニコ生体験。こういう双方向体験を経て、ネットの世界でのジャーナリズムのあり方を模索していって欲しいと思う。／朝日新聞デジタル：コメント７万件と時間を共有　記者が見たニコニコ動画 http://j.mp/qiS37A
GentIewomenhood,Sun Oct 09 23:17:20 +0000 2011,123175238631571456,140392,1448,161,26,has_no_media,I thought you were good looking  until I clicked "view more pictures" O_O ...
SoloReflexiones,Sun Oct 09 23:16:52 +0000 2011,123175123791527936,3543532,96,144,36,has_no_media,- ¿Por qué se murió Rita comiendo SUGUS? - Porque no eran de SUGUSto.
2insana,Sun Oct 09 23:11:41 +0000 2011,123173819367174144,24503,1798,59,2,has_no_media,الجزيرة جابت اللى حصل فى قناة ٢٥ ، المذيعة مرعوبة وبتصرخ وبتقولهم انا حااااااامل ... الحمد لله ربنا كتب للجيش فضيحة القمع والترويع على الهوا
SalvePimenta,Sun Oct 09 18:42:15 +0000 2011,123106011736317952,463330,1892,104,1,has_no_media,RT se você não quer ir amanhã para ░░░░░█▀░█▀░█▀░█▀█░█░░█▀█░░░░░ ░░░░░█▀░▀█░█░░█░█░█░░█▀█░░░░░ ░░░░░▀▀░▀▀░▀▀░▀▀▀░▀▀░▀░▀░░░░░
LeandroSupera,Sun Oct 09 23:07:53 +0000 2011,123172863430770688,372958,701,238,9,has_no_media,Um monte de verdade é dita em tom de brincadeira.
LScola4,Sun Oct 09 23:05:15 +0000 2011,123172200982384640,420026,111,65,2,has_no_media,Good luck @derekfisher on tomorrows meeting  our season it's in your hands!
jjooycinhaas2,Sun Oct 09 18:42:42 +0000 2011,123106125343236096,789,404,0,0,has_no_media,O mlk se apego *; (nn *    to lascada u.u
ChoraoFrases,Sun Oct 09 23:01:54 +0000 2011,123171357402996736,408392,19,238,8,has_no_media,Se não for hoje  um dia será. Algumas coisas por mais impossíveis que pareçam  a gente sabe que foram feitas para um dia dar certo
ferdian,Sun Oct 09 23:00:21 +0000 2011,123170965164265472,590,165,0,0,has_no_media,My Top 3 #lastfm Artists: Alex Turner (63)  Tycho (61) & How to Dress Well (54) http://t.co/AMKfEPWk
DrHigazy,Sun Oct 09 22:55:46 +0000 2011,123169815111270400,193490,67,113,13,has_no_media,الى كل المصريين الشرفاء .. قاوموا سارقى أحلامكم من رؤوس الجهل و دعاة الدجل السياسى و الدينى.. اعلنوا أن  المصير واحد فى وطن واحد اسمه مصر
travisrclark,Sun Oct 09 22:55:45 +0000 2011,123169807309864960,288648,3376,141,35,has_no_media,Rainy day = napping and movies
drtonyevans,Sun Oct 09 22:52:31 +0000 2011,123168996290859008,153635,4830,120,38,has_no_media,The old covenant can be summed up in one word: Do. The new covenant can be summed up in one word: Done.
andrenickatina,Sun Oct 09 22:42:33 +0000 2011,123166485630828544,46190,6,81,15,has_no_media,Somtimes my son don't b feeling how much weed I smoke..n I don't like 2 disappoint him so I tell him da truth...I DON'T GIVE A FUCK! Fillmoe
SabahHamamou,Sun Oct 09 18:45:17 +0000 2011,123106777293262848,7235,1896,51,2,has_no_media,الادارة بالتأزيم - اجعلها فوضى حتي يطالبك الجميع بالبقاء وتكون لديك ذرائع حتي تلتصق بالكرسي كمن وضعك عليه - المجلس العسكري انظر اليك
OINKimmaPIG,Sun Oct 09 22:40:17 +0000 2011,123165916912566272,163048,6177,72,22,has_no_media,I still get excited when I go into a bathroom and see a high-powered hand dryer
relatosotarios,Sun Oct 09 18:45:37 +0000 2011,123106859702947840,13624,359,68,1,has_no_media,♥
patriamea,Sun Oct 09 22:35:23 +0000 2011,123164682545659904,877009,26888,288,38,has_no_media,나경원 후보 남편이 6개월 군복무를 위해 3대 독자로 태어나지 않은 것 처럼  박원순 후보가 8개월 군복무를 위해 종조부가 강제징용되고 종조부 아들이 사망한 것은 아니다.
RealPoderoso,Sun Oct 09 22:31:59 +0000 2011,123163827696181248,1204756,154,463,6,has_no_media,"te amo" "olha minha foto 3x4 que passa"
justinbtolove,Sun Oct 09 22:25:50 +0000 2011,123162281906405376,6488,1245,461,4,has_no_media,ATENÇÃO: Surpresa ao Justin  dia 11 de Outubro  o dia que ele vai embora  vamos colocar nos TTs "JUSTIN IN BRAZIL 2012" ok? RT PORFAVOR!!
EvanT,Sun Oct 09 22:24:07 +0000 2011,123161850027319296,96861,65,131,40,has_video,Don't know how I survived off roading with @AvrilLavigne (she's actually a great driver) http://t.co/GYHWjgge
Flamengo,Sun Oct 09 18:46:54 +0000 2011,123107182957965312,3645010,133,194,7,has_no_media,Flamengo: Felipe  Léo Moura  Wellinton  Alex Silva  Junior Cesar  Maldonado  Muralha  Renato  Thiago Neves  Diego Maurício e Deivid
Lenandlar,Sun Oct 09 22:22:11 +0000 2011,123161359859974144,985,1264,0,0,has_no_media,@nazrag tweets not coming fast enough...lol
7areghum,Sun Oct 09 22:15:59 +0000 2011,123159800073818112,102348,1973,65,0,has_no_media,يا جلالة الملك لقد كنت شاهدا على ما فعله على سلمان بالوطن و كيف كان السبب في تدني الاقتصاد نرجو منك سحب الأراضي التي منحت له فهو لا يستحق
jaycuhhh,Sun Oct 09 22:15:01 +0000 2011,123159556586094592,592,410,0,0,has_no_media,@samanthaeve_ call me
alaa,Sun Oct 09 22:14:23 +0000 2011,123159398863478784,690076,1173,51,0,has_no_media,احد ابطال التحرير ستاشر سنة اصاب في رأسه في العباسية و نزل ثاني النهاردة واتصاب رصاص حي في قدمه النهاردة مش ناسيين التحرير يا ولاد الوسخة
bieberpamonha,Sun Oct 09 22:10:18 +0000 2011,123158369656782848,16171,1546,139,7,has_no_media,barbie traiu o ken com o boneco do justin bieber.
suckme_baby,Sun Oct 09 18:48:23 +0000 2011,123107555944833024,69859,279,53,2,has_no_media,um me esquece vale mais que um texto de mil linhas.
SADLILPOET,Sun Oct 09 18:48:30 +0000 2011,123107585711800320,1082,349,64,9,has_no_media,Clearly  Watching Selena is about watching Selena  ya know...the talented one.
ComedyPosts,Sun Oct 09 22:01:03 +0000 2011,123156044217200640,2950805,153,208,48,has_no_media,Eating solves everything. When you’re sad. When you’re mad. When you're bored.
maniacoemseries,Sun Oct 09 22:00:10 +0000 2011,123155822741176320,376519,301,238,7,has_no_media,"Em frente seguiremos através dos medos." (My Chemical Romance)
Sports_HQ,Sun Oct 09 21:54:22 +0000 2011,123154360459993088,658235,119216,141,52,has_no_media,The least initial deviation from the truth is multiplied later a thousandfold. -Aristotle
BackFemea,Sun Oct 09 21:54:21 +0000 2011,123154356945162240,445,310,0,0,has_no_media,Why do we love to hurt so much?
slmandel,Sun Oct 09 21:46:31 +0000 2011,123152385769078784,155392,388,72,4,has_no_media,I believe Oklahoma did that  sir. RT @PROUDofTEXAS @slmandel Shame on you. I just canceled your magazine. Think before you trash Texas.
7rrf_Qlm,Sun Oct 09 21:46:01 +0000 2011,123152261361827840,111540,17214,121,0,has_no_media,Alex com ciúmes marca e diz que o Homem Picanha é só dele.
hipstermermaid,Sun Oct 09 21:44:06 +0000 2011,123151778190598144,132653,667,94,32,has_no_media,My parents are sending me mixed signals. They moved without telling me  again.
AlArabiya_Brk,Sun Oct 09 21:38:02 +0000 2011,123150250692198400,12781077,36,93,4,has_no_media,التلفزيون المصري: إعلان حظر التجول في وسط القاهرة من 2 صباحاً الى 7 صباحاً
Salon,Sun Oct 09 21:26:06 +0000 2011,123147247172075520,659427,6047,54,44,has_no_media,Steve Jobs' acid trip and draconian U.S. drug policy http://t.co/1pJoMkT9
falaemicida,Sun Oct 09 21:12:57 +0000 2011,123143939049005056,72565,51,64,1,has_no_media,"Complicado bagulho de mina."
Chargers,Sun Oct 09 21:12:12 +0000 2011,123143750120783872,549309,29164,82,3,has_no_media,Philip Rivers with his third career rushing TD  this one for two yards  and then an emphatic spike in the end zone. Chargers 13  Broncos 9.
L_Cubia,Sun Oct 09 21:11:56 +0000 2011,123143683527806976,751,600,0,0,has_no_media,この時間に起きるのが明日明後日と連続だからなぁ
BuzzVoice,Sun Oct 09 21:11:18 +0000 2011,123143523351527424,576,328,0,0,has_no_media,Buzz Radio  Politics Episode 7268 http://t.co/YalSx3xE &lt;-Listen Up
maniacoemseries,Sun Oct 09 21:09:02 +0000 2011,123142951437205504,376519,301,163,15,has_no_media,"A distância entre nós parece estar crescendo." (Your Sweet Six Six Six - HIM)
vlad_sp,Sun Oct 09 21:05:46 +0000 2011,123142129114554368,96930,3794,78,1,has_no_media,voce que sabe rs = expressao usada pelas mulheres para informar que se voce fizer o que voce quer  vc esta FUDIDO
CaioFAbreuCitou,Sun Oct 09 18:57:01 +0000 2011,123109729772908544,960705,89,1051,74,has_no_media,Há certas coisas que era melhor eu não ter visto  lido  e muito menos procurado.
JoeyEssex_,Sun Oct 09 20:57:03 +0000 2011,123139936332427264,3531512,665,55,13,has_no_media,On way to Sugahut! @reemparties @sugarhut Reem ;)
OCazuzaCitou,Sun Oct 09 20:54:12 +0000 2011,123139221530750976,22463,2,166,4,has_no_media,FLUMINENSE  TIMINHO  NÃO SABE PERDER. Não sabe brincar  não vai pro play  timeco.
HotAndroidApps,Sun Oct 09 20:50:03 +0000 2011,123138175827841024,55526,1,3,2,has_no_media,Hot #android #app: Apps2ROM ★ ROOT Willing to free up some space or speed-up your applications w... http://t.co/vVEDBomj
CodySimpson,Fri Oct 14 23:57:30 +0000 2011,124997286244786176,7760249,207969,645,228,has_no_media,follow @CeramicChickn and his adventures with our team  around the world. he's gonna see Japan next. I love it cuz he doesn't give a cluck.
DopestThoughtss,Fri Oct 14 23:48:35 +0000 2011,124995043835654144,226714,191343,55,6,has_no_media,That awkward moment when someone says  "name a good song" & you suddenly forget all songs ever made.
spireli,Fri Oct 14 23:43:34 +0000 2011,124993782050586624,116314,414,101,29,has_no_media,Aprendí que el que quiere puede y lo consigue. Aprendí que a veces el que arriesga no pierde nada y que perdiendo también se gana.
SkinsSaid,Fri Oct 14 23:38:58 +0000 2011,124992625966202880,6497,6,104,43,has_no_media,It means I still love you.
spireli,Fri Oct 14 23:33:24 +0000 2011,124991221260222464,116314,414,257,6,has_no_media,RETWEET si extrañas a alguien en este momento.
BBCBreaking,Fri Oct 14 23:32:07 +0000 2011,124990902325362688,23122619,3,387,31,has_no_media,The British public has donated £72m for victims of the drought in East Africa  the most ever for a food crisis.http://bbc.in/qqJulm
MensHumor,Fri Oct 14 23:30:15 +0000 2011,124990430508089344,3608346,232,604,108,has_no_media,I'm not holding the door open for you because I'm polite  I'm holding it open because I want to check out your ass.
marcusmaiaa,Fri Oct 14 23:26:51 +0000 2011,124989576128376832,9686,565,65,0,has_no_media,se o rato viesse dentro do Ruffles  ele ia ter ar pra respirar durante uns 2 anos
bunnias,Fri Oct 14 23:26:35 +0000 2011,124989509338267648,555,86,0,0,has_no_media,ALGUIIIIIEN TIENE EL TELEFONO DEL MNROY !!! PLS HELLLPP RT @erikaportillo1 deje mi bolsa ayer :'(
ashleytisdale,Fri Oct 14 23:24:34 +0000 2011,124989000573403136,13116448,199,524,204,has_no_media,Proud to say I'm extension free!!!! :) rockin the shorter hair for fall http://t.co/ogYNf0cn
sasakitoshinao,Fri Oct 14 23:23:06 +0000 2011,124988629205532672,527800,21527,210,106,has_no_media,これってSBはちゃんとアナウンスすべきでは？　解約したiPhone本体の所有権が消滅しちゃう感じがなんか不可解。／解約したiPhoneにiOS 5をインストールしようとすると使用不能に、復元も不可 - GIGAZINE http://t.co/yvSfxJZG
bigfanInna,Fri Oct 14 23:21:52 +0000 2011,124988322669002752,888,36,0,0,has_no_media,@AnaSubilia haha tkt moi aussi mdr xD
fefito,Fri Oct 14 23:20:41 +0000 2011,124988023267004416,93566,1118,70,2,has_no_media,Sério  eu ainda não superei que eles voltaram de barco. LIMPINHOS. DO CENTRO DA TERRA. COM DINOSSAUROS.
ecaSafitrii,Fri Oct 14 23:20:06 +0000 2011,124987877271678976,4751,490,0,0,has_no_media,Ooh RT @audykurniasari: Gatau kak gak liat jam heheRT @echa22dudulls: Uda ga ad tamu dtg soalnya dek :) kamu (cont) http://t.co/VxPIyokL
Nikkilopzy,Fri Oct 14 23:18:11 +0000 2011,124987395740401664,977,601,0,0,has_no_media,We are happy to report that Rick Ross is ok.   He posted this video to show us all that he's on the road to recovery ... watch here --&gt;...
Matchox,Fri Oct 14 23:16:02 +0000 2011,124986853047808000,74499,163,172,2,has_no_media,onde eu clico pra conseguir sair numa sexta-feira?
gaabilorena,Fri Oct 14 23:13:07 +0000 2011,124986117106839552,123,121,0,0,has_no_media,queria tá no MIB :/
boozinhaa,Fri Oct 14 23:12:36 +0000 2011,124985989931347968,135380,400,72,0,has_no_media,Ahahhahahahahahahaha alguem me fala que p*rra éssa na novela 'morde e assopra'? Hahahhha bizarro viu
dvntownsend,Fri Oct 14 23:07:14 +0000 2011,124984638077796352,77204,453,61,4,has_no_media,it must just be me  but all this zombie shit is duuuuuuuumb... dumb dumb dumb. 2011: the year of dubstep wobbling zombie shit. :)
AlbertoCiurana,Fri Oct 14 23:05:18 +0000 2011,124984153593749504,3037250,7346,60,24,has_no_media,La puerta mejor cerrada es aquella que puede dejarse abierta.
Halo,Fri Oct 14 23:05:18 +0000 2011,124984151202988032,742511,756,129,34,has_no_media,Halo: Anniversary achievements revealed! http://t.co/nvIYrk57
JRKruijer,Fri Oct 14 23:03:07 +0000 2011,124983601363300352,315,127,0,0,has_no_media,@followanoek Slaaplekker anoek! xoxo(L)
TheNextWeb,Fri Oct 14 23:02:48 +0000 2011,124983521939959808,1663190,1186,247,9,has_no_media,Marvel's The Avengers trailer breaks iTunes record at 10M downloads in 24hrs http://t.co/GpMMBjRZ by @heycheri on @TNWapple
tati_bernardi,Fri Oct 14 23:01:11 +0000 2011,124983116325584896,339938,311,244,39,has_no_media,"vou esperar uns 3 dias pra ela se acalmar e tento de novo". (Sim  nós sabemos exatamente como funciona essa mente simplória de vocês).
QualquerDiario,Fri Oct 14 23:01:11 +0000 2011,124983114882744320,98807,30,109,1,has_no_media,ainda bem que meu nariz é virado para baixo  se fosse para cima eu morreria afogado quando chovesse... não sei nadar :s HAHA
VersosFrases,Fri Oct 14 22:51:37 +0000 2011,124980709218725888,474614,22,271,17,has_no_media,Ela: Como vai o coração ?  Ele: Batendo. Ela: E se ele parar de bater ?  Ele: Foi por que você foi embora da minha vida.
MacTrast,Fri Oct 14 22:49:35 +0000 2011,124980197844975616,174631,242,53,20,has_no_media,Did you know that Siri can update your Twitter status too?  It's true!  Here's how it's done: http://t.co/DL0RrRSH
geoffjohns,Fri Oct 14 22:47:14 +0000 2011,124979606016110592,188323,2348,155,14,has_no_media,Oh  yes...announced the team up of all team ups: Robot Chicken/DC Comics Special 2012 on Adult Swim!! @SethGreen @wizmatts @cyborgturkey
SammiDoll,Fri Oct 14 22:43:31 +0000 2011,124978668735954944,108543,134,76,34,has_no_media,One comment - it doesn't matter who is dating who or why. There's a reason we as people do as we do. Its called Experiencing. Loving. Living
Rayangz917,Fri Oct 14 22:43:06 +0000 2011,124978566160056320,2,0,0,0,has_no_media,@Deejay_Lash use www.TalentHouseLive .com for ur page. u can have a verified account s/o ur page or a 100k account.
FellipheAlmeida,Fri Oct 14 22:30:04 +0000 2011,124975283630641152,102133,6400,37,0,has_no_media,Não adianta dizer o que está sentindo  as pessoas não se importam.
HugoGloss,Fri Oct 14 22:26:09 +0000 2011,124974298510266368,1423764,3521,93,0,has_no_media,Ai gente  esse é o segredo??? Ce juuura... Eu acho q o segredo dele é pior  q largou a Luciana cadeirante e fugiu p Preciosa
TheNextWeb,Fri Oct 14 22:24:34 +0000 2011,124973902748336128,1663191,1186,136,18,has_no_media,iPhone 4S so "disappointing" that it broke Sprint records and AT&T set to double activation records http://t.co/kfqPeZPn
ARlSADA,Fri Oct 14 22:16:53 +0000 2011,124971968788316160,138755,159,160,5,has_no_media,Se fosse fácil se chamaria Miojo  não relacionamento!
disneywords,Fri Oct 14 22:15:04 +0000 2011,124971508991930368,4001553,0,367,62,has_no_media,My friends need to be punished. –Lilo (Lilo and Stitch)
Dana_A_BHR,Fri Oct 14 22:13:56 +0000 2011,124971224047693824,173,139,65,0,has_no_media,@Bahrain_unity @mnarfezhom @alfarooo8 دعواتكم للشيخ عمر عبدالكافي اهو في الانعاش اللهم رب الناس مذهب الباس اشف الشيخ عمر شفاء لا يغادر سقما
bellathorne,Fri Oct 14 22:08:15 +0000 2011,124969792561086464,6354688,7843,125,40,has_no_media,Selena Gomez  Debby Ryan  Bella Thorne  Zendaya and More Are Teaming Up! (Vid)  http://t.co/XiLzeNA9 via @AddThis
ChoraoFrases,Fri Oct 14 22:02:10 +0000 2011,124968265222066176,408391,19,151,3,has_no_media,"Faça da sua vida algo melhor do que já viu e ouviu"
GlobalGrind,Fri Oct 14 21:59:40 +0000 2011,124967636026134528,433626,997,83,11,has_no_media,Rick Ross tweets video message for fans after collapsing! &gt;&gt; http://t.co/qOaRbz7N
couchcrewchief,Fri Oct 14 21:56:29 +0000 2011,124966833622220800,971,2029,0,0,has_no_media,Thank you @kellijo75: RT "@couchcrewchief: @MissSprintCup There is only 1 #couchcrewchief on FaceBook & Twitter  everyone else... #wannabes"
Patrick_Quan,Fri Oct 14 21:56:27 +0000 2011,124966824973578240,7721,4821,45,2,has_no_media,I swear being in love makes you jealous  paranoid  and nonchalant about certain situations .
WakaFlocka,Fri Oct 14 21:52:50 +0000 2011,124965913979142144,1604169,6210,49,3,has_no_media,No show tonight
YasserHareb,Fri Oct 14 21:46:24 +0000 2011,124964295963459584,264734,630,60,9,has_no_media,الأحلام الصادقة لا تُرَد ولا تُستبدَل
OINKimmaPIG,Fri Oct 14 21:40:29 +0000 2011,124962808638091264,163048,6177,98,36,has_no_media,Today this guy was buying some condoms and he got his card declined. LMFAO. He just got dick blocked by Visa :’)
OfficialKat,Fri Oct 14 21:40:05 +0000 2011,124962706607439872,907925,511,338,358,has_no_media,@Drake I'm proud of you too
wavykrnpapi,Fri Oct 14 21:32:37 +0000 2011,124960827580235776,2087,50,2,0,has_no_media,"I think if you get kicked in the face you deserved it because that means that you watched the foot come to your face."
AnnCoulter,Fri Oct 14 21:30:07 +0000 2011,124960196450725888,864038,562,481,49,has_no_media,Occupy protest will have a "Mass March on Chase Bank” Saturday to close their accounts. Chase expected to lose well over $100.
ahdolescente,Fri Oct 14 21:28:35 +0000 2011,124959811715596288,104752,259,156,11,has_no_media,Mostre a todos que  em um céu escuro  você pode ser uma estrela brilhante. (Miley Cyrus)
SnoopDogg,Fri Oct 14 21:27:18 +0000 2011,124959489223962624,14184385,2640,63,15,has_no_media,Oslo  Norway - Tha Doggumentary European Fall 2011 Tour - 2 more shows  2 more cities.......... http://t.co/cYFBh4hh
SnoopDogg,Fri Oct 14 21:25:12 +0000 2011,124958959021985792,14184385,2640,71,18,has_no_media,He Is I  I am Him  Slim Wid A Tilted Brim - roccn in fronta 9000 in Oslo Norway @ Tha Spektrum  ugot2doit http://t.co/c5BmvznV
maniacoemseries,Fri Oct 14 21:21:35 +0000 2011,124958049361342464,376519,301,108,6,has_no_media,"O Punk Rock está morto... E eu matei o maldito." - Billie Joe Armstrong - Green Day
AustinMahone,Fri Oct 14 21:19:59 +0000 2011,124957649514147840,9573407,86027,52,28,has_no_media,IM ALSO DOING THE T-SHIRT GIVE AWAY!!!:D http://t.co/OJKKpuhh
rafinhabastos,Fri Oct 14 21:19:47 +0000 2011,124957598704345088,10068068,370,1060,48,has_no_media,Estarei arrecadando $ p/ pagar meus processos com shows em Campinas (sab) e Goiânia (dom). Espero a sua doação  amiguinho.
JakePittsBVB,Fri Oct 14 21:16:09 +0000 2011,124956682307633152,592504,166,71,43,has_no_media,Jinxx QOTD "I don't have biggers boog enough"
Beriorgar,Fri Oct 14 21:12:32 +0000 2011,124955774899335168,196,172,0,0,has_no_media,interesting  i just looked at my thermometer  it was 18 Celcius in my room. i put it down next to me  and now it's 3 degrees hotter!
EuBisbilhotei,Fri Oct 14 21:11:54 +0000 2011,124955614081327104,636943,23491,230,12,has_no_media,Não desista  um dia você vai olhar pra trás  e vai ver que valeu apena lutar.
IamBrittanyHall,Fri Oct 14 21:10:04 +0000 2011,124955153412521984,80134,1460,52,2,has_no_media,S/o to all the niggas who sit on twitter callin girls hoes cuz they can't even get ONE hoe to fuck them... You mad?
SmokeyyOnFriday,Fri Oct 14 21:03:18 +0000 2011,124953449027735552,61441,67,120,6,has_no_media,Writing. Like. This. Doesnt. Make. Your. Point. Any. Stronger. It. Makes. It. Look. Like. Your. Computer. Has. Asthma
TIME,Fri Oct 14 21:00:44 +0000 2011,124952802828095488,10840697,843,252,21,has_no_media,One airline wants to cut costs by getting rid of toilets. (There's no way this will end well) | http://t.co/iadQrBDQ (via @TIMENewsFeed)
WomenOfHistory,Fri Oct 14 21:00:33 +0000 2011,124952756191641600,846113,124455,95,34,has_no_media,I believe the most important single thing  beyond discipline & creativity is daring to dare. -Maya Angelou
Bushwackerinc,Fri Oct 14 21:00:27 +0000 2011,124952732040822784,8789,1293,0,0,has_no_media,This #auto #FF goes out to @overlandexperts @SEMASHOW @skyjacker @jeepreviews & @fjcmagazine
jorgeramosnews,Fri Oct 14 20:56:59 +0000 2011,124951860334444544,1858011,100,81,47,has_no_media,"Tienen que encontrar eso que aman": Steve Jobs. Lean y vean su discurso http://t.co/iF62jkPB
Alyssa_Milano,Fri Oct 14 20:56:28 +0000 2011,124951731510575104,2883310,1508,70,119,has_no_media,10 Sites to Learn Something New in 10 Minutes a Day (Mashable) http://t.co/LmXKZSx5 /via @Flipbooks
Dicas_do_heman,Fri Oct 14 20:52:53 +0000 2011,124950826002300928,103039,315,224,16,has_no_media,Quero ver você passar: (  ) pelos meus critérios de cidadania  (  ) pela lâmina da espada justiceira  (  ) por debaixo da cordinha
GirlNotes,Fri Oct 14 20:52:08 +0000 2011,124950637099233280,1846713,11586,308,94,has_no_media,Sitting in the cinema  ready to watch the movie  then BOOM! The human giraffe sits in front of you.
frasesretofc,Fri Oct 14 20:49:55 +0000 2011,124950082348007424,6387,21,53,0,has_no_media,Plante o bem para colher o bem!
letsnotbenormal,Fri Oct 14 20:43:54 +0000 2011,124948568975998976,412,276,0,0,has_no_media,:)
geerocha,Fri Oct 14 20:41:15 +0000 2011,124947901360250880,500968,141,74,18,has_no_media,Tavares ensinamento o verdadeiro churrasco dos Gaúchos. da horaaa
dannn_i,Fri Oct 14 20:29:04 +0000 2011,124944835818962944,342,274,0,0,has_no_media,i miss my brother &'zavier
Catrafrases,Fri Oct 14 20:20:31 +0000 2011,124942684354912256,1198436,407,455,9,has_no_media,Tem gente que machuca os outros  tem gente que não sabe amar.
Trendeh,Fri Oct 14 20:18:17 +0000 2011,124942121273794560,77941,360,52,2,has_no_media,Vomit. RT @TraceCyrus: I am very excited to say  last week I asked my girlfriend Brenda Song to marry me and she said YES!
iQuoteComedy,Fri Oct 14 20:16:41 +0000 2011,124941717202944000,2164806,681,255,92,has_no_media,I'm not saying you’re the fattest person I've ever seen  but if I had to name the top 5... you would be the first 3
ebs_14,Fri Oct 14 20:11:17 +0000 2011,124940357992587264,275042,265,100,55,has_no_media,@hallsy04 and I are gonna have @RNH_93 over for supper tonight and gonna attempt to cook some food
106andpark,Fri Oct 14 20:11:10 +0000 2011,124940330163376128,6051609,693,90,26,has_no_media,Which @MindlessBhavior video is your fave?? Hit Us Up
maniacoemseries,Fri Oct 14 20:06:41 +0000 2011,124939199819419648,376519,301,83,3,has_no_media,Drogas são horríveis. Elas acabam com seu coração  seu fígado e seu cérebro. E o pior de td é q deixam vc igual aos seus pais. - Frank Zappa
Mbd3onKSA,Fri Oct 14 20:03:02 +0000 2011,124938284060258304,354890,293265,74,0,has_no_media,“@reqooo: ريتويت اذا تحب السباحه!!”
Alburesychistes,Fri Oct 14 20:01:19 +0000 2011,124937851812057088,38546,17991,124,25,has_no_media,Amor  ¿Sabes que es lo más hermoso que tienes? - Wow ¿Qué cosa mi amor? - No tengo ni idea  por eso te pregunto.
BabyAnimaIPicss,Fri Oct 14 19:55:56 +0000 2011,124936494031978496,1215161,131312,233,77,has_no_media,Dear Mosquitos  I think Mother Nature takes enough blood from me               already. Sincerely  I'll need a blood donor soon.
SarkiSexy,Fri Oct 14 19:53:41 +0000 2011,124935930376241152,1694,239,56,8,has_no_media,"Lembrar é fácil para quem tem memória. Esquecer é difícil para quem tem coração." .. Lembrar também é dificil pra quem tem Alzheimer  ok?
BestofCapricorn,Fri Oct 14 19:48:17 +0000 2011,124934570276683776,202721,7,170,31,has_no_media,Capricorn must learn that faith is an important spiritual quality that should be cultivated.
LADIEZGOGAGA,Fri Oct 14 19:34:49 +0000 2011,124931180226281472,15031,2933,163,3,has_no_media,I hate it when I make plans  get excited  then everything goes wrong . -__-
