TheBobOngQuote,Sun Oct 09 14:16:01 +0000 2011,123039011773231104,1446640,33,743,160,has_no_media,"Ang tunay na kaibigan hindi nang-iiwan  kahit mapagalitan pa ng magulang. =))"
GirIPost_,Tue Oct 11 05:58:18 +0000 2011,123638535516463104,6347,0,130,22,has_no_media,For every good reason there is to lie  there is a better reason to tell the truth.
OccupyBOS_Media,Tue Oct 11 05:57:22 +0000 2011,123638301340090368,6036,124,126,3,has_no_media,Please RT  Occupy Boston under attack: http://t.co/lSH2odNv
Rawangpai,Tue Oct 11 05:57:19 +0000 2011,123638288211910656,940873,730,73,3,has_no_media,RT @ittipat_Rw: กรมชล เตือน ปชช.ชุมชน ซอยวัดกู้ บางพูด ปากเกร็ด นนทบุรี คันกั้นน้ำขาดเป็นช่วงๆให้เตรียมขนของขึ้นที่่สูง น้ำจะขึ้นต่อเนื่อง
girlposts,Tue Oct 11 05:46:11 +0000 2011,123635484617482240,6210691,74317,363,136,has_no_media,If you want me in your life  please start acting like it. You have no idea  how close I am to giving up. &lt;/3
cr0sstheline,Tue Oct 11 05:45:16 +0000 2011,123635252991246336,183415,6261,406,69,has_no_media,Cross the line if you feel such a deep regret after everytime you cut yet you still do it.
3wash_SJ,Sun Oct 09 14:17:22 +0000 2011,123039352740786176,462,269,14,0,has_no_media,RT @mubarakadel: الصاحــــب الي مايعزك ساعة الضيق ... وقت الرخا ماله بالأصحاب حاجــــــــه
naosalvo,Tue Oct 11 05:36:35 +0000 2011,123633069293961216,829731,951,66,9,has_no_media,A menina: "Vou ali ser Dj  e ja volto" HORAS dps saquei q ia se masturbar! Q outros sinonimos bizarros vcs tem mulheres? Preciso saber disso
488mt,Tue Oct 11 05:34:59 +0000 2011,123632667580313600,982829,43076,187,3,has_no_media,หน่วยงานใด?ต้องการ เจ็ทสกี เรือยาง เรือเล็กเรือ สปรินเตอร์ เพื่อเข้าไปช่วยชาวบ้าน ติดต่อ 081-841-5662 คุณปุ้ม
idillionaire,Tue Oct 11 05:30:46 +0000 2011,123631604810788864,1056876,144,130,89,has_no_media,I'm more pissed off than a mosquito in a room full of mannequins.
ParisCarney,Tue Oct 11 05:16:59 +0000 2011,123628137601970176,78080,396,86,13,has_no_media,Congratulations joe!! Soo stinkin amazing!! RT @joejonas: BUY FAST LIFE ON ITUNES IS A TT! YES!
pang_ornjira,Tue Oct 11 05:14:16 +0000 2011,123627451564826624,217730,99,93,6,has_no_media,RT @MayPitchy: RT @peipanwad:  พระเทพเสด็จไปกับรถทหาร ช่วยน้ำท่วมที่อำเภอวังน้อย ไม่เป็นข่าว แม้แต่ในข่าวพระราชสำนัก ทรงพระเจริญ
unicefkorea,Tue Oct 11 05:10:51 +0000 2011,123626593351499776,53302,46131,68,10,has_no_media,2011 아시아송페스티벌과 함께 하는 유니세프 음악 엔보이 임명식 시작합니다. 소녀시대 서현  슈퍼주니어 동해 참석. @유니세프한국위원회 http://t.co/L1xQHFpw
papadixx,Tue Oct 11 05:04:01 +0000 2011,123624872965443584,499,387,0,0,has_no_media,@krshclrplma DIVINA MOVES!!!
eliroth,Tue Oct 11 05:03:55 +0000 2011,123624850265882624,284613,813,300,106,has_no_media,Okay   so guess who has AMAZING taste in horror movies???? Another reason to love @selenagomez... She's a horror geek! http://t.co/VLKcwzDO
KongKaroon,Tue Oct 11 05:02:33 +0000 2011,123624505653460992,158984,133,128,7,has_no_media,RT @MayPitchy: พระเทพเสด็จไปกับรถทหาร ช่วยน้ำท่วมที่อำเภอวังน้อย ไม่เป็นข่าว แม้แต่ในข่าวพระราชสำนัก ทรงพระเจริญ  http://t.co/gieOh7ns
__Sammael,Sun Oct 09 14:25:31 +0000 2011,123041406414622720,150,254,0,0,has_no_media,Sigan a @Lilith_Mel◄◄◄ dan #FollowBack #SiguemeYTeSigo #MeSiguesTeSigo #TeamFollowBack #Reciprocidad 4
VictorMatfield,Tue Oct 11 04:55:10 +0000 2011,123622646465314816,308520,229,82,12,has_no_media,Feel so empty waking up this morning without the dream of bringing back the cup. Thanks for all the support at the airport. Was unbelievable
channelvthai,Tue Oct 11 04:48:30 +0000 2011,123620970773741568,129483,161,203,0,has_no_media,ด่วน!! ปทุมธานีต้องการอาสาสมัครจำนวน 500 คน ช่วยกันแพคกระสอบทราย พบกันที่ศาลากลางจังหวัดปทุมธานีครับ
record_mexico,Tue Oct 11 04:41:30 +0000 2011,123619209153495040,1011638,305,207,13,has_no_media,De acuerdo con la prensa británica  Real Madrid prepara una oferta de casi 47 millones de dólares por Chicharito http://t.co/ni8qr7Cf
D_LivingLegend,Tue Oct 11 04:36:40 +0000 2011,123617992750800896,1488,1780,0,0,has_no_media,#Np J.Cole-Grown Simba #HustleMuzik #NoDaysOff http://t.co/DrAoFKo5
PhilYHusband,Tue Oct 11 04:34:45 +0000 2011,123617509491478528,959344,642,108,12,has_no_media,Game day vs Nepal! Last game of the year for Azkals. Make it count! :D
ComedyOrTruth,Tue Oct 11 04:31:31 +0000 2011,123616694127177728,2756992,40290,1523,344,has_no_media,In December 20 2012  I want someone to send me a text saying  "Incase the world ends tomorrow  I want you to know that I love you."
idillionaire,Tue Oct 11 04:30:11 +0000 2011,123616360361238528,1056876,144,222,55,has_no_media,"Get off the internet so I can use the house phone" Those were the days.
4M_hyunah,Tue Oct 11 04:22:15 +0000 2011,123614364824637440,474089,46,214,170,has_no_media,^∇^ http://t.co/bqCUNfwW http://t.co/6JUX6LJt http://t.co/4rDSuJqC
Renee_Lyon3,Tue Oct 11 04:20:54 +0000 2011,123614021931909120,105199,8412,46,7,has_no_media,Always be a first-rate version of yourself rather than a second-rate version of somebody else.
DopestThoughtss,Tue Oct 11 04:16:31 +0000 2011,123612921736601600,226718,191346,413,40,has_no_media,Favorite Disney singers: [ ] Miley Cyrus [ ] Selena Gomez [√] Timon and Pumba
fndausta,Tue Oct 11 04:08:48 +0000 2011,123610979236974592,3097,458,0,0,has_no_media,@SecilOzdemir77 aa aynen cok tuhaf erkutta da birsey yok anlamadim gitti !! :)
AlbertoRavell,Sun Oct 09 14:32:31 +0000 2011,123043167095357440,1548132,1635,124,4,has_no_media,La inflación acumulada durante los 11 años de Chávez es de 733%. ABarrera.
Occupy_Boston,Tue Oct 11 04:01:42 +0000 2011,123609193130364928,25660,357,74,1,has_no_media,Riot police are at Dewey. Nonviolence is how we win this.
GirlTroubIes,Tue Oct 11 04:00:58 +0000 2011,123609007121367040,1724631,1405,625,184,has_no_media,Seeing that one person  even if it is just for a short period of time  but it still manages to makes your day.
itsgabrielleu,Tue Oct 11 03:57:02 +0000 2011,123608017529864192,3072735,661,109,3,has_no_media,Owners take all the risk??? Sorry...never seen an owner w/ an ACL injury...business is abt risk  bad management is a whole nutha animal
RealComedyKing,Tue Oct 11 03:52:37 +0000 2011,123606905045266432,81731,1799,157,23,has_no_media,If someone Loves you  they would not hurt You.
LoveQuotes,Tue Oct 11 03:50:01 +0000 2011,123606250087923712,1766867,92,365,194,has_no_media,Let your dreams be bigger than your fears and your actions be louder than your words.
Karndee,Tue Oct 11 03:49:45 +0000 2011,123606185772462080,10771,352,62,0,has_no_media,มหาวิทยาลัยธรรมศาสตร์ ศูนย์รังสิต เลื่อนสอบปลายภาค 1/54 ตั้งแต่วันที่ 12 ต.ค.-21 ต.ค. 54 เป็นวันที่ 1-10 พ.ย. 54
WillHoge,Tue Oct 11 03:49:43 +0000 2011,123606175899058176,31995,290,287,25,has_no_media,you know the difference between Jay Cutler and Hank Williams Jr?   Hank Williams Jr has an offensive line
BrodyJenner,Tue Oct 11 03:48:23 +0000 2011,123605842250567680,2262645,124,510,54,has_no_media,I feel so grateful for the amazing friends and family I have been blessed with.. life is what YOU make of it!!
Lex_Doom,Tue Oct 11 03:45:06 +0000 2011,123605013443514368,88,46,0,0,has_no_media,#TheLastDeathOpera va sonando bien #KickAss gracias a @CamusAltamirano  @JorgeFerroM y @nachocastillo87!!
diamonds4gil,Sun Oct 09 14:35:41 +0000 2011,123043961483952128,144,262,0,0,has_no_media,LORT @YaManKdot: Sometimes preachers have a great sermon  but then they drag it out and they lose u.. smh..LOL!!!!!!!
ExoticAssBrii_,Tue Oct 11 03:39:55 +0000 2011,123603709266640896,12717,1881,84,1,has_no_media,RT if you love sex
welovehani,Tue Oct 11 03:35:51 +0000 2011,123602684715597824,226271,11658,104,115,has_no_media,한국 기업 법인세가 세계적으로 얼마나 낮은 수준인지 선대인(@kennedian3) 씨의 글입니다. 학습하듯 읽어주세요. 이런 글은 아예 외워버려야 합니다. http://t.co/KAZpAzzR
TensionDiffused,Tue Oct 11 03:35:35 +0000 2011,123602617476710400,93,6,0,0,has_no_media,Of the trio I like Hermione Best and and I love Emma a lot too......I just love how Jo portrayed her. Strong ... http://t.co/vNA28L0D
jobsonlinkupCA,Tue Oct 11 03:30:05 +0000 2011,123601236325974016,214,0,0,0,has_no_media,American Tutoring: Financial Accounting Tutor #Job (West Hollywood  CA) http://t.co/lztuPvIJ
Maggie__Weible,Tue Oct 11 03:21:56 +0000 2011,123599184740880384,456,219,0,0,has_no_media,People who get enjoyment out of other peoples pain make me sick. Look at yourself instead of judging others. #FUCK
imam_ali_says,Tue Oct 11 03:17:27 +0000 2011,123598055793627136,242302,4,65,8,has_no_media,قال أمير المؤمنين الإمام علي عليه السلام: الهي والله ما عبدتك خوفا من نارك   ولا طمعا بجنتك   لكنني وجدتك أهلا" للعبادة فعبدتك .
Sinceridades,Tue Oct 11 03:16:16 +0000 2011,123597759042433024,380700,130,193,23,has_no_media,Sabe qual a diferença entre eu e você? É que eu te amo  e você apenas gosta de mim.
maryjanekilla,Tue Oct 11 03:14:35 +0000 2011,123597333698068480,482,215,0,0,has_no_media,@iman_likes_men @hannahlucas16 who has the sex truth or dare book
shanenickerson,Tue Oct 11 03:11:17 +0000 2011,123596502428958720,20727,941,103,45,has_no_media,It's hard to quantify the size of the fuck I don't give about a canceled basketball season.
_WildAndSHAYDEE,Sun Oct 09 14:43:17 +0000 2011,123045875126775808,671,247,0,0,has_no_media,RT @Sing_2Charise: Single life &lt;
barbylpz_,Tue Oct 11 03:06:11 +0000 2011,123595219982757888,760,273,1,0,has_no_media,RT @DemiFlyWithMe: Tell me who's that.
RamDanielle,Tue Oct 11 03:03:32 +0000 2011,123594552274718720,30060,419,310,68,has_no_media,that stage in a friendship where you can start insulting them.♥
itsBlairWaIdorf,Tue Oct 11 03:01:35 +0000 2011,123594061515984896,303612,220038,54,10,has_no_media,Most girls don't realize what they're worth and most men don't realize what they have until she's gone.
pelanza,Tue Oct 11 02:57:29 +0000 2011,123593030652534784,1590720,495,139,10,has_no_media,Viciados em tranca @geerocha @alanyuji http://t.co/PI52kUQq
GirlDictionary,Tue Oct 11 02:51:59 +0000 2011,123591647371083776,515178,35172,1047,286,has_no_media,Love when you're ready  not when you're lonely.
PTI,Tue Oct 11 02:47:54 +0000 2011,123590617367457792,1094326,243,155,6,has_no_media,Jim Schwartz is gonna need rotator cuff surgery by the end of this season.
GailSimone,Tue Oct 11 02:47:24 +0000 2011,123590495111880704,82541,6842,92,21,has_no_media,Wonder Woman doesn't need a dad  she has a thousand moms already.
iSpeakForGirls,Sun Oct 09 14:47:08 +0000 2011,123046845193789440,158077,162,111,41,has_no_media,I'd go back in time and change it but I can't. So if the chain is on your door I understand.
teracarissa,Tue Oct 11 02:46:06 +0000 2011,123590166957920256,92247,7434,122,43,has_no_media,God will send ppl who will do right by you. When they come  do right by them.
Rawangpai,Tue Oct 11 02:43:40 +0000 2011,123589552769220608,940875,730,107,1,has_no_media,ปทุมธานี ยังคงวิกฤต จาก พนังกั้นน้ำรั่ว 4 จุด อบจ.ปทุมธานีบอก ยังอุดไม่ได้  เสี่ยงท่วม นิคมนวนคร ตลาดไท มธ.ศูนย์รังสิต www.rawangpai.com
MJtaughtYou,Tue Oct 11 02:40:21 +0000 2011,123588721034543104,198,194,0,0,has_no_media,I got the hiccups and they hurt
H_Grace_field,Sun Oct 09 14:48:07 +0000 2011,123047090610896896,12,33,0,0,has_no_media,내가 항상 꿈꾸는 일이다ㅋ하지만 안된다ㅜㅜRT @garie5882: 너무 많이 들리고 너무 많이 보인다. 눈 감고 귀 막고 납작하게 엎드려 있다가 타이밍봐서 다 담그고 승부봐야겠다ㅋ
Sintoniafrase,Tue Oct 11 02:40:01 +0000 2011,123588637442056192,754876,198687,89,7,has_no_media,“4 letras e 1 sentimento que me consome por completo: SONO”
lariwn,Tue Oct 11 02:38:01 +0000 2011,123588131122450432,6383,281,1,0,has_no_media,Eu queria ser só sua  mas Deus me fez propriedade do mundo.
MisterBombillo,Tue Oct 11 02:30:11 +0000 2011,123586161447936000,574039,242759,140,24,has_no_media,¿No te agrado? Entonces por favor toma tu turno  sienta & espera a que me importe.
Kutipan_Anda,Tue Oct 11 02:25:22 +0000 2011,123584950632054784,1273909,413,111,16,has_no_media,Anda dapat memulai merancang masa depan baik Anda dengan mengendalikan diri untuk terus bersikap baik
MoRocca,Tue Oct 11 02:22:47 +0000 2011,123584298946265088,449391,414,71,15,has_no_media,How cool would it be if Michelle Obama cut her hair like Diana Ross in The Wiz & sang Ease on Down the Road along Pennsylvania Ave?!
daddy_yankee,Tue Oct 11 02:20:01 +0000 2011,123583603425804288,8899250,78,303,51,has_no_media,Terminando otro tema de Prestige con Los de la Nazza!
cher,Tue Oct 11 02:19:05 +0000 2011,123583367798206464,3072788,156,344,150,has_no_media,OMG! I WAS CRYING ! WASNT EXPECTING 2 B SO NERVOUS ! BROKE  MY BRACELET CLAPPING ! IM SO PROUD !! CHAZ WAS GREAT! LOVED DAVID ARQUETTE  2nd
feministhulk,Tue Oct 11 02:18:26 +0000 2011,123583202689417216,80323,42,287,35,has_no_media,DEAR COLUMBUS  TAKING OVER ANOTHER PERSON'S HOME: NOT "DISCOVERY " BUT TRESPASSING. SINCERELY  HULK
Thi1i,Tue Oct 11 02:13:57 +0000 2011,123582073712803840,4194,231,111,21,has_no_media,esse dia está tão chato que deve ter um capítulo inteiro sobre ele na bíblia
23cAlLmE_cRaZiE,Tue Oct 11 02:13:13 +0000 2011,123581890480455680,299,228,0,0,has_no_media,Aye @FLASHx5 you still breathing over there? Lol
RomeoandJuLlet,Tue Oct 11 02:11:59 +0000 2011,123581582186528768,80719,15,77,39,has_no_media,It's easy to say I'm fine instead of having to explain the reasons why I'm not.
BlairVadia,Tue Oct 11 02:11:22 +0000 2011,123581426179383296,118603,6,459,48,has_no_media,O amor só serve pra vender livros e filmes.
boyswho,Tue Oct 11 02:06:26 +0000 2011,123580184686374912,339875,15215,1139,222,has_no_media,Dear eyelashes  wishbones  pennies  shooting stars  11:11 and birthday candles. What happened to my wishes? Sincerely  still waiting..
wordstionary,Tue Oct 11 02:06:15 +0000 2011,123580136498003968,3374886,42,832,171,has_no_media,"Hey  remember when you had a crush on ___" "NOOOOOOOOOOOOO"
citacao,Tue Oct 11 02:02:19 +0000 2011,123579147963473920,119303,18,114,20,has_no_media,de Bob Marley: Eu gosto do impossível  tenho medo do provável  não gosto de rotina  dou risada do ridículo e choro porque tenho vontade.
sportspickle,Tue Oct 11 01:57:29 +0000 2011,123577930310877184,150225,1184,226,4,has_no_media,John Calipari is probably wondering if this means the first 2 weeks of Kentucky's season is cancelled  too.
OCazuzaCitou,Sun Oct 09 14:57:32 +0000 2011,123049460950515712,22463,2,179,2,has_no_media,E eu tenho orgulho de dizer: Eu faço parte da MAIOR torcida do mundo. Obrigado por existir  meu Flamengo.
delgadomaite,Tue Oct 11 01:45:33 +0000 2011,123574928346853376,1672627,471,196,19,has_no_media,Qué sabroso es el paso del tiempo  cuando aprendes que en la vida cada piedra en el camino tiene un maravilloso por qué!
todobailando,Tue Oct 11 01:45:33 +0000 2011,123574927780614144,436,31,0,0,has_no_media,Bailando 2011: El martes no estara Showmatch: Novedades sobre Bailando por un sueño 2011 esta semana.  Ver nota http://t.co/VM8Yi4s0
missA_suzy,Tue Oct 11 01:43:57 +0000 2011,123574523814612992,3448411,90,249,194,has_no_media,히히히히 폭풍인증3333 감사해요 여러분!! http://t.co/LlSejKzT
lovelikah,Tue Oct 11 01:43:20 +0000 2011,123574372291194880,13478,5819,67,1,has_no_media,RT If You listen to Chris Brown   Lil Wayne   Wale   Tyga   Drake   Rick Ross   Lil Bossie   Trey Songz  Kayne West   Big Sean EVERYDAY (:
RaulBarranko,Tue Oct 11 01:38:26 +0000 2011,123573138473754624,146,842,0,0,has_no_media,@cynthia_uriastv oye puede mandar pofa un saludo a arturo barranco q nunca se pierde este programa viva el komander
StinkDiesel,Tue Oct 11 01:37:07 +0000 2011,123572806742056960,671,93,0,0,has_no_media,@BadAss_Ferrari Lol Ion Got No Hoes Tho !
felipeneto,Tue Oct 11 01:35:27 +0000 2011,123572387596877824,4928661,572,52,3,has_no_media,Se você é um profissional experiente q consegue vender cocô pra um investidor fazendo ele acreditar q é um bom negócio  ENTRE EM CONTATO!
CarinMB,Tue Oct 11 01:31:26 +0000 2011,123571374999613440,292697,270,615,209,has_no_media,Good times in Brazil - next stop Buenos Aires!! I here you have some sweet leather.
angelicamsx,Sun Oct 09 15:00:06 +0000 2011,123050106948820992,872,144,0,0,has_no_media,@matheuslmd @evelynrivi MANDA SMS PORRA
victoroliveira,Tue Oct 11 01:27:30 +0000 2011,123570385248727040,107142,702,71,2,has_no_media,se a dira paes estivesse fazendo papel de solineuza ela pegaria o bilhete premiado e faria um aviãozinho
chachigonzales,Tue Oct 11 01:27:13 +0000 2011,123570315287732224,819949,1988,46,10,has_no_media,Stay strong @TheMinnyGang you are in our prayers! Love u!
ramonbautista,Tue Oct 11 01:24:13 +0000 2011,123569560975708160,2473922,1405,259,41,has_no_media,ituloy mo lang pagiging magaling mo today
besthpquotes,Sun Oct 09 15:00:45 +0000 2011,123050271516536832,2466,531,68,7,has_no_media,Congratulations to Rupert Grint for winning the Best British Actor award! Well deserved!
MrRoymer,Tue Oct 11 01:22:59 +0000 2011,123569249800294400,19505,8745,132,36,has_no_media,Si nunca te arriesgas a perder nunca te das la oportunidad de ganar.
RomanGuerra10,Tue Oct 11 01:21:15 +0000 2011,123568811654905856,293,625,0,0,has_no_media,Hay gente que vive de la historia  y nosotros como todo ser humano tenemos 24 horas para hacer y vivir nuestra propia historia!
PTI,Tue Oct 11 01:14:36 +0000 2011,123567139994079232,1094326,243,94,1,has_no_media,Okay  this game has just about become unwatchable.
AndreaRussett,Sun Oct 09 15:04:01 +0000 2011,123051092589285376,2315167,9898,57,8,has_no_media,I wake up soo confused.
SojiGotIt,Tue Oct 11 01:06:00 +0000 2011,123564974084853760,1635,974,0,0,has_no_media,@FLEpayton I did Scolla's "Gimme A Sign" too if you didn't know lol... But anyway  thanks! Really appreciate it.
PiscesAreUs,Tue Oct 11 01:03:06 +0000 2011,123564245647507456,336562,148078,344,51,has_no_media,They'll kiss on your neck  but Pisces will love when you kiss theirs :)
TeenThings,Tue Oct 11 01:00:53 +0000 2011,123563686806814720,353467,2303,306,77,has_no_media,"Awwh someone needs a hug" Don't touch me!
soufoda__,Sun Oct 09 15:04:34 +0000 2011,123051233517903872,49075,351,217,2,has_no_media,domingo com gosto de eu não devia ter acordado
RamDanielle,Tue Oct 11 00:59:08 +0000 2011,123563247155675136,30060,419,201,51,has_no_media,watching a romantic movie and getting pissed off about your non-existent love life.
CollegeBoi_B,Tue Oct 11 00:57:45 +0000 2011,123562897749188608,112187,342,68,6,has_no_media,Sometimes all a girl needs is THAT guy to tell her she's beautiful and hug her like he's always gonna be there.
wymmtimmee4,Tue Oct 11 00:54:38 +0000 2011,123562113611481088,1002,597,0,0,has_no_media,The only thing detroits been able to cheer for happily lately was baseball
AYYSIAN,Tue Oct 11 00:54:05 +0000 2011,123561976898134016,360200,48655,1065,296,has_no_media,Hi. I'm a teenager & I speak 3 languages: English  Sarcasm  & Swearing.
AYEEEITSCHUCKIE,Tue Oct 11 00:53:12 +0000 2011,123561754235109376,435752,1025,277,40,has_no_media,I see right through you. Bullshit and all
RamDanielle,Tue Oct 11 00:47:10 +0000 2011,123560237377667072,30060,419,89,14,has_no_media,I'm a sucker for blue eyes ♥
vickzri,Tue Oct 11 00:40:58 +0000 2011,123558676509368320,1538,32,1,0,has_no_media,se ta querendo eu eu tbm to te querendo.. ♪   @laryhmaia   haha ;99
TheHamadi,Tue Oct 11 00:34:30 +0000 2011,123557048200859648,2371,52,534,0,has_no_media,RT @FreddyAmazin: When you’re laughing So hard you think you might die.
CaioFAbreuCitou,Tue Oct 11 00:32:01 +0000 2011,123556423190847488,960699,89,1081,86,has_no_media,As vezes sinto falta  as vezes acho que é um alívio estar longe.
Marmol1234,Tue Oct 11 00:27:03 +0000 2011,123555174156476416,54,280,38,0,has_no_media,RT @washingtonpost: Herman Cain  former astronaut Mark Kelly up for Mustached American of the Year award: http://t.co/ceQSGojN
AussieGrit,Tue Oct 11 00:21:20 +0000 2011,123553736172900352,1203040,257,121,83,has_no_media,Baseball night! http://t.co/pqQhwQYV
RACKEDup_Lawry,Tue Oct 11 00:14:10 +0000 2011,123551932869648384,1444,448,0,0,has_no_media,@Blue_eyedBeauti maybe.. Depend on how much you talkin bout..
Edgar_Allan_Poe,Tue Oct 11 00:14:08 +0000 2011,123551923642171392,112261,1095,97,23,has_no_media,On occasion a stiletto slipped between the ribs is more advantageous than an exclamation point.
ZachAllStar,Tue Oct 11 00:11:15 +0000 2011,123551196685406208,62652,178,69,56,has_video,Hahahaha this is hilarious! Great job guys :) http://t.co/jPl22x1Y
The_Gospels,Tue Oct 11 00:07:04 +0000 2011,123550142451302400,908294,29,611,126,has_no_media,Jesus looked at them and said  "With man this is impossible  but with God all things are possible." - Matthew 19:26
jumblejim,Tue Oct 11 00:06:30 +0000 2011,123550003611439104,816468,703,55,43,has_no_media,@jarpad Oh  sorry  bro.  Won't do it again.  ;-)  Seriously--having fun in Toronto?  Or are you back?
copoplastico,Tue Oct 11 00:00:44 +0000 2011,123548550440288256,40191,575,59,3,has_no_media,queria ser famoso só pra dizer ''to com uns projetos aí e to atacando de DJ''
nao_bee,Mon Oct 10 23:55:36 +0000 2011,123547258934407168,489,349,0,0,has_no_media,@Miyumiyu0828 おはようございます。デカっ！微妙にブサ...あ、いやっ(^^;
jalenmpatrick,Mon Oct 10 23:53:31 +0000 2011,123546735736913920,6012,1422,187,1,has_no_media,RETWEET if you love your mom !
bieberpamonha,Mon Oct 10 23:48:25 +0000 2011,123545449079652352,16171,1546,105,3,has_no_media,''os apostos se atraem'' hum  justin é rico e eu pobre  ele é bonito e eu feia. SOMOS ALMAS GEMEAS
patriamea,Mon Oct 10 23:47:38 +0000 2011,123545252257742848,876970,26889,214,4,has_no_media,최종호소! 오늘 11일(화)이 서울시장보궐선거 부재자투표 신고마감일. 18시까지 서류가 동사무소 도착해야 함. 직접서류를 우체국에 가져가면 처리해줍니다. 한표가 귀중합니다. http://t.co/itJ5mXI9
thayanacabrall,Mon Oct 10 23:40:58 +0000 2011,123543574804570112,120,470,0,0,has_no_media,@thamara159 Voooo :) vamo vamoo  é o ultimoo shooow  tem que se despediiir delees :D
actorbrianwhite,Sun Oct 09 15:13:25 +0000 2011,123053458294194176,170756,2141,182,40,has_no_media,What God intended for you goes far beyond anything you can imagine. - Oprah
RomeoandJuLlet,Mon Oct 10 23:35:15 +0000 2011,123542135457857536,80719,15,80,25,has_no_media,I still get those stupid butterflies every time I see you.
afrasedebebada,Mon Oct 10 23:34:21 +0000 2011,123541912660606976,662593,7,448,4,has_no_media,Momentos não voltam  mas lembranças permanecem.
garettnelson,Mon Oct 10 23:30:40 +0000 2011,123540982481432576,1039282,247787,233,82,has_no_media,Female: What do you want to be when you grow up? Male: Your husband. &lt;3
denisanfh,Mon Oct 10 23:30:25 +0000 2011,123540920233766912,392,233,0,0,has_no_media,Km ness marukanna ucul RT @inezhottest: marukana alus eta ih ya ampun
JaredLeto,Mon Oct 10 23:30:18 +0000 2011,123540889871192064,2294982,90,222,79,has_no_media,AMAZING "@EchelonChile: @30SECONDSTOMARS @jaredleto @SHANNONLETO @thisisthehive Human Triad in Mapocho River http://t.co/9N0Mb19M"
andreaabrum,Mon Oct 10 23:27:35 +0000 2011,123540207621517312,547,872,0,0,has_no_media,baa  tava me lembrando que amanhã quando eu for leva a belly na escolinha vo te que leva 2 refri de 2 litros  aaah
mashable,Sun Oct 09 15:15:04 +0000 2011,123053874222333952,7180854,2837,127,129,has_no_media,Facebook Timeline: 10 Stunning Designs [PICS] - http://t.co/yAFXL8yv
alexfriass,Mon Oct 10 23:23:32 +0000 2011,123539190746054656,42119,530,1073,513,has_no_media,Día mundial de se quieren y no son novios.
AleVallees,Mon Oct 10 23:23:11 +0000 2011,123539099259908096,688,246,0,0,has_no_media,@MeryEvia No hihih:33
CollegeBoi_B,Mon Oct 10 23:20:20 +0000 2011,123538383288020992,112187,342,56,5,has_no_media,I don't care how attractive you THINK you are - your personality makes you ugly.
_DiegoReyesA,Mon Oct 10 23:07:55 +0000 2011,123535257763971072,243,221,2,0,has_no_media,@CaradecoCollins el mas traidor puede que lo tengas de frente bebiendo tus frias o comiendo tu cena caliente!
TupacLyrics,Mon Oct 10 23:06:12 +0000 2011,123534826396594176,139586,5,112,10,has_no_media,Feel the fire of my mother's corrupted seed. Tupac
HomerJSimpson,Mon Oct 10 23:00:24 +0000 2011,123533366770417664,2268699,17,277,30,has_no_media,When Columbus discovered it  it was the New World.  Now it’s old and has bad hips.
