Nyarlath_Limit,Sat Oct 08 16:57:20 +0000 2011,122717222937427968,140,176,0,0,has_no_media,@SplayingS 킼킼
stedymarconi,Sat Oct 08 16:58:23 +0000 2011,122717485010141184,213,22,0,0,has_no_media,Preciso tirar esses coreanos da minha cabeça  viu... -.-"
TreySongz,Sat Oct 08 16:58:39 +0000 2011,122717552748142592,9918051,3629,137,16,has_no_media,Free haircuts for kids under 18 at RazorSharp on Bollingbrooke St in da burg 3pm-6pm
Fuad_Alhashem,Sat Oct 08 16:58:53 +0000 2011,122717612126904320,265260,16,75,7,has_no_media,ستيفي وندر مطرب امريكي افريقي واعمي وشعره طويل والشيخ احمد الفهد يقلده في طول شعره اتمني علي بوفهد ان لايقلده ايضا في عماه !!!
CaioFAbreuCitou,Sat Oct 08 17:00:02 +0000 2011,122717904058855424,960683,89,314,30,has_no_media,Não adianta  sei que essa doença não é do corpo.
OMGFactsSex,Sat Oct 08 17:00:26 +0000 2011,122718002553696256,412076,12,834,142,has_no_media,Boys get jealous it's cute. But when girls get jealous. it's world war 3.
JonahHill,Sat Oct 08 17:02:50 +0000 2011,122718608173432832,4979241,6,322,53,has_no_media,If your doctor dies  you should immediately fire him  because he's obviously not good at his job. (22 days til ALLEN GREGORY!)
allkpop,Sat Oct 08 17:04:20 +0000 2011,122718984016625664,2729327,432,78,32,has_no_media,Goo Hara says it’s hard for her to gain weight http://t.co/UoMNJYMW
ginachoi87,Sat Oct 08 17:04:46 +0000 2011,122719093970305024,578388,293,89,65,has_no_media,Me and leaderrr Nam to da G ~  나랑 리더 남 투더 지지지~  줄 서있는데도 열심히 "천번의 입맞춤" 대본 보고있다.. 멋져멋져!!  주말 연속극 본방사수!♥   http://t.co/9KR2pv1b
__iAmYourLEADER,Sat Oct 08 17:05:16 +0000 2011,122719217123471360,603,681,0,0,has_no_media,????
ZooeyDeschanel,Sat Oct 08 17:05:23 +0000 2011,122719249239248896,6891252,592,228,87,has_no_media,There's a fight between 2 leaf blowers outside my window. Which one will win: the loud one or the other loud one?
newbr33d,Sat Oct 08 17:14:00 +0000 2011,122721418654908416,419,404,0,0,has_no_media,@Ms_AlishaP let me know the info
jochemfloor,Sat Oct 08 17:15:31 +0000 2011,122721800462405632,523,1634,122,0,has_no_media,RT @ggreenwald: Ex-LAPD DepChief:"damage that came from prohibition of alcohol pales in comparison to harm wrought by drug prohibition"  ...
MWilsonNYT,Sat Oct 08 17:16:10 +0000 2011,122721962127659008,2925,653,164,49,has_no_media,Those Chinatown buses from NYC to Boston and beyond kept prices low through old fashioned hustle. Oh  and guns. Story: http://t.co/W25jQoNl
Paginas365,Sat Oct 08 17:20:12 +0000 2011,122722976620756992,187046,7,238,16,has_no_media,"Às vezes tenho ódio de viver  mas tenho medo de morrer." (Bang Bang! Você Morreu)
nate_robinson,Sat Oct 08 17:22:05 +0000 2011,122723451453714432,1061447,1950,96,11,has_no_media,I'm so fly I need feathers
WordsOf_Emotion,Sat Oct 08 17:28:03 +0000 2011,122724953425584128,525302,111821,235,33,has_no_media,I miss us
ThunderNMay,Sat Oct 08 17:31:11 +0000 2011,122725740146999296,92,101,0,0,has_no_media,@IhtzMeBre the dinner is before 4 and 5
brasiliadepre,Sat Oct 08 17:38:55 +0000 2011,122727687805603840,4617,555,54,1,has_no_media,Sabadão  você sem fazer nada e pior.. Em brasília.
ufc,Sat Oct 08 17:39:56 +0000 2011,122727943947567104,3963312,20213,147,5,has_no_media,Your new cover of UFC Undisputed 3! http://t.co/86RVNYfd
SuperSportBlitz,Sat Oct 08 17:41:01 +0000 2011,122728214358532096,976068,244,92,1,has_no_media,Bafana Bafana DO NOT qualify for the African Cup of Nations  Niger go through based on a better head to head record between the 3 teams.
AmerAlShaibani,Sat Oct 08 17:41:57 +0000 2011,122728450808233984,36711,394,78,5,has_no_media,الرجل العادي عندما يرى حبيبته أنيقة يقول لها: أنتي جميلة،الرجل المثالي: يقول لها أنتي أجمل إمرأة بالكون،الرجل الكويتي: روحي غيري هدومچ بسرعة
mishacollins,Sat Oct 08 17:43:21 +0000 2011,122728804341919744,2407040,68,3240,1537,has_no_media,Спасибо. я тебя люблю всех.
mafgood,Sat Oct 08 17:45:00 +0000 2011,122729218323918848,4362,21,83,0,has_no_media,اهل مكه او المتواجدين حاليا بالحرم   هذا الشخص فاقد للذاكره الرجاء اي شخص يقابله  يتصل على هذا الرقم  ٠٥٠١٢٢٢٢٠٥     http://t.co/k4RF1o5H
PerfectIyQuoted,Sat Oct 08 17:53:00 +0000 2011,122731231497564160,1043678,199,430,69,has_no_media,"You break it  you pay it." Fuck no  I break it  leave it there & awkwardly run away.
BDJSports,Sat Oct 08 18:01:07 +0000 2011,122733272471048192,244,711,0,0,has_no_media,@Helena_Boada hope you're enjoying London! Let's bring some british teams to #EuroValencia2011! ;)
TerrellePryor,Sat Oct 08 18:01:58 +0000 2011,122733488876167168,132291,503,294,12,has_no_media,Just Win baby--Al Davis
allkpop,Sat Oct 08 18:04:19 +0000 2011,122734081254490112,2729327,432,191,40,has_no_media,SECRET to go head to head against SNSD with ‘Sexy Black’ concept http://t.co/c8VcFJwN
RealDjKayslay,Fri Oct 14 23:46:51 +0000 2011,124994609209286656,367883,1721,49,3,has_no_media,I Don't care what position a nigga is in  if he disrespectful or obnoxious shit on them! They can't block ya blessings only GOD can!
SnoopDogg,Fri Oct 14 23:44:59 +0000 2011,124994139459829760,14183722,2640,75,21,has_no_media,got nominated for tha "must follow artist on twitter" for MTV's online music awards! vote here: http://t.co/jBcjsngq
psicodelico,Fri Oct 14 23:41:50 +0000 2011,124993345285128192,20454,560,82,0,has_no_media,CENTRO DA TERRA JURASSIK PARK ROBÔS ACHO QUE O BOB MARLEY PASSOU PELA NOVELA
sickipediabot,Fri Oct 14 23:38:43 +0000 2011,124992559931076608,423992,0,158,28,has_no_media,All those in favour of banning jockeys from whipping their horses say aye. Those against  say neigh.
iamdiddy,Sat Oct 08 18:06:01 +0000 2011,122734508838625280,11559910,1806,371,42,has_no_media,I got soul and I'm super Bad.
JasperDolphin,Sat Oct 08 18:06:38 +0000 2011,122734664434712576,355939,405,481,109,has_no_media,I Wanna Do A Song With @Mileycyrus Then Eat Her Out While She Rolls My Blunt.
JustMrMonopoly,Sat Oct 08 18:08:46 +0000 2011,122735200512909312,100152,39178,234,19,has_no_media,You're a true 90's kid if you've ever heard someone say  "Get off the phone  I need to use the internet."
trillchel,Fri Oct 14 23:22:43 +0000 2011,124988533793492992,757,487,0,0,has_no_media,@theonlydwhite when??
sasakitoshinao,Fri Oct 14 23:17:08 +0000 2011,124987127846014976,527587,21527,50,123,has_no_media,クチコミ経由の縁故採用は転職者全体の23％。この縁故をネットの縁に変えていこうという新しい可能性。面白い。／縁故採用2.0の逆襲をどう活かすか？  http://t.co/lRw4TZi5
1988_GLAYER,Fri Oct 14 23:16:33 +0000 2011,124986984673456128,197,191,0,0,has_no_media,@KaoRi54G かおりちゃんおはよー(´―｀*)TERUさんパワーでお仕事がんばろうね󾍇󾠓
MrHarryDerbidge,Sat Oct 08 18:12:56 +0000 2011,122736247989997568,437206,5250,150,9,has_no_media,I'm actually loving @CherLloyd 's new song! X
rudynalvasoares,Fri Oct 14 23:07:07 +0000 2011,124984607836880896,2856,3001,0,0,has_no_media,Comunidade Resenhas Literárias: ''UM SONHO A MAIS" - NANDA MEIRELES http://t.co/rhHBLNny
felipeneto,Sat Oct 08 18:14:27 +0000 2011,122736631148068864,4928305,572,65,1,has_no_media,"Deseja instalar as atualizações e reiniciar o computador?" - Alguém clica em "sim"?
Catrafrases,Fri Oct 14 23:02:28 +0000 2011,124983437147897856,1198420,407,637,21,has_no_media,Quem insiste em te criticar  faria de tudo para estar no seu lugar.
AndyMilonakis,Fri Oct 14 23:00:54 +0000 2011,124983046205222912,469509,799,86,13,has_no_media,Gourmet Fat Boys &gt; Four Gay Frat Boys.
NJTRANSIT_NEC,Fri Oct 14 22:59:07 +0000 2011,124982595556605952,8992,0,0,0,has_no_media,Trains are now departing NYPS on or close to schedule.
mylifesayings,Fri Oct 14 22:58:10 +0000 2011,124982354715492352,92516,143,102,39,has_no_media,If something's bound to happen  it will happen.. Right time  right person  and for the best reason.
GirlBible,Fri Oct 14 22:57:01 +0000 2011,124982066751348736,129992,65,94,25,has_no_media,Create an environment that motivates YOU. It will push you alot faster toward your goals.
reuben_morgan,Fri Oct 14 22:55:54 +0000 2011,124981788048240640,77325,149,122,59,has_no_media,You can count on it&gt;&gt; Gods plans for you are way bigger than what you might be thinking right now!!!
travismills,Fri Oct 14 22:50:51 +0000 2011,124980516565942272,312841,1050,107,12,has_no_media,This shit is beautiful
LoveQuotes,Sat Oct 08 18:19:39 +0000 2011,122737938269339648,1766800,92,284,129,has_no_media,There's a story behind every person. There's a reason why they're the way they are. Think about that before you judge someone.
BIRDMAN5STAR,Fri Oct 14 22:42:56 +0000 2011,124978522455416832,2371625,434,202,25,has_no_media,Luvu BARBiE.YMCMB. Y.U.MAD.
VersosFrases,Fri Oct 14 22:37:16 +0000 2011,124977095242825728,474600,22,139,11,has_no_media,Não importa o que as pessoas dizem sobre você. Elas continuaram falando mesmo que você faça a coisa certa ou errada. Só seja você mesmo.
_Snape_,Fri Oct 14 22:35:48 +0000 2011,124976729608564736,1369692,394,84,38,has_no_media,Hamlet takes emo to a whole new level. Even more emo than Potter in a cupboard under the stairs.. Check it out.. http://t.co/aneHEwgY - spon
washingtonpost,Fri Oct 14 22:14:17 +0000 2011,124971312631390208,6616064,1286,67,10,has_no_media,Rep. Eric Cantor has been removed from his local Republican committee in Virginia: http://t.co/lbN6S0eZ
FellipheAlmeida,Fri Oct 14 22:13:32 +0000 2011,124971123044651008,102134,6400,68,3,has_no_media,'Há uma história por trás de cada pessoa. Há uma razão pela qual elas são do jeito que são  então não julgue
jimenaofficial,Fri Oct 14 22:06:00 +0000 2011,124969228196515840,1380593,2172,86,9,has_no_media,Quien es Bisogno para hablar mal de Espinoza Paz? un gordo que se aplasta a criticar en tv....
PaathyCastro,Fri Oct 14 22:03:57 +0000 2011,124968713547030528,97,61,1178,0,has_no_media,RT @SignosFodas: #Capricórnio 5° Fato: Quando eu amo  eu amo mesmo.
TheIlIuminati,Sat Oct 08 18:28:36 +0000 2011,122740188886740992,253478,94,371,52,has_no_media,Twitter is like a fridge. When you’re bored you keep opening and closing it every few minutes to see if there’s anything good in it.
skr2323,Fri Oct 14 22:00:17 +0000 2011,124967789357305856,234,191,0,0,has_no_media,-dream as if you live forever  live as if you'll die today! James Dean
Legendarios,Sat Oct 08 18:32:22 +0000 2011,122741138611380224,9101033,49,81,6,has_no_media,Hoje tem  @ClaudiaLeitte no Legendários!  http://t.co/8BQRdsWw
palshabab2,Fri Oct 14 21:58:39 +0000 2011,124967380244893696,319,1601,0,0,has_no_media,http://t.co/yVq6Xpun
rairojasii,Fri Oct 14 21:55:34 +0000 2011,124966603107479552,3863,3918,0,0,has_no_media,@HermanHermanos can't send you DM dude  FOLLOW ME coño LOL
aagym,Fri Oct 14 21:49:57 +0000 2011,124965187433402368,1789102,16,165,37,has_no_media,Allah Maha Baik selalu menuntun kita kembali kepadaNya walau kita tak henti henti berbuat maksiat dan melupakanNya
bad_cheerry,Fri Oct 14 21:45:31 +0000 2011,124964072679677952,22,20,0,0,has_no_media,Photo: › não quero sofrer  então não me iluda. › › (☠@diario-de-uma-rockeira☠) http://t.co/3vKo9dgB
Drake,Fri Oct 14 21:40:16 +0000 2011,124962751939485696,33025564,641,579,722,has_no_media,@EllenPage I'm so proud of you.
Drake,Fri Oct 14 21:33:56 +0000 2011,124961158749880320,33025564,641,241,327,has_no_media,@venusxGG I'm so proud of you.
WeirdHorse,Fri Oct 14 21:32:21 +0000 2011,124960759330508800,152849,7,58,10,has_no_media,Just burped onto a spider and it died
mo_ferraz,Fri Oct 14 21:30:57 +0000 2011,124960406727962624,237,126,0,0,has_no_media,@barbarababller Dênis o pimentinha
TheIlIuminati,Fri Oct 14 21:18:42 +0000 2011,124957325017620480,253479,94,316,60,has_no_media,*Pssst* .....is that a guy or a girl? o_O
mashable,Fri Oct 14 21:18:16 +0000 2011,124957216343203840,7180026,2837,122,46,has_no_media,“The Muppets” New Trailer Reveals Epic Plot of Awesome [VIDEO] - http://t.co/brUDYWsH
WomenLoveBrickz,Fri Oct 14 21:11:35 +0000 2011,124955533630377984,361673,370229,299,73,has_no_media,A second chance doesn't mean anything if you haven't learned from your first mistake.
AYYSIAN,Fri Oct 14 21:11:21 +0000 2011,124955473437933568,360203,48656,1489,254,has_no_media,That moment when you do a MATH problem and your answer isn't even one of the choices -___-
SimplyChri5tian,Fri Oct 14 21:10:35 +0000 2011,124955280248274944,2144515,30003,359,74,has_no_media,@TraceCyrus Really? Nah man never got it. Let me check with the office ... Can't wait!!!  Oh and CONGRATS to you and Brenda!!!!!
retwet_etha,Sat Oct 08 18:42:12 +0000 2011,122743614198661120,12959,159,60,3,has_no_media,هذي صورة آخر أيام ستيف جوبز بعد إنهيار حالته  الصحيه .. بسبب سرطان البنكرياس   http://t.co/jvPkC9VI
LuisChataing,Fri Oct 14 21:00:12 +0000 2011,124952670103535616,4168118,152,62,1,has_no_media,Blackberry compensará a sus usuarios agregando un botón adicional al teclado que servirá para ordenar room service.
xcaoimhe_,Fri Oct 14 20:58:23 +0000 2011,124952213020868608,1529,1815,0,0,has_no_media,@leahoneillx3 I don't think there's been any more leaked :/ but we only have to wait another month to listen to the whole thing :') xxx
ApenasSaudades,Sat Oct 08 18:45:38 +0000 2011,122744478082670592,368823,39,130,7,has_no_media,Nos meus sonhos  sou a pessoa mais feliz do mundo  mais amada  e menos iludida  que pena que tudo acaba quando abrimos os olhos.
Vol_Football,Sat Oct 08 18:46:16 +0000 2011,122744637038399488,284356,794,64,3,has_no_media,Same old genes  brand new pants...The Rock at its finest:  http://t.co/63r56VB0
spritediet,Fri Oct 14 20:52:43 +0000 2011,124950785011355648,26231,126,91,9,has_no_media,http://t.co/I0JXFcXx &lt; EU
TIME,Fri Oct 14 20:50:06 +0000 2011,124950126694367232,10838907,843,62,3,has_no_media,RT @marypols: Starting to think of Occupy Wall Street as sort of a Green Tea Party.
spireli,Fri Oct 14 20:47:52 +0000 2011,124949563952992256,116316,414,86,13,has_no_media,Hay dos tipos de risa  la que te provoca alguien que te gusta y las demás.
AYEEEITSCHUCKIE,Fri Oct 14 20:38:07 +0000 2011,124947113577676800,435759,1026,122,4,has_no_media,getting homework on weekends &lt;
Judgenap,Sat Oct 08 18:48:41 +0000 2011,122745244872744960,357748,1052,166,21,has_no_media,We have only one party. That is the big government party. It has a Democrat wing that enjoys welfare and a Republican wing that likes war.
Mbd3onKSA,Fri Oct 14 20:36:13 +0000 2011,124946635120840704,354849,293261,93,0,has_no_media,ريتويت اذا لمن يدخل وقت الصلاة ما ترتاح الا لمن تصلي
Mbd3onKSA,Fri Oct 14 20:34:02 +0000 2011,124946083485978624,354849,293261,55,0,has_no_media,ريتويت اذا متفائل باسبوع مثمر !
MensHumor,Fri Oct 14 20:30:15 +0000 2011,124945133442572288,3608461,232,396,65,has_no_media,Does banging a girl in your room with the door locked count as safe sex?
kellyoxford,Fri Oct 14 20:29:47 +0000 2011,124945014546640896,630254,965,241,236,has_no_media,I'd like a video montage of every time I'm talking to someone and not making eye contact and they turn around to see what I'm looking at.
KevinHart4real,Fri Oct 14 20:25:55 +0000 2011,124944040159490048,29901767,538,160,10,has_no_media,I just touched down ROCHESTER NY  it's going down 2night @ "RIT" I'm about 2 smack y'all in the face with a brand new hour of MATERIAL
mishacollins,Fri Oct 14 20:23:18 +0000 2011,124943383109173248,2407057,68,838,916,has_no_media,Honestly  I just hope the antlers don't  snag on the way out.
FemaIeTxts,Fri Oct 14 20:23:03 +0000 2011,124943318705635328,835122,606153,401,67,has_no_media,I'm not going to sit around  chase after you  give you all my attention  when you're out giving someone else your attention..no
Mariespiga,Fri Oct 14 20:19:29 +0000 2011,124942420575133696,222,316,0,0,has_no_media,Paso con los viejitos verdes LOL
tribecalledMEZZ,Fri Oct 14 20:17:07 +0000 2011,124941826208698368,577,404,0,0,has_no_media,What it dew nephew? Haha
ApenasSaudades,Fri Oct 14 20:13:01 +0000 2011,124940793612996608,368823,39,173,12,has_no_media,Queria poder ser um livro  para que quando acontesse alguma coisa ruim era só arrancar a página.
lmpuIsive,Fri Oct 14 20:10:58 +0000 2011,124940279122890752,205503,137854,275,41,has_no_media,That fucked up moment when you pretend to be on your phone to ignore someone..and then that muthafucka rings...
Mbd3onKSA,Fri Oct 14 20:03:12 +0000 2011,124938326103961600,354849,293261,86,0,has_no_media,“@NoufHussain: ريتويت إذا انت تسوي ريتويت كثير
okcookiepants,Fri Oct 14 19:55:56 +0000 2011,124936494715633664,474,665,0,0,has_no_media,Remarkably  I look more awkward in my new license photo than in my last one. It's almost like this was my goal.
TravisPorter,Fri Oct 14 19:51:52 +0000 2011,124935470818930688,492380,4558,79,2,has_no_media,Real gentalman... fuck n never call again
Aiannucci,Fri Oct 14 19:48:41 +0000 2011,124934670843527168,491533,539,258,16,has_no_media,Just catching up on the news in the UK. Is the Government actually drunk?
The_Gospels,Fri Oct 14 19:48:31 +0000 2011,124934628594298880,908225,29,91,40,has_no_media,I have faith that God is living out a divine plan through me. Have faith in God. - Mark 11:22
RealSkipBayless,Fri Oct 14 19:46:39 +0000 2011,124934157724958720,1909623,0,94,3,has_no_media,Cowboys getting healthier off bye  NE coming off emotional  physical rivalry. Boys will move ball at will vs. NE D. Rob/Rex will slow Brady.
girlposts,Sat Oct 08 19:00:27 +0000 2011,122748207582294016,6210112,74324,803,297,has_no_media,Find a heart that will love you at your worst and arms that will hold you at your weakest.
MisterBombillo,Sat Oct 08 19:00:30 +0000 2011,122748218617503744,574043,242766,144,24,has_no_media,Una relación la empiezan 2 y la terminan 3.
samjones999,Fri Oct 14 19:38:19 +0000 2011,124932064435896320,95,441,0,0,has_no_media,Khan 1 clear at Portugal Masters: Khan finished 36 holes at 13-under 131 and is one stroke clear at Oceanico Vic... http://t.co/W6SoORp9
CraveMyThoughts,Sat Oct 08 19:02:06 +0000 2011,122748622117937152,1985992,39773,262,83,has_no_media,I make mistakes  & gain from them on my own. Experienceis my best teacher. Always was  always will be.
girlposts,Fri Oct 14 19:31:29 +0000 2011,124930344989360128,6210112,74324,880,185,has_no_media,That awkward moment when you hand someone your phone to show them one picture & then they start scrolling through the rest without asking.
Maitre_Eolas,Fri Oct 14 19:31:28 +0000 2011,124930339247362048,213398,462,172,21,has_no_media,Un officier du NYPD reconnait que sa police planquait de la drogue sur des innocents pour faire les chiffres demandés http://t.co/mLZnUhhj
MouridBarghouti,Fri Oct 14 19:29:53 +0000 2011,124929939358228480,375485,138,65,8,has_no_media,عمر بن الخطاب كان يحمل هم معزة عثرت بالعراق وبيننا اليوم من يرفض التعاطف مع أم قتلوا ابنها وعمره 19 سنة
koffboy,Fri Oct 14 19:28:08 +0000 2011,124929500394946560,1090054,9,149,49,has_no_media,Пассажиры поезда Москва-Одесса поняли  что что-то пошло не так  когда по вагону с напряжённым лицом прошёл Стивен Сигал.
BlairVadia,Fri Oct 14 19:10:57 +0000 2011,124925173429313536,118605,6,107,10,has_no_media,Erro tweets do mesmo jeito que erro em escolher o cara certo.
BrianStann,Fri Oct 14 19:10:56 +0000 2011,124925172057772032,161862,294,50,10,has_no_media,Huge news today for my charity  awarded a $150k grant from Prudential to help veterans find jobs  so proud of our team @hireheroesusa
relatosotarios,Fri Oct 14 19:07:54 +0000 2011,124924408170160128,13624,359,66,2,has_no_media,"Ninguém tem o direito de me julgar a não ser eu mesmo." (Raul Seixas)
HuffingtonPost,Fri Oct 14 19:07:06 +0000 2011,124924207632097280,7144074,5681,88,20,has_no_media,Google kills failed social network http://t.co/ndcVYjeP
simon_price01,Fri Oct 14 19:06:18 +0000 2011,124924005407928320,19494,3660,49,5,has_no_media,BREAKING NEWS: The Stone Roses to reform! Brand new album expected in 2019.
yoyoha,Fri Oct 14 19:04:54 +0000 2011,124923653417742336,72116,997,59,136,has_no_media,"Well  there's no point in starting that now." - Friday  3pm
UGGLYTRUTH,Fri Oct 14 19:04:07 +0000 2011,124923454897143808,1881428,55,800,170,has_no_media,¿Para que seguir si sabes que no te hace feliz?
OMGFactsSex,Fri Oct 14 19:00:49 +0000 2011,124922625305743360,412072,12,442,70,has_no_media,turn down the music when I drive so I can see better. (by @dc2you)
GirlNotes,Fri Oct 14 19:00:19 +0000 2011,124922499321430016,1846766,11586,189,68,has_no_media,You don't have to attend every argument you're invited to ♥
Rene,Fri Oct 14 18:58:15 +0000 2011,124921980964192256,869994,85044,980,174,has_no_media,Someone needs to invent a mirror that takes pictures.
JASMINEVILLEGAS,Fri Oct 14 18:56:42 +0000 2011,124921590688395264,1674853,23913,88,11,has_no_media,http://t.co/q5yeCYo4 :)
thinkprogress,Fri Oct 14 18:53:39 +0000 2011,124920819985027072,479909,977,59,8,has_no_media,Hard news this afternoon on Fox  http://t.co/jT1SyWWx
NipseyHussle,Fri Oct 14 18:52:02 +0000 2011,124920415591215104,622513,2546,83,2,has_no_media,Send one up foe tha hommie @rickyrozay
Maratona_IS,Fri Oct 14 18:48:09 +0000 2011,124919438511308800,1417,269,0,0,has_no_media,@ISAmrVerdadeiro Me ajuda a conhecer a Ivete?
girlposts,Fri Oct 14 18:46:01 +0000 2011,124918900667334656,6210114,74324,481,152,has_no_media,Life never stops pushing forward. Stay focused and never slow down with regrets. Smile  forgive  forget  and keep moving!
SwagZinnetjes,Fri Oct 14 18:43:41 +0000 2011,124918313145991168,184321,132,66,2,has_no_media,Je computer!̸̶͚͖͖̩̻̩̗͍̮̙̈͊͛̈͒̍̐ͣͩ̋ͨ̓̊̌̈̊́̚͝͠ͅ ̷̧̢̛͖̤̟̺̫̗͚̗͖ͪ̏̔̔̒́ͥ̓ͫ̀ͤ̇ͥ͝ ̡̊͛̇ ͫ̉ͦ̊̀̔ͧͮ͆̽ͦͩ͋̌͗̚̚҉̵͖̟͙̮͈̼̹̞͝ͅheeft aids
RealCavalliBoss,Fri Oct 14 18:41:20 +0000 2011,124917722671874048,292325,27400,114,6,has_no_media,Without Facebook I wouldn't remember some of my friends birthdays.
teracarissa,Fri Oct 14 18:34:11 +0000 2011,124915924070445056,92238,7427,94,49,has_no_media,God had to cut some ppl away from you because they would have killed you. Throw a party that some ppl walked away!
matty_selley,Sat Oct 08 19:15:11 +0000 2011,122751913417650176,321507,11018,612,42,has_no_media,Basically! ONE DIRECTION. Are the best thing ever to come out of X Factor!!!! And ever will be!
ollyofficial,Fri Oct 14 18:28:56 +0000 2011,124914599781875712,7220301,3078,62,17,has_no_media,Loving dublin!! BIG gig tonight!! All for a fantastic charity...'help a dublin child' everything raised tonight will help sooo many kids!! X
lifehacker,Fri Oct 14 18:27:28 +0000 2011,124914233208078336,3197179,42,60,116,has_no_media,Here's how to get iMessage working seamlessly if you have multiple iOS devices or you share an iTunes account: http://t.co/7dZVDT5C
wizkhalifa,Fri Oct 14 18:23:26 +0000 2011,124913218467532800,26109392,754,1196,106,has_no_media,Snap Your Bongs For Me
Nouriel,Fri Oct 14 18:18:35 +0000 2011,124911997530816512,384012,398,59,10,has_no_media,How to explain gap btw consumr confidence and sales? Maybe income inequality is now at point at which sales are driven by the top 20% of HHs
PerfectIyQuoted,Fri Oct 14 18:16:14 +0000 2011,124911407069270016,1043678,199,289,67,has_no_media,Life is not about how big your problem is  it’s about how smart you deal with it.
JLSOfficial,Sat Oct 08 19:18:30 +0000 2011,122752749942214656,1070881,3769,228,110,has_no_media,I'm floating... literally! Ax
ella_creamydiva,Fri Oct 14 18:10:15 +0000 2011,124909900731121664,401,471,0,0,has_no_media,"@XSTROLOGY: #Taurus is stable  balanced  conservative and good-looking."
DCBROCKLESNAR,Fri Oct 14 18:07:35 +0000 2011,124909229734756352,268175,8,76,23,has_no_media,A glimpse into Steve Austin's future. F5. http://t.co/y5eFO9Gg
aurosan,Fri Oct 14 18:05:47 +0000 2011,124908776712192000,57044,1188,68,7,has_no_media,"The thing about quotes on the Internet is you can not confirm their validity." - Abraham Lincoln
djpaulelstak,Fri Oct 14 18:03:41 +0000 2011,124908245914624000,26626,187,0,0,has_no_media,At the airport heading for Scotland. First a frappuchino java chip and a chocolate cake! #lovestarbucks
garyowencomedy,Fri Oct 14 17:58:15 +0000 2011,124906879213256704,192131,658,168,1,has_no_media,I swear I get all the news from Twitter.  Found out Rick Ross had a seizure & he's OK in less then 5 minutes.
TheComedyHumor,Sat Oct 08 19:22:51 +0000 2011,122753842575196160,2003268,109,424,108,has_no_media,If people could read my mind  I'd get punched in the face a lot.
EuBisbilhotei,Fri Oct 14 17:56:45 +0000 2011,124906500782174208,636936,23491,236,25,has_no_media,Foda-se se não sou bom o bastante para você  quero ser o suficiente para mim.
melfronckowiak,Fri Oct 14 17:55:52 +0000 2011,124906278681190400,1330859,177,1172,345,has_no_media,Cantando Doce Vampiro com a tiru @sophiaabrahao na Van! Pra alegria de quem quer dormir... "Beija minha boca  até me matar... De amooor!"
rustyrockets,Fri Oct 14 17:55:33 +0000 2011,124906199903772672,11978845,286,54,22,has_no_media,Canadian officialdom has been thwarted- I'm coming tomorrow- look at me  http://t.co/ppiS7MaH we'll cure all with love.
elizadoolittle,Fri Oct 14 17:55:30 +0000 2011,124906188071636992,168225,548,66,2,has_no_media,Am at MTV Brazil !
