StopZain,Fri Oct 07 22:14:22 +0000 2011,122434619336429568,888,1838,170,0,has_no_media,هذا الحساب الرسمي لحملة مقاطعة زين اتمنى نشره للتفاعل مع الحملة وسيتم يومياً التذكير بالحملة وبرنامجها ومستجداتها . دعمكم يهمنا. @Alwashi7i
KINGDAJAH,Fri Oct 07 23:16:10 +0000 2011,122450173157847040,886,171,0,0,has_no_media,Imma keep it funkyyyy with yu girl. We aint that cool.
SapGod,Fri Oct 07 23:41:49 +0000 2011,122456625469591552,9161,1070,95,4,has_no_media,I hate admitting I miss people but I love hearing they miss me.
Divinity555,Fri Oct 07 14:00:34 +0000 2011,122310349528645632,592,473,93,26,has_no_media,Don't waste your breath  I don't believe that bullshit.
HeartC0nfessi0n,Fri Oct 07 13:01:15 +0000 2011,122295421430284288,20281,0,101,32,has_no_media,That annoying feeling when you're dying to talk to someone  but you refuse to text them first.
q8_Housewife,Fri Oct 07 22:13:56 +0000 2011,122434507684052992,204,427,59,0,has_no_media,@almatlk80  حملة كلنا قناة وصال  لا لوقف قناة السنه  نطالب باعادة قناة الحق  اذا كنت مؤيد للحمله اضافة الصور + ريتويت http://t.co/zYjFXSV6
sanjiv_chopra,Fri Oct 07 10:03:12 +0000 2011,122250613663858688,20404,5406,119,43,has_no_media,Leaders embrace change.Those who don't have the courage to do so and stay with the status quo  will  fail or at best be mired in mediocrity
chx,Fri Oct 07 22:53:29 +0000 2011,122444464861089792,5997,99,78,18,has_no_media,I have not been a McDonalds fan but this is really really gross (SFW) http://t.co/R0kKnDkN
INABA0926_LA,Fri Oct 07 16:32:14 +0000 2011,122348517971869696,2542,1467,0,0,has_no_media,あー
IFUCK_FACES,Fri Oct 07 21:33:45 +0000 2011,122424395795939328,44348,152,452,33,has_no_media,i'm stubborn   i have too much pride   i'm difficult   i'm mean   but i'm a damn good girlfriend   bestfriend   & w/e else you want me to be
GRINDPAZE,Fri Oct 07 17:00:02 +0000 2011,122355512225439744,338,575,1,0,has_no_media,RT @MonumentalGrind: ALL DAY AND DON&#39;T FORGET THAT SMOKERS PARADISE @GRINDPAZE
Brunafonso_,Fri Oct 07 15:49:23 +0000 2011,122337732881162240,646,219,465,0,has_no_media,RT @Garotalronia: Mãe - 1 palavra  3 letras e 1 sentimento eterno.
BengkelCintaa,Fri Oct 07 10:32:08 +0000 2011,122257893943808000,5269,13,125,14,has_no_media,Dalam cinta  kita butuh pengorbanan waktu  menjaga kepercayaan  tetap setia dan menjaga lisan ‎​☺
BenLudmer,Fri Oct 07 18:31:46 +0000 2011,122378601474686976,39741,2354,141,8,has_no_media,Sem dúvida o inventor do leite moça cremoso aproximou o dia da minha morte
Chariko84,Fri Oct 07 21:07:23 +0000 2011,122417763733086208,3866,33,0,0,has_no_media,@WalterKoopman Thanks
cute1004,Fri Oct 07 17:46:29 +0000 2011,122367203852034048,15603,146,172,8,has_no_media,제 동생이 어제 묻지마 폭행을 목격했답니다. 뒤에서 갑자기 덮치고 여러명이 한명을 순식간에 무차별폭행하고 도망가더랍니다 무리 중엔 여자도있었고... http://dw.am/LikWi
Banderalwhby,Fri Oct 07 19:40:02 +0000 2011,122395781608120320,196,281,51,2,has_no_media,@iFrayan جاك البرد وتورطت في القفازات والايفون ؟ عندنا الحل http://t.co/6LeOUqMf http://t.co/KiDNSOSk
FantaIaranja,Fri Oct 07 15:59:31 +0000 2011,122340286054674432,22608,14,120,4,has_no_media,"__/__/__" = Prova já começou difícil.
UFAlum88,Fri Oct 07 13:23:21 +0000 2011,122300982183989248,45,109,973,143,has_no_media,@SethMacFarlane  http://t.co/b3L2Skqe
hillaryrumball,Fri Oct 07 13:31:31 +0000 2011,122303039381049344,254,237,51,1,has_no_media,@therealtobymac Can u pls help us by retweeting this 4 a Deaf children's camp? We need the $ so badly! http://t.co/VuzHSxLd
MacemMacemTweet,Fri Oct 07 10:22:36 +0000 2011,122255496970387456,2523,95,152,2,has_no_media,Mantan itu buat dikenang? Щ(ºДºщ) gasuka kata" gitu
MacemMacemTweet,Fri Oct 07 10:26:32 +0000 2011,122256488227016704,2523,95,187,3,has_no_media,Pacaran : smsan teruss | LDR : seingetnya | single :gada sms ! HaHa
CaliSwagDstrct,Fri Oct 07 20:40:18 +0000 2011,122410947775184896,78115,1684,124,14,has_no_media,We love the Philippines can't wait to come back
isopixel,Fri Oct 07 07:26:19 +0000 2011,122211135545020416,150483,17741,114,0,has_no_media,@letty_colima Cuente borregos eléctricos...
MacemMacemTweet,Fri Oct 07 10:42:34 +0000 2011,122260521935306752,2523,95,140,2,has_no_media,Cinta itu gatau dmn datang   kapan   dan sm siapa :D
MacemMacemTweet,Fri Oct 07 10:43:42 +0000 2011,122260807844241408,2523,95,83,2,has_no_media,Dan cinta akan musibah karna pengkhianatan :)
MacemMacemTweet,Fri Oct 07 10:42:46 +0000 2011,122260570140442624,2523,95,123,5,has_no_media,Cinta itu tumbuh karna kenyamanan .
TVTango,Fri Oct 07 14:45:27 +0000 2011,122321646332821504,11631,240,88,19,has_no_media,Today in TV History: CHARMED premiered 1998 WB w/ @HDonoho  @Alyssa_Milano  @thebriankrause  Shannen Doherty. http://t.co/0PbIQi8f
martyred1,Fri Oct 07 11:29:40 +0000 2011,122272376170872832,56,280,840,8,has_no_media,Follow @LarryFitzgerald. He is donating 10 cents a follower  $1000 a catch  $10000 a td this month towards breast cancer.
basashi13,Fri Oct 07 14:03:52 +0000 2011,122311181473026048,236,240,0,0,has_no_media,井口裕香ちゃん大好きだけど別に男とニャンニャンしてたとしても多分発狂しないわー。むしろﾜﾛﾀｗってなるレベル
HaruJANGHaru,Fri Oct 07 13:40:21 +0000 2011,122305262693515264,45,103,0,0,has_no_media,@hi__tommy ありがとうございました!!!☆*:.｡. o(≧▽≦)o .｡.:*☆おかげで、飛行機に乗れました!!!笑
ItsThingsInLife,Fri Oct 07 20:09:56 +0000 2011,122403303412871168,816251,158572,128,31,has_no_media,When you're afraid too much of a bad thing  you're just pulling that bad thing to come closer to you.
TheRealTerryC,Fri Oct 07 12:40:17 +0000 2011,122290144622542848,924,829,0,0,has_no_media,I Pray Ta God I Look My Killer In His Eyes !
DolIynho,Fri Oct 07 23:42:11 +0000 2011,122456716519542784,237,0,209,9,has_no_media,OI AMIGUINHOS  VAMOS SAIR PRA BALADA?
ALQAHTANI_23,Fri Oct 07 09:38:59 +0000 2011,122244518459355136,850,495,85,5,has_no_media,حصلت الناشطه توكل كرمان من اليمن على جائزة نوبل .. مبرووك لليمن ولنساء العرب ..
ltsAugustaIsina,Fri Oct 07 09:35:04 +0000 2011,122243535557763072,100251,79059,212,32,has_no_media,The only thing you should bring from your past is a new  matured you.
Nahmm,Fri Oct 07 12:11:21 +0000 2011,122282863419854848,2890,640,88,9,has_no_media,ไม่มีใครบอกคุณได้ว่าน้ำใจ เป็นอย่างไรนอกจากคุณจะ"รับ"หรือ"ให้"มันด้วยตนเอง
teenagernotes,Fri Oct 07 12:00:58 +0000 2011,122280251366719488,2158833,116,342,84,has_no_media,Revenge? Nah  I'm too lazy. I'm just going to sit here & let karma mess you up
natasyamndsr,Fri Oct 07 12:15:37 +0000 2011,122283940433240064,854,317,0,0,has_no_media,Kenapa sms bi? Gue gakpunya pulzaaah @rubiirubi
wivellalien,Fri Oct 07 13:23:51 +0000 2011,122301110806511616,1028,430,0,0,has_no_media,Bising
yolarrydabomb,Fri Oct 07 23:30:57 +0000 2011,122453889625755648,120,277,0,0,has_no_media,@FrontierCorp I called you guys to pay my bill today and someone told me you cant pay over the phone anymore :( can you confirm that?
Schwabpiraten,Fri Oct 07 12:50:13 +0000 2011,122292643693731840,651,87,60,6,has_no_media,Epic Win: Grüne übernehmen Piraten-Position zum Copyright http://t.co/QsVcr5im
bannersbaby,Fri Oct 07 07:31:29 +0000 2011,122212434160259072,605,844,54,0,has_no_media,@harry_moseley Inoperable brain tumour. Keep this brave & inspirational 11y/o in yr thoughts 4 his last few days PLEASE RT @DGoughie
oficialamauryjr,Fri Oct 07 19:40:01 +0000 2011,122395776436543488,341419,275,62,0,has_no_media,Aliás  sugestões são bem vindas. Valem aspectos curiosos e pouco conhecidos dos turistas.
arslanartist,Fri Oct 07 07:05:08 +0000 2011,122205802617511936,1540,1407,81,2,has_no_media,Top 10 Cars of 20112011 http://t.co/7Iny35xI via @TechVocal
IbnEid,Fri Oct 07 22:34:38 +0000 2011,122439719782072320,573,838,58,3,has_video,@safa_tv عاجل / الخبيث نمر النمر في خطبة الجمعة اليوم بالعوامية يصرح بعدائه للمملكة ويؤيد العنف !  http://t.co/AxqAAsho رتويت لو سمحت
RakanNervous,Fri Oct 07 08:12:21 +0000 2011,122222717889019904,1850,361,311,18,has_no_media,‏​‏​‏​‏​‏​‏​‏​‏​قناه خااااصه للقارى ماهر المعيقلي المصحف كاملا مدار ٢٤ساعة  تردد القناه١١٧٢٧  نايل سات كم شخص سيفتح القناه بسببك  رتيوووت
scy,Fri Oct 07 21:58:10 +0000 2011,122430541634084864,2965,820,75,19,has_no_media,Mit freundlichen Hitlergrüßen aus Sachsen  wo die Schulen aufgegeben haben  Nicht-Nazis zu beschützen. http://j.mp/nF3nbQ /v @eigensinn83
ciphergoth,Fri Oct 07 16:50:43 +0000 2011,122353170994307072,1113,277,95,31,has_no_media,Pornographers! I am available as a consultant to make sure you get these important details right: http://t.co/YVH8FjVh
LostWords_,Fri Oct 07 23:49:00 +0000 2011,122458432472219648,2013484,284,614,174,has_no_media,The minute you think of giving up  think of the reason why you held on so long.
accessvip,Fri Oct 07 20:36:27 +0000 2011,122409977867550720,19547,7588,95,0,has_no_media,Quem vai relembrar HOJE o super Rock in Rio na @access_lounge??? Red Hot  Capital  Cold Play...vai ser showwwwwww!
Saintly_Life,Fri Oct 07 20:52:43 +0000 2011,122414071038488576,439496,37,155,49,has_no_media,When we can't piece together the puzzle of our own lives  remember the best view of a puzzle is from above.  Let Him help put you together.
rememberingjobs,Fri Oct 07 16:08:16 +0000 2011,122342485702881280,153,2,126,101,has_no_media,Gallery: Artists Pay Tribute to Steve Jobs | Underwire | Wired.com http://t.co/06S094WI
AustinFornierr,Fri Oct 07 09:13:01 +0000 2011,122237985247870976,2982,739,107,17,has_no_media,You annoy me. You hurt me. You ignore me. You confuse me. You disappoint me. You use me. Yet I jump at the chance to spend time with you..
MacemMacemTweet,Fri Oct 07 10:43:06 +0000 2011,122260654215278592,2523,95,106,3,has_no_media,Cinta juga bersemi karna kebersamaan :D
DarkAgeZZima,Fri Oct 07 10:34:58 +0000 2011,122258608216997888,624,7,0,0,has_no_media,Узнайте больше о нашем проекте на фанатском радио Forsaken World! http://t.co/VkhwAPFQ
rememberingjobs,Fri Oct 07 13:56:13 +0000 2011,122309253989015552,153,2,105,81,has_video,Watch Thank You Steve - Made on a Mac on Vimeo! http://t.co/lHr2D46q
SwiffD,Fri Oct 07 08:51:51 +0000 2011,122232658158829568,15674,795,62,2,has_no_media,I think this Paranormal Activity 3 is gonna be the best one.....
WhatsCool,Fri Oct 07 23:38:51 +0000 2011,122455879042875392,5575,2892,50,6,has_no_media,On Twitter: HAPPY BIRTHDAY BRUNO MARS: Cause it's @BrunoMars birthday. Happy Birthday Bruno a.k.a The Sex Dragon! The Hooligans love you!!
snooofa,Fri Oct 07 13:13:28 +0000 2011,122298495792201728,488,307,0,0,has_no_media,“@hassan_hamidi: “@Hanoof_ALQ: حلوه الصوره؟  هههههههههههههههههههههههههه” لا”     افا ليش
sayingsforgirls,Fri Oct 07 07:30:03 +0000 2011,122212071352967168,1989930,222,360,109,has_no_media,A broken heart is the worst. It’s like having broken ribs. Nobody can see it  but it hurts every time you breathe.
OPaulosantos,Fri Oct 07 17:10:20 +0000 2011,122358106628964352,8036,271,54,1,has_no_media,Faço provas de matemática inspirado em Sócrates: "Só sei que nada sei."
gshow,Fri Oct 07 18:29:04 +0000 2011,122377918633607168,1061756,566,78,1,has_no_media,Ed Motta comenta seus sucessos na TV no quadro Segue a Trilha. http://t.co/aAjaW6kk
unlimitedream0,Fri Oct 07 07:33:03 +0000 2011,122212828173180928,90,435,102,3,has_no_media,EPHEDRINE | SUPPLEMENTS CANADA | WEIGHT LOSS | NUTRITION | VITAMINS | GAIN WEIGHT | LOSE FAT: http://t.co/TctEpqfX
ithinkthatway,Fri Oct 07 19:54:58 +0000 2011,122399536340664320,3320793,157,218,74,has_no_media,People always ask 'are you okay?' But they're never really expecting the truth  because if I was okay  you wouldn't really have to wonder.
feliciayaury,Fri Oct 07 13:24:10 +0000 2011,122301187486777344,735,485,0,0,has_no_media,@amelia_horas siapa?
HeavyKief,Fri Oct 07 19:19:00 +0000 2011,122390484688699392,326,84,0,0,has_no_media,@palmandal dang it @YnnsPhilippakis!!! always taking away the women lol you too! cheers!
HayakawaYukio,Fri Oct 07 09:42:37 +0000 2011,122245436663808000,51099,52,70,11,has_no_media,東日本では、これから30年間子どもに芋掘りさせられません。@hana3snow3
zizu_kwang,Fri Oct 07 09:36:00 +0000 2011,122243769469898752,102,273,172,3,has_no_media,ฮันเกิงมาไทย เจอม่ะกี้ขอถ่ายรูปแล้วป๋าบอกsorry  คนที่มาด้วยบอกว่ายังจำได้อีกน่ะ ป๋าน่ารักมากก มาเงียบจริงๆๆๆ
HeyItsRemi,Fri Oct 07 22:38:31 +0000 2011,122440696622882816,25587,214,255,43,has_no_media,Girl: How much do you love me? Guy: Well  look at the stars & count them. That's how much I love you. Girl: but  its morning. Guy: Exactly
usembassyoslo,Fri Oct 07 09:30:20 +0000 2011,122242344971010048,10519,683,59,2,has_no_media,Congratulations to Ellen J. Sirleaf  Tawakel Karman and Leymah Gbowee with winning the Nobel Peace Prize for their work with women's rights!
Mohammedq8,Fri Oct 07 16:08:59 +0000 2011,122342667932807168,6787,3186,64,2,has_no_media,“@kowaitiya: فضيحه وزير التربيه  يحذف حديث  " لعنه الله من سب الصحابه"    http://t.co/NT5s1wZ5 http://t.co/xyRjuxNJ http://t.co/7IFwWWtL”
RadenBudiNM,Fri Oct 07 10:50:45 +0000 2011,122262579786686464,365,307,0,0,has_no_media,I love you so much @estiyulistia muaaah :*:*&lt;3.
unlimitedream0,Fri Oct 07 07:50:17 +0000 2011,122217164957691904,90,435,54,0,has_no_media,Columbia Missouri Personal Injury Attorney | Jefferson City Missouri  Boone County: http://t.co/lKdmXc42. ID 2
capcold,Fri Oct 07 19:50:22 +0000 2011,122398381069959168,21342,176,55,11,has_no_media,한글날  언론에 바라는 바: 1최소한 한글과 한국어는 구분할 줄 알았으면. 2과학적문자라고 자랑만 할게 아니라  최신 과학적 응용과 성과를 소개해줄 것. 3한글의 아름다움을 이야기하려면  당신들 사이트의 못생긴 폰트부터 어떻게 좀... OTL
Holsssss_,Fri Oct 07 07:49:07 +0000 2011,122216872593719296,10920,1967,856,40,has_no_media,ONE DIRECTION Y U SO FIT.
Muser,Fri Oct 07 16:33:26 +0000 2011,122348821106802688,1225,0,113,19,has_no_media,「賈伯斯傳」應該會是今年末最好看的一本書，但是拜託出版社千萬不要請詹X志等人推崇其創新、或何X鵬之流盛讚其企業，也別找李X同陳X茜等數位化外之民來寫序或導讀，更別找時尚雜誌總編輯，那類是文屁，最好是連書腰都無，讓書跟賈伯斯致力要求的一樣：簡約、乾淨、直接，就好。
DemiNiens,Fri Oct 07 14:34:28 +0000 2011,122318880776523776,108,99,0,0,has_no_media,@Isajofl haha zielige isa
DailyLoveScopes,Fri Oct 07 10:23:18 +0000 2011,122255671273078784,384912,19,86,15,has_no_media,The annoyances of yesterday become relationship strengthening conversations today. Do what needs to be done. http://t.co/oOZeTn2P
unlimitedream0,Fri Oct 07 07:48:59 +0000 2011,122216837441273856,90,435,99,3,has_no_media,Columbia Missouri Personal Injury Attorney | Jefferson City Missouri  Boone County: http://t.co/H93mevJX via @AddThis
aboutkyaraa,Fri Oct 07 11:21:28 +0000 2011,122270311931592704,15,43,0,0,has_no_media,Booooom dia seextaaaa...o que temos de bom pra hj?Nãooo me decepcione :))
wd_LMR,Fri Oct 07 08:49:48 +0000 2011,122232141118586880,263,154,127,4,has_no_media,@DrSajed  تحية لإيكيا اعترافها بخطئها: إيكيا تدعو عملائها إعادة خيمة الأطفال لإمكانية تسببها بالضرر على الصغار http://t.co/wVQwuYIw
fucktyler,Fri Oct 07 08:31:36 +0000 2011,122227564734455808,3003597,212,75,7,has_no_media,Shit GOT REAL WHATS GOOD?
RealCavalliBoss,Fri Oct 07 11:56:36 +0000 2011,122279154136793088,292347,27400,88,13,has_no_media,Today is a gift  that's why it is called the present.
mrtkya,Fri Oct 07 11:37:11 +0000 2011,122274264698208256,1259,301,62,2,has_no_media,http://t.co/LXcrvE1g
unlimitedream0,Fri Oct 07 07:53:56 +0000 2011,122218084944707584,90,435,54,0,has_no_media,Hazardous & Industrial Waste Management http://t.co/4ajzwBOD
MacemMacemTweet,Fri Oct 07 13:16:00 +0000 2011,122299132755972096,2523,95,68,1,has_no_media,Kau hadir didalam bayangan semu hidupku .
IamEddylaine,Fri Oct 07 18:44:16 +0000 2011,122381747173343232,624,405,0,0,has_no_media,@erickmafra Quando vc vai fazer twitcam ?? 9
Maulidaoki13,Fri Oct 07 14:20:00 +0000 2011,122315240997269504,510,275,0,0,has_no_media,Ntahlah kmu bae braja disekitar kmu.tau kamu mah baa iduik tuh sbnanyoh RT @zahrraa: @maulidaoki kok gitu ?
namuhyunnn,Fri Oct 07 10:59:44 +0000 2011,122264842001330176,130,114,865,0,has_no_media,RT @MyQuotesBook: Don't rush into love  because even in fairy tales  the happy ending takes place on the last page.
Women_Of_Christ,Fri Oct 07 15:11:29 +0000 2011,122328197072297984,835747,37,66,30,has_no_media,Tired of playing the game by your rules and always loosing? Try God's... Loosing is NEVER an option!
KimKardashian,Fri Oct 07 09:34:12 +0000 2011,122243316262776832,45876613,119,58,27,has_no_media,Rise & glam! Getting ready for the Today Show! I am sooo tired!
123Tooyou,Fri Oct 07 07:48:00 +0000 2011,122216591537618944,37685,10951,55,5,has_no_media,‏​‏​‏​‏​‏​‏​‏​‏​قناه خااااصه للقارى ماهر المعيقلي المصحف كاملا مدار ٢٤ساعة  تردد القناه١١٧٢٧  نايل سات كم شخص سيفتح القناه بسببك  رتيوووت
annxious06,Fri Oct 07 13:13:58 +0000 2011,122298622703452160,2767,245,90,11,has_no_media,"The greatest love story ever told.. is YOUR OWN." - Letters to Juliet ♥
aondevaichegar,Fri Oct 07 13:33:17 +0000 2011,122303481792040960,631,4,46,0,has_no_media,"Mãe me da 460 00 reais?" 'para?' "pra comprar crack " 'ah  ta pensei que fosse pra ir no show do Justin Bieber  toma ai filho o dinheiro'
tmeriley,Fri Oct 07 08:42:38 +0000 2011,122230340537421824,568,873,121,12,has_no_media,10 years ago we had Steve Jobs  Bob Hope and Johnny Cash - Now we have no Jobs  no Hope and no Cash
Triawan,Fri Oct 07 07:45:22 +0000 2011,122215929189892096,85072,1148,75,1,has_no_media,Drpd larang2 Miss Universe bersilaturahim  lbh relevan MUI Jabar larang uang KORUPTOR bangun rumah ibadah.
Godly_Life,Fri Oct 07 15:38:18 +0000 2011,122334944038105088,751991,42,90,21,has_no_media,We need not join the mad rush to purchase an earthly fallout shelter.  God is our eternal fallout shelter.  -Martin Luther King  Jr.
LickMyTatts,Fri Oct 07 15:46:10 +0000 2011,122336923875418112,36974,2007,90,5,has_no_media,If You A Badd Bitch Dont Hang Out With Ugly Hoes.. Hang Out With A Group Of Badd Bitches And Get Fuckin Chose!
Legendcake,Fri Oct 07 08:14:44 +0000 2011,122223316655292416,180,48,50,0,has_no_media,@alfarooo8 ليش يا حكومتي دمي و دم إخواني الشرطة رخيص عندج و هم إلي حموج بعد الله من مخطط الروافض و من باعج و باع الديرة تحسبون له ألف حساب
AarMcity,Fri Oct 07 12:38:02 +0000 2011,122289578903216128,292,282,64,1,has_no_media,23.59ของวันนี้ขอให้ชาวปทุมรีบขนของไว้ชั้นบนเพราะน้ำอาจทะลักออกมาไคมีรถยนต์ฝากได้ที่ดอนเมืองข่าวออกช่อง7ไม่แน่ใจ100%ฝากรีด้วยนะ @appcheeze
ltsAugustaIsina,Fri Oct 07 08:09:30 +0000 2011,122222000054870016,100251,79059,104,10,has_no_media,Every Good woman deserve to find that one person that can make her heart smile  & hold onto it tight and don't let it go ever
mandiperkins,Fri Oct 07 18:55:40 +0000 2011,122384614491820032,3063,92,110,14,has_no_media,"3 apples changed the world: The 1 that Eve ate  the 1 that dropped on Newton’s head & the 1 that Steve built."
ltsAugustaIsina,Fri Oct 07 08:09:12 +0000 2011,122221924360261632,100251,79059,134,15,has_no_media,realize u cant wait around on some one who isnt waiting around for you
ltsAugustaIsina,Fri Oct 07 08:08:57 +0000 2011,122221864629190656,100251,79059,80,16,has_no_media,Ladies don't be so busy trying not to get hurt in love that u hurt your chances at being loved.
ltsAugustaIsina,Fri Oct 07 08:08:08 +0000 2011,122221659221532672,100251,79059,128,23,has_no_media,Many women will keep their feelings bottled up inside cause she tried pouring her heart out to the wrong guy..
ltsAugustaIsina,Fri Oct 07 08:08:26 +0000 2011,122221731355176960,100251,79059,89,11,has_no_media,People shouldn't wanna change other people. Accept them for who they are or stay out of their life.
ltsAugustaIsina,Fri Oct 07 08:08:47 +0000 2011,122221820077277184,100251,79059,81,16,has_no_media,Real women doesn't entertain drama... Its cuz she don't got time for it..
obahiko,Fri Oct 07 09:12:50 +0000 2011,122237940976979968,366,369,0,0,has_no_media,@uesannnn ハイオク指定やねん(´ω｀)
lordjennell,Fri Oct 07 20:50:47 +0000 2011,122413583123484672,822,767,1,0,has_no_media,RT @ImFhuckingGoofy: Sometimes u gotta let shit goo nd say ''Fhuck it'' nd move on
FabinhoProdutor,Fri Oct 07 14:53:11 +0000 2011,122323592389214208,136256,313,82,5,has_no_media,MEU NOME NÃO É "VALENÇA" MAS ESTOU "ALCEU" DISPOR... Voltando para Sp.
weqaisi,Fri Oct 07 12:52:49 +0000 2011,122293298604937216,464,355,113,3,has_no_media,@saeedalhelal @battalalgoos @almriseul    اتمنى الكل يشوف الصوره :) http://t.co/Wg8HuVyc شكراًلمن التقط الصورة ولمن وظفهاهذاالتوظيف الحضاري”
madmackerel9599,Fri Oct 07 11:09:01 +0000 2011,122267177347850240,215,228,0,0,has_no_media,俺得・・・・＞RT
ltsAugustaIsina,Fri Oct 07 08:14:24 +0000 2011,122223234539192320,100251,79059,138,39,has_no_media,You cannot be good enough for everybody  but you will always be the best for the one who deserves you.
ltsAugustaIsina,Fri Oct 07 08:13:55 +0000 2011,122223110513623040,100251,79059,84,17,has_no_media,Things changed . Times changed . I changed . You Changed.
CKasem01,Fri Oct 07 14:16:58 +0000 2011,122314478799962112,45,79,60,0,has_no_media,@iannnnn ธรรมศาสตร์รังสิตได้จัดที่พักให้กับคนที่น้ำท่วม ลงทะเบียนได้ตั้งแต่ 11.00 ที่ยิมเนเซี่ยม 2 ฝากช่วยประกาศต่อด้วยนะครับพี่
abo3li555,Fri Oct 07 22:50:26 +0000 2011,122443696217145344,97,56,83,1,has_no_media,RT @3asalaswad حملة كلنا قناة وصال لا لوقف قناة السنه  نطالب باعادة قناة الحق  اذا كنت مؤيد للحمله اضافة الصور+ريتويت @janoubalsourra1
hamkaastosti_,Fri Oct 07 19:53:22 +0000 2011,122399133112872960,116,162,0,0,has_no_media,#nf @OmarrChamakh
LickMyTatts,Fri Oct 07 15:50:16 +0000 2011,122337958534725632,36974,2007,50,3,has_no_media,Like Hoes Know They Ass Aint "Thick".. SMH All That Fuckin Cellulite
VersosFrases,Fri Oct 07 20:32:22 +0000 2011,122408949428396032,474584,22,72,2,has_no_media,Memória é uma coisa engraçada  lembro de tudo que queria esquecer  esqueço tudo que preciso lembrar.
JuanisVidal,Fri Oct 07 17:05:49 +0000 2011,122356968370339840,952,862,1,0,has_no_media,Ese abrazo que nos damos los dos cuando nos saludamos ese beso que se escapa de mi cuando nos encontramos #HueleaPeligro
BUMantjingHAE,Fri Oct 07 12:28:10 +0000 2011,122287096600866816,1779,168,76,0,has_no_media,หานเกิงอยู่ไทยจริงๆ ตอนนี้!!
opinRN,Fri Oct 07 13:16:03 +0000 2011,122299146211299328,185,305,0,0,has_no_media,RT @viatumblr: My heart finally realized what my mind knew all along: He's not worth it. #viatumblr
RichardPlugge,Fri Oct 07 10:18:23 +0000 2011,122254435417202688,9047,453,133,1,has_no_media,RT @jndkgrf Quote die ik tegenkwam : "10 years ago we had Steve Jobs  Bob Hope and Johnny Cash - Now we have no Jobs  no Hope and no Cash."
PARNNK,Fri Oct 07 14:57:35 +0000 2011,122324697332449280,822,478,119,0,has_no_media,@johnwinyu   ช่วยหน่อยนะคะ ตอนนี้อ.บางปะหัน จ.อยุธยา ไม่มีน้ำกินเลยได้รับแจกแค่บ้านละ2ขวด ขาดแคลนน้ำดื่มและอาหารมากค่ะ
jamesblake,Fri Oct 07 07:12:13 +0000 2011,122207585104429056,238706,8,412,108,has_no_media,日本のみんな、こんにちわ。来週日本に行きます、みなさんにお会いするのを楽しみにしています。
MensHumor,Fri Oct 07 16:30:13 +0000 2011,122348008779161600,3608741,232,172,25,has_no_media,I basically spend all of my time finding new ways to waste my time.
ltsAugustaIsina,Fri Oct 07 08:14:09 +0000 2011,122223171465248768,100251,79059,108,32,has_no_media,Time passes  memories fade  feelings change  people leave  but hearts never forget.
