https://twitter.com/SydScienceFest/status/686835841407299584,A team of hardcore marine scientists left yesterday to study the Southern Ocean | More at https://t.co/hEZuzFUwS1 https://t.co/GlYqAzzz2x,2,0.014285714,HERhttps://twitter.com/SydScienceFest/status/720384927523586048,"Next week, a free talk at @macleaymuseum explores how art &amp; science can work together to stop climate change! | https://t.co/xPBvO2Ofr0",19,0.014189694,HERhttps://twitter.com/SydScienceFest/status/722747746914947072,Are your eyes hungry? Let them feast on this ISS timelapse from NASA: https://t.co/TwwZDUUvuW,4,0.014184397,HERhttps://twitter.com/SydScienceFest/status/724135822178549760,"For the Vivid festival, @ICTENSW stage a #TeachMeet for all things creative, tech and fun! | https://t.co/5hNr3UCdhU https://t.co/loPHTSIU5F",3,0.014150943,HERhttps://twitter.com/SydScienceFest/status/634964365028933633,.@all_isee for chemistry. I think we lesrnt from PR is that you never know where physicists are. Never date one.  #sydsciencefest,1,0.014084507,HERhttps://twitter.com/SydScienceFest/status/632114812734996480,"KS: ""Never fly a kite in a thunder storm. Best places to get hit by lightning are golf courses and the beach"" #ssf15",1,0.014084507,HERhttps://twitter.com/SydScienceFest/status/632111245785587713,"The @GSAForum is holding a talk called 'Powering Sydney into the Future"" for #ssf15. Buy tickets here! https://t.co/QXVc9eID7a",1,0.014084507,HERhttps://twitter.com/SydScienceFest/status/665697483822120960,"Neuroscience is now open source and 3D printable! https://t.co/PAQqD8GBdW",6,0.014084507,HERhttps://twitter.com/SydScienceFest/status/700193258358439936,@AstroCate @maasmuseum Thanks Catherine! Is it okay if we contact you in a few months when the volunteer callout happens?,1,0.014084507,HERhttps://twitter.com/SydScienceFest/status/630887342207688704,"As well as our opening night at @maasmuseum, Syd Institute of Marine Science is holding a chat on #citsci this Thurs! http://t.co/IYnhGUKVSn",25,0.013989927,HERhttps://twitter.com/SydScienceFest/status/633968551230054401,"""When you really, really get into that empty, deep space, theologians and physicists ask the same questions"" #kindathinky #sydsciencefest",2,0.013986014,HERhttps://twitter.com/SydScienceFest/status/618209593848496128,"We've grown! After 9 huge years, and 150,000 visitors, Ultimo Science Festival is now part of the Sydney Science Festival! #sydsciencefest",7,0.013972056,HERhttps://twitter.com/SydScienceFest/status/634972211669897217,PR: scientists need reproducibility if they want to publish. And we can't with this theory #sydsciencefest,2,0.013888889,HERhttps://twitter.com/SydScienceFest/status/669274815879098368,Fancy a light conversation? Turns out Mantis Shrimp are communicating via polarised light | https://t.co/6jsF333A71 https://t.co/Zczuly373O,3,0.013824885,HERhttps://twitter.com/SydScienceFest/status/710222956186755073,"Google Science Fair, a global online competition open to 13-18 year olds, closes 18 May! | https://t.co/K7Oj5IPUB0 https://t.co/HNTTY1StnJ",3,0.013636364,HERhttps://twitter.com/SydScienceFest/status/720022450797428741,"New Rovers, from the mind of @tomgauld https://t.co/0XAQYAsBvQ",7,0.013539652,HERhttps://twitter.com/SydScienceFest/status/633520644534104064,We have an amazing amount of events happening tomorrow night in all different places! #sydsciencefest,1,0.013513514,HERhttps://twitter.com/SydScienceFest/status/633959558428274689,Up now is @bijlarchitect! #sydsciencefest #kindathinky,3,0.013513514,HERhttps://twitter.com/SydScienceFest/status/665335100033409024,We're suckers for beautiful space photos. https://t.co/wxepHxqzND,1,0.013513514,HERhttps://twitter.com/SydScienceFest/status/723773445054599168,Check out the program for @pintofscienceAU: thirty science talks over three days! https://t.co/zVfHgF5tNO https://t.co/AV9kzGiWUJ,2,0.013513514,HERhttps://twitter.com/SydScienceFest/status/633212833509982209,"Another great pick is a talk from Warwick Holmes, who worked on the @ESA_Rosetta, on Thursday night! http://t.co/BzdRg5XfTv #sydsciencefest",7,0.013461538,HERhttps://twitter.com/SydScienceFest/status/666437392140804096,"Check out this awesome exhibition of Science-infused Art, 28 Nov - 6 Dec at @CultureAtWork https://t.co/c5uYNd8sVg https://t.co/Tt4RIgtOfl",2,0.013422819,HERhttps://twitter.com/SydScienceFest/status/634965461860401152,"DC up now against @josiendebie. DC arguing again for humans. Humans, he argues, are basically just weird. #sydsciencefest",1,0.013333333,HERhttps://twitter.com/SydScienceFest/status/634691023348740096,@cosmictoner @sydneyobs @StargazerFred Great work!,1,0.013333333,HERhttps://twitter.com/SydScienceFest/status/671994021003313152,We love citizen science. Also we love dogs. @Sydney_Uni's new app unites them at last! https://t.co/qhxQgUCEe3 https://t.co/zTmGsHb1qb,1,0.013333333,HERhttps://twitter.com/SydScienceFest/status/633558896368455681,ML: Also important to understand that microbes are literally everywhere #sydsciencefest,2,0.013245033,HERhttps://twitter.com/SydScienceFest/status/632005262052724736,"Next Q: ""What evidence do we have that a black hole is at the centre of our galaxy?"" #ssf15",1,0.013157895,HERhttps://twitter.com/SydScienceFest/status/633844005063671808,Benefit of this would be both partners can work on the same thing. Panelists with scientist partners emphatically agree #sydsciencefest,3,0.013100437,HERhttps://twitter.com/SydScienceFest/status/667486259896524800,Is oversue of antibiotics causing dangerous levels of resistance among diseases? Totally. | via @2ser https://t.co/TMMvuDZw4C,1,0.012987013,HERhttps://twitter.com/SydScienceFest/status/705184270302711810,"This month, the free Inspiring Science talk at Ultimo Library looks at Infectious Maths and Mean Plants | https://t.co/U3IrpKJN3E",3,0.012931034,HERhttps://twitter.com/SydScienceFest/status/670182070723944448,The Telharmonium was the Spotify of 1906 | via @atlasobscura https://t.co/UMYk1TDBsg #technology #tech https://t.co/DLNADVvDW8,1,0.012820513,HERhttps://twitter.com/SydScienceFest/status/633559339416993792,"ML: Antimicrobials are things like antibacterial solutions, bleach, antifungals.  Things like that #sydsciencefest",2,0.012738854,HERhttps://twitter.com/SydScienceFest/status/689584191323906048,Here's a fascinating article on the future of antibiotics research by @carlzimmer | https://t.co/8emRjRzzgD https://t.co/54sBF3wwyN,2,0.012738854,HERhttps://twitter.com/SydScienceFest/status/632005540416098304,MP: Detecting black holes are tricky because they don't emit light but stars move around them #ssf15,1,0.012658228,HERhttps://twitter.com/SydScienceFest/status/666139390297665536,"Congratulations to our friends at @climarteaus, using art to inspire action on climate change, for their victory at the #MelbAwards!",2,0.012658228,HERhttps://twitter.com/SydScienceFest/status/695037341287780352,Don't miss John Barrow's talk on the structure of the universe next week @UNSWScience | https://t.co/WoxkQ79NaW https://t.co/aOyWcx03db,3,0.012658228,HERhttps://twitter.com/SydScienceFest/status/722686271265587200,Sleep: why it matters and how to get more of it | A free talk at @Sydney_Ideas https://t.co/m35VWNDjmX https://t.co/SGF6Dtxpal,9,0.012640449,HERhttps://twitter.com/SydScienceFest/status/633968211583627264,"""There's a great tradition of quantum theology.  We love thinking about what that empty space is composed of"" #kindathinky #sydsciencefest",2,0.012578616,HERhttps://twitter.com/SydScienceFest/status/686322716488679425,Wildlife TV Presenter and Adventurer @SteveBackshall talks at @SydOperaHouse this week! | https://t.co/mHLFUR6a5A https://t.co/3a990s7rZs,106,0.01254141,HERhttps://twitter.com/SydScienceFest/status/633522321043513344,And that's just what is happening tomorrow NIGHT.  Check out our site for events during the day as well #sydsciencefest,1,0.0125,HERhttps://twitter.com/SydScienceFest/status/666479657043128320,Isn't it great to have spiders? Cuddle one at London Zoo! #webcontent | via @atlasobscura https://t.co/AhZYIF02kI https://t.co/DZ5orRUj71,2,0.0125,HERhttps://twitter.com/SydScienceFest/status/632125619682148353,"Question: ""What do your students think about the culture of anti-science these days?"" #ssf15",1,0.012195122,HERhttps://twitter.com/SydScienceFest/status/631746265995329536,"Being able to create white light is ""the best thing that has ever happened to science"". So much work has come from that #ssf15",1,0.012195122,HERhttps://twitter.com/SydScienceFest/status/633561596254486528,Areas where these processes occur the most include hospitals and nursing homes. But also farms! #sydsciencefest,3,0.012195122,HERhttps://twitter.com/SydScienceFest/status/633829533649514496,AND Dr Charlene Lobo (maths and material sciences). And Dr Maggie Evans-Galea is chairing (med research and @WomenSciAUST) #sydsciencefest,8,0.012195122,HERhttps://twitter.com/SydScienceFest/status/715692377692737536,The recording of Space Jam from last year's #SydScienceFest is now up thanks to @RadioNational! https://t.co/QLnsp8BgA9,14,0.012079379,HERhttps://twitter.com/SydScienceFest/status/632005640387358720,MP: So you can detect them by watching the movements of nearby stars #ssf15,1,0.012048193,HERhttps://twitter.com/SydScienceFest/status/712161907482992640,Science Fiction Meets Science Fact: writer @adelaidesean &amp; astronomer Fred Watson @sydneyobs https://t.co/bjTkz6AfRB https://t.co/pUXmMgFCEx,46,0.012019859,HERhttps://twitter.com/SydScienceFest/status/633567729031647236,"Myth 2: ""Nagging works"". It just doesn't. The more you say something with no response, the less likely it is to work #sydsciencefest",1,0.011904762,HERhttps://twitter.com/SydScienceFest/status/633193820130181120,"DK: So everything you see is a combo of the true colour, the shade, comparisons - all evolved traits #ssf15",1,0.011904762,HERhttps://twitter.com/SydScienceFest/status/633087070970359808,"Here's a piece by the @DailyLifeAu of one of our speakers, Dr Maggie Aderin-Pocock! #ssf15http://t.co/1oR8VJeFIS",7,0.01188455,HERhttps://twitter.com/SydScienceFest/status/706740201083838464,"The name's Grant.NSW Regional Science Grant.Up to $10,000 available from @Sydney_Science for new initiatives: https://t.co/aaWuzjzVVK",6,0.011857708,HERhttps://twitter.com/SydScienceFest/status/631745528095633408,"Bringing out the laser. Specifically, a class 3 laser #ssf15",1,0.011764706,HERhttps://twitter.com/SydScienceFest/status/633197554067337216,DK using the film 'Lucy' as the example which is based on this premise #ssf15 #askdrkarl,1,0.011627907,HERhttps://twitter.com/SydScienceFest/status/632004682584473600,Dr Maggie Aderin-Pocock is wrapping up her talk now with some questions #ssf15,1,0.011627907,HERhttps://twitter.com/SydScienceFest/status/633560418007420928,"ML: Despite antibiotics stopping infections, there has been a slight increase in some others #sydsciencefest",2,0.011428571,HERhttps://twitter.com/SydScienceFest/status/695143765917458432,Just a quick reminder that looking at photos of galaxies on Google Images is a great way to spend three hours of your life.,2,0.011428571,HERhttps://twitter.com/SydScienceFest/status/635399931423920128,Thanks so much to everyone who helped #sydsciencefest happen!  We are looking forward to coming back next year for more science-y goodness!,10,0.011376564,HERhttps://twitter.com/SydScienceFest/status/633568226471903232,"AW: But its important that praise is specific, not just generalised phrases #sydsciencefest",1,0.011363636,HERhttps://twitter.com/SydScienceFest/status/633199132354605056,"DK: Technically, not all at the same time. But over a day, you will use every part of an organ. #ssf15 #askdrkarl",1,0.011363636,HERhttps://twitter.com/SydScienceFest/status/634285866194726912,"""We only have 20 amino acids here on Earth"" #sydsciencefest",2,0.011363636,HERhttps://twitter.com/SydScienceFest/status/687922981272682496,Rumors Are Flying That We Finally Found Gravitational Waves | via @Gizmodo https://t.co/04jTLIAN53 https://t.co/uQ8GEDuvxh,2,0.011363636,HERhttps://twitter.com/SydScienceFest/status/709860614097772544,The Social and Material life of Bottled Water - a refreshing talk @Sydney_Ideas |https://t.co/X7YfQxIM0X https://t.co/x4qpkBchCm,9,0.011349306,HERhttps://twitter.com/SydScienceFest/status/633966182014455812,".@FrBower: Families are getting smaller@rodl: Mm, but maybe they're just getting lost in our massive houses#sydsciencefest #kindathinky",6,0.011278195,HERhttps://twitter.com/SydScienceFest/status/633200859065614336,"Next topic! Do we have free-will, asks @DoctorKarl #ssf15 #askdrkarl",1,0.011235955,HERhttps://twitter.com/SydScienceFest/status/633197885295693824,"DK: This starts off kind of with William James, a painter. #ssf15 #askdrkarl",1,0.011235955,HERhttps://twitter.com/SydScienceFest/status/632124027444719616,"KS: ""If you don't believe in climate change or global warming, there's something wrong with you. Or you may be a politician"" #ssf15",1,0.011235955,HERhttps://twitter.com/SydScienceFest/status/632868134270058496,@SydScienceFest Robots for errything!! Ping @MakerFaireSYD,2,0.011235955,HERhttps://twitter.com/SydScienceFest/status/707102601687465984,Tomorrow afternoon at @UNSWScience: Australias contribution to global carbon cycle extremes https://t.co/RUMdvtBQz4 https://t.co/WgARYo3THr,3,0.011152416,HERhttps://twitter.com/SydScienceFest/status/632852405449682945,"When SW was just getting started with being the jungle, he couldn't figure out why for the first few nights he felt uneasy... #ssf15",1,0.011111111,HERhttps://twitter.com/SydScienceFest/status/708773346457083904,How To Talk About Climate Change Without Talking About Climate Change | vis @Sydney_Ideas https://t.co/9qYskBj32i https://t.co/yhRBP5EHEg,7,0.011093502,HERhttps://twitter.com/SydScienceFest/status/633960531385184257,"""Our houses are obese, there is no other way to say it"" @bijlarchitect #sydsciencefest #kindathinky",15,0.011005136,HERhttps://twitter.com/SydScienceFest/status/633941247149785088,SB: My study is how to delay aging through nutrition. #sydsciencefest #kindathinky,1,0.010989011,HERhttps://twitter.com/SydScienceFest/status/667184044967235585,"ALERT! Tonight, Thu at 8:43 to 8:46 pm the Space Station is over Sydney to a height of 72. Appears 35 above SW, disappears: 25 above ENE",6,0.010869565,HERhttps://twitter.com/SydScienceFest/status/710349995296362497,Don't forget Brian Greene is in Sydney tomorrow night! Grab your last minute tickets here | https://t.co/VUDmq8tEcF https://t.co/DTO0XOCkEI,3,0.010830325,HERhttps://twitter.com/SydScienceFest/status/709263004009779200,"Don't forget! It's an all-science episode of #QandA tonight, with Brian Greene, Tamara Davis, Emma Johnston and more https://t.co/cX5DGs9Uww",5,0.010683761,HERhttps://twitter.com/SydScienceFest/status/632745352400007168,"""LifePatch is a biohack group in Jakarta &amp; is heavily involved in the community and the government, which would be great to see here"" #ssf15",3,0.010676157,HERhttps://twitter.com/SydScienceFest/status/633569098933276672,That finishes up AW's talk and another awesome UTS forum of 'Science in Focus' #sydsciencefest,1,0.010638298,HERhttps://twitter.com/SydScienceFest/status/633964880215699456,*walks on the stage with a beer* #sydsciencefest #kindathinky,1,0.010526316,HERhttps://twitter.com/SydScienceFest/status/633212183841632256,"And we are done! Tomorrow is another science-filled day.  @Cmdr_Hadfield chatting, and a 'weird food' dinner hosted by TAFE @sydneyinstitute",4,0.010498688,HERhttps://twitter.com/SydScienceFest/status/631997885249261568,"MP: it's important for kids to see that you don't need to be a boy, white or exceptionally serious to be a scientist #ssf15",5,0.01048218,HERhttps://twitter.com/SydScienceFest/status/633564504983339009,The second speaker tonight is actually Dr Anne Dedousis-Wallace who is stepping in for Dr Rachael Murrihy #sydsciencefest,1,0.010416667,HERhttps://twitter.com/SydScienceFest/status/632006631409086464,(On a Big Bang question)MP: The name Big Bang was an insult used to discredit the theory. Similar to 'The God Particle' #ssf15,1,0.010416667,HERhttps://twitter.com/SydScienceFest/status/631755077884112896,"MP encouraging children to get into physics and  astronomy - ""help us, we need you!"" #ssf15",1,0.010309278,HERhttps://twitter.com/SydScienceFest/status/665519049678446592,Gagarin by Public Service Broadcasting is your new favourite cosmonaut-history-themed funk song https://t.co/7ox21oFSIK,1,0.010309278,HERhttps://twitter.com/SydScienceFest/status/694312561165144065,"Tonight @austmus: the new #CitizenScience film MARATUS. Cool spiders, a Q&amp;A, and nibbles. https://t.co/DNBNPS5YVm https://t.co/DnCRjT1U3W",8,0.010217114,HERhttps://twitter.com/SydScienceFest/status/634283665187565568,"""People think you can't go from Syd to working for a (or THE) European Space Agency.  Warwick did; it just takes dedication"" #sydsciencefest",1,0.010204082,HERhttps://twitter.com/SydScienceFest/status/633960070372458496,"""243 square m is the current average sized house built here"" #sydsciencefest #kindathinky",1,0.01010101,HERhttps://twitter.com/SydScienceFest/status/633936470449848320,"Tonight's topic is excess, excessive everything, more garbage, more beautiful, more gold, more whatever. #sydsciencefest #kindathinky",1,0.01010101,HERhttps://twitter.com/SydScienceFest/status/633113245033754624,@Sydney_Science YEAH you are!,2,0.01010101,HERhttps://twitter.com/SydScienceFest/status/666373899953684480,A board game about intestinal microbes? That takes guts. | via @AMNH https://t.co/4EBjYqFYRS #science #biology,1,0.01010101,HERhttps://twitter.com/SydScienceFest/status/671829673760960513,Say 'bye' to the gender binary: there's no such thing as a 'male' or 'female' brain | https://t.co/CzsUX5GLa3 https://t.co/9EL2dBVDst,1,0.01010101,HERhttps://twitter.com/SydScienceFest/status/692483238267346944,Want to work in Antarctica? Yeah you do! Applications close tonight: https://t.co/MEI3dV4QRR https://t.co/oli7HVeqnF,1,0.01010101,HERhttps://twitter.com/SydScienceFest/status/706996099970678784,"This tweet is for Ada Lovelace, Margaret Hamilton, Grace Hopper and all the other #WomenInSTEM without whom tweeting wouldn't be possible.",19,0.010015814,HERhttps://twitter.com/SydScienceFest/status/631998046490882048,(The bottom photo is of MP and her husband - both scientists) #ssf15,2,0.01,LERhttps://twitter.com/SydScienceFest/status/633243467003490304,.@tarongazoo is holding a #citizenscience workshop for high schoolers tomorrow #sydsciencefest http://t.co/rWWe2PtFls,1,0.00990099,LERhttps://twitter.com/SydScienceFest/status/633561321724751872,ML: Basic selection process-bacteria adapt and mutate and then pass genes on. That's what they do. But humans encourage this #sydsciencefest,3,0.00990099,LERhttps://twitter.com/SydScienceFest/status/691033674565951489,Whoa! Ping pong practice with a ball made of water on the International @Space_Station https://t.co/gyAZAu2fKT https://t.co/0fEfLIxGqA,1,0.00990099,LERhttps://twitter.com/SydScienceFest/status/633560900473982976,"Alright, so how do these bacteria become immune to our antibiotics? #sydsciencefest",2,0.009803922,LERhttps://twitter.com/SydScienceFest/status/633562031933648896,ML: What this means is that any approaches to fix this has to span not just human use #sydsciencefest,3,0.009803922,LERhttps://twitter.com/SydScienceFest/status/699033996022317056,Science? Science. SCIENCE? SCIENCE! Submissions for Sydney Science Festival close 7 March. https://t.co/UbbFxITihj https://t.co/wYwZp9dvmF,19,0.009773663,LERhttps://twitter.com/SydScienceFest/status/697680469228441600,"For Int'l Women's Day, Kogarah Library is hosting a free talk on Women in Science! Yeah! | https://t.co/wKhQUbxLmU https://t.co/P1x6GiWZnj",2,0.009756098,LERhttps://twitter.com/SydScienceFest/status/631747926612557824,"RM: ""social media is making it more acceptable to love maths. I go to schools now and half the kids admit they love maths"" #ssf15",1,0.009708738,LERhttps://twitter.com/SydScienceFest/status/698042871539200000,Just a reminder that Aus scientist Barry Marshall drank a beaker of Helicobacter Pylori to prove bacteria cause stomach ulcers. #forscience?,6,0.00955414,LERhttps://twitter.com/SydScienceFest/status/633965251629678592,"""No member of the clergy is allowed to walk into a sex club...without a good reason"" #sydsciencefest #kindathinky",1,0.00952381,LERhttps://twitter.com/SydScienceFest/status/664966943925886976,Cool mathematical drawing activity from @CSIROhelix! The way to a maths lover's heart probably involves a protractor https://t.co/2Na0vsQNwX,2,0.009478673,LERhttps://twitter.com/SydScienceFest/status/711672410970431489,The Psychology of Food Cravings: a free talk @Sydney_Science about... mmm... I could really go for some chips... https://t.co/71z6abUqmR,2,0.009478673,LERhttps://twitter.com/SydScienceFest/status/633937217929412608,"""Let's start with how much Aussie's drink.  We don't win.  It's actually the Czechs (most beer)""   #sydsciencefest #kindathinky",1,0.009433962,LERhttps://twitter.com/SydScienceFest/status/633831397896028160,[Hashtags for this are either #sydsciencefest or #researchequityUTS],3,0.009433962,LERhttps://twitter.com/SydScienceFest/status/667839090339876864,Tesla would be proud! New Wi-fi sends electricity as well as internet | via @sciencealert https://t.co/EdIbwuKYMO https://t.co/pAE53dUkcG,1,0.009433962,LERhttps://twitter.com/SydScienceFest/status/672625207496990721,"It's a big ball of wibbly-wobbly, timey-wimey impossibility https://t.co/GEYe5DjFO6",3,0.009345794,LERhttps://twitter.com/SydScienceFest/status/675124858980802560,A fundamental quantum physics problem has been proved unsolvable | via @factormagazine https://t.co/GMdG8OmwKO https://t.co/25i8sdRgBt,3,0.009287926,LERhttps://twitter.com/SydScienceFest/status/690308957743742976,Our hero @DoctorKarl is giving a FREE talk at @Sydney_Uni in April. Register now! | https://t.co/fNa5xgQS30 https://t.co/zwP2hFXf1P,79,0.009236525,LERhttps://twitter.com/SydScienceFest/status/632125874448367616,KS: These days we don't expect every student to want to be a scientist but we DO expect them to be science literate #ssf15,1,0.009174312,LERhttps://twitter.com/SydScienceFest/status/690822071333605376,"Tomorrow at 5:30 am, there'll be a planetary alignment to be enjoyed by those who like getting up early (or staying up very very very late).",1,0.009174312,LERhttps://twitter.com/SydScienceFest/status/633957782123745281,The prize was a Texas Hold'em kit...for the pool? #sydsciencefest #kindathinky,1,0.009090909,LERhttps://twitter.com/SydScienceFest/status/685235467906891778,Are you an Australian science researcher who loves talking? Apply for FameLab now! https://t.co/MqF03hVtts https://t.co/wKHyufbY7U,4,0.009090909,LERhttps://twitter.com/SydScienceFest/status/634180430875521024,.@Sydney_Uni and @CoEPP are showing the film Particle Fever for free on campus tonight. An awesome film on the LHC! #sydsciencefest,8,0.008998875,LERhttps://twitter.com/SydScienceFest/status/633209932083408896,"Q: ""When you started getting into the media, how did medical colleagues react?"" #askdrkarl #sydsciencefest",1,0.008849558,LERhttps://twitter.com/SydScienceFest/status/633207835506028545,"DK: And then if you do, stick to the facts and don't get angry. #askdrkarl #sydsciencefest",1,0.00877193,LERhttps://twitter.com/SydScienceFest/status/704097117913161730,"The @Space_Station is over Sydney tonight from 8:33 PM to 8:39 PM! Appears: 10 above NW, Disappears: 11 above SE https://t.co/KrDlMdDmHa",1,0.00877193,LERhttps://twitter.com/SydScienceFest/status/673732961951490048,"Yes, we have no bananas: Disease may kill off the most beloved banana | via @washingtonpost https://t.co/PIRtZsbMNf https://t.co/CbHhyFrD4e",1,0.008695652,LERhttps://twitter.com/SydScienceFest/status/700110791366877185,A Scientific Approach to teaching Science: a recursive talk by Carl Wieman @Sydney_Science | https://t.co/NwTeeTWMC7 https://t.co/ezx7XokIWR,5,0.008695652,LERhttps://twitter.com/SydScienceFest/status/708410994574401537,Next month at Ultimo Library: Free science talks on Bizarre Sex and Swarm Intelligence | https://t.co/55jqWMoD1X https://t.co/u7uwsSJ1V0,2,0.008658009,LERhttps://twitter.com/SydScienceFest/status/633122940180168704,.@Sydney_Uni is getting into the #natsciwk spirit with heaps of events and also a list of USyd scientists to follow http://t.co/P4UxYySyzD,36,0.008633094,LERhttps://twitter.com/SydScienceFest/status/669021882310610944,Doctors use Google Glass and Virtual Reality to unblock an artery | https://t.co/sMMbpXihD1 https://t.co/kAKG6Ra7ls,1,0.00862069,LERhttps://twitter.com/SydScienceFest/status/631348402094149633,"Speed meet some awesome scientists and #scicomm people, including @astropixie, @BecCrew and @sarahinscience  https://t.co/1BXcuTCyCY",21,0.008613618,LERhttps://twitter.com/SydScienceFest/status/633095746661695488,.@Cmdr_Hadfield is speaking tomorrow night for #ssf15! Enjoyed his chats about Trump on @QandA?  This will be even better.  We promise.,1,0.008547009,LERhttps://twitter.com/SydScienceFest/status/632006198800179200,Lots of #auspol folk joining in on science experiments today at school for #natsciwk  https://t.co/Vqwk5GrgXF,1,0.008547009,LERhttps://twitter.com/SydScienceFest/status/707358631923228672,"Fred Watson AM talks on Trailblazers in Astronomy, March 24 | via @AusGeo and @AustMus https://t.co/FxQNaq01Uf https://t.co/Q7dm5v1aH1",13,0.008376289,LERhttps://twitter.com/SydScienceFest/status/633206994132860928,"Audience member: ""How are we going to change the action/lackthereof on climate change in time?"" #askdrkarl #sydsciencefest",1,0.008264463,LER