sydneyobs,Tue Apr 15 08:41:03 +0000 2014,455989163364737024,3623,654,0,0,0,has_no_media,Observations blog: Look east for today’s lunar eclipse - Under a brighter sky  last Thursday Toner Stevenson s... http://t.co/Zqi1vnL6p0
sydneyobs,Tue Apr 15 08:07:30 +0000 2014,455980721106984960,3623,654,6,5,0.333333333,has_no_media,The sky might give us a partial glimpse of the eclipse in a few minutes. Fingers crossed! #eclipse
sydneyobs,Tue Apr 15 08:06:38 +0000 2014,455980502361456640,3623,654,1,0,0.222222222,has_photo,Lots of atmosphere but alas no Moon on this Eclipse night but we are still hoping! http://t.co/W73v9pIcnX
sydneyobs,Tue Apr 15 08:01:27 +0000 2014,455979198151016448,3623,654,0,2,0.166666667,has_photo,Watching a live feed of the Eclipse fed from LA Thanks Griffith Observatory! http://t.co/6gH0jx3yFn
sydneyobs,Tue Apr 15 08:01:17 +0000 2014,455979158250606594,3623,654,2,2,0.049019608,has_no_media,Watch Total Lunar Eclipse April 14-15  2014 on @Livestream: http://t.co/RMFevYjZkV
sydneyobs,Tue Apr 15 07:33:12 +0000 2014,455972091624296449,3623,654,0,0,0,has_photo,Astronomer Mel talking to Glen Wheeler @2GB from inside the time ball tower. #eclipse http://t.co/09iKERbeok
sydneyobs,Tue Apr 15 07:15:52 +0000 2014,455967726029119489,3623,654,3,2,0.384615385,has_photo,Meanwhile to the west - the sky clears. #Eclipse http://t.co/KTSyvapF0X
sydneyobs,Tue Apr 15 07:13:05 +0000 2014,455967025555181568,3623,654,0,2,0.333333333,has_photo,Retreat inside the tower it's wet on top now. #Eclipse http://t.co/1QayoB4jQI
sydneyobs,Tue Apr 15 06:59:10 +0000 2014,455963525341405185,3623,654,2,1,0.333333333,has_photo,Hoping for a brake in the weather. #Eclipse http://t.co/tPWmmVNZIi
sydneyobs,Tue Apr 15 06:55:39 +0000 2014,455962639936389120,3623,654,5,1,0.0625,has_photo,Astronomer Mel talking to Richard Glover @702sydney from the time ball http://t.co/nQRanZ0pAh
sydneyobs,Tue Apr 15 06:53:32 +0000 2014,455962107352084480,3623,654,2,2,0.081967213,has_photo,Some staff leaving the messengers cottage to get into position for the eclipse. # eclipse http://t.co/fch6GFUjJJ
sydneyobs,Tue Apr 15 06:37:10 +0000 2014,455957990755946496,3623,654,0,1,0.090909091,has_photo,Astromoner Mel heading up the time ball tower to view the eclipse. http://t.co/smbPhUzi9H
sydneyobs,Tue Apr 15 05:38:02 +0000 2014,455943106660032512,3623,654,6,0,0.085714286,has_no_media,@sydneyobs video live stream is now working - http://t.co/gy5GTOCq3y - Hope the weather clears so we have something to show from 5.28pm.
sydneyobs,Tue Apr 15 05:09:40 +0000 2014,455935967908466690,3623,654,7,3,1,has_no_media,Oh no - sob - it's raining @sydneyobs.... Hoping it clears for the eclipse at 5.28pm.
sydneyobs,Tue Apr 15 04:33:43 +0000 2014,455926919771746304,3623,654,1,0,0.142857143,has_no_media,Observations blog: Preparations for today’s total lunar eclipse http://t.co/EosAt2squg
sydneyobs,Tue Apr 15 03:03:16 +0000 2014,455904158332116993,3623,654,1,1,0.25,has_photo,The time ball dropping on eclipse day. It's 1.00pm #eclipse day http://t.co/SZnNRJM72t
sydneyobs,Tue Apr 15 02:59:30 +0000 2014,455903209194659840,3623,654,1,0,0.142857143,has_photo,Letting light onto the setup.#eclipse http://t.co/XMUcAhQWOB
sydneyobs,Tue Apr 15 02:38:45 +0000 2014,455897987659468802,3623,654,0,0,0.1,has_photo,Tricaster is networked! #Eclipse http://t.co/ZxjMHCxlcl
sydneyobs,Tue Apr 15 02:34:35 +0000 2014,455896941721686016,3623,654,0,1,0.125,has_photo,It's all about cables!  #Eclipse http://t.co/bcZTehDbqb
sydneyobs,Tue Apr 15 00:46:36 +0000 2014,455869765479702528,3623,654,2,1,0.230769231,has_photo,Did you know the Moon is receding from the Earth at 3.8cm per year? Andrew and Irma are checking Moon facts. http://t.co/k8qiSy6r72
sydneyobs,Mon Apr 14 20:45:11 +0000 2014,455809012186247169,3623,654,11,2,0.333333333,has_no_media,Observations blog: Daily cosmobite: red Moon rising - Tonight  weather permitting  people in Sydney  Melbourne a... http://t.co/5HyWs6HhF6
sydneyobs,Mon Apr 14 11:47:47 +0000 2014,455673771118968832,3623,654,0,0,0,has_no_media,An Exo-Moon detected in another Solar system using gravitational micro-lensing http://t.co/2EJmESvPtz @702sydney
sydneyobs,Mon Apr 14 11:44:57 +0000 2014,455673056346656768,3623,654,6,2,0.163265306,has_no_media,Listening to @drsimmo on @702sydney about tomorrow evening's Total Lunar Eclipse. Find out more and view live http://t.co/1YbT0xnwFG
sydneyobs,Mon Apr 14 06:43:18 +0000 2014,455597142988427265,3623,654,9,3,0.04676259,has_no_media,This time tomorrow we'll be preparing for a total lunar eclipse at Sydney Observatory (starts 5.28pm). http://t.co/1YbT0xnwFG for info.
sydneyobs,Mon Apr 14 06:00:04 +0000 2014,455586266197659648,3623,654,3,1,0.266666667,has_no_media,Mel from Sydney Observatory describes the red Moon rising early tomorrow evening  if the clouds clear  http://t.co/EVgGurpunI
sydneyobs,Sun Apr 13 20:35:40 +0000 2014,455444230065115136,3623,654,0,1,0.25,has_no_media,Observations blog: Daily cosmobite: Mars and the Moon - Though it is almost a week after it was at opposition  Mar... http://t.co/itkmeU5gYW
sydneyobs,Sat Apr 12 09:46:44 +0000 2014,454918531478351872,3623,654,10,11,1.222222222,has_no_media,Australian Indigenous Astronomy: Indigenous Astronomy @ UNSW a great blogpost to follow http://t.co/8ArYVVEdHH
sydneyobs,Sat Apr 12 00:22:19 +0000 2014,454776492904288259,3623,654,0,1,0.142857143,has_no_media,Tropical cyclones explained http://t.co/rluaFdDLfR via @ABCNews
sydneyobs,Fri Apr 11 20:42:18 +0000 2014,454721122182103040,3623,654,0,0,0,has_no_media,Observations blog: Daily cosmobite: the largest moon - The largest moon is Jupiter’s moon Ganymede that ha... http://t.co/9nK3Ym23DI
sydneyobs,Fri Apr 11 05:43:17 +0000 2014,454494877481328640,3623,654,11,4,0.64,has_no_media,Get ready for the Lunar Eclipse next Tuesday early evening http://t.co/1YbT0xnwFG. This is a naked eye/binocular event in the east.
sydneyobs,Thu Apr 10 20:42:39 +0000 2014,454358823378362368,3623,654,0,0,0,has_no_media,Observations blog: Daily cosmobite: Venus and Neptune - The large distance of the outer planet Venus from Earth m... http://t.co/t4d2kz1TM7
sydneyobs,Thu Apr 10 07:24:17 +0000 2014,454157906372333569,3623,654,1,3,0.294117647,has_photo,This is the Astrograph in its position getting ready for display in our new dome  opening October. http://t.co/uKr0HceDRg
sydneyobs,Wed Apr 09 19:39:20 +0000 2014,453980499263119360,3623,654,0,0,0,has_no_media,Observations blog: Daily cosmobite: which is the largest moon? http://t.co/JhUB0HA5vL
sydneyobs,Tue Apr 08 19:43:47 +0000 2014,453619232451096577,3623,654,0,0,0,has_no_media,Observations blog: Daily cosmobite: Spica - Visible in the eastern sky in the early evening  this is the brightest... http://t.co/WXYqinHKcC
sydneyobs,Tue Apr 08 11:16:37 +0000 2014,453491598853021698,3623,654,0,1,0.25,has_no_media,@rainfordhugh Will get back to you - did notice that the rainfall readings for Observatory Hill are considerably less than other locations.
sydneyobs,Tue Apr 08 11:13:30 +0000 2014,453490816057495552,3623,654,3,3,1.285714286,has_no_media,@pascalg15 @ABCstarstuff and Sydney Obs listens to StarStuff regularly and @365DaysOfAstro podcasts are a great medium for astronomy.
sydneyobs,Mon Apr 07 19:38:45 +0000 2014,453255578924883969,3623,654,0,0,0,has_no_media,Observations blog: Daily cosmobite: Mars at opposition - Every two years or so  the Earth catches up with slower-m... http://t.co/Q9vaMYDrBu
sydneyobs,Mon Apr 07 02:39:00 +0000 2014,452998951353188352,3623,654,0,0,0.571428571,has_no_media,Observations blog: 2014-05-23 Sydney Writers’ Festival: Stories  stargazing  art and wine with author Michael ... http://t.co/hxPYtHgr0W
sydneyobs,Sun Apr 06 20:36:20 +0000 2014,452907680529932288,3623,654,0,0,0,has_no_media,Observations blog: Daily cosmobite: Jupiter and the Moon - Did you see a bright object near the Moon last night? T... http://t.co/Bbne4TPbfG
sydneyobs,Sat Apr 05 04:58:25 +0000 2014,452309260844552193,3623,654,0,1,0.111111111,has_photo,Fabulous Solar viewing today   sunspots  filaments and prominences! http://t.co/uvheqDocGu
sydneyobs,Fri Apr 04 20:42:00 +0000 2014,452184333680668672,3623,654,0,0,0,has_no_media,Observations blog: Daily cosmobite: clocks go back - People in the south-eastern states can catch an extra hour of... http://t.co/Vg089IgnVm
sydneyobs,Thu Apr 03 19:41:28 +0000 2014,451806708487421952,3623,654,1,1,0.166666667,has_no_media,Observations blog: Daily cosmobite: stars in the north - If we face north in the early evening we see Spica low to... http://t.co/SyxrMQg6Fe
sydneyobs,Wed Apr 02 20:47:45 +0000 2014,451461003147247616,3623,654,1,0,0.05,has_no_media,Observations blog: Daily cosmobite: Virgo the Maiden - In the early evening this zodiac constellation is visible l... http://t.co/PgYJHdjNZI
sydneyobs,Wed Apr 02 11:39:50 +0000 2014,451323117160263681,3623,654,1,0,0.142857143,has_no_media,Plenty of astronomers @sydneyobs for the @AAOastro AusGO workshop tonight! Hope @astropixie @cosmicpudding report Moon/planet/stargazing.
sydneyobs,Tue Sep 30 21:24:25 +0000 2014,517062436109578240,3623,654,1,0,0.025906736,has_no_media,October 2014 night sky guide podcast  transcript and sky chart http://t.co/5ysgWrHPnW
sydneyobs,Tue Sep 30 21:22:25 +0000 2014,517061932654669824,3623,654,0,0,0,has_no_media,Daily cosmobite: Constellation Aquila  the Eagle http://t.co/LWlqz1Oti0
sydneyobs,Tue Sep 30 21:21:34 +0000 2014,517061715909828608,3623,654,5,9,0.055033557,has_photo,A regular solar day tour with @starstryder @SkepticZone . Some nice sunspot groups and a filament @WorldSpaceWeek http://t.co/U67hvdsWG3
sydneyobs,Tue Sep 30 13:08:21 +0000 2014,516937596250103808,3623,654,0,0,0.144578313,has_no_media,@starstryder and @SkepticZone doing a selfie whilst @sydneyobs is solar viewing today! We podcast too - hear Oct '14 http://t.co/qrDzEPbp9r
sydneyobs,Tue Sep 30 03:26:10 +0000 2014,516791084211376129,3623,654,9,3,0.043744532,has_no_media,Getting ready for the total lunar eclipse? Take a look at the ASA fact sheet by Nick Lomb https://t.co/XqoUOArkhU
sydneyobs,Mon Sep 29 21:23:20 +0000 2014,516699774259458048,3623,654,0,1,0.013736264,has_no_media,Daily cosmobite: Happy Birthday Phil Plait http://t.co/Mw6pGfKm0Z
sydneyobs,Sun Sep 28 12:45:50 +0000 2014,516207151673384962,3623,654,1,0,0.018987342,has_no_media,@SBS just treated us to the Galaxy Song in Monty Python Live with Brian Cox corrections. Note @SciBry quoted on Wiki http://t.co/r775fQId2z
sydneyobs,Sun Sep 28 06:53:18 +0000 2014,516118435881701376,3623,654,0,0,0.012320329,has_no_media,A favourite 'bad astronomy' moment:Viral Video Showing Sun’s “Vortex” Motion Is Wildly Inaccurate http://t.co/qBq2tCHamj via @BadAstronomer
sydneyobs,Sun Sep 28 02:04:42 +0000 2014,516045807397527552,3623,654,1,0,0.013084112,has_no_media,Announcing a Polynesian cultural astronomy event 18 October. Hawai'i and beyond with the Prof Clive Ruggles. ! http://t.co/uNRJaDO6Rt
sydneyobs,Sat Sep 27 23:27:39 +0000 2014,516006284462927872,3623,654,3,1,0.019455253,has_no_media,Date fixed for comet landing attempt  12 Nov UT. http://t.co/q4ymv1VelN
sydneyobs,Fri Sep 26 02:20:38 +0000 2014,515325039424446464,3623,654,1,1,0.022508039,has_photo,Glittering 'Fine Possession' jewellery exhibition @phmuseum -'Milky Way' by Alice Whish inspired by our own galaxy. http://t.co/Rq2xzCVVzA
sydneyobs,Thu Sep 25 22:00:24 +0000 2014,515259551377924099,3623,654,1,0,0.016627078,has_no_media,Accessing the sky: building Sydney Observatory's new dome - blog 2 http://t.co/POH6sbhHY0
sydneyobs,Thu Sep 25 21:49:47 +0000 2014,515256879442690048,3623,654,0,0,0.006024096,has_no_media,Daily cosmobite: Mars and Antares http://t.co/UjDZ2zuhGs
sydneyobs,Thu Sep 25 10:19:27 +0000 2014,515083151316500480,3623,654,1,0,0.009501188,has_no_media,Daily cosmobite: Ole Roemer anniversary http://t.co/yHNGEi8UoL
sydneyobs,Wed Sep 24 21:12:37 +0000 2014,514885137863958528,3623,654,1,1,0.014880952,has_no_media,Why India's Mars mission is so cheap - and thrilling http://t.co/fSLjVucjnN
sydneyobs,Wed Sep 24 21:11:53 +0000 2014,514884950827343872,3623,654,0,0,0.003236246,has_no_media,India Mars mission arrives in orbit around Mars to study the Red Planet's atmosphere http://t.co/RxniH0HVT5
sydneyobs,Tue Sep 23 03:05:17 +0000 2014,514249112040910849,3623,654,1,0,0.029339853,has_no_media,Daily cosmobite: Spring equinox  2014 http://t.co/L147tymPpM
sydneyobs,Mon Sep 22 23:08:43 +0000 2014,514189579423711232,3623,654,1,1,0.011415525,has_no_media,Nice historical account of the history of astrometry. Part I: Mapping the sky from ancient to pre-modern times http://t.co/yvWT744elL
sydneyobs,Mon Sep 22 22:10:06 +0000 2014,514174828790566912,3623,654,0,0,0.003021148,has_no_media,Cosmic study 'underestimated' dust and results are being reassessed. This is science in action! http://t.co/xHCMOxV63S
sydneyobs,Mon Sep 22 12:13:02 +0000 2014,514024570777370624,3623,654,0,0,0.011080332,has_no_media,Daily cosmobite: Centenary of Sydney's telephone time-service http://t.co/6pkn3QKu2x
sydneyobs,Sun Sep 21 08:26:31 +0000 2014,513605177769611266,3623,654,0,1,0.008264463,has_no_media,“@BFPTravel: travellers in #Australia #NewZealand here are the museums to schedule http://t.co/w4FUhZRaMk including Sydney Observatory 
sydneyobs,Sat Sep 20 12:36:16 +0000 2014,513305642967130112,3623,654,1,1,0.030567686,has_no_media,3D printer telescope snaps moon pics.  http://t.co/t3zZlF1kzh
sydneyobs,Fri Sep 19 06:34:58 +0000 2014,512852329482027008,3623,654,0,0,0.009876543,has_no_media,Spring into Space this school holidays with our astronomical program http://t.co/9L51J8mpxL
sydneyobs,Fri Sep 19 01:12:45 +0000 2014,512771240562421761,3623,654,3,6,0.03329753,has_photo,Aaaaaaarh! Skull and crossbones fly over Sydney for international talk like a pirate day. @ANMMuseum @phmuseum http://t.co/CFghrR6EdF
sydneyobs,Thu Sep 18 21:30:46 +0000 2014,512715377231417344,3623,654,10,6,0.01702685,has_no_media,Ahoy matey - It's national pirate day - we'll be flying a skull and crossbones flag to signal pirates entering Sydney Harbour @ANMMuseum
sydneyobs,Thu Sep 18 12:42:15 +0000 2014,512582373259481088,3623,654,1,2,0.014218009,has_no_media,Accessing the sky: the building of Sydney Observatory's new dome - blog 1 http://t.co/gcgzX81FZ4
sydneyobs,Tue Sep 16 12:27:44 +0000 2014,511853941072465920,3623,654,0,0,0.018181818,has_no_media,@NicolaLoaring Definitely! Has to be second time lucky this year.
sydneyobs,Tue Sep 16 03:47:54 +0000 2014,511723121556979712,3623,654,2,1,0.026530612,has_no_media,Special issue JAHH dedicated to Australian Indigenous Astronomy published and freely available online http://t.co/8vgtCmNuSc
sydneyobs,Mon Sep 15 22:36:52 +0000 2014,511644849825517568,3623,654,0,0,0.016997167,has_no_media,#abcnews Galactic cannibalism in progress. A new interpretation of globular clusters @ABCstarstuff  http://t.co/fsx9vjQ9ve
sydneyobs,Mon Sep 15 07:58:56 +0000 2014,511423911007748096,3623,654,0,0,0.007496252,has_video,The Einstein Lecture 2014 - ‘Pocket Astrophysics’ with Orsola De Marco http://t.co/W6WBhvajXz
sydneyobs,Sun Sep 14 20:33:13 +0000 2014,511251344879923200,3623,654,5,3,0.047047047,has_photo,Sydney Obs astronomy educators headed to South Aust to image #aurora. Instead Geoff got Moon-lit Murray River+Crux. http://t.co/nEcCKWdM26
sydneyobs,Sun Sep 14 03:39:19 +0000 2014,510996185180413952,3623,654,6,7,0.036741214,has_photo,Sidewalk Solar astronomy with Monty on Sundays at Sydney Observatory @phmuseum http://t.co/AaRbYhiO9g
sydneyobs,Sun Sep 14 02:57:13 +0000 2014,510985592964788225,3623,654,0,0,0.026490066,has_photo,We will be watching the Time Ball drop at precisely 1pm from Millers Point Fair  @therocks @cityofsydney http://t.co/PA5kG0gGEp
sydneyobs,Sun Sep 14 00:39:44 +0000 2014,510950991387062272,3623,654,0,1,0.071428571,has_no_media,@SteveAstorga no but waiting to hear from astronomer at large @beyond_beneath
sydneyobs,Sun Sep 14 00:30:36 +0000 2014,510948695991283712,3623,654,2,2,0.038636364,has_photo,Looking forward to the  @music @therocks Millers Point Fair today http://t.co/oF1rzHumoQ
sydneyobs,Sat Sep 13 23:55:50 +0000 2014,510939944496295936,3623,654,1,0,0.075027996,has_photo,Major outreach at Millers Point fair today near @therocks solar viewing meets archaeology and history. http://t.co/V2dsyrqunh
sydneyobs,Thu Sep 11 11:38:18 +0000 2014,510029562831306753,3623,654,1,4,0.072769953,has_no_media,The Zooniverse is expanding . If you haven't dabbled in real citizen science there are many opportunities here! https://t.co/XgqE29Aqdq
sydneyobs,Thu Sep 11 11:20:59 +0000 2014,510025207415721984,3623,654,4,3,0.044297832,has_photo,Three red objects in tonight's sky: Antares in Scorpius  Mars and Saturn via @StarWalk app http://t.co/wPsP8Gcs2g http://t.co/F9gHlI1ihj
sydneyobs,Thu Sep 11 11:14:29 +0000 2014,510023570861207552,3623,654,2,0,0.017751479,has_no_media,“@365DaysOfAstro: Today's podcast: Awesome Astronomy - September Edition http://t.co/m2erCWLw6L” serious fun - if you are a @GeekinSydney
sydneyobs,Thu Sep 11 09:44:47 +0000 2014,510000998102745089,3623,654,0,0,0.038461538,has_no_media,@manokihikihi did you see that the Solar Flare you saw was an X class Mass Coronal Ejection? What does that mean? See http://t.co/a4T0zRHxL7
sydneyobs,Mon Sep 08 22:06:27 +0000 2014,509100481004589056,3623,654,1,2,0.017799353,has_photo,3D view of the planetary system KIC 9632895 (via @ExoplanetApp) in the habitable zone and rotates around binary stars http://t.co/2PnNkRBTFI
sydneyobs,Mon Sep 08 12:00:16 +0000 2014,508947929755697153,3623,654,0,0,0.028571429,has_no_media,Daily Cosmobite: I see a supermoon setting and rising  http://t.co/YugGj4kuJ1
sydneyobs,Mon Sep 08 04:38:40 +0000 2014,508836795912429569,3623,654,1,1,0.005112474,has_no_media,Remembering WW1: Lawrence Hargrave worked at Sydney Observatory. His son  Geoffrey  died at Gallipoli http://t.co/moqr23sYk0 @1914centenary
sydneyobs,Sun Sep 07 23:26:30 +0000 2014,508758236686585856,3623,654,1,1,0.020833333,has_no_media,No  We’re Not Facing an Onslaught of Asteroid Impacts http://t.co/kUkzxh9p0Q
sydneyobs,Sun Sep 07 12:54:30 +0000 2014,508599187399655424,3623,654,2,1,0.020618557,has_no_media,On 9 Sept its the third and final #supermoon2014...not that super  still if it's clear like tonight  worth a look at moonrise - 5:56pm.
sydneyobs,Sun Sep 07 04:43:41 +0000 2014,508475668833640448,3623,654,2,2,0.049180328,has_no_media,Congratulations John Goldsmith for  amazing research and a visually spectacular website http://t.co/Gi2Gsvwfkg
sydneyobs,Sat Sep 06 06:04:46 +0000 2014,508133688115081216,3623,654,2,1,0.021482277,has_photo,3D view of the planetary system CoRoT-22 (via @ExoplanetApp) Fast and hot exoplanet orbits it's Sun every nine days! http://t.co/xkPX0fnBLE
sydneyobs,Sat Sep 06 04:50:50 +0000 2014,508115081461121025,3623,654,0,0,0.026515152,has_photo,@ESA_Rosetta @KerrieDougherty great talk about the history of comet exploration  ROSETTA - Nov 2014 lander deploy! http://t.co/4Mh6YCEJNI
sydneyobs,Sat Sep 06 04:24:58 +0000 2014,508108570571722753,3623,654,1,0,0.014888337,has_photo,@Spacecurator Kerrie Dougherty explains different types of comets + exploration missions @ultimoscience @phmuseum http://t.co/pLWzryIzx7
sydneyobs,Sat Sep 06 04:20:34 +0000 2014,508107466819661824,3623,654,1,1,0.03968254,has_photo,Speed meet geek Brenan Dew now in the transport hall @phmuseum @ultimoscience his speciality is ancient Egypt astro. http://t.co/s5CEfkdRA8
sydneyobs,Sat Sep 06 03:22:24 +0000 2014,508092828509941761,3623,654,5,2,0.033395176,has_photo,It's a great day @ultimoscience @phmuseum we are here today and tomorrow! Lots to see @spacecurator comet talk at 2 http://t.co/DDFD6iHgN5
sydneyobs,Sat Sep 06 03:16:09 +0000 2014,508091254979043328,3623,654,3,1,0.041343669,has_photo,Volunteer Matt is @ultimoscience @phmuseum explaining our solar system today and tomorrow! http://t.co/5DXYB2p2kG
sydneyobs,Sat Sep 06 02:48:58 +0000 2014,508084411758166016,3623,654,2,0,0.016282225,has_photo,Sydney Observatory is part of @ultimoscience safe solar viewing with Col and Brenan out the front of @Phm useum http://t.co/dgHaSqvlYJ
sydneyobs,Fri Sep 05 07:39:50 +0000 2014,507795225612271616,3623,654,3,1,0.025718608,has_no_media,Great talk about Comets and Rosetta by @spacecurator Kerrie Dougherty 2pm tomorrow at Ultimo Science Festival 2014 http://t.co/4lVZ9ALAsB
sydneyobs,Fri Sep 05 07:37:52 +0000 2014,507794730512420864,3623,654,2,0,0.040372671,has_no_media,Speed Meet a Geek: Sat  2-4pm Ultimo Science.  Brenan Dew  Astrophysicist + Observatory guide  is one of the geeks. http://t.co/nIzxvKFL1z
sydneyobs,Fri Sep 05 07:24:02 +0000 2014,507791249600819200,3623,654,1,2,0.065281899,has_photo,Wedding camera drone on Observatory Hill http://t.co/e98SIkWTJ9
sydneyobs,Fri Sep 05 07:23:25 +0000 2014,507791092750626816,3623,654,1,0,0.040384615,has_photo,http://t.co/eqd3TKtb0z
sydneyobs,Thu Sep 04 03:19:35 +0000 2014,507367340426539008,3623,654,1,3,0.053406998,has_photo,Sydney harbour is a sea and sky visual feast today http://t.co/HlSLbkLLJc
sydneyobs,Thu Sep 04 01:19:05 +0000 2014,507337015830921216,3623,654,0,1,0.015037594,has_no_media,Looking forward to 2014 Einstein Lecture ‘Pocket Astrophysics’ with Orsola De Marco | Ultimo Science Festival 2014 http://t.co/HFrmTF2ai6
sydneyobs,Wed Sep 03 22:39:53 +0000 2014,507296955437834240,3623,654,0,0,0.035714286,has_no_media,@GeekinSydney @PULSEatParkes @WorldSpaceWeek we have a great program over the entire school holidays! http://t.co/9L51J8mpxL
sydneyobs,Tue Sep 02 22:23:22 +0000 2014,506930407518924800,3623,654,1,2,0.022900763,has_no_media,Great technology challenge ahead! Excited to see the first 3D Printer in Space which will Launch This Month http://t.co/OeoJ2YPlId
sydneyobs,Tue Sep 02 10:26:42 +0000 2014,506750054749569024,3623,654,1,1,0.038383838,has_no_media,We are all made of stars http://t.co/JOtBAptkCT via @ConversationEDU
sydneyobs,Tue Sep 02 07:42:18 +0000 2014,506708679660281856,3623,654,0,1,0.022222222,has_no_media,@mecbc @lianerossler Not naive. The future for all city dwellers is good lighting - way to achieve it is design awareness and standards.
sydneyobs,Tue Sep 02 04:29:22 +0000 2014,506660130130108418,3623,654,0,0,0.025157233,has_no_media,@lianerossler The lighting is vital and Barangaroo designer Mark Major is aware of astronomical issues. http://t.co/XLnlZL3909 #syddesign
sydneyobs,Tue Sep 02 04:06:39 +0000 2014,506654410684891136,3623,654,0,2,0.032763533,has_photo,#syddesign @phmuseum Sydney visions. A milieu of art  opera  architecture  science  gardens  heritage. The gem? http://t.co/ykgJVOFc8S
sydneyobs,Tue Sep 02 03:24:50 +0000 2014,506643889269116928,3623,654,0,0,0.030150754,has_no_media,At #sydsydneydesign - planning cultural identity of Sydney - engagement with arts  architecture  science  technology  gardens and heritage.
sydneyobs,Mon Sep 01 21:50:50 +0000 2014,506559835819626496,3623,654,0,0,0.034482759,has_no_media,@Shence1992 @CosmossUp Moon moves into the Earths shadow at 8:15pm in Eastern Australia. See http://t.co/u4LAkav4cW
sydneyobs,Mon Sep 01 21:37:57 +0000 2014,506556589986172928,3623,654,2,0,0.047311828,has_no_media,“@CosmossUp: 5 fantastic photos of lunar eclipses http://t.co/0RbCaeb3j1 http://t.co/nvUWqD9ztr” The next Lunar Eclipse is 8 October!
sydneyobs,Mon Sep 01 08:51:19 +0000 2014,506363660923457536,3623,654,0,2,0.02247191,has_photo,The Cosmological Principle - John Webb is explaining the big concepts used when thinking 'Universe'. @sydskywatch http://t.co/KxOqLkwfCE
sydneyobs,Mon Sep 01 08:38:54 +0000 2014,506360537685295104,3623,654,0,0,0.012121212,has_photo,John Webb's talk about the shape of the Universe...the crossover between astronomy and cosmology. @sydskywatch now. http://t.co/IOHlXBdbnU
sydneyobs,Sun Aug 31 00:21:52 +0000 2014,505873065868156928,3623,654,0,1,0.024725275,has_no_media,Daily cosmobite: Saturn and the Moon http://t.co/GEnmasl7Ti
sydneyobs,Sun Aug 31 00:20:20 +0000 2014,505872679711162368,3623,654,0,0,0,has_no_media,@ProfAstroSarah yes - an area for discussion at NACAA. I'll try to get stats.
sydneyobs,Fri Aug 29 12:59:27 +0000 2014,505338943785553922,3623,654,1,0,0.017804154,has_no_media,#abcnews Telescopes refine distance to the 'Seven Sisters' http://t.co/12cNRXZr4N
sydneyobs,Fri Aug 29 01:09:39 +0000 2014,505160317312057344,3623,654,1,0,0.039835165,has_photo,The Schmidt tapestry created by Valerie Kirk (ANU) imaging ultra deep field Hubble image + science grid #asawia2014 http://t.co/96VhjCYUxb
sydneyobs,Thu Aug 28 06:12:36 +0000 2014,504874168538505216,3623,654,2,0,0.01364366,has_video,Cordelia Fine critiques Science: It's a Girl Thing as a 'masterpiece of offensiveness' ! #asawia2014 http://t.co/So71CHHGXt via @youtube
sydneyobs,Thu Aug 28 01:54:16 +0000 2014,504809157837336576,3623,654,6,3,0.012148823,has_no_media,The allure of astronomy - a great national forum is happening right now -representation of a diversity of scientists is realised #asawia2014
sydneyobs,Thu Aug 28 00:54:36 +0000 2014,504794139746004992,3623,654,1,0,0.012787724,has_photo,The leaky pipeline persists! Women fall behind in senior astro positions. Same situation worldwide . @AtheneDonald http://t.co/umEBs3B3fP
sydneyobs,Thu Aug 28 00:50:22 +0000 2014,504793077693693952,3623,654,0,1,0.010230179,has_no_media,Prof Sarah Maddison presenting stats on #asawia2014 http://t.co/svnmTVMNGk. Great data collection! #women amateur astronomers? No data...Hmm
sydneyobs,Thu Aug 28 00:26:13 +0000 2014,504786998964387840,3623,654,2,1,0.026984127,has_photo,Hon Michaela Cash found out @brianmaycom is an astronomer at Queen concert #asawia2014. http://t.co/UQds1VaoAl
sydneyobs,Thu Aug 28 00:12:06 +0000 2014,504783445269045248,3623,654,2,3,0.012842466,has_photo,We are all made of stars - Women in Astronomy 2014 at ANU opened by @cosmicpinot #asawia2014 http://t.co/XPzdZBBaCO
sydneyobs,Tue Aug 26 06:48:08 +0000 2014,504158336015556608,3623,654,0,0,0.017811705,has_no_media,Daily cosmobite: a famous cluster http://t.co/V62KPIM9Y5
