sydneyobs,Sat Apr 18 06:39:16 +0000 2015,589317251465023489,3622,654,1,1,0.015250545,has_no_media,International Dark Sky Week April 13 - 19 -  illustration showing how Inner City residents can miss out http://t.co/iGgFVGoPfx @cityofsydney
sydneyobs,Fri Apr 17 09:08:29 +0000 2015,588992417367392256,3622,654,1,0,0.00625,has_no_media,@maasmuseum @airandspace we love Star Wars and the new trailer for Star Wars: Episode VII slate Interpretation: http://t.co/EDkIty0q06
sydneyobs,Fri Apr 17 04:57:18 +0000 2015,588929202163822592,3622,654,1,0,0.018151815,has_video,We've busted out the moves for #MuseumDanceOff2! Check out how we get down at @maasmuseum + @sydneyobs! http://t.co/Li8PPp2r45
sydneyobs,Thu Apr 16 21:54:10 +0000 2015,588822719283605505,3622,654,5,3,0.036184211,has_photo,Lots of new exoplanets discovered - 3D view of the planetary system EPIC 201367065 (via @ExoplanetApp) http://t.co/aD1FMP8NCi
sydneyobs,Thu Apr 16 21:32:49 +0000 2015,588817344761200640,3622,654,0,0,0.028368794,has_video,Star Wars: The Force Awakens Official Teaser #2 "Chewy we're home!" It's not science but it makes us curious.  http://t.co/nTksXJsReZ
sydneyobs,Thu Apr 16 20:42:49 +0000 2015,588804761496858625,3622,654,0,0,0.009677419,has_no_media,Dark matter becomes less 'ghostly' http://t.co/Q7jV1GA2wu
sydneyobs,Thu Apr 16 02:38:26 +0000 2015,588531866967220224,3622,654,1,2,0.010881393,has_photo,Thanks to our Excellent volunteers helping under 8s to make models of Jupiter @maasmuseum http://t.co/2v8YQbuqfZ
sydneyobs,Thu Apr 16 02:27:40 +0000 2015,588529160487710720,3622,654,0,0,0.011363636,has_photo,Musical planets March around their orbits - who stole Jupiter? Will the asteroids bring them down? http://t.co/LeHdnBoPMT
sydneyobs,Thu Apr 16 02:24:52 +0000 2015,588528453009285121,3622,654,1,0,0.005025126,has_photo,Chockablock science shows! Great to see children and adults enthusiastic about gaseous Jupiter science! @maasmuseum http://t.co/HTn226tlFL
sydneyobs,Thu Apr 16 01:45:21 +0000 2015,588518510822719488,3622,654,0,0,0.064903846,has_photo,Even the adults are having an astronomical time at our under 8s party day! http://t.co/IxWpgrQddx
sydneyobs,Thu Apr 16 00:21:54 +0000 2015,588497507996471296,3622,654,2,1,0.033333333,has_photo,Rocket launch is go! Jupiter Party day is on now @maasmuseum http://t.co/ILTBRRu41X
sydneyobs,Wed Apr 15 21:02:03 +0000 2015,588447215326089216,3622,654,2,1,0.013528749,has_photo,Did you see astronomers in @smh who guide tours at Sydney Obs-Britton &amp; Moss? Woohoo! @cosmicpudding @maasmuseum http://t.co/vGvcJ1y27D
sydneyobs,Wed Apr 15 20:56:59 +0000 2015,588445937921437696,3622,654,2,0,0.00967118,has_no_media,It's a gorgeous day for a Jupiter Party! Under 8s come on in and get gaseous with the king of planets. http://t.co/vb0oAcvdeh
sydneyobs,Wed Apr 15 08:29:48 +0000 2015,588257905205448704,3622,654,0,0,0.014450867,has_no_media,Harry sees a Great Prominence Eject http://t.co/MMd5rvMVz9
sydneyobs,Tue Apr 14 20:35:04 +0000 2015,588078037582786560,3622,654,0,0,0.006060606,has_no_media,Comet lander tells magnetic story http://t.co/q1TzafZ8FY
sydneyobs,Tue Apr 14 20:32:34 +0000 2015,588077407912902656,3622,654,1,0,0.021505376,has_no_media,Coloured Pluto comes into view http://t.co/f4luEslDCh
sydneyobs,Mon Apr 13 21:03:57 +0000 2015,587722917045108736,3622,654,0,0,0.017241379,has_no_media,Dwarf Ceres captured in colour http://t.co/hCoupLe4y1
sydneyobs,Mon Apr 13 21:03:34 +0000 2015,587722822148993025,3622,654,0,0,0.015015015,has_no_media,Dark matter map yields first results http://t.co/bm7PzDV7dD
sydneyobs,Mon Apr 13 09:00:18 +0000 2015,587540803032985601,3622,654,1,3,0.055248619,has_photo,Amazing image of Milky Way over Erupting Volcano http://t.co/ZrTVboFx4Z http://t.co/pxPtjvSVBu
sydneyobs,Mon Apr 13 08:42:13 +0000 2015,587536255849607170,3622,654,1,1,0.007692308,has_no_media,Malala Yousafzai gets asteroid http://t.co/sI1LpF9dbR
sydneyobs,Mon Apr 13 07:13:29 +0000 2015,587513923760365569,3622,654,3,0,0.011450382,has_no_media,Space curator Kerrie Dougherty is speaking at 7:30pm tonight about the New Solar System http://t.co/8Wk1Sj6c2K
sydneyobs,Sun Apr 12 21:21:17 +0000 2015,587364890832080897,3622,654,2,0,0.012285012,has_no_media,Solving secrets of supernova and dark energy http://t.co/mj1y07GhRl
sydneyobs,Tue Apr 07 06:29:53 +0000 2015,585328622677794817,3622,654,1,1,0.033370412,has_photo,Old Brisbane Observatory. The oldest structure in QLD. Time ball once dropped at 1pm. @hist_astro @maasmuseum http://t.co/gLnfOU0c2t
sydneyobs,Mon Apr 06 10:06:52 +0000 2015,585020840447582208,3622,654,1,1,0.020700637,has_no_media,Star's birth glimpsed 'in real time' http://t.co/opKLmd4sle
sydneyobs,Sat Apr 04 12:05:54 +0000 2015,584326022989877248,3622,654,2,4,0.053503185,has_photo,Our live feed from Griffith Observatory is showing gorgeous totality pink! http://t.co/6fv4F65uKQ
sydneyobs,Sat Apr 04 12:00:48 +0000 2015,584324736282308608,3622,654,5,5,0.048282266,has_photo,Gorgeous champagne pink Lunar Eclipse #lunareclipse @maasmuseum http://t.co/Ljc5LbBTIb
sydneyobs,Sat Apr 04 10:57:17 +0000 2015,584308755824680960,3622,654,0,1,0.021377672,has_no_media,@scienceworks_mv send an image or live feed link! Total cloud in Sydney!
sydneyobs,Sat Apr 04 10:32:48 +0000 2015,584302591892262913,3622,654,0,0,0.046783626,has_no_media,Total Lunar Eclipse treat using live feed links lhttp://www.sydneyobservatory.com.au/2015/experience-an-easter-total-lunar-eclipse-treat/
sydneyobs,Sat Apr 04 10:30:34 +0000 2015,584302029486497792,3622,654,0,1,0.018058691,has_no_media,Over 8000 people tuning into the stream from @GriffithObserv - great to see!
sydneyobs,Sat Apr 04 10:28:18 +0000 2015,584301460264914944,3622,654,0,0,0.023423423,has_photo,Finding out all about #LunarEclipse as seen from the Moon http://t.co/F8rDfz9ED1
sydneyobs,Sat Apr 04 10:07:53 +0000 2015,584296321760174080,3622,654,9,15,0.021048244,has_photo,We are enjoying the live feed from @griffithobservatory #LunarEclipse @maasmuseum http://t.co/gfFLjjVCPU
sydneyobs,Sat Apr 04 10:03:13 +0000 2015,584295148118417409,3622,654,4,1,0.031156381,has_photo,Keen visitors for #LunarEclipse @maasmuseum are enjoying our welcome at the new East Dome http://t.co/mvz6dhti2X
sydneyobs,Sat Apr 04 09:56:18 +0000 2015,584293405879996416,3622,654,4,5,0.01947395,has_photo,Visitors are enjoying exhibits while waiting for clouds to clear and #LunarEclipse to start @MAAS museum http://t.co/vfsourqT97
sydneyobs,Sat Apr 04 07:53:11 +0000 2015,584262423038726144,3622,654,0,3,0.067484663,has_photo,Go away cloud! http://t.co/2wklOcsFql
sydneyobs,Sat Apr 04 07:48:08 +0000 2015,584261153615777792,3622,654,0,1,0.013435701,has_video,Its wet wet wet in Sydney but you can see and hear Brenan Dew and Willy Stevens discuss all things Lunar https://t.co/a4ZGPfceEx
sydneyobs,Sat Apr 04 05:38:48 +0000 2015,584228605028212736,3622,654,0,0,0.041666667,has_no_media,@Beechmere You have a lovely photo of a Solar Eclipse! Tonight's Lunar Eclipse  if the clouds pass  will be quite different.
sydneyobs,Sat Apr 04 05:37:51 +0000 2015,584228366447845376,3622,654,0,1,0.024305556,has_no_media,@Eastwood2122 @702sydney @wojennifer Optimism is an astronomical characteristic!
sydneyobs,Fri Apr 03 09:17:16 +0000 2015,583921194761461760,3622,654,3,3,0.028340081,has_no_media,The USA has A Tetrad Of Lunar Eclipses. In Australia tomorrow is the last one until 2018. See this interesting Video http://t.co/K8PHxqjNGr
sydneyobs,Fri Apr 03 04:35:20 +0000 2015,583850245290909697,3622,654,4,1,0.070344828,has_video,Lunar Eclipse: Brenan Dew and Willy Stevens prepare us for tomorrow's event!  https://t.co/u0PpJyVHh6 via @YouTube
sydneyobs,Thu Apr 02 23:29:59 +0000 2015,583773402877407233,3622,654,6,3,0.019520357,has_no_media,Last chance to see a total lunar eclipse from Australia until 2018 @maasmuseum #LunarEclipse #Sydneyy http://t.co/qWZjK2cnkB via @smh
sydneyobs,Thu Apr 02 23:18:39 +0000 2015,583770548896923648,3622,654,12,1,0.037102473,has_no_media,Your last chance to see a total lunar eclipse from Australia until 2018 says astronomer Geoff Wyatt http://t.co/bfXPzViP4w
sydneyobs,Wed Sep 30 13:02:01 +0000 2015,649207573485219840,3622,654,2,3,0.002932551,has_no_media,October 2015 night sky guide and sky chart http://t.co/AG2dp5qk5U
sydneyobs,Wed Sep 30 09:27:34 +0000 2015,649153603278520320,3622,654,0,1,8.37E-04,has_no_media,If the presence of life is ever detected beyond our solar system  then Sydney-born Victoria Meadows and her team will be at the centre of it
sydneyobs,Wed Sep 30 09:08:14 +0000 2015,649148737588035584,3622,654,0,2,0.001257862,has_no_media,Vikki Meadows  once a guide at Sydney Observatory  now searching for life on exo-planets with space telescopes.
sydneyobs,Wed Sep 30 08:52:31 +0000 2015,649144782489423872,3622,654,1,0,0.001005458,has_no_media,Technologies to find exo-Earths: coronagraphs and an exo-starshade  both on space telescopes  eg WFIRST-AFTA.
sydneyobs,Wed Sep 30 08:44:19 +0000 2015,649142720452104192,3622,654,1,1,0.001163975,has_no_media,Vikki Meadows: Earth's 'habitability index' is not the highest amongst presently known extra-solar planets!
sydneyobs,Wed Sep 30 08:40:53 +0000 2015,649141855561453568,3622,654,1,0,2.93E-04,has_no_media,Earth-sized planets are up to 1.6 Earth radii  above this may not be rocky  may have no surface  may not have liquid water.
sydneyobs,Wed Sep 30 08:40:13 +0000 2015,649141688221327360,3622,654,0,0,5.96E-04,has_no_media,Vikki Meadows: life beyond solar system  questions are: Are we weird? Are we alone?
sydneyobs,Wed Sep 30 08:35:10 +0000 2015,649140417745711104,3622,654,0,1,4.55E-04,has_no_media,Life beyond Solar System? Prof Vikki Meadows talking at Australian Astronomical Observatory Allison-Levick Memorial Lecture.
sydneyobs,Mon Sep 28 16:20:07 +0000 2015,648532650018213888,3622,654,3,3,0.002883691,has_no_media,So good evidence for liquid water on Mars! But its salty  cold and undrinkable. And a new word too: 'deliquescence'.
sydneyobs,Mon Sep 28 07:50:33 +0000 2015,648404414990970880,3622,654,1,0,0.034090909,has_no_media,@cosmictoner It's an eclipse-drought in Australia! Our next good one is not until Jan 2018 @StargazerFred @ABCstarstuff @sydskywatchers
sydneyobs,Wed Sep 23 07:21:42 +0000 2015,646585213468831744,3622,654,1,0,0.00125139,has_no_media,Equinox sunset today @sydneyobs  and everywhere on Earth  is due west.
sydneyobs,Tue Sep 22 20:01:36 +0000 2015,646414060364431360,3622,654,17,9,0.005232489,has_no_media,Spring equinox today - at 06:21 EAST to be precise! Equal daytime and nighttime hours. A day for balance perhaps?
sydneyobs,Tue Sep 15 23:30:33 +0000 2015,643929927851446272,3622,654,1,0,7.86E-04,has_no_media,It's #AskACurator day @maasmuseum. @sydneyobs will feature from 11am-noon. If you have a question...
sydneyobs,Fri Sep 11 02:43:05 +0000 2015,642166443132383236,3622,654,2,2,0.024081115,has_photo,@sydneyobs beautiful &amp; functional pulley  normally unseen  part of clock drive for historic south dome refractor. http://t.co/Dy98vK5fMo
sydneyobs,Fri Sep 11 02:39:22 +0000 2015,642165507907432448,3622,654,1,5,0.020679468,has_photo,@sydneyobs historic refractor and south dome almost back in service after repair &amp; restoration. Thanks Tim  Carey. http://t.co/qMovn6G5BY
sydneyobs,Mon Sep 07 09:29:02 +0000 2015,640819052110151680,3622,654,4,1,9.69E-04,has_no_media,Kvis  miriad  kpvslice @sydskywatch @sydneyobs Anita shows how astronomers visualise &amp; interpret radio data of G333 to see gas motions.
sydneyobs,Mon Sep 07 08:55:17 +0000 2015,640810559793795072,3622,654,1,0,0.012254902,has_no_media,@sydskywatch meeting @sydneyobs Anita Petzler talks about the 3d structure of giant molecular cloud G333 - important for star formation.
sydneyobs,Thu Sep 03 02:39:52 +0000 2015,639266531365421056,3622,654,6,4,0.002355158,has_no_media,Space Station in 2 bright evening passes over Sydney. Sep 3 7-7:05pm  from NW to SE. Sep 4 6:07-6:14pm also NW to SE. Both at 60deg max alt.
sydneyobs,Mon Aug 31 02:00:49 +0000 2015,638169540065497088,3622,654,0,0,0.014827018,has_no_media,@sydneyobs sydsciencefest @cosmictoner. Will tweet @WRStargazing results as soon as we have them. Seems to be a delay! Sorry all.
sydneyobs,Fri Aug 21 11:15:55 +0000 2015,634685355665440768,3622,654,0,0,0.011058452,has_no_media,@wrstargazing @sydneyobs @SydScienceFest All done. Now we reconcile the counts and wait for verification on Monday.
sydneyobs,Fri Aug 21 10:35:21 +0000 2015,634675148151373824,3622,654,4,3,0.02014652,has_photo,@wrstargazing record attempt underway. Everyone watching the sky from @sydneyobs. http://t.co/66A6gvYYBE
sydneyobs,Fri Aug 21 10:13:52 +0000 2015,634669742536552449,3622,654,0,0,0.00856531,has_photo,@WRStargazing @sydneyobs stargazers enjoying music &amp; momos. 20mins to go. Clouds are clearing. http://t.co/mmt1EOgjkT
sydneyobs,Fri Aug 21 09:24:43 +0000 2015,634657370874875904,3622,654,6,2,0.027861446,has_photo,@wrstargazing event @sydneyobs gets underway. Cloudy but we can see photons from Moon. http://t.co/59inNLmzWX
sydneyobs,Fri Aug 21 06:11:49 +0000 2015,634608827137003520,3622,654,7,0,0.004945055,has_no_media,LED lighting  more blue light  visible from space. Compare to http://t.co/Niay4jfmV7 http://t.co/llczYR8Jcs
sydneyobs,Thu Aug 20 23:35:15 +0000 2015,634509029675532289,3622,654,8,7,0.00308472,has_no_media,Tonight we attempt @WRStargazing to break 'Most People Stargazing Across Multiple Sites in a Country' world record  8:30pm.
sydneyobs,Thu Aug 20 10:31:47 +0000 2015,634311861349969920,3622,654,3,2,0.003453436,has_photo,And the comet that Warwick made! Dry ice water &amp; carbon powder. Messy black vapourising spectacle. Thanks Warwick. http://t.co/1Zpd7C9V2P
sydneyobs,Thu Aug 20 10:13:39 +0000 2015,634307298505003008,3622,654,2,1,0.002140182,has_photo,Warwick Holmes @maasmuseum #sydsciencefeat Rosetta talk with comet-making gear. http://t.co/8L2KN74ULx
sydneyobs,Wed Aug 19 04:38:49 +0000 2015,633860647193739264,3622,654,1,0,0.001896505,has_no_media,Smell a comet  make a comet @maasmuseum @SydScienceFest. https://t.co/iZ9EJfWRfC
sydneyobs,Mon Aug 17 04:02:44 +0000 2015,633126792769859584,3622,654,6,0,0.002018367,has_photo,Warwick Holmes @maasmuseum prepares for his "Philae &amp; Rosetta Comet Encounter" talk for @sydsciencefest. Thu Aug 20. http://t.co/vEGBIjIq2N
sydneyobs,Fri Aug 14 08:58:17 +0000 2015,632114003414683648,3622,654,1,2,8.74E-04,has_photo,David Malin discusses winning image @sydneyobs at Winning Sky Photos exhibition. Exhibition open until late Sept. http://t.co/wnuBjmOqHj
sydneyobs,Fri Aug 14 08:33:57 +0000 2015,632107882603917312,3622,654,0,2,0.001634192,has_photo,Geoff Wyatt introduces the Winning Sky Pictures opening talk by David Malin @sydneyobs. http://t.co/Nrq9tVhG2D
sydneyobs,Fri Aug 14 08:09:36 +0000 2015,632101753484279809,3622,654,2,2,0.003009027,has_photo,Overall winner at opening of Winning Sky Photos exhibition @sydneyobs. http://t.co/gPn4B4uZiC
sydneyobs,Wed Aug 12 19:00:32 +0000 2015,631540788879450112,3622,654,2,0,0.002685079,has_photo,Comet 67P/Churyumov-Gerasimenko closest to the Sun today  Aug 13 2015 http://t.co/3b9sZoXCKC http://t.co/Att9QFa04j
sydneyobs,Sun Aug 09 19:00:33 +0000 2015,630453631775420416,3622,654,2,2,0.004098361,has_photo,How big are the stars? http://t.co/3RxGtgmXrS http://t.co/cfXU0G81aw
sydneyobs,Sat Aug 08 19:00:57 +0000 2015,630091343746875392,3622,654,1,0,0.001913352,has_photo,A horse  two blokes and two big mirrors! http://t.co/IdsCKkxhU8 http://t.co/EBJm2BjLcX
sydneyobs,Thu Aug 06 23:56:55 +0000 2015,629441051049218048,3622,654,1,0,6.45E-04,has_no_media,An interferometer. What's that? It's the key to future astronomy. Find out more at http://t.co/OKZAibHcTy via @sydsciencefest @sydneyobs
sydneyobs,Thu Aug 06 02:09:41 +0000 2015,629112076208701440,3622,654,0,1,0.034782609,has_no_media,@MitchDoyle13 Not much to go on  but likely a fireball/bolide. Always fun to see! @weezmgk  @DoctorKarl
sydneyobs,Tue Aug 04 09:55:05 +0000 2015,628504421949833216,3622,654,2,1,0.002007696,has_no_media,What does a comet smell like? Experience for yourself at Warwick Holmes talk @SydScienceFest http://t.co/rCnS9UrvYR via @sydsciencefest
sydneyobs,Mon Jul 27 19:00:56 +0000 2015,625742684888502272,3622,654,0,0,0.010490978,has_photo,The legacy of Australia’s most influential  yet least known  telescope http://t.co/Um5ZuOUXGj http://t.co/YMWKbuSeiN
sydneyobs,Mon Jul 27 01:21:35 +0000 2015,625476092871086080,3622,654,1,1,0.007819288,has_no_media,August 2015 night sky guide and sky chart http://t.co/wVjlKXLfD7
sydneyobs,Sun Jul 26 19:01:00 +0000 2015,625380315901464576,3622,654,0,0,0.00264667,has_photo,ESA engineer Warwick Holmes to talk on Rosetta mission to comet 67P  Aug 20 2015 http://t.co/3pZaFhnLOD http://t.co/4r24QJydBd
sydneyobs,Fri Jul 24 02:03:54 +0000 2015,624399575814569984,3622,654,2,1,0.002632734,has_no_media,Aroma Festival Comes to Sydney Observatory http://t.co/IVdRzv05gR
sydneyobs,Fri Jul 17 06:47:53 +0000 2015,621934328788881408,3622,654,8,5,0.023638968,has_photo,See Venus  Jupiter and the crescent Moon this weekend http://t.co/Qk6yaRk1RQ http://t.co/5EUWeBl3k3
sydneyobs,Wed Jul 15 23:05:37 +0000 2015,621455605576826880,3622,654,2,0,0.004826255,has_no_media,#pluto "Too much is barely enough" Discovery is addictive http://t.co/joVsREtdHZ.?Category=Planets&amp;IM_ID=20261
sydneyobs,Tue Jul 14 11:56:34 +0000 2015,620924847183392769,3622,654,11,11,0.011804384,has_no_media,Congratulations New Horizons! Another milestone for humanity. And a great moment for the NH team. Pluto is no longer a distant mystery.
sydneyobs,Tue Jul 14 11:01:32 +0000 2015,620910996844969984,3622,654,2,3,0.005198488,has_no_media,3462 days down  Less than one hour to go  50 000km to Pluto. Don't blink!
sydneyobs,Tue Jul 14 09:48:39 +0000 2015,620892654562185216,3622,654,1,1,0.00156658,has_no_media,Are we there yet? New Horizons two hours and 100 000km to go to Pluto flyby. Almost there.
sydneyobs,Tue Jul 14 04:22:42 +0000 2015,620810626043019265,3622,654,3,2,0.013944223,has_no_media,Keeping up with the New Horizons Pluto flyby http://t.co/fogYHQZaa8
sydneyobs,Mon Jul 13 02:54:26 +0000 2015,620426025827090436,3622,654,1,1,0.012269939,has_no_media,@cosmictoner Mint 2 Obs Hill in 1907? Plans existed to move SydObs but Harley Wood: public protest over Mint proposal led to Obs staying put
sydneyobs,Fri Jul 10 19:01:14 +0000 2015,619582164737241092,3622,654,0,0,0.012145749,has_photo,Harry views the flares that caused the June 23  2015 aurora over Sydney http://t.co/kFeDzefsTP http://t.co/PftRpSCK9W
sydneyobs,Fri Jul 10 06:47:28 +0000 2015,619397507710226432,3622,654,3,2,0.020765027,has_photo,Wow! Now we see surface detail on Charon too. But Pluto and Charon are such different colours. http://t.co/U69hi6sf1i http://t.co/CETH5rrWL2
sydneyobs,Thu Jul 09 19:01:06 +0000 2015,619219745175433216,3622,654,0,0,0.004669261,has_photo,Deirdre sets out to catch an Active Region but comes home with a Hedgrerow http://t.co/4fGE8cLIdf http://t.co/XZkPSR1iSg
sydneyobs,Wed Jul 08 07:55:11 +0000 2015,618689773058658304,3622,654,6,5,0.061666667,has_photo,ISS over Sydney Observatory. Hard to see but just to left of bright Venus! Jupiter below. Hope you got better shots! http://t.co/u2wFMivM79
sydneyobs,Wed Jul 08 06:55:48 +0000 2015,618674828535398400,3622,654,6,3,0.036213469,has_no_media,Clouds clearing over Sydney. Get ready for ISS passage past Venus &amp; Jupiter. Venus is visible already before sunset.
sydneyobs,Tue Jul 07 04:27:11 +0000 2015,618275040618917889,3622,654,1,1,0.011121409,has_photo,Pluto – New Horizons images vs the 2010 “Buie” maps http://t.co/wpsz0Zdrpr http://t.co/GHpgxgLLon
sydneyobs,Mon Jul 06 19:00:14 +0000 2015,618132365617971200,3622,654,0,0,0.00137741,has_no_media,Growing up with Pluto #4 – Surface features! http://t.co/8ywA853yAB
sydneyobs,Sun Jul 05 19:00:16 +0000 2015,617769985058799618,3622,654,1,0,0.014613779,has_photo,Growing up with Pluto #3 – Two frozen worlds http://t.co/KgH1Iog8vE http://t.co/d9OCiZC7YQ
sydneyobs,Sun Jul 05 05:11:20 +0000 2015,617561377817800704,3622,654,0,0,0.002280502,has_no_media,"Light Pollution: Dimmer is Brighter" Mike Chapman talks  Skywatchers meeting Sydney Obs Mon 6 July http://t.co/8Wk1Sj6c2K
sydneyobs,Sat Jul 04 19:00:49 +0000 2015,617407734552526848,3622,654,0,0,0.00861244,has_photo,Growing up with Pluto #2 – First sign of moon Charon http://t.co/NErqvdabWV http://t.co/oDcDtPP8N8
sydneyobs,Fri Jul 03 19:00:34 +0000 2015,617045282623127552,3622,654,0,0,0.014102564,has_photo,Growing up with Pluto #1 – Simply a dot in the sky http://t.co/Uf7Za27GMi http://t.co/xYsccWJHWV
sydneyobs,Thu Jul 02 23:27:19 +0000 2015,616750026157457409,3622,654,1,1,0.014164306,has_no_media,July 2015 night sky guide podcast  transcript and sky chart http://t.co/qLcqo7B66V
sydneyobs,Thu Dec 31 08:23:55 +0000 2015,682477269562986496,3622,654,2,5,0.04787234,has_photo,The night begins... Sydney observatory New Years sunset! https://t.co/bc4VMIBH4C
sydneyobs,Thu Dec 31 03:00:23 +0000 2015,682395848177680384,3622,654,6,5,0.029126214,has_photo,Can you spell out our Signal Station flags....? "Happy New Year" from @sydneyobs https://t.co/uelK9bte7S
sydneyobs,Thu Dec 31 00:15:39 +0000 2015,682354392012472320,3622,654,0,1,0.038461538,has_no_media,@some_amanda HI Amanda  if youre quick you may still get in. call  9217 0186
sydneyobs,Wed Dec 30 23:09:01 +0000 2015,682337623923232769,3622,654,5,11,0.031609195,has_photo,Women in STEM. Our fabulous team today at sydney observatory! @sydneyobs @maasmuseum https://t.co/LbApy4BSIZ
sydneyobs,Wed Dec 30 19:55:01 +0000 2015,682288800928665600,3622,654,2,2,0.010447761,has_no_media,A stunning part of the world - especially at this time of the year. Aurora hunting time  https://t.co/8kxKpdUfIh
sydneyobs,Wed Dec 30 10:52:49 +0000 2015,682152353949036544,3622,654,0,1,0.058823529,has_no_media,@pancakesjones yes there are a few. Tx for your interest. How many do you want? Pls provide your mobile to confirm your place.
sydneyobs,Wed Dec 30 06:24:56 +0000 2015,682084938489966593,3622,654,0,2,0.092833876,has_photo,We have some spaces left for NYE at sydney observatory. $100 pp to the first 5 to message https://t.co/v73F6VxdiM https://t.co/jk1OeY8M55
sydneyobs,Tue Dec 29 20:06:29 +0000 2015,681929302011580417,3622,654,5,7,0.057809331,has_photo,Look up for the International Space Station pass over 9pm #NewYearsEve @sydneyobs fireworks! https://t.co/C9dLeYrFTh
sydneyobs,Tue Dec 29 20:00:51 +0000 2015,681927884676567041,3622,654,0,1,0.018666667,has_no_media,Breathtaking images viewable through our north dome solar telescope currently @FlareAware.  https://t.co/2x77Xu3YHC
sydneyobs,Tue Dec 29 02:05:28 +0000 2015,681657255595380736,3622,654,3,2,0.058414465,has_photo,Thanks for visiting at 12:59! Great group of families watching historic time ball drop today and everyday at 1pm https://t.co/rHWsOJlEVY
sydneyobs,Mon Dec 28 06:29:23 +0000 2015,681361284533628928,3622,654,0,0,0,has_no_media,Some good holiday sci-fi reading! Tips from top scientists https://t.co/mDshBJ787Y
sydneyobs,Sun Dec 27 20:02:57 +0000 2015,681203637096329217,3622,654,2,1,0.009039548,has_no_media,Looking for something to do with the kids this wet Sydney day? How about a 3D space movie or planetarium? Park at @Barangaroo - 5 mins away
sydneyobs,Sun Dec 27 19:44:20 +0000 2015,681198951178047489,3622,654,0,1,0.003984064,has_no_media,Beautiful siding Spring under a double rainbow.  https://t.co/JoBoJeuwOm
sydneyobs,Sun Dec 27 11:36:11 +0000 2015,681076103197241346,3622,654,1,0,0.009487666,has_no_media,Big year ahead for James Webb telescope https://t.co/fthKbZeH4z
sydneyobs,Sun Dec 27 11:31:44 +0000 2015,681074982697316353,3622,654,0,2,0.013384321,has_no_media,Enceladus: Does this moon hold a second genesis of life? https://t.co/4VXKrCFJH9
sydneyobs,Sat Dec 26 21:05:19 +0000 2015,680856941103468544,3622,654,3,6,0.020304569,has_no_media,A great historical female astronomer! https://t.co/xcPt6hnkvq
sydneyobs,Sat Dec 26 08:43:56 +0000 2015,680670369401851904,3622,654,4,2,0.020531401,has_no_media,Read this  then come to our talk @sydneyobs 18 Mar6pm. https://t.co/vduIKAsQCL https://t.co/ERdbP04nYH
sydneyobs,Wed Dec 23 19:37:45 +0000 2015,679747742801854465,3622,654,0,0,0.002247191,has_no_media,The debate continues https://t.co/xR4dCiVKkb
sydneyobs,Wed Dec 23 19:31:31 +0000 2015,679746172999700480,3622,654,2,1,0.011435832,has_no_media,We've been asked this a lot this week...  https://t.co/eNFIZa4eDh
sydneyobs,Wed Dec 23 19:19:07 +0000 2015,679743051992973312,3622,654,0,0,0.011331445,has_no_media,Christmas comes to iss.  https://t.co/KumHP7Uty1
sydneyobs,Wed Dec 23 10:33:03 +0000 2015,679610662054539264,3622,654,0,0,0.027896996,has_no_media,Hey @Millielily what time are you going to be on 2GB tomorrow chatting about the full moon on #Christmas day?
sydneyobs,Wed Dec 23 07:32:06 +0000 2015,679565127549505538,3622,654,0,1,0.05,has_no_media,This looks amazing!  https://t.co/Jsg1hdvwxX
sydneyobs,Tue Dec 22 09:45:00 +0000 2015,679236185500160000,3622,654,5,6,0.027340514,has_no_media,Due to popularity we've got +20 seats to our Summer Series talk on Black Holes with Fred Watson 21 Jan here: https://t.co/pLuwjUFIZc
sydneyobs,Tue Dec 22 05:27:45 +0000 2015,679171443964305408,3622,654,2,3,0.031034483,has_photo,Powerful aurora puts on spectacular display in Tasmania - via @abcnews https://t.co/VJd0bqpUtg https://t.co/22grfDLcHk
sydneyobs,Tue Dec 22 05:27:16 +0000 2015,679171323717771264,3622,654,2,3,0.021341463,has_photo,Spectacular icy clouds rival auroras in Norway skies - via @abcnews https://t.co/Zi7IxH5x6j https://t.co/n5Kt51Osxh
sydneyobs,Tue Dec 22 01:00:22 +0000 2015,679104154573381632,3622,654,1,1,0.009188361,has_no_media,Join Ed Buckbee at @sydneyobs for a free talk about the first astronauts to fly in space. 4 Jan 11.30am https://t.co/hbTiJjXVNi @JackieSlav
