sydneyobs,Fri Nov 07 19:48:58 +0000 2014,530809152701231105,3622,654,1,0,0.037348764,has_no_media,The dome being built in 1952 - see how Sydney had no high-rise http://t.co/VmCdOCejSh @702sydney @salmonmornay
sydneyobs,Fri Nov 07 19:43:13 +0000 2014,530807706781626368,3622,654,2,1,0.008083141,has_no_media,@salmonmornay @702sydney Simon Marnie wll be talking about Accessing the sky in Sydney Observatory's new dome http://t.co/5o9SzNSTv6 …
sydneyobs,Fri Nov 07 09:20:19 +0000 2014,530650947119091713,3622,654,3,2,0.026941363,has_no_media,Accessing the sky - building Sydney Observatory's new dome - blog 6 http://t.co/5o9SzNSTv6
sydneyobs,Fri Nov 07 09:17:25 +0000 2014,530650216194519040,3622,654,1,0,0.013084112,has_no_media,Urban light pollution: Why we're all living with permanent 'mini jet-lag' - http://t.co/kYwv82YcHC #GoogleAlerts
sydneyobs,Thu Nov 06 20:37:47 +0000 2014,530459051092500480,3622,654,0,0,0,has_no_media,Daily cosmobite: Harley Wood's dome under construction - historic background to our current reconstruction program http://t.co/VaRXTP49e6
sydneyobs,Thu Nov 06 20:35:57 +0000 2014,530458589404864512,3622,654,0,1,0.022012579,has_no_media,Planet formation captured in photo http://t.co/rxEUNfuYeu
sydneyobs,Thu Nov 06 20:35:17 +0000 2014,530458421041319936,3622,654,1,0,0.011764706,has_no_media,Half of stars are 'outside galaxies' http://t.co/gc86SrDc1T
sydneyobs,Thu Nov 06 13:39:05 +0000 2014,530353679958671360,3622,654,0,0,0.037190083,has_no_media,Accessing the sky - building Sydney Observatory's new dome - blog 6  'Return of the dome' http://t.co/5o9SzNSTv6
sydneyobs,Thu Nov 06 06:47:29 +0000 2014,530250096881852416,3622,654,1,0,0.006451613,has_no_media,VLA and the town that never was.... see the Bracewell sundial in this report form Melissa Hulbert in New Mexico http://t.co/7XVwt0nsGK
sydneyobs,Wed Nov 05 21:54:38 +0000 2014,530116002994876416,3622,654,8,4,0.027461487,has_photo,There ain't nothing like a dome coming back to its home! @phthinkspace @phmuseum @AAOastro @troygrant http://t.co/cZ1PQFzkD5
sydneyobs,Wed Nov 05 21:08:11 +0000 2014,530104312546865152,3622,654,6,3,0.035320088,has_photo,@troygrant @johnajaka celebrating the return of Sydney Observatory historic dome @phmuseum http://t.co/WUrI9FR6Ob
sydneyobs,Wed Nov 05 19:16:22 +0000 2014,530076172642578433,3622,654,3,4,0.033101045,has_photo,Today  winds permitted  the dome goes on - a big moment in building an accessible dome and reinstating heritage. http://t.co/AeqmupEuPX
sydneyobs,Wed Nov 05 19:10:43 +0000 2014,530074752572862464,3622,654,0,0,0.02166065,has_no_media,Daily cosmobite: The Andromeda galaxy http://t.co/L05zTMGY4j
sydneyobs,Wed Nov 05 04:36:50 +0000 2014,529854832396361728,3622,654,1,0,0.016241299,has_no_media,Solar Eclipse Conference – Part 2 http://t.co/8My4hEWJo2
sydneyobs,Wed Nov 05 03:46:44 +0000 2014,529842223827795968,3622,654,0,2,0.03125,has_no_media,Gough &amp; Margaret Whitlam: thanks for your time. @whitlammemorial http://t.co/nJncW3DWDL
sydneyobs,Tue Nov 04 10:29:18 +0000 2014,529581142911877121,3622,654,0,0,0.009433962,has_no_media,Daily cosmobite: Constellation Pegasus  the Winged Horse http://t.co/mx2qJk9vj0
sydneyobs,Mon Nov 03 21:59:29 +0000 2014,529392444551348224,3622,654,0,0,0.013192612,has_no_media,Sydney Observatory astrograph dome returned in the wee hours of 4 Nov. Welcome home! https://t.co/ECd9NLJ9e5
sydneyobs,Mon Nov 03 09:24:25 +0000 2014,529202429410017281,3622,654,0,0,0.018581081,has_photo,Nick @sydskywatch presents highlights of the month including a close encounter with comet Siding Spring @AAOastro http://t.co/fKZyYc4Wo4
sydneyobs,Mon Nov 03 09:15:55 +0000 2014,529200290310787072,3622,654,0,2,0.056239016,has_photo,#sydneyharbour never looked so good as the backdrop to @sydskywatch observer  Ross and his solar photography kit! http://t.co/dM1b4TCEUU
sydneyobs,Mon Nov 03 08:14:26 +0000 2014,529184817783390209,3622,654,0,1,0.0056926,has_no_media,#exoplanet Our solar system appears to be unusual so far. Dr Kedziora-Chudczer researching exoplanet atmospheres is challenging!
sydneyobs,Mon Nov 03 08:02:09 +0000 2014,529181725734080513,3622,654,0,1,0.004587156,has_no_media,We are learning about 'Super-Earths' 'Hot-Jupiters' and 'Hot-Neptunes' exoplanet science is exciting! @sydskywatch
sydneyobs,Mon Nov 03 07:47:12 +0000 2014,529177961925062656,3622,654,1,1,0.009118541,has_photo,Dr Lucyna Kedziora-Chudczer is talking about the search for liquid on extra solar planets @sydskywatch  @UNSWScience http://t.co/RZA68e2uzP
sydneyobs,Sun Nov 02 20:02:55 +0000 2014,529000722885406720,3622,654,0,0,0.021341463,has_no_media,Daily cosmobite: First ever images of a nova explosion http://t.co/JQTJzopcHi
sydneyobs,Sun Nov 02 04:06:48 +0000 2014,528760108440748032,3622,654,0,3,0.041484716,has_no_media,Looking forward to the delivery of the dome this coming week for Sydney Observatory's new accessible telescope http://t.co/ij5DGvtg9D
sydneyobs,Sat Nov 01 13:08:00 +0000 2014,528533917742030848,3622,654,0,0,0.008379888,has_no_media,#abcnews China's 'little flyer' returns to Earth http://t.co/XiBUMCB5nZ
sydneyobs,Sat Nov 01 13:05:24 +0000 2014,528533265720676352,3622,654,1,0,0.004158004,has_no_media,Space project will go on - Branson http://t.co/L1WfFoPyKv
sydneyobs,Sat Nov 01 01:49:34 +0000 2014,528363186919981057,3622,654,1,0,0.007434944,has_no_media,Search for Water on Extra Solar Planets by Using Polarized Light by Dr Lucyna Kedziora-Chudczer http://t.co/uZYrLGmuQN
sydneyobs,Fri Oct 31 20:51:06 +0000 2014,528288071960117248,3622,654,1,0,0.028301887,has_no_media,One dead in SpaceShipTwo test crash http://t.co/Jir2N9arnf
sydneyobs,Fri Oct 31 11:52:55 +0000 2014,528152637305126912,3622,654,8,8,0.066596195,has_photo,Milky Way over Devils Tower http://t.co/Th31D1wsW2 http://t.co/JobE0ZEngz
sydneyobs,Fri Oct 31 07:39:28 +0000 2014,528088851378479105,3622,654,0,1,0.017142857,has_no_media,First quarter Moon - Mare Tranquilitatis. Photo by first flight inventor Lawrence Hargrave who worked at Sydney Obs. http://t.co/ZI0IDvBYJ4
sydneyobs,Fri Oct 31 06:08:57 +0000 2014,528066073220751363,3622,654,6,0,0.015189873,has_no_media,Next Monday's Sky Watcher event: Search for Water on Extra Solar Planets by Dr Kedziora-Chudczer  @sydskywatch http://t.co/RmLZlKPVhp
sydneyobs,Thu Oct 30 10:55:38 +0000 2014,527775829921501184,3622,654,0,0,0.018181818,has_no_media,Aboriginal rock art - how old is it actually? › Ask an Expert (ABC Science): http://t.co/7rkNN35VWN
sydneyobs,Thu Oct 30 09:25:27 +0000 2014,527753137948352512,3622,654,1,2,0.016759777,has_no_media,Accessing the Sky: building Sydney Observatory's new accessible dome - blog 5 http://t.co/ij5DGvtg9D
sydneyobs,Thu Oct 30 09:23:12 +0000 2014,527752570572251136,3622,654,3,1,0.017208413,has_no_media,November 2014 night sky guide podcast  transcript and sky chart http://t.co/ZzaZ5kyyte
sydneyobs,Thu Oct 30 04:07:01 +0000 2014,527673001676771329,3622,654,0,0,0.013586957,has_no_media,Daily Cosmobite: The Halloween Hole - Looking out of the Milky Way http://t.co/QjtSt76IDG
sydneyobs,Wed Oct 29 04:24:02 +0000 2014,527314893150486529,3622,654,0,0,0.017456359,has_no_media,Orbital Sciences rocket  station cargo ship  lost in spectacular launch mishap | Spaceflight Now http://t.co/V2RwTOymr4
sydneyobs,Tue Oct 28 19:57:48 +0000 2014,527187495687962624,3622,654,0,0,0.018518519,has_no_media,@JeremyRHook there is a posting on our Lights in the Sky blog Q&amp;A with a similar observation: http://t.co/HScjdqjXHK. Please comment there.
sydneyobs,Tue Oct 28 19:53:37 +0000 2014,527186442733117441,3622,654,0,0,0,has_no_media,Daily Cosmobite: Centenary of Sir David Gill's death http://t.co/hh9c6FdwMK
sydneyobs,Tue Oct 28 19:52:26 +0000 2014,527186146934022144,3622,654,1,1,0.02247191,has_no_media,@tribesofsydney Luckily there is another Total Lunar Eclipse in April 2015 so plenty of time to practise.
sydneyobs,Tue Oct 28 19:50:29 +0000 2014,527185654690508800,3622,654,2,2,0.075,has_no_media,Fantastic images of Earth and Moon from Space. Australia is easily seen in this image. http://t.co/OPIKr25JNL
sydneyobs,Mon Oct 27 20:04:56 +0000 2014,526826902594396160,3622,654,1,0,0.051912568,has_no_media,IPhone Moon Imaging Without a Telescope http://t.co/Z9UV30L0DO
sydneyobs,Mon Oct 27 20:01:27 +0000 2014,526826025338933248,3622,654,0,0,0.009966777,has_no_media,Daily Cosmobite: Moon and Mars in the west http://t.co/UWz3CWsHHv
sydneyobs,Mon Oct 27 12:14:59 +0000 2014,526708636957949952,3622,654,0,0,0.013157895,has_no_media,Accessing the Sky: building Sydney Observatory's new accessible dome - blog 5 the Grubb telescope mount arrives back! http://t.co/ij5DGvtg9D
sydneyobs,Mon Oct 27 12:00:17 +0000 2014,526704937426628608,3622,654,0,0,0.065934066,has_no_media,@mckSt3ve @madcatjo2point0 No other reports of this nature on our 'LIghts in the Sky' blog http://t.co/HScjdqjXHK Perhaps you could submit?
sydneyobs,Mon Oct 27 08:57:53 +0000 2014,526659033709572098,3622,654,7,5,0.100689655,has_photo,Moon has a wry smile over Sydney Harbour tonight - it is a gorgeous evening for astronomy! http://t.co/8PrG9VcxDB
sydneyobs,Sun Oct 26 20:41:08 +0000 2014,526473624299925504,3622,654,0,0,0.014164306,has_no_media,November 2014 night sky guide podcast  transcript and sky chart http://t.co/ZzaZ5kyyte
sydneyobs,Sun Oct 26 20:40:32 +0000 2014,526473475729276928,3622,654,0,0,0,has_no_media,Daily cosmobite: The Spare-Tyre nebula in Grus http://t.co/j9YPKBxnz3
sydneyobs,Sat Oct 25 07:00:27 +0000 2014,525904707265376258,3622,654,5,2,0.012096774,has_no_media,Government: Observatory makes stars more accessible -  @phmuseum http://t.co/CukHDqoEuz via @smh
sydneyobs,Sat Oct 25 01:13:19 +0000 2014,525817347202760704,3622,654,0,1,0.045045045,has_photo,smartphone photo from Sydney Obs H-Alpha safe solar telescope - magnificent sunspot group + large filament @phmuseum http://t.co/CWhB8LO57t
sydneyobs,Fri Oct 24 20:25:42 +0000 2014,525744964358008832,3622,654,0,0,0.00110011,has_no_media,@RogerHighfield Congratulations great things happening at London Science Museum!
sydneyobs,Fri Oct 24 10:14:59 +0000 2014,525591274292645888,3622,654,1,1,0.043668122,has_no_media,Sunspot almost outshines eclipse. A report from New Mexico by Melissa Hulbert on the Solar Eclipse &amp; conference http://t.co/ONJneReUMj
sydneyobs,Fri Oct 24 09:10:34 +0000 2014,525575064486297600,3622,654,1,1,0.060240964,has_no_media,@tribesofsydney Our telescope will get two wopping great tubes through its 'head' in a few weeks time.
sydneyobs,Fri Oct 24 05:17:31 +0000 2014,525516414786879489,3622,654,1,0,0.018475751,has_no_media,Daily cosmobite: Today's eclipse and Saros 153 http://t.co/KELaY8BUeN
sydneyobs,Fri Oct 24 05:17:08 +0000 2014,525516319450337280,3622,654,1,0,0.011764706,has_no_media,What a great Partial Solar Eclipse video! Thanks Griffiths Observatory!  @livestream: http://t.co/PGSplaIJcN
sydneyobs,Fri Oct 24 04:50:14 +0000 2014,525509548375683072,3622,654,2,1,0.04353562,has_photo,Very nice sunspot group  on the sun today. Through the H-alpha we  are also seeing large filaments. @phmuseum http://t.co/VCKXNCyx6u
sydneyobs,Thu Oct 23 22:37:53 +0000 2014,525415844734451712,3622,654,4,8,0.046087889,has_photo,The Astrographic telescope mount is located! Back after 30 years. @AAOastro @ROGAstronomers http://t.co/FnUobihwj1
sydneyobs,Thu Oct 23 21:53:44 +0000 2014,525404732077375488,3622,654,1,0,0.039568345,has_photo,The 1890 Grubb telescope on the back of a truck returns to Sydney Observatory today @AAOastro - new exhibit in Jan. http://t.co/4HtCcpHNyD
sydneyobs,Thu Oct 23 21:48:31 +0000 2014,525403419553460224,3622,654,0,3,0.032634033,has_photo,The 1890 Star Camera telescope arrives back at Sydney Observatory today - an historic moment! http://t.co/UV8jB9wZqp
sydneyobs,Thu Oct 23 21:08:51 +0000 2014,525393437533548544,3622,654,1,0,0.01618123,has_no_media,Impressive live stream from Griffiths Observatory  see the eclipse start in a few minutes http://t.co/e7g8r6bS5B
sydneyobs,Thu Oct 23 20:48:38 +0000 2014,525388348844544000,3622,654,0,1,0.011461318,has_no_media,It's sunny and 28deg in Los Angeles today - perfect for the partial @eclipse @702sydney @ABCstarstuff @beyond_beneath http://t.co/e7g8r6bS5B
sydneyobs,Thu Oct 23 20:38:43 +0000 2014,525385855452844032,3622,654,0,0,0.04109589,has_no_media,@PeoplesAstro @_dmurphy_  Let's hope LA lives up to its sunny reputation for the partial #Eclipse soon to start  http://t.co/u1U5fsYC6z
sydneyobs,Thu Oct 23 20:18:15 +0000 2014,525380703106908162,3622,654,6,1,0.021419355,has_no_media,Live stream of partial solar #eclipse in North America begins in 42mins. Two options available via this link http://t.co/u1U5fsYC6z
sydneyobs,Thu Oct 23 12:03:16 +0000 2014,525256137965187072,3622,654,3,1,0.015717092,has_no_media,Don't miss the partial solar #eclipse via a live feed AEDT 8am Friday from  http://t.co/e7g8r6bS5B
sydneyobs,Thu Oct 23 12:00:10 +0000 2014,525255355916222465,3622,654,0,1,0.013157895,has_no_media,“@The_SolarSystem: Partial Solar #Eclipse to Dazzle US on Thursday! Aussies can watch live feed 8am Friday http://t.co/gRuDo9wZJV.
sydneyobs,Thu Oct 23 06:14:12 +0000 2014,525168290356658176,3622,654,0,0,0.029972752,has_no_media,Daily cosmobite: A partial solar eclipse http://t.co/e7g8r6bS5B
sydneyobs,Thu Oct 23 06:12:58 +0000 2014,525167981949485056,3622,654,0,0,0.19047619,has_no_media,@BrianKronberger @TrollKingofChat our web team will investigate!
sydneyobs,Wed Oct 22 22:27:12 +0000 2014,525050765182636032,3622,654,0,0,0.003533569,has_no_media,Daily cosmobite: A partial solar eclipse in the US seen via a live link Friday morning http://t.co/e7g8r6bS5B
sydneyobs,Tue Oct 21 21:29:43 +0000 2014,524673912299216897,3622,654,0,0,0.003745318,has_no_media,Daily cosmobite: Constellation Grus  the Crane http://t.co/pU6NAFjS86
sydneyobs,Tue Oct 21 09:46:21 +0000 2014,524496905435226112,3622,654,0,1,0.023094688,has_no_media,Memories of Gough &amp; Margaret Whitlam: thanks for your time. http://t.co/nJncW3DWDL #GoughWhitlam @phmuseum
sydneyobs,Tue Oct 21 09:36:04 +0000 2014,524494316417208321,3622,654,2,2,0.031353135,has_no_media,Gough &amp; Margaret Whitlam: thanks for your time. http://t.co/nJncW3DWDL
sydneyobs,Mon Oct 20 11:56:05 +0000 2014,524167165637709825,3622,654,2,0,0.099415205,has_no_media,Partial Solar Eclipse 6:38am AEDT  24 Oct is not visible from Australia. We will keep you informed of live feeds: http://t.co/fDgX4ZULvm
sydneyobs,Mon Oct 20 08:31:32 +0000 2014,524115687208263680,3622,654,1,0,0.009153318,has_no_media,Daily cosmobite: Comet Siding Spring (C/2013 A1) skims past Mars http://t.co/YTJNbtrLz2
sydneyobs,Sun Oct 19 12:33:56 +0000 2014,523814304126992384,3622,654,1,1,0.025,has_no_media,Orbiters on alert as comet skims Mars http://t.co/ir9SB7S4Ws
sydneyobs,Sat Oct 18 10:59:27 +0000 2014,523428137929961472,3622,654,0,0,0.095238095,has_no_media,@WonkyAstronomer Seems it could be both!
sydneyobs,Sat Oct 18 07:21:45 +0000 2014,523373353550102529,3622,654,2,1,0.019117647,has_photo,A dynamic talk tonight from Clive Ruggles about Polynesian archaeo astronomy. http://t.co/jjHmj2CNM4
sydneyobs,Sat Oct 18 04:40:08 +0000 2014,523332677936496641,3622,654,0,1,0.011363636,has_no_media,Special archaeo astronomy event tonight with Clive Ruggles  http://t.co/YV7wHUhRi0
sydneyobs,Fri Oct 17 19:17:06 +0000 2014,523190987422576640,3622,654,0,0,0.009584665,has_no_media,Saturn's Death Star moon is 'wonky or watery' http://t.co/j1n9NHMeZP
sydneyobs,Fri Oct 17 11:01:32 +0000 2014,523066274184589312,3622,654,0,0,0.015841584,has_photo,Anthony Bastic awards Sea Mirror grand lighting award @VividSydney @sydskywatch @phmuseum http://t.co/Asq8Ad4n2c
sydneyobs,Fri Oct 17 10:58:51 +0000 2014,523065600088612864,3622,654,1,1,0.019883041,has_photo,Ruth McDermott and Ben Baxter run award @IES @VividSydney @phmuseum @ArtsNSW http://t.co/zm9R9faSYz
sydneyobs,Fri Oct 17 08:58:21 +0000 2014,523035274851266561,3622,654,0,0,0.019455253,has_photo,James Laurendent ex @phmuseum wins prestigious lighting award @ IES AWARDS @sydskywatch http://t.co/VyhrHtD82E
sydneyobs,Fri Oct 17 08:40:30 +0000 2014,523030782130929666,3622,654,0,0,0.030769231,has_no_media,@VividSydney @IDADarkSky IES LIGHTING Awards ceremony- there is such a thing as environmental creative external light! @GuideDogsNSWACT
sydneyobs,Thu Oct 16 21:03:51 +0000 2014,522855462346051584,3622,654,1,1,0.015060241,has_no_media,Daily cosmobite: Mercury reaches inferior conjunction today http://t.co/u04MYX7TJC
sydneyobs,Thu Oct 16 12:05:20 +0000 2014,522719940390842368,3622,654,0,0,0.008522727,has_no_media,Vale James S. Kerr: a vocal and expert advocate for heritage and Conservation Plan methodology  including Sydney Obs. http://t.co/YV7wHUhRi0
sydneyobs,Thu Oct 16 08:37:34 +0000 2014,522667654079721473,3622,654,1,3,0.019469027,has_video,Fantastic short movie! Steve and the stars. Inspiring!  http://t.co/i45xZrx2XF via @youtube
sydneyobs,Thu Oct 16 08:23:45 +0000 2014,522664178528432128,3622,654,0,0,0.002475248,has_no_media,Starbugs: Mini Robots Go Observing - Sky &amp; Telescope - Star Wars sounds good sung by starbugs http://t.co/tabXkAbEwx via @sharethis
sydneyobs,Thu Oct 16 08:15:33 +0000 2014,522662114628886529,3622,654,4,2,0.029567054,has_photo,@astropixie presents the future of the AAO - and describes the amazing GAMA survey of galaxies. Wish you were here! http://t.co/uLMxqsoo5l
sydneyobs,Thu Oct 16 07:57:20 +0000 2014,522657530002952193,3622,654,1,0,0.011538462,has_no_media,The Image Photon Counting System  developed by Alec Boksenberg was one of the most important instruments @AAOastro  http://t.co/lEjDXHI2Os
sydneyobs,Thu Oct 16 07:48:28 +0000 2014,522655298972958720,3622,654,2,1,0.009876543,has_photo,Warrick Couch Director of AAO reminds us if the role Bart Bok played in getting funds &amp; political impetus. @AAOastro http://t.co/k5lIL5NXz6
sydneyobs,Thu Oct 16 07:41:33 +0000 2014,522653558802358273,3622,654,0,0,0.010799136,has_photo,Andrew Hopkins head of research and outreach at AAO starts tonight's proceedings - looking forward to film premiere! http://t.co/aViYqeR7Nd
sydneyobs,Thu Oct 16 07:38:38 +0000 2014,522652825738678274,3622,654,0,2,0.005665722,has_no_media,Tonight's talk celebrates 40years of the AAO and it's just about to start at the ABC ULTIMO http://t.co/FmE80AUCS4
sydneyobs,Wed Oct 15 21:15:58 +0000 2014,522496123785605120,3622,654,0,0,0.007434944,has_no_media,Daily cosmobite: Happy 40th Birthday AAT! http://t.co/IKpAUzJy1f
sydneyobs,Wed Oct 15 20:57:26 +0000 2014,522491462978523136,3622,654,0,0,0.022641509,has_no_media,Comet landing gets green light http://t.co/SFld9qEso3
sydneyobs,Wed Oct 15 03:24:18 +0000 2014,522226429828673536,3622,654,1,1,0.034574468,has_no_media,If you really want to understand Einstein's relativity theory this is an engaging way to  do so. Starts 21st Oct. http://t.co/wiUT54WQ8b
sydneyobs,Wed Oct 15 00:01:17 +0000 2014,522175338965528576,3622,654,4,1,0.022637795,has_no_media,http://t.co/FmE80AUCS4. Looking forward to this talk tomorrow night at ABC Ultimo on Australia's main optical observatory. @AAO @phmuseum
sydneyobs,Tue Oct 14 22:39:38 +0000 2014,522154793196732417,3622,654,0,0,0.017482517,has_no_media,Daily cosmobite: Warrumbungles view from Mt Woorut http://t.co/qYsXou3ObC
sydneyobs,Tue Oct 14 22:25:38 +0000 2014,522151268274302976,3622,654,0,1,0.01754386,has_video,@beyond_beneath @ellinjaa Great composition of three eclipses!  2 Lunar and one partial Solar  in three landscapes https://t.co/1xgfWNecZc
sydneyobs,Tue Oct 14 12:20:56 +0000 2014,521999092524675072,3622,654,2,1,0.073446328,has_no_media,Lightning Strike  Sydney Harbour  1892 - storms on the harbour are spectacular events and tonight's is no exception http://t.co/0cPrcnu17W
sydneyobs,Tue Oct 14 10:55:37 +0000 2014,521977623576993793,3622,654,1,1,0.041666667,has_no_media,@beyond_beneath @ellinjaa Can't wait to see you Lunar Eclipse video!
sydneyobs,Mon Oct 13 21:17:53 +0000 2014,521771833167585280,3622,654,0,0,0.006578947,has_no_media,Daily cosmobite: Harley wood still searching for telescope sites  1958 http://t.co/3r98jlipyc
sydneyobs,Mon Oct 13 10:51:35 +0000 2014,521614220299739136,3622,654,1,2,0.02238806,has_no_media,WOW! Celebrate AAO Telescope's 40th anniversary FREE Warrick Couch &amp; @astropixie presentation Thurs 16 Oct ABC Ultimo http://t.co/8ay0dz2XB4
sydneyobs,Mon Oct 13 09:04:40 +0000 2014,521587313898319872,3622,654,0,0,0.045714286,has_no_media,Daily cosmobite: The Earth is a sphere http://t.co/QKMLaetVeK
sydneyobs,Mon Oct 13 09:03:58 +0000 2014,521587134327578624,3622,654,3,2,0.032051282,has_video,Spectacular Siding Spring Observatory fly-over film:  Eyes on the Sky: http://t.co/yWukwgHF8o via @YouTube
sydneyobs,Sun Oct 12 08:50:02 +0000 2014,521221241705734144,3622,654,4,2,0.034340659,has_photo,The Helix Nebula from Blanco and Hubble http://t.co/Mdy4lghtYb http://t.co/uHbGalFeHe
sydneyobs,Sun Oct 12 01:55:09 +0000 2014,521116831767994368,3622,654,2,0,0.011508951,has_no_media,Getting educated in gender equity - one scientist shares his experience: http://t.co/3ekZn0Jgqi via @womensciAUST
sydneyobs,Sat Oct 11 05:21:24 +0000 2014,520806350478004224,3622,654,3,0,0.011267606,has_no_media,Polynesian Astronomy: Cultural Astronomy!  Expert on ancient cultures and astronomy  Clive Ruggles is in Sydney  http://t.co/YV7wHUhRi0
sydneyobs,Sat Oct 11 03:14:05 +0000 2014,520774307429879808,3622,654,0,1,0.10430839,has_no_media,A bird’s eye view of the eclipse over Sydney Opera and Harbour bridge http://t.co/oypAjLDnMC
sydneyobs,Fri Oct 10 10:38:51 +0000 2014,520523850321125376,3622,654,1,0,0.010769231,has_no_media,Daily cosmobite: Full Moon and synchronous coral spawning http://t.co/uQOzyGwABS
sydneyobs,Fri Oct 10 10:38:26 +0000 2014,520523747506147328,3622,654,0,0,0.006912442,has_no_media,Sarah reports on the total lunar eclipse for October 8  2014 http://t.co/V5RcWcbJCl
sydneyobs,Thu Oct 09 21:48:01 +0000 2014,520329862733504512,3622,654,0,0,0.012658228,has_no_media,Understanding Relativity OBS Adult Education Course that takes your mind on a journey http://t.co/Tas2qAUdJZ
sydneyobs,Thu Oct 09 21:45:07 +0000 2014,520329132685537280,3622,654,0,1,0.019354839,has_no_media,Daily cosmobite: Why is there not always a lunar eclipse at full Moon? http://t.co/5gtZx9fqAP
sydneyobs,Wed Oct 08 13:28:41 +0000 2014,519841812999979009,3622,654,0,0,0.074626866,has_no_media,@cosmicpudding a lot of cloud but very nice at the end see Geoff's photo I think it's the best
sydneyobs,Wed Oct 08 13:27:19 +0000 2014,519841470832865280,3622,654,2,2,0.015238095,has_no_media,Skywatchers awed by 'Blood Moon' http://t.co/8Cqym1qpZi
sydneyobs,Wed Oct 08 13:24:21 +0000 2014,519840726176108544,3622,654,0,0,0.005988024,has_no_media,Met Office opens solar storm centre http://t.co/aVLXtlhbm2
sydneyobs,Wed Oct 08 13:20:55 +0000 2014,519839861583273984,3622,654,0,0,0.086206897,has_no_media,@cosmicpudding it actually looks very artistic!
sydneyobs,Wed Oct 08 12:14:19 +0000 2014,519823098334306304,3622,654,51,34,0.056779536,has_photo,Blood Red Moon from Sydney Observatory just coming out of totality http://t.co/xExnTeHLwZ
sydneyobs,Wed Oct 08 11:55:13 +0000 2014,519818291770966016,3622,654,7,5,0.035220994,has_video,We are getting a lovelly clear live stream now - Lunar Eclipse from Sydney Observatory: http://t.co/W1U8V1K7ES via @YouTube
sydneyobs,Wed Oct 08 11:19:44 +0000 2014,519809362135494656,3622,654,2,10,0.018976898,has_no_media,We saw the blood Moon finally!
sydneyobs,Wed Oct 08 10:40:42 +0000 2014,519799541898305536,3622,654,1,1,0.057563588,has_no_media,http://t.co/4IpzVhLaaW We are watching the eclipse from Griffith Observatory  LA @GriffithObserv
sydneyobs,Wed Oct 08 10:33:54 +0000 2014,519797827350716416,3622,654,0,0,0.048128342,has_no_media,@beyond_beneath Lucky You- send an image if you can.
sydneyobs,Wed Oct 08 10:33:03 +0000 2014,519797616184262656,3622,654,8,7,0.05880513,has_photo,Eclipsed Blood Moon from Griffith Observatory LA http://t.co/zJSVoyQAaN
sydneyobs,Wed Oct 08 10:31:34 +0000 2014,519797240777306112,3622,654,6,7,0.071587125,has_photo,A few minutes of hope tonight how are you going @beyond_beneath http://t.co/TPzOB8I5jr
sydneyobs,Wed Oct 08 10:14:33 +0000 2014,519792959399555072,3622,654,2,2,0.049496644,has_photo,We are live streaming from Griffith Observatory LA http://t.co/0CzVNaL5Jh
sydneyobs,Wed Oct 08 10:10:56 +0000 2014,519792047645929472,3622,654,7,5,0.0625,has_photo,Harbour Bridge viewing as Lunar eclipse clouded out in Sydney. http://t.co/DjQfAYYxN5
sydneyobs,Wed Oct 08 09:48:22 +0000 2014,519786368558305280,3622,654,10,10,0.063616071,has_photo,Lunar eclipse cupcakes are a sweet surprise on a cloudy night! http://t.co/4MbEukBVgY
sydneyobs,Wed Oct 08 07:30:50 +0000 2014,519751760382943232,3622,654,0,0,0.073275862,has_video,@IL_virtual Hi we are booked out but watch on-line via our live stream and go outside and look North east from 8:15pm http://t.co/W1U8V1K7ES
sydneyobs,Wed Oct 08 07:10:18 +0000 2014,519746592786501632,3622,654,14,2,0.060583942,has_video,Lunar Eclipse from Sydney Observatory live stream of the astronomical flags- waiting for Moon http://t.co/W1U8V1K7ES via @YouTube
sydneyobs,Wed Oct 08 06:38:59 +0000 2014,519738711735422977,3622,654,4,6,0.035330261,has_photo,TV crews are all doing the weather report from Observatory Hill this afternoon - go away clouds and let Moon shine http://t.co/EBLmAgWsFU
sydneyobs,Wed Oct 08 06:00:47 +0000 2014,519729095890849792,3622,654,6,4,0.037620742,has_video,Lunar Eclipse from Sydney Observatory:Our live feed  link http://t.co/W1U8V1K7ES via @YouTube Or see still images on http://t.co/Y2ImaSHdMh
sydneyobs,Wed Oct 08 05:48:34 +0000 2014,519726021080129538,3622,654,1,0,0.036889332,has_photo,A decent image of what we believe is the worlds only blood red Moon eclipse flag. http://t.co/zJCTQHmcv8
sydneyobs,Wed Oct 08 05:29:54 +0000 2014,519721326567636992,3622,654,1,1,0.005797101,has_no_media,@TDEon7 Keep tuned into our twitter to see images of the Moon and Luna-gazers.
