Meet @atticascott  the first African American woman elected to #KYleg in 20 years by beating a 34 year incumbent. https://t.co/fZb8vRbq0X,HER,has_no_media
As extremists illegally target access to care at PP health centers  we've taken states to court to fight back. https://t.co/PUw4taDNvy,HER,has_no_media
KY elected the first African American woman to the state legislature in 20 years. 20 years!  https://t.co/IfqiCE42uB https://t.co/0vGFCOeaNW,HER,has_photo
Meet Julie Burkhart who's opening an abortion clinic in OK — where jailing abortion providers almost became law. https://t.co/11tsgaSqPn,HER,has_no_media
Any one of us could have been Purvi Patel. How else will state governments punish women for their reproductive decisions? #FreePurvi,HER,has_no_media
Purvi Patel has spent a year+ in prison for her pregnancy outcome. Learn about her case→ https://t.co/nRL4ClFLwE https://t.co/8G5zxw6QJj,HER,has_photo
"No one has attempted to open a clinic in Oklahoma since 1974 — at least  not until now." https://t.co/11tsgaSqPn https://t.co/XtkIbVmWja,HER,has_photo
.@Heck4Nevada's ad targeting African American women &amp; Latinas is shameful. ALL women are equally capable of making their own decisions.,HER,has_no_media
People in LA were already required to wait 24 hours to get an abortion  &amp; then this passed. https://t.co/lM123l3BBQ https://t.co/ZBsyyrDNkj,HER,has_photo
AZ  MO  KS  MI &amp; LA have pushed laws to halt funding to women’s health clinics &amp; expand waiting periods for abortion https://t.co/sa55D4y2oc,HER,has_no_media
Sexism on Louisiana's House floor exposes the old boys' club that undermined #reprorights. https://t.co/XqEys44FRV https://t.co/ZHXYcx3yjz,HER,has_photo
Anti-abortion politicians must understand: Policies that punish women &amp; doctors for basic #reprohealth won't stand. https://t.co/ZZ6vRX8XSV,HER,has_no_media
Ohio's officials struggle to find providers of cancer screenings  family planning  &amp; prenatal care after PP defund:  https://t.co/LO930eVRL4,HER,has_no_media
Politicians are practicing medicine without a license &amp; it hurts women. Here's 11 ways they're restricting abortion: https://t.co/KrAvuGkLuK,HER,has_no_media
Ohio officials are struggling to accommodate Planned Parenthood’s patients if this law takes effect on Monday --&gt; https://t.co/LO930eVRL4,HER,has_no_media
.@CoryBooker introduced a bill to stop pharmacies from denying people #BC or #EC. https://t.co/E5PWo7BxEd https://t.co/5nkK5u9ADx,HER,has_photo
Where do you want to be in 10 years? Choose your future &amp; get the tools you need from a @PPFA health center: https://t.co/ghik4SXLyJ,HER,has_photo
.@realDonaldTrump promised to overturn Roe v. Wade—and his list of #SCOTUS replacements proves that he's serious. https://t.co/qFZl1d5NNE,HER,has_photo
We're doing more than ever to ensure that anti-women's health politicians don't make it into office. https://t.co/9iPjwOF02X #PinkOutTheVote,HER,has_no_media
Dr. McNicholas provides safe &amp; legal abortion in the Midwest. Here's what she's up against: https://t.co/JGDD8z03i9 https://t.co/d7wHxMMdV0,HER,has_photo
.@CWJaneTheVirgin has never shied away from frankly discussing safe &amp; legal abortion. https://t.co/XWGlQPntdL https://t.co/9n5MOVdVf1,HER,has_photo
.@realDonaldTrump: Your best bet to roll reproductive rights back decades! #WontBePunished https://t.co/TKyfJlCDkc https://t.co/ywNm3Vh5pI,HER,has_photo
BREAKING: Oklahoma @GovMaryFallin just vetoed a bill that would have made abortion a felony  punishing women and doctors across the state.,HER,has_no_media
Mostly male lawmakers are undermining #reprorights without input from those affected. https://t.co/JGDD8z03i9 https://t.co/l3LXk6wgc5,HER,has_photo
'I think there's a better word to describe grown men who act this way. They’re not "bullies." They’re abusers.' https://t.co/89CGmvW9vm,HER,has_no_media
Ladies  don't worry. Louisiana has built in time for your simple lady brain. @TheOnion https://t.co/yGvaKdNZDB https://t.co/w9TnjbPMdA,HER,has_photo
Doesn't sound so "pro-women" now does it? https://t.co/TKyfJlCDkc #WontBePunished https://t.co/6obz7BQ4tv,HER,has_photo
“Patriarchy &amp; racism means I’m less likely to be thought the doctor  so that allows me to hide in the open.” https://t.co/oCqb6Whjl3,HER,has_no_media
Thanks @SenBookerOffice for introducing the Access to Birth Control (ABC) Act to ensure no one can be denied or intimidated at pharmacies.,HER,has_no_media
A doctor to #Gynoticians: Stop passing laws that second-guess doctors  endanger patients &amp; cost taxpayers millions. https://t.co/GVRwhlQYSH,HER,has_no_media
This doctor lays out the revisionist history &amp; junk science that Arizona lawmakers used to undermine #reprorights. https://t.co/rjtCG2EUU8,HER,has_no_media
"Women: you have to treat 'em like sh*t." - @realDonaldTrump #NotMyCandidate https://t.co/wct3Ci3P8U https://t.co/LHmbL4SBI8,HER,has_photo
Experiences of trans men can provide a unique window into how gender functions in American society. -@CharlotteAlter https://t.co/N0GntWLxoR,HER,has_no_media
Missouri is a cautionary tale for the nation. Thanks @marieclaire for telling our stories. https://t.co/xMjS3wV5Oy https://t.co/gUY1P94H3B,HER,has_photo
Great news: California expanded health care for 170K undocumented children!  https://t.co/NrmDlMM21G https://t.co/va9bF5Yb0J,HER,has_photo
We're joining over 100 groups to tell Congress to pass a #cleanbudget with no unpopular policy riders. #Noriders https://t.co/McI59Ndaty,HER,has_photo
The OK Senate passed a bill to revoke licenses &amp; jail doctors who provide abortion. https://t.co/bSYrxdbRxj https://t.co/9uzvAIHvnf,HER,has_photo
Today is Nat'l #SayHerName Day of Action. Black women  girls &amp; femmes deserve safety  support &amp; reproductive justice https://t.co/2gO5Tj9tJI,HER,has_no_media
.@JustinTrudeau just lifted the abortion ban on Canada's international aid. https://t.co/DK64Ep2xho #HelmsHurts https://t.co/xk8NJo4epc,HER,has_photo
1 in 5 women have come to a PP health center at some point in their lifetime — it's simple math. #PinkOutTheVote https://t.co/fn5iFqvAsC,HER,has_photo
"There are no “good” abortions &amp; “bad” abortions  there are only pregnant people who want them &amp; pregnant people who don’t." - @thelindywest,HER,has_no_media
.@JustinTrudeau did away with Canada's Helms amendment equivalent  expanding access to abortion. https://t.co/mKSqksHju1 #HelmsHurts,HER,has_no_media
It's terrifying that Donald Trump will be the GOP nominee for president. https://t.co/PSHNXbz3AA https://t.co/D0VV53JDdb,HER,has_photo
Lawmakers who sneak unpopular riders into the budget want to avoid a real debate. #noriders #cleanbudget https://t.co/Q54x9VSysy,HER,has_photo
Abortion restrictions just push safe &amp; legal abortion out of reach for many. It doesn't decrease people's needs. https://t.co/IZ1pUl7sg4,HER,has_no_media
With no final Supreme Court ruling in #ZubikvBurwell  employees can maintain access to birth control — for now. https://t.co/SIXbK9LTK3,HER,has_photo
Deportation raids threaten the dignity of women &amp; children  &amp; will have devastating effects on immigrant families' health. #StopTheRaids,HER,has_no_media
Alabama's gov signed an anti-abortion restriction into law that would close the health centers most women rely on. https://t.co/uWts0i0VB9,HER,has_no_media
Deportation raids reinforce the culture of fear that keeps many immigrants from seeking the health care they need. Health has no borders.,HER,has_no_media
We can’t go back — everyone deserves to benefit from no-copay birth control. https://t.co/JhXcKr757f #HandsOffMyBC https://t.co/1yIFBBNZvh,HER,has_photo
The Supreme Court didn't rule on #ZubikvBurwell  instead asked lower courts to reconsider. https://t.co/JhXcKr757f https://t.co/xOXFHESvJH,HER,has_photo
.@realDonaldTrump is not an outlier in the GOP. Republican legislators have waged assault on #reprorights &amp; health. https://t.co/li8jLJHWie,HER,has_photo
Women will maintain access to birth control coverage while the lower courts review #ZubikvBurwell. #HandsOffMyBC https://t.co/72n0IFYjnk,HER,has_photo
Stereotypes about mothers &amp; fathers create pay differences at work. Let's ditch the myths &amp; support #MomsEqualPay.  https://t.co/J1cBaZILwV,HER,has_no_media
The Massachusetts Senate passed a transgender rights bill &amp; it's expected to pass &amp; go to the gov for signature. https://t.co/UkTxfvceqW,HER,has_no_media
.@HHSGov clarified that denying trans people health care is discriminatory under protections of #ACA. #ThanksACA! https://t.co/qZZajSb4fu,HER,has_no_media
#ReproHealth is more than a woman's issue. Empowering women empowers families  communities  &amp; our entire country.​​ https://t.co/cwNzz9wIrf,HER,has_no_media
"We’re fighting for real &amp; positive change this year &amp; beyond. You cannot exclude us from your America." -Winnie Ye https://t.co/kaXzbAUdux,HER,has_photo
These 6 issues — including access to care at Planned Parenthood health centers — are at stake in this election→ https://t.co/o7q4EAMbSY,HER,has_no_media
We're so thankful for the hospitality &amp; space to work to #PinkOutTheVote in #Pinksburgh! https://t.co/3UlKZGhxWy https://t.co/sDNvpf7nex,HER,has_photo
To all those who seek to intimidate  undermine  &amp; punish women: #WontBePunished. Sign on ⇛ https://t.co/eRtFLv6WXk https://t.co/YjNNSLzhXr,HER,has_photo
Whether you're not registered or recently moved  it's time to ensure your voice is heard. https://t.co/3yp5QEwpmT. https://t.co/vbKfVAfeFt,HER,has_photo
"Justice for everyone — that is why we keep organizing." @MarlonDMarshall #PinkOutTheVote https://t.co/J6BIspLCYu,HER,has_photo
Dee Dee Waters fired up the crowd with all of the reasons why we must #PinkOutTheVote. Our rights are under threat. https://t.co/AwJXoMiyeN,HER,has_photo
.@realDonaldTrump is: 🚨 demeaning   🚨 egotistical   🚨 misogynistic   🚨 racist   🚨 xenophobic   &amp; spreads hatred.   We must #PinkOutTheVote.,HER,has_no_media
What you call an "unruly mob " we call "democracy in action." @CecileRichards sets the record right. #PinkOutTheVote https://t.co/8ZY2m9heiQ,HER,has_photo
"The attacks on trans ppl in the community are by those who love us in secret &amp; kill us in public." -Dee Dee Waters https://t.co/EKLSeNriF4,HER,has_photo
"I don't care how great your city council member is  he shouldn't be in your doctors office with you." - @danielgilman #PinkOutTheVote,HER,has_no_media
Folks are shouting out their commitments to #PinkOutTheVote. How many hours will you commit to? Let us know! https://t.co/3U6VtwmJKf,HER,has_photo
.@PPPASariStevens shares how a single story swayed PA legislators to stop a dangerous abortion ban. #PinkOutTheVote https://t.co/Oll4aqD6wD,HER,has_photo
Are you in to make sure @realDonaldTrump never makes it to the White House? Let's get to work! #PinkOutTheVote https://t.co/xSr7XdJM4g,HER,has_photo
THIS is why we're at #PowerofPink. The only way to stop extremists is to #PinkOutTheVote. https://t.co/7cBSd2zgvX https://t.co/fqJPoVjfSI,HER,has_photo
Americans like lice &amp; Nickelback more than @realDonaldTrump  but that doesn't mean we can let up. #PinkOutTheVote https://t.co/iSYfQhFWxf,HER,has_no_media
We can't sit on the sidelines while lawmakers target our rights &amp; access to health care. https://t.co/3UlKZGz9l8 https://t.co/saqWYV4vtL,HER,has_photo
"There are some people who want to build walls. We're gonna build more bridges." - Rich Fitzgerald  County Executive https://t.co/10Y9Q7GZGN,HER,has_photo
"Do not disparage my trans sisters in my name." - @RBraceySherman  speaking on anti-LGBTQ bills. #PowerOfPink https://t.co/4dsGXtKI9L,HER,has_photo
"Sexual &amp; #reprorights are human rights that are for everyone. They're foundational for full lives &amp; dreams." - @dawnlaguens #PinkOutTheVote,HER,has_no_media
"Planned Parenthood isn't just for one specific group of people. Planned Parenthood is for everybody." - @AndiiViveros #PinkOutTheVote,HER,has_no_media
Standing ovation for Cazembe Jackson for sharing why he came to Planned Parenthood &amp; why he stays. #PowerOfPink https://t.co/J1M9C9I3Cm,HER,has_photo
Deirdre Schifeling calls out how @realDonaldTrump's dangerous rhetoric on abortion hurts us all. #PinkOutTheVote https://t.co/KHoT3pBFEQ,HER,has_photo
MD passed the most expansive birth control access law in the country! It's what's possible if we #PinkOutTheVote. https://t.co/StsUzdtuxl,HER,has_no_media
Your access to abortion  or any other constitutional right  should not depend on your zip code. Tell Congress to #ActForWomen. #PowerOfPink,HER,has_no_media
Notice that areas where the #ZikaVirus will impact 1st are states that cut access to care at PP &amp; #ReproHealth https://t.co/LBw6SMFTBx,HER,has_animated_gif
It’s time for a law that puts reproductive health &amp; rights first. That’s why we #ActForWomen &amp; support the Women's Health Protection Act!,HER,has_no_media
A thousand young activists from across the country are coming together in Pittsburgh today to #PinkOutTheVote! https://t.co/SAv9noCFyC,HER,has_photo
YES→Sen. Elizabeth Warren taking on Donald Trump #FTW! ✊ ✊ ✊ https://t.co/isn6bGAaFD,HER,has_no_media
In the last week  Planned Parenthood filed suit in two states and three states have enacted “defunding” measures. https://t.co/lnvc6ZA4Zs,HER,has_photo
Sen. @PattyMurray knows the damage a "President Trump" would do to women. It's time for GOP Senators to #DoYourJob! https://t.co/DIo4sjyge0,HER,has_photo
The two women fighting the discriminatory #HB2 law know the pain of prejudice &amp; that's key. https://t.co/2djjAq8Wbu https://t.co/8W6r8iRuRM,HER,has_photo
PP is suing Ohio for blocking PP patients from care. Since July  PP has filed suit in 15 cases to protect access to care at health centers.,HER,has_no_media
.@realDonaldTrump doesn't just spew sexist rhetoric  he backs it w/ dangerous policies that ignore women's lives. https://t.co/TKyfJlCDkc,HER,has_no_media
Due to state political attacks  almost 1/2 the PP clinics that could respond to #ZikaVirus have seen patients blocked from care at PP.,HER,has_no_media
#ZikaVirus is a public health emergency. The immediate response must include access to family planning  education  and counseling services.,HER,has_no_media
This isn't about politics. Congress shouldn't stand in the way of funding to prevent the public health crisis possible with the #ZikaVirus.,HER,has_no_media
John Kasich’s policies hurt Ohioans – so PP Ohio is taking him to court to protect their patients. #WontBePunished https://t.co/BT00n49N02,HER,has_photo
.@realDonaldTrump isn't just misogynistic talk. A Trump presidency comes with promises of overturning Roe v. Wade. https://t.co/aryRxRpL65,HER,has_no_media
.@realDonaldTrump says he's the best chance to overturn Roe v. Wade &amp; criminalize safe abortion. WATCH: https://t.co/aryRxRpL65 #NeverTrump,HER,has_no_media
Extremists in AL passed 2 abortion restrictions in the last hours of session that would close 2 of 5 clinics left. https://t.co/FOnRsw7Q0T,HER,has_no_media
Native American women are 2 1/2 times more likely to experience sexual assault. https://t.co/yB8Y4IJ7TA https://t.co/hmIQUBhzLr,HER,has_photo
For immigrants  Muslims &amp; people of color  the rhetoric coming from GOP presidential candidates is personal. https://t.co/m5fj49NGen #APAHM,HER,has_no_media
How many lawmakers wrote heartfelt posts abt how great moms are  but won't change policy to make their lives easier? https://t.co/cnYke2fmuQ,HER,has_no_media
North Carolina just announced that instead of treating LGBTQ people with dignity &amp; respect  they're going to sue the federal government.,HER,has_no_media
Extremists in MO:  - Said pregnancy from rape is a "silver lining" - Used racist stereotypes to ban abortion - Blocked PP patients from care,HER,has_no_media
An @ACLU report finds that 1 in 6 hospital beds is in a Catholic institution  which limits reproductive care. https://t.co/nwnFQVWL0X,HER,has_no_media
Flowers  candy  health care &amp; housing—show you know what she deserves. Send a #MamasDay card from @StrongFams. https://t.co/vLqCJOSNIx,HER,has_photo
After AZ was shamed into repealing their newly passed restrictions on abortion  they voted to block access to care at PP. #StandWithPP,HER,has_no_media
To the lawmakers targeting @PPFA: Attacking a health care organization that 1 in 5 women have come to is not wise. https://t.co/Ohr7fdaAmu,HER,has_no_media
We must fight for every person’s right to become a mother  if and when they are ready. #MothersDay #MomsMatter,HER,has_no_media
Planned Parenthood wishes you a happy #MothersDay! #MomsMatter https://t.co/zU5M9Jcb2G,HER,has_photo
Attacking access to care at Planned Parenthood does not win elections. Americans support access to care at PP. https://t.co/Ohr7fdaAmu,HER,has_no_media
PP nurses protect the lives and health of millions of women  men  and families — and they'll always be here for you. #NationalNursesWeek,HER,has_no_media
Vermont just moved to make more kinds of birth control &amp; vasectomies accessible! Thanks for your work @ppnne. https://t.co/wQb5tD4LIF,HER,has_no_media
.@ChrisChristie would rather shortchange women &amp; be "women unfriendly" because #EqualPay is "business unfriendly." https://t.co/Yx3psAtcE4,HER,has_no_media
Why are anti-abortion lawmakers the absolute worst when it comes to sexual assault &amp; rape? https://t.co/5tAGGqxiGz https://t.co/pwILSEjRqc,HER,has_photo
The NC “Women and Children’s Protection Act of 2015" mandates your ultrasound must be sent to state officials. https://t.co/fBTqBbaC0C,HER,has_photo
.@SpeakerRyan says he can't support @realDonaldTrump "at this time." Same. #NeverTrump #NotMyCandidate https://t.co/2WKF50aMXV,HER,has_photo
Consent doesn't start in college — young ppl need #SexEd on consent much sooner. https://t.co/1Ud7Kc3fPl @TakePart https://t.co/qAZp1anu0U,HER,has_photo
LA's “Women’s Enhanced Reflection Act?"  Mandates a 72-hr waiting period for abortion. https://t.co/oZ3AUUw06i https://t.co/d6EtGpT0Iw,HER,has_photo
Politicians are using lies as the basis for legislation &amp; they're getting away with it. https://t.co/oZ3AUUw06i https://t.co/B66UdGjgpq,HER,has_photo
POLL: The majority of women in the US have experience gender-based discrimination. So much for that #WomanCard. https://t.co/5Fb6ggJwKV,HER,has_no_media
A lose/lose situation. Here's how @JohnKasich has made life hell for women in Ohio: https://t.co/VpKYL4tdnC https://t.co/I8rXPgjggA,HER,has_photo
We stand with @GynAndTonic — who filed a civil rights complaint bc her hospital told her to be silent on abortion.  https://t.co/VKyEintgYx,HER,has_no_media
1 in 5 college women will be raped and experts believe #SexEd is to blame. https://t.co/xanCThRGdJ https://t.co/J05kPEaLdZ,HER,has_photo
#Abortion is an economic justice issue. Lawmakers ignore our health care needs &amp; cut access to safe &amp; legal care. https://t.co/BsZsDKEixU,HER,has_no_media
These two built campaigns on attacking PP &amp; undermining #reprorights. That will never win elections. #rejecTED https://t.co/1yFWkKGQnm,HER,has_photo
Women's pregnancy outcomes are already criminalized. Abortion is a legal right  but only for some. https://t.co/kDHbxpqzL9 #WontBePunished,HER,has_no_media
When 1 in 5 women have gone to Planned Parenthood  attacking access to care at PP health centers will never win elections. #NotMyCandidate,HER,has_no_media
Bringing this back  but now for @tedcruz. #NotMyCandidate https://t.co/jSGo2q3QHk,HER,has_no_media
.@realDonaldTrump spouts hateful lies about immigrants  Muslims  and anyone who protests his dangerous "policies." https://t.co/PSHNXbQEZa,HER,has_no_media
With states blocking care at PP &amp; banning abortion  we need a president who'll fight for access. Trump is not that person. #NotMyCandidate,HER,has_no_media
You should know how bad the #GOP pres candidates would be for women's health. Take the quiz→https://t.co/Bqco0kt0A0 https://t.co/fBpixTGoHu,HER,has_photo
Gynoticians are too busy interfering in your personal  medical decisions to educate themselves on sexual assault. https://t.co/T2RKhwIfJF,HER,has_no_media
Did you know that servicewoman have a hard time getting the birth control of their choice? #StandWithServiceWomen https://t.co/8OMT8YQSMD,HER,has_no_media
Women really change things when they're in leadership — and it helps EVERYONE.  https://t.co/iU6z6D38ph https://t.co/2AeJ7DWiUB,HER,has_photo
News networks need to stop calling @realDonaldTrump  "controversial" when what they mean is "bigoted". https://t.co/adHYXnZaQ1 #NeverTrump,HER,has_no_media
Women comprise 19% of Congress  with women of color being only 6%. What would parity mean? https://t.co/iU6z6D38ph https://t.co/yPcefX81wF,HER,has_photo
The Colorado Springs health center fully reopened Sunday. Sending 💖  to @PPRockyMountain. https://t.co/t3rvOWTxZ8 https://t.co/885PWCUfY8,HER,has_photo
.@ACLU is suing to stop Indiana's extreme anti-abortion restriction from going into effect. https://t.co/fgMr3Dz2fx #WeWontGoBack,HER,has_no_media
We deplore your violence. We reject your threats. We aren't going anywhere. #StandWithPP https://t.co/t3rvOWTxZ8 https://t.co/mfpTBLZwPw,HER,has_photo
Fiorina built her campaign around lies about PP. Lies she stuck to when fact-checkers repeatedly called her out. https://t.co/1mbjIfTN7m,HER,has_no_media
This interview of @CecileRichards in the @TexasObserver is 🔥 . Fantastic questions from @agarciaditta. https://t.co/3rG5T85quL,HER,has_no_media
.@MHarrisPerry testified before the new Congressional Caucus for Black Women &amp; Girls about how the US fails them. https://t.co/Vb1Q5BJqAO,HER,has_no_media
The Equality Act is a solution to state anti-LGBTQ laws. It has 210 co-sponsors.  https://t.co/pyOnerWEyD https://t.co/cnVEQKLMQO,HER,has_photo
Trump’s Man Card Pays Off: It’s unimaginable that a woman could run on such a flimsy set of “ideas” as Trump has offered. - @sallykohn,HER,has_no_media
.@realDonaldTrump &amp; @tedcruz have made hate a main part of their campaigns. #OnMayDay communities are mobilizing against racism &amp; bigotry.,HER,has_no_media
When women are seeing their rights stripped away  it is reprehensible that @realdonaldtrump continues to dismiss &amp; degrade women. #OnMayDay,HER,has_no_media
Donald Trump &amp; Ted Cruz agree on PP. Both would block people from care at PP &amp; they’re willing to shut down the government to do so.,HER,has_no_media
#OnMayDay communities across the country are taking a stand stand against racism &amp; bigotry. https://t.co/SwsBazYDT3 https://t.co/heYa60V4lZ,HER,has_photo
No longer is racism being couched in language. Donald Trump is emboldened to be explicit &amp; it's rallying his base. https://t.co/dGENwRt6gM,HER,has_no_media
The unplanned teen pregnancy rate reached an all-time low  despite anti-women's health care lawmakers's setbacks.  https://t.co/evwtBdpgog,HER,has_no_media
"The current attacks on fetal tissue research pose a serious threat to medical breakthroughs." - @prachigu https://t.co/2iE0NS3Vl2,HER,has_no_media
Extremists behind faked  malicious video campaign against Planned Parenthood are advisors to @Tedcruz's campaign. https://t.co/aSAJo3QwxP,HER,has_no_media
Ted Cruz's VP pick reinforces that he only cares about restricting #reprohealth access. https://t.co/wkK6LpdYFY https://t.co/SbJRR0xca7,HER,has_photo
Play the ‘woman card’ and reap these ‘rewards’! - @petridishes https://t.co/W894tDggT3 #WomanCard #DealMeIn https://t.co/cFiXl3W7iY,HER,has_photo
OK court rules oral sex isn't rape if victim is blacked out. Consciousness is required for consent &amp; we need laws that reflect that. #SAAM,HER,has_no_media
Deandre Levy writes a powerful exploration of toxic masculinity and how it contributes to rape culture. #SAAM https://t.co/SjXyIP2pgs,HER,has_no_media
Anti-abortion lawmakers are threatening life-saving fetal tissue research. @prachigu lists 12 things to know. https://t.co/2iE0NS3Vl2,HER,has_no_media
Here's 65 reasons why @HillaryClinton is a total badass. #TBT https://t.co/EOiRqzhzfy #ShesWithUs @HuffPostWomen https://t.co/8JAaw8hR4t,HER,has_photo
#Reprohealth care &amp; access are absolutely economic justice issues. https://t.co/KSw35ff7pm #NoRJwithoutEJ https://t.co/PdfACujWY4,HER,has_photo
"I learned that survivor rights are not equal across the US. Over forty states have backlogs in untested [rape] kits." - Amanda Nguyen #SAAM,HER,has_no_media
Here's 8 stories @tedcruz should have read before picking @CarlyFiorina by @MotherJones. https://t.co/nYnAIOIBfT https://t.co/4Rbq49yOrr,HER,has_photo
This is what #RiseUp is fighting for. We need to establish baseline procedures for sexual assault survivors. #SAAM https://t.co/bgpKkH0cUs,HER,has_photo
For many military women  accessing abortion when deployed overseas is not an option. Congress  will you #StandWithServicewomen,HER,has_no_media
It's wrong that servicewomen overseas must overcome language barriers &amp; travel to other countries for abortion care.  #StandWithServiceWomen,HER,has_no_media
Women play a vital role in the military. They should be able to access #reprohealth care. #StandWithServiceWomen https://t.co/NR5DADYSRN,HER,has_photo
The "woman card?" Please. It's rare to hear @realDonaldTrump talk about women without sexualizing them or dismissing their issues. #DealMeIn,HER,has_no_media
Anti-abortion extremists will use proven lies to further their extreme agenda. https://t.co/SeJ9mhIyO1 #StandWithPP https://t.co/KOIE6RA5sm,HER,has_photo
What @realDonaldTrump doesn't get is that women dislike him because of how he talks about them &amp; he marginalizes our issues. #NeverTrump,HER,has_no_media
Trump isn't playing *his* cards right. 7 out of 10 women have an unfavorable view of him.  https://t.co/PSHNXbz3AA https://t.co/aSHKBR2Mwm,HER,has_photo
